[
  {
    "url": "https://www.linkedin.com/in/williamhgates/",
    "email": "bill@example.com",
    "type": "linkedin",
    "name": "Bill Gates",
    "title": "Chair, Gates Foundation and Founder, Breakthrough Energy",
    "contextForAI": "Bill has a {:badgeType} account\nBill Gates\nChair, Gates Foundation and Founder, Breakthrough Energy\n Top Voice\nGates Foundation\nHarvard University\nSeattle, Washington, United States  Contact info\nhttps://gatesnot.es/tgn\n39,962,208 followers\nFollowed by Juan Antonio Lugo P√©rez, Robert Lynch, and 1 other\nFollowed by Juan Antonio Lugo P√©rez, Robert Lynch, and 1 other\nFollow\nConnect\nView my newsletter\nMore\nProfile enhanced with Premium\nAbout\nAbout\nChair of the Gates Foundation. Founder of Breakthrough Energy. Co-founder of Microsoft. Voracious reader. Avid traveler. Active blogger.\nChair of the Gates Foundation. Founder of Breakthrough Energy. Co-founder of Microsoft. Voracious reader. Avid traveler. Active blogger.\nFeatured\nFeatured\nPost\nPost\nLooking ahead to the next 20 years, the Gates Foundation has three major aspirations to guide¬†our work: ‚Äã\n‚Äã\n1. No mom, child, or baby dies of a preventable cause. ‚Äã\n2. The next generation grows up in a world without deadly infectious diseases. ‚Äã\n3. Hundreds of millions of people break free from poverty, putting more countries on a path to prosperity. ‚Äã\n ‚Äã\nI know that with the right commitment of resources, a¬†fairer and¬†healthier¬†future for everyone is just on the horizon.\nWhat the Gates Foundation hopes to accomplish over the next 20 years\nBill Gates on LinkedIn ‚Ä¢ 5 min read\n4,961\n972 comments\nPost\nPost\nI have always been an optimist. These days, though, my optimism comes with footnotes. For the first time this century, the world slipped backwards on key measures like childhood mortality in 2025, and if we don‚Äôt make the right decisions, this trend will continue. ¬†At the same time, I also believe that, within the next decade, the world will not only get back on track but enter a new era of unprecedented progress. As we start 2026, I‚Äôm thinking about how the year ahead will position us for decades to come. \nHow to get the world back on track and enter a new era of unprecedented progress\nBill Gates on LinkedIn ‚Ä¢ 5+ min read\n5,857\n959 comments\nActivity\nActivity\n39,962,208 followers\n39,962,208 followers\nFollow\nPosts\nComments\nVideos\nImages\nNewsletter\nDocuments\nLoaded 9 Posts posts\nBill Gates\nBill Gates\n ‚Ä¢ 3rd+\nInfluencer ‚Ä¢ 3rd+\nChair, Gates Foundation and Founder, Breakthrough Energy\nChair, Gates Foundation and Founder, Breakthrough Energy\nView my newsletter\n3w ‚Ä¢ \n3 weeks ago ‚Ä¢ Visible to anyone on or off LinkedIn\nThis anti-malarial drug¬†is poised to become¬†the first breakthrough in malaria treatment in almost 25 years.¬†This incredible step forward is a testament to partnership and science‚Äîand it couldn‚Äôt¬†have come¬†at a more critical time.¬†‚Äã\n‚Ä¶more\nGates Foundation\nGates Foundation\n1,481,400 followers\n1,481,400 followers\nScience has brought us one step closer to a world without malaria.\nGanLum is the first breakthrough in malaria treatment in more than 25 years, offering hope for families across Africa. With drug resistance currently threatening decades of progress, this innovative treatment arrives at a critical moment.\nIt‚Äôs a bold reminder of what‚Äôs possible when we invest in science and innovation to move toward a malaria-free future.\n‚Ä¶more\nA Huge Win in the Fight Against Malaria ‚Ä¢ 4 pages\n1/4\n4,130\n931 comments\n245 reposts\nBill Gates\nBill Gates\n ‚Ä¢ 3rd+\nInfluencer ‚Ä¢ 3rd+\nChair, Gates Foundation and Founder, Breakthrough Energy\nChair, Gates Foundation and Founder, Breakthrough Energy\nView my newsletter\n4w ‚Ä¢ \n0 months ago ‚Ä¢ Visible to anyone on or off LinkedIn\nI‚Äôm deeply sad to learn of the passing of Dr. Bill Foege. Bill was a towering figure in global health‚Äîa man who saved the lives of literally hundreds of millions of people.¬†He was also a friend and mentor who gave me a deep grounding in the history of global health and inspired me with his conviction that the world could do more to alleviate suffering. ‚Äã\n‚Äã\nBill and I often talked together about the future of global health. The legacy of his career is that many of the remarkable developments to come will have his imprint all over them.¬†‚Äã\n‚Ä¶mo",
    "isCSuite": true
  },
  {
    "url": "https://www.linkedin.com/in/satyanadella/",
    "email": "satya@example.com",
    "type": "linkedin",
    "name": "Satya Nadella",
    "title": "Chairman and CEO at Microsoft",
    "contextForAI": "1\n2\n3\n4\n5\nCards updated\nSatya has a {:badgeType} account\nSatya Nadella \n3rd degree connection\n3rd\nChairman and CEO at Microsoft\n Top Voice\nMicrosoft\nThe University of Chicago Booth School of Business\nClose\nElijah, you aren't verified yet\nAdd a badge like Satya to show others your profile is authentic. Verified members get 60% more profile views on average.\nVerify now\nRedmond, Washington, United States  Contact info\n11,873,385 followers\nFollowed by Juan Antonio Lugo P√©rez, R Risheek Dandekeri, and 3 others\nFollowed by Juan Antonio Lugo P√©rez, R Risheek Dandekeri, and 3 others\nFollow\nMessage\nMore\nHighlights\nHighlights\nSatya recently posted on LinkedIn\nSatya recently posted on LinkedIn\nUnderstand what topics Satya posts about to inform your outreach.\nUnderstand what topics Satya posts about to inform your outreach.\nFree insight from Sales Navigator\nFree insight from Sales Navigator\nUnlock more insights about leads\nImprove outreach with sales insights\nTry Sales Navigator for ¬£0\n1-month free. We‚Äôll remind you 7 days before your trial ends.\nShow all 2 highlights\nAbout\nAbout\nAs chairman and CEO of Microsoft, I define my mission and that of my company as empowering every person and every organization on the planet to achieve more.\nAs chairman and CEO of Microsoft, I define my mission and that of my company as empowering every person and every organization on the planet to achieve more.\nFeatured\nFeatured\nPost\nPost\nA few reflections on the year ahead for our industry ... https://lnkd.in/gwygrzzB\nLooking Ahead to 2026\nsnscratchpad.com\n4,058\n348 comments\nPost\nPost\n10 PRINT \"ANTHROPIC + MICROSOFT + NVIDIA = MORE COMPUTE, COGNITION, AND CHOICE.\"\n17,712\n755 comments\nPost\nPost\nJust wrapped our earnings call and wanted to share a few highlights from the quarter. \nBottom line: We‚Äôve got great momentum across our AI platform and our family of Copilots,¬†fueling our increasing investments in both capital and talent.\nWe‚Äôre building a planet-scale cloud and AI factory.\nWe‚Äôll increase our AI capacity by 80% this year, and nearly double our DC footprint over the next two.\nThat includes Fairwater in Wisconsin, the world‚Äôs most powerful AI datacenter, which will scale to two gigawatts alone.\nWe are building a fungible fleet that spans every stage of the AI lifecycle and is constantly optimized to deliver the best ROI and TCO for us and our customers.\nOne example: during the quarter, we increased the token throughput for GPT-4.1 and GPT-5 by more than 30% per GPU.\nOur family of Copilots and agents also surpassed over 150 million monthly active users across high value domains:\n‚Ä¢ Information work: 90 percent of the F500 now use Microsoft 365 Copilot ‚Äì and we‚Äôre shipping updates very fast\n‚Ä¢ Coding: GitHub Copilot now has 26 million-plus users\n‚Ä¢ Security: 36+ agents integrated across Entra, Defender, Purview, Intune\n‚Ä¢ Science & Health: We helped document 17 million-plus patient encounters, up 5X year over year\n‚Ä¢ Consumer: Tons of new capabilities announced over the past two weeks, from Groups and Mico in Copilot, to \"Hey Copilot\" in Windows\nAnd this week, we signed a new agreement with OpenAI, a milestone for both companies. \nIt‚Äôs been an incredible investment, with nearly 10X return and no carry. All the value goes straight to shareholders.\nAnother thing I feel super proud about is that Microsoft is now behind two of the largest nonprofits in the world!\nYou can read more about our results here: https://lnkd.in/gxtVeMk2 \n7,825\n443 comments\nPost\nPost\nI love how easy it‚Äôs becoming to learn on the go with podcasts in Copilot.\nI turned GitHub‚Äôs latest Octoverse report into a 5-minute pod ‚Äî short, smart, and snappy. Packed with info on the seismic shifts happening in how people build software. Check it out! \n4,588\n248 comments\nPost\nPost\nSuper fun conversation with Jordi Hays and John Coogan. Thanks for bringing TBPN to GitHub Universe. Work's not done!\n2,664\n53 comments\nActivity\nActivity\n11,873,385 followers\n11,873,385 followers\nFollow\nPosts\nComments\nVideos\nImage",
    "isCSuite": true
  },
  {
    "profileUrl": "https://www.linkedin.com/in/ACoAAA-R52ABCa6FC5tArHuOpWJ67NU6JboYa-Q",
    "name": "EWEJE, Oyeniyi - CPHR Candidate",
    "title": "People Business Partner | Delivering HR Solutions for Global Growth, Employee Relations, and Leadership Development",
    "location": "London Area, United Kingdom",
    "company": "",
    "about": "",
    "experience": "Experience\nExperience\nRedCloud\nRedCloud\nFull-time ¬∑ 3 yrs\nFull-time ¬∑ 3 yrs\nNigeria ¬∑ Hybrid\nNigeria ¬∑ Hybrid\nPeople Business Partner - Africa\nPeople Business Partner - Africa\nApr 2024 - Present ¬∑ 1 yr 11 mos\nApr 2024 to Present ¬∑ 1 yr 11 mos\nManaged and ensured full focus on enabling and supporting RedCloud through extraordinary growth. In working closely with the People Ops, the People Business Partner will guide people leaders through performance and feedback management, lead employee relations situations, act as a partner and coach to our leaders, and contribute to the creation and iteration of resources and tools implemented for employees along with the overall People Strategy.\nManaged and ensured full focus on enabling and supporting RedCloud through extraordinary growth. In working closely with the People Ops, the People Business Partner will guide people leaders through performance and feedback management, lead employee relations situations, act as a partner and coach to our leaders, and contribute to the creation and iteration of resources and tools implemented for employees along with the overall People Strategy.\nHuman Resources Manager\nHuman Resources Manager\nMar 2023 - Mar 2024 ¬∑ 1 yr 1 mo\nMar 2023 to Mar 2024 ¬∑ 1 yr 1 mo\nRedCloud is a global technology company, headquartered in London that is leveraging AI-powered technology to make global trade simpler.\n\nRedCloud‚Äôs Intelligent Open Commerce Platform connects FMCG Brands, Distributors, and Local Merchants on a single, equitable marketplace, empowering them with real-world insights and data to help them make better decisions.\n\nRedCloud enables FMCG Brands to seize new opportunities in emerging markets, facilitates access to more buyers & streamlines operations for Distributors, and helps Local Merchants spend more time selling products, not searching for them. The company comprises a highly diverse, dynamic team of driven talented people from over twenty different countries, speaking multiple languages, ",
    "isCSuite": true,
    "contextForAI": "test\nEWEJE, Oyeniyi - CPHR Candidate \n1st degree connection\n1st\nPeople Business Partner | Delivering HR Solutions for Global Growth, Employee Relations, and Leadership Development\nProduct Marketing Alliance\nLondon Area, United Kingdom  Contact info\n32,789 followers \n500+ connections\nScott C. Eneje is a mutual connection\nScott C. Eneje is a mutual connection\nMessage\nMore\nHighlights\nHighlights\nEWEJE, follows your company on LinkedIn\nEWEJE, follows your company on LinkedIn\nEWEJE, is aware of your brand and may be more receptive to outreach.\nEWEJE, is aware of your brand and may be more receptive to outreach.\nFree insight from Sales Navigator\nFree insight from Sales Navigator\nUnlock more insights about leads\nImprove outreach with sales insights\nTry Sales Navigator for ¬£0\n1-month free. We‚Äôll remind you 7 days before your trial ends.\nAbout\nAbout\nOyeniyi Eweje is an experienced People Business Partner with over 10 years of expertise in human resource, talent management, and leadership across diverse industries such as tech, SaaS, Oil and Gas, and startups. Oyeniyi has successfully led human resource initiatives for companies with 50 to over 500 employees, overseeing critical human resource functions such as recruitment, employee relations, learning and development, and performance management.\nOyeniyi Eweje is an experienced People Business Partner with over 10 years of expertise in human resource, talent management, and leadership across diverse industries such as tech, SaaS, Oil and Gas, and startups. Oyeniyi has successfully led human resource initiatives for companies with 50 to over 500 employees, overseeing critical human resource functions such as recruitment, employee relations, learning and development, and performance management.\nTop skills\nTop skills\nCommunication ‚Ä¢ Training\nCommunication ‚Ä¢ Training\nActivity\nActivity\n32,789 followers\n32,789 followers\nFollowing\nPosts\nComments\nImages\nLoaded 9 Posts posts\nEWEJE, Oyeniyi - CPHR Candidate\nEWEJE, Oyeniyi - CPHR Candidate\n   ‚Ä¢ 1st\nVerified ‚Ä¢ 1st\nPeople Business Partner | Delivering HR Solutions for Global Growth, Employee Relations, and Leadership Development\nPeople Business Partner | Delivering HR Solutions for Global Growth, Employee Relations, and Leadership Development\n5mo ‚Ä¢ \n5 months ago ‚Ä¢ Visible to anyone on or off LinkedIn\nüöÄ¬†Why I Prefer to Hire Talent from Africa\nAfrica is not just rising‚Äîit‚Äôs already here.\nWhen I hire, I look for \nhashtag\n#resilience, \nhashtag\n#creativity, and \nhashtag\n#bold thinking. And time and again, I find these qualities in African professionals. They bring fresh perspectives, deep technical skills, and a hunger to solve real-world problems.\nUnlike traditional markets in Europe, Africa offers:\n ‚úÖ A rapidly growing pool of tech-savvy, globally minded talent\n ‚úÖ A culture of innovation shaped by resourcefulness\n ‚úÖ A strong sense of community and collaboration\nHiring from Africa isn‚Äôt about \nhashtag\n#cost‚Äîit‚Äôs about \nhashtag\n#value. It‚Äôs about building teams that reflect the future of work: diverse, distributed, and driven.\nI don‚Äôt use buzzwords like ‚ÄúEMEA.‚Äù I hire from¬†Africa¬†because I believe in its people, its potential, and its power to lead.\nhashtag\n#AfricaTalent \nhashtag\n#GlobalHiring \nhashtag\n#TechLeadership \nhashtag\n#RemoteWork \nhashtag\n#InclusiveGrowth \nhashtag\n#FutureOfWork\n‚Ä¶more\nActivate to view larger image,\nSee content credentials\nActivate to view larger image,\n117\n7 comments\n2 reposts\nEWEJE, Oyeniyi - CPHR Candidate\nEWEJE, Oyeniyi - CPHR Candidate\n   ‚Ä¢ 1st\nVerified ‚Ä¢ 1st\nPeople Business Partner | Delivering HR Solutions for Global Growth, Employee Relations, and Leadership Development\nPeople Business Partner | Delivering HR Solutions for Global Growth, Employee Relations, and Leadership Development\n1yr ‚Ä¢ \n1 year ago ‚Ä¢ Visible to anyone on or off LinkedIn\nThrilled to be recognized as the most active user of Teamtailor! üöÄ I'm grateful for Teamtailor's intuitive platform, driving efficiency and innovation in HR processes. This acknowledgment highlights my dedication to leveraging technology for talent acquisition and management.\nTeamtailor has revolutionized recruitment, elevating candidate experience and enabling data-driven decisions. Being an active user showcases the platform's user-friendliness and alignment with modern HR requirements.\nA heartfelt thank you to the Teamtailor community for fostering a space of growth and achievement. Here's to ongoing success and innovation! üíº‚ú®\nhashtag\n#HRTech \nhashtag\n#Teamtailor \nhashtag\n#TalentManagement \nhashtag\n#RecruitmentInnovation \nhashtag\n#HRExcellence\nSpecial shoutout to my colleagues, Caroline Matsimela and Luciana M. ! üåü\n[Link to the recognition here: https://lnkd.in/d6MTJgiz]\n‚Ä¶more\nActivate to view larger image,\nActivate to view larger image,\n130\n49 comments\n2 reposts\nShow all posts\nExperience\nExperience\nRedCloud\nRedCloud\nFull-time ¬∑ 3 yrs\nFull-time ¬∑ 3 yrs\nNigeria ¬∑ Hybrid\nNigeria ¬∑ Hybrid\nPeople Business Partner - Africa\nPeople Business Partner - Africa\nApr 2024 - ",
    "searchKeyword": "CEO"
  },
  {
    "profileUrl": "https://www.linkedin.com/in/richard-davis-a8a5282b2",
    "name": "Richard Davis",
    "title": "Chief Executive Officer at Top Marks AI",
    "location": "London, England, United Kingdom",
    "company": "Top Marks AI",
    "about": "",
    "experience": "Experience\nExperience\nChief Executive Officer\nChief Executive Officer\nTop Marks AI ¬∑ Full-time\nTop Marks AI ¬∑ Full-time\nMay 2023 - Present ¬∑ 2 yrs 10 mos\nMay 2023 to Present ¬∑ 2 yrs 10 mos",
    "isCSuite": true,
    "contextForAI": "Richard has a {:badgeType} account\nRichard Davis \n2nd degree connection\n2nd\nChief Executive Officer at Top Marks AI\nTop Marks AI\nUniversity of Cambridge\nLondon, England, United Kingdom  Contact info\n500+ connections\nConnect\nMessage\nMore\nAbout\nAbout\nCEO of Top Marks AI\n+ AI marking services across a huge range of subjects and qualifications -- both academic and vocational.\n+ Currently offering free trials to schools across the UK: please contact me at richard@topmarks.ai for details.\n+ Read about the accuracy of our software here: https://www.topmarks.ai/how-accurate-is-ai-marking.\nCEO of Top Marks AI + AI marking services across a huge range of subjects and qualifications -- both academic and vocational. + Currently offering free trials to schools across the UK: please contact me at richard@topmarks.ai for details. + Read about the accuracy of our software here: https://www.topmarks.ai/how-accurate-is-ai-marking.\nActivity\nActivity\n1,238 followers\n1,238 followers\nPosts\nComments\nLoaded 4 Posts posts\nRichard Davis\nRichard Davis\n   ‚Ä¢ 2nd\nPremium ‚Ä¢ 2nd\nChief Executive Officer at Top Marks AI\nChief Executive Officer at Top Marks AI\n11mo ‚Ä¢ \n11 months ago ‚Ä¢ Visible to anyone on or off LinkedIn\nOk, opinions please... ü§î\nSo our AI marking software ‚Äî Top Marks AI ‚Äî is now being used by over 8,000 teachers across the UK.\nBut time and again, teachers tell me they're quietly paying for the software OUT OF THEIR OWN POCKETS rather than asking their school to cover it. \nWhy? They feel anxious about even mentioning AI tools to their senior leadership! \nA quote from a teacher literally this morning, when I asked about this: ‚ÄúMy school still doesn't believe in AI. Only me.‚Äù\nI'm genuinely curious - what's creating this disconnect? If you're a teacher, does this sound familiar? And if you're in school leadership, what would make these conversations easier? \nAfter all, shouldn't tools that save teachers precious time be celebrated, not hidden?\nhashtag\n#TeacherLife \nhashtag\n#EdTechChat \nhashtag\n#SchoolLeadership\n‚Ä¶more\n24\n9 comments\n1 repost\nRichard Davis\nRichard Davis\n   ‚Ä¢ 2nd\nPremium ‚Ä¢ 2nd\nChief Executive Officer at Top Marks AI\nChief Executive Officer at Top Marks AI\n1yr ‚Ä¢ Edited ‚Ä¢ \n1 year ago ‚Ä¢ Edited ‚Ä¢ Visible to anyone on or off LinkedIn\nüö® News Alert! üö® \nIntroducing individual student barcodes for batch marking.\nHow does it work?\n1) Upload a list of students. üßë‚Äçüéì \n2) Download a unique barcode for each student. üèÅ \n3) When batch marking their essays with Top Marks AI ‚Äì whether it be 30, or 300 essays ‚Äì our software will automatically assign each essay to the correct student. üìÑ \nüëÄ Watch the video to learn more üëÄ \nhttps://lnkd.in/d49f6KHs\nhashtag\n#EdTech \nhashtag\n#Education \nhashtag\n#AI \nhashtag\n#GCSE \nhashtag\n#EnglishTeaching \nhashtag\n#TeacherWorkload\n‚Ä¶more\nAI Marking: How to Batch Mark Handwritten Scripts with Unique Student Barcodes\nyoutube.com\n18\n2 comments\nShow all posts\nExperience\nExperience\nChief Executive Officer\nChief Executive Officer\nTop Marks AI ¬∑ Full-time\nTop Marks AI ¬∑ Full-time\nMay 2023 - Present ¬∑ 2 yrs 10 mos\nMay 2023 to Present ¬∑ 2 yrs 10 mos\nEducation\nEducation\nUniversity of Cambridge\nUniversity of Cambridge\nMaster of Philosophy - MPhil, Literature\nMaster of Philosophy - MPhil, Literature\n2011 - 2012\n2011 - 2012\nUCL\nUCL\nBachelor's degree, English Language and Literature, General\nBachelor's degree, English Language and Literature, General\n2008 - 2011\n2008 - 2011\nGrade: 1st\nGrade: 1st\nShow all 3 educations\nInterests\nInterests\nTop Voices\nTop Voices\nCompanies\nCompanies\nGroups\nGroups\nSchools\nSchools\nAmanda Bickerstaff\nAmanda Bickerstaff\n¬∑ 3rd\nThird degree connection\nEducator | AI for Education Founder | Keynote | Researcher | LinkedIn Top Voice in Education\nEducator | AI for Education Founder | Keynote | Researcher | LinkedIn Top Voice in Education\n85,502 followers\n85,502 followers\nFollow",
    "searchKeyword": "CEO"
  },
  {
    "profileUrl": "https://www.linkedin.com/in/stephen-hollis-0a23552a",
    "name": "Stephen Hollis",
    "title": "Chief Executive Officer",
    "location": "United Kingdom",
    "company": "Yard Sale Pizza",
    "about": "",
    "experience": "Experience\nExperience\nChief Executive Officer\nChief Executive Officer\nYard Sale Pizza ¬∑ Full-time\nYard Sale Pizza ¬∑ Full-time\nNov 2025 - Present ¬∑ 4 mos\nNov 2025 to Present ¬∑ 4 mos\nLondon Area, United Kingdom ¬∑ Hybrid\nLondon Area, United Kingdom ¬∑ Hybrid\nOperations Director - Soul Coffee / Starbucks\nOperations Director - Soul Coffee / Starbucks\nSoul Foods Group ¬∑ Full-time\nSoul Foods Group ¬∑ Full-time\nMay 2022 - Nov 2025 ¬∑ 3 yrs 7 mos\nMay 2022 to Nov 2025 ¬∑ 3 yrs 7 mos\nInvestor and enthusiast\nInvestor and enthusiast\nBabaBoom\nBabaBoom\nJul 2016 - Dec 2024 ¬∑ 8 yrs 6 mos\nJul 2016 to Dec 2024 ¬∑ 8 yrs 6 mos\nOperations Director\nOperations Director\nOperations Director\nThe MSG Group - Domino's Pizza ¬∑ Full-time\nThe MSG Group - Domino's Pizza ¬∑ Full-time\nJan 2017 - May 2022 ¬∑ 5 yrs 5 mos\nJan 2017 to May 2022 ¬∑ 5 yrs 5 mos\nUK\nUK\nDominos pizza\nDominos pizza\nBrand Operations Director\nBrand Operations Director\nMalmaison\nMalmaison\nJun 2016 - Nov 2016 ¬∑ 6 mos\nJun 2016 to Nov 2016 ¬∑ 6 mos\nUk\nUk\nShow all 12 experiences",
    "isCSuite": true,
    "contextForAI": "Stephen Hollis \n2nd degree connection\n2nd\nChief Executive Officer\nYard Sale Pizza\nBritannia Royal Naval College\nUnited Kingdom  Contact info\n500+ connections\nIwona Plumpton is a mutual connection\nIwona Plumpton is a mutual connection\nConnect\nMessage\nMore\nHighlights\nHighlights\nStephen was recently hired\nStephen was recently hired\nStephen started their role at Yard Sale Pizza 4 months ago.\nStephen started their role at Yard Sale Pizza 4 months ago.\nFree insight from Sales Navigator\nFree insight from Sales Navigator\nUnlock more insights about leads\nImprove outreach with sales insights\nTry Sales Navigator for ¬£0\n1-month free. We‚Äôll remind you 7 days before your trial ends.\nAbout\nAbout\nSo I‚Äôve been doing this a long time... A high volume Operations Director turned CEO with over twenty five years experience in multi site restaurant and the hospitality industry in general (corporate and franchise). An accomplished generalist Operator whose strengths lie in building high performing teams, collaborating across all functions and building strong relationships with key stake holders. I have overseen the growth and expansion of numerous high street restaurant, QSR and casual dining businesses and understand the critical importance of managing change both through periods of growth and challenging trade. I have a balanced and pragmatic approach to operations centred on the nurturing of talent, needs of the customer and the design and execution of operational practises. Before this two decade adventure, I spent the 1990s serving as a Commissioned Officer in the Royal Navy with extensive experience in broad based man management, planning, organisation and Leadership...\nSo I‚Äôve been doing this a long time... A high volume Operations Director turned CEO with over twenty five years experience in multi site restaurant and the hospitality industry in general (corporate and franchise). An accomplished generalist Operator whose strengths lie in building high performing teams, collaborating across all functions and building strong relationships with key stake holders. I have overseen the growth and expansion of numerous high street restaurant, QSR and casual dining businesses and understand the critical importance of managing change both through periods of growth and challenging trade. I have a balanced and pragmatic approach to operations centred on the nurturing of talent, needs of the customer and the design and execution of operational practises. Before this two decade adventure, I spent the 1990s serving as a Commissioned Officer in the Royal Navy with extensive experience in broad based man management, planning, organisation and Leadership...\n‚Ä¶see more\nActivity\nActivity\n5,680 followers\n5,680 followers\nPosts\nComments\nLoaded 8 Posts posts\nStephen Hollis\nStephen Hollis\n   ‚Ä¢ 2nd\nVerified ‚Ä¢ 2nd\nChief Executive Officer\nChief Executive Officer\n2w ‚Ä¢ \n2 weeks ago ‚Ä¢ Visible to anyone on or off LinkedIn\nBorn from the hard work and sheer talent of an amazing YSP team‚Ä¶ welcome East Finchley to the family ‚ù§Ô∏è\nYard Sale Pizza\nYard Sale Pizza\n3,510 followers\n3,510 followers\nHello New Shop! So proud of our team, from the shop build to hiring this amazing bunch of people ‚ù§Ô∏è meet the East Finchley crew üòç \nThe oven's raring to go and we can't wait to serve some banging pizza üçï üî•\n‚Ä¶more\nActivate to view larger image,\n1/4\nActivate to view larger image,\n51\n2 comments\nStephen Hollis reposted this\nYard Sale Pizza\nYard Sale Pizza\n3,510 followers\n3,510 followers\n1mo ‚Ä¢ \n1 month ago ‚Ä¢ Visible to anyone on or off LinkedIn\nWe're expanding fast with exciting plans round the corner, looking for brilliant individuals to join our teams in London üçï‚ú®üõµ\nSecond Pizza Chef\nJob by Yard Sale Pizza\nLondon, England, United Kingdom (On-site)\nView job\nView job\n12\n3 reposts\nShow all posts\nExperience\nExperience\nChief Executive Officer\nChief Executive Officer\nYard Sale Pizza ¬∑ Full-time\nYard Sale Pizza ¬∑ Full-time\nNov 2025 - Present ¬∑ 4 mos\nNov 2025 to Present ¬∑ 4 mos\nLondon Area, United Kingdom ¬∑ Hybrid\nLondon Area, United Kingdom ¬∑ Hybrid\nOperations Director - Soul Coffee / Starbucks\nOperations Director - Soul Coffee / Starbucks\nSoul Foods Group ¬∑ Full-time\nSoul Foods Group ¬∑ Full-time\nMay 2022 - Nov 2025 ¬∑ 3 yrs 7 mos\nMay 2022 to Nov 2025 ¬∑ 3 yrs 7 mos\nInvestor and enthusiast\nInvestor and enthusiast\nBabaBoom\nBabaBoom\nJul 2016 - Dec 2024 ¬∑ 8 yrs 6 mos\nJul 2016 to Dec 2024 ¬∑ 8 yrs 6 mos\nOperations Director\nOperations Director\nOperations Director\nThe MSG Group - Domino's Pizza ¬∑ Full-time\nThe MSG Group - Domino's Pizza ¬∑ Full-time\nJan 2017 - May 2022 ¬∑ 5 yrs 5 mos\nJan 2017 to May 2022 ¬∑ 5 yrs 5 mos\nUK\nUK\nDominos pizza\nDominos pizza\nBrand Operations Director\nBrand Operations Director\nMalmaison\nMalmaison\nJun 2016 - Nov 2016 ¬∑ 6 mos\nJun 2016 to Nov 2016 ¬∑ 6 mos\nUk\nUk\nShow all 12 experiences\nEducation\nEducation\nBritannia Royal Naval College\nBritannia Royal Naval College\nBritannia Royal Naval College\n1991 - 1992\n1991 - 1992\nGillotts, Henley on Thames\nGillotts, Henley on Thames",
    "searchKeyword": "CEO"
  },
  {
    "profileUrl": "https://www.linkedin.com/in/ACoAAAN6I2wBf4sUmz2QA5K9cQvicA05WEiOJR4",
    "name": "Iwona Plumpton",
    "title": "Henry Stewart Events & The HS Property Hub",
    "location": "London, England, United Kingdom",
    "company": "Henry Stewart Events",
    "about": "",
    "experience": "",
    "isCSuite": true,
    "contextForAI": "Iwona has a {:badgeType} account\ntest\nIwona Plumpton\n1st degree connection\n1st\nHenry Stewart Events & The HS Property Hub\nHenry Stewart Events\nUniversity of Wroclaw\nLondon, England, United Kingdom  Contact info\n500+ connections\nSynvia Solutions is a mutual connection\nSynvia Solutions is a mutual connection\nMessage\nMore",
    "searchKeyword": "CEO"
  },
  {
    "profileUrl": "https://www.linkedin.com/in/parklins",
    "name": "Parklins I.",
    "title": "Chief Executive Officer, BabyMomsi",
    "location": "London Area, United Kingdom",
    "company": "BabyMomsi",
    "about": "",
    "experience": "Experience\nExperience\nCEO\nCEO\nBabyMomsi ¬∑ Full-time\nBabyMomsi ¬∑ Full-time\nJan 2025 - Present ¬∑ 1 yr 2 mos\nJan 2025 to Present ¬∑ 1 yr 2 mos\nLondon Area, United Kingdom\nLondon Area, United Kingdom\nHead of UX\nHead of UX\nAppsumer (Acquired by InMobi)\nAppsumer (Acquired by InMobi)\nJul 2022 - Dec 2024 ¬∑ 2 yrs 6 mos\nJul 2022 to Dec 2024 ¬∑ 2 yrs 6 mos\nLondon Area, United Kingdom\nLondon Area, United Kingdom\nSenior User Experience Designer\nSenior User Experience Designer\nFunnelish ¬∑ Part-time\nFunnelish ¬∑ Part-time\nSep 2023 - Mar 2024 ¬∑ 7 mos\nSep 2023 to Mar 2024 ¬∑ 7 mos\nLondon Area, United Kingdom\nLondon Area, United Kingdom\nSenior User Experience Designer\nSenior User Experience Designer\nMRM ¬∑ Contract\nMRM ¬∑ Contract\nMay 2022 - Jul 2022 ¬∑ 3 mos\nMay 2022 to Jul 2022 ¬∑ 3 mos\nLondon Area, United Kingdom\nLondon Area, United Kingdom\nSenior Product Designer\nSenior Product Designer\nDataCamp ¬∑ Full-time\nDataCamp ¬∑ Full-time\nMay 2021 - May 2022 ¬∑ 1 yr 1 mo\nMay 2021 to May 2022 ¬∑ 1 yr 1 mo\nLondon Area, United Kingdom ¬∑ Hybrid\nLondon Area, United Kingdom ¬∑ Hybrid\nShow all 7 experiences",
    "isCSuite": true,
    "contextForAI": "Parklins I. \n2nd degree connection\n2nd\nChief Executive Officer, BabyMomsi\nBabyMomsi\nRavensbourne University London\nLondon Area, United Kingdom  Contact info\n7,059 followers \n500+ connections\nEWEJE, Oyeniyi - CPHR Candidate is a mutual connection\nEWEJE, Oyeniyi - CPHR Candidate is a mutual connection\nFollow\nMessage\nMore\nAbout\nAbout\nBuilding products with love | Driving Innovation in FemTech\nI am a Human-Interaction Technology Leader with over 12 years of experience in UX, Product, and Human-Centered Innovation. My expertise lies in creating intuitive, AI-powered, and user-centric products that bridge the gap between technology and human behavior.\nAs the Co-founder & CEO of Babymomsi, I am leading the charge in reshaping maternal and infant care through AI-driven insights and seamless mobile experiences. My approach combines behavioral science, design thinking, and data intelligence to build products that truly serve and support users.\nThroughout my career, I have worked across startups, enterprise platforms, and FinTech, driving product innovation, growth, and user adoption at scale. I thrive at the intersection of technology, business, and design, ensuring that every product decision is anchored in deep user understanding and business impact.\nI am passionate about leveraging AI, automation, and smart design to create digital experiences that feel natural, effortless, and empowering. If you‚Äôre as excited as I am about human-interaction technology and the future of femtech, let‚Äôs connect! üöÄ\nBuilding products with love | Driving Innovation in FemTech I am a Human-Interaction Technology Leader with over 12 years of experience in UX, Product, and Human-Centered Innovation. My expertise lies in creating intuitive, AI-powered, and user-centric products that bridge the gap between technology and human behavior. As the Co-founder & CEO of Babymomsi, I am leading the charge in reshaping maternal and infant care through AI-driven insights and seamless mobile experiences. My approach combines behavioral science, design thinking, and data intelligence to build products that truly serve and support users. Throughout my career, I have worked across startups, enterprise platforms, and FinTech, driving product innovation, growth, and user adoption at scale. I thrive at the intersection of technology, business, and design, ensuring that every product decision is anchored in deep user understanding and business impact. I am passionate about leveraging AI, automation, and smart design to create digital experiences that feel natural, effortless, and empowering. If you‚Äôre as excited as I am about human-interaction technology and the future of femtech, let‚Äôs connect! üöÄ\n‚Ä¶see more\nFeatured\nFeatured\nPost\nPost\nBabyMomsi is SEIS Pre-approved!! I‚Äôm so excited to share that our SEIS Advance Assurance application has been approved by HMRC for an Investment amount of ¬£250k! üéâ\nWe‚Äôre building BabyMomsi to prevent and support postpartum depression for new and expecting mums with our AI-powered digital doula app. \nNow, we‚Äôre officially fundraising our Pre-Seed round for UK based Angel Investors who can receive 50% tax relief and all the benefits of SEIS Investment.\nAlready, we have 2/10 commitment towards our target ask and are actively speaking with angels.\nWould you like to take a look at our deck? Shoot me a dm and I‚Äôll share a copy with you. You could also schedule a quick call to discuss the market opportunity, our traction, partnerships, research and growth plans: https://lnkd.in/dPR7mrgu\nLet‚Äôs revolutionise perinatal mental health market for at-risk new and expecting mums together!\nhashtag\n#SEIS \nhashtag\n#angelinvestors \nhashtag\n#investment \nhashtag\n#opportunity \nhashtag\n#femtech \nhashtag\n#healthtech \nhashtag\n#ai \nhashtag\n#perinatalmentalhealth \nhashtag\n#babymomsi \nhashtag\n#startup \nhashtag\n#unitedkingdom \nhashtag\n#londonangelinvestors\n848\n153 comments\nActivity\nActivity\n7,059 followers\n7,059 followers\nFollow\nPosts\nComments\nVideos\nImages\nArticles\nLoaded 9 Posts posts\nParklins I.\nParklins I.\n   ‚Ä¢ 2nd\nVerified ‚Ä¢ 2nd\nChief Executive Officer, BabyMomsi\nChief Executive Officer, BabyMomsi\n1w ‚Ä¢ Edited ‚Ä¢ \n1 week ago ‚Ä¢ Edited ‚Ä¢ Visible to anyone on or off LinkedIn\nYesterday at King‚Äôs College London Institute for Healthcare & Engineering for the Startup Roadshow. We have been putting a lot of work in the background at BabyMomsi. We have successfully completed our v2 with extensive research insights from our MVP and are now ready to go to market! üéâ\nOn the last image is a sneak-peak into our AI-powered Digital Doula built to be the chatGPT for mums but with more emotional intelligence and safeguarding interventions.\nWe are introducing BabyMomsi for Business our (B2B model) and are rolling out pilots in the coming weeks for private clinics, clinicians and employers benefit providers, if you‚Äôd be interested in participating, please reach out to me or pilot@babymomsi.com and we‚Äôll set you up quick. Let‚Äôs move maternal health from reactive to preve",
    "searchKeyword": "CEO"
  },
  {
    "profileUrl": "https://www.linkedin.com/in/pate-easy-msc-6679ab23a",
    "name": "Pate Easy MSc.",
    "title": "Chair Man / Chief Executive Officer",
    "location": "London Area, United Kingdom",
    "company": "",
    "about": "",
    "experience": "Experience\nExperience\nChair Man / CEO\nChair Man / CEO \nChair Man / CEO \nPristiqe Ltd ¬∑ Full-time\nPristiqe Ltd ¬∑ Full-time\nOct 2019 - Mar 2024 ¬∑ 4 yrs 6 mos\nOct 2019 to Mar 2024 ¬∑ 4 yrs 6 mos\nLondon Area, United Kingdom ¬∑ Hybrid\nLondon Area, United Kingdom ¬∑ Hybrid\nAnalyse interpret data and information from datasets to support strategic direction of Pristiqe.\nInitiate market research to identify advantages to increase market share of SME's through strategic consultations.\nAnalyse interpret data and information from datasets to support strategic direction of Pristiqe. Initiate market research to identify advantages to increase market share of SME's through strategic consultations.\nStrategic Lead Property Developer\nStrategic Lead Property Developer\nStrategic Lead Property Developer\nPrivate Developers ¬∑ Full-time\nPrivate Developers ¬∑ Full-time\nJan 2018 - Oct 2023 ¬∑ 5 yrs 10 mos\nJan 2018 to Oct 2023 ¬∑ 5 yrs 10 mos\nHybrid\nHybrid\nWorked as a property project manager by planning, using strategy to set out requirements for resources and people teams to achieve target and overall aim.\nWorked as a property project manager by planning, using strategy to set out requirements for resources and people teams to achieve target and overall aim.\nTeam Leadership, Project Management and +5 skills\nProperty Project Manager\nProperty Project Manager \nProperty Project Manager \nQuality Trades ¬∑ Full-time\nQuality Trades ¬∑ Full-time\nMar 2015 - Dec 2017 ¬∑ 2 yrs 10 mos\nMar 2015 to Dec 2017 ¬∑ 2 yrs 10 mos\nGreater London, England, United Kingdom\nGreater London, England, United Kingdom\nEnsure the effective management of teams and project phases by communicating with internal and external stakeholders involved in the processes to complete the project builds.\nEnsure the effective management of teams and project phases by communicating with internal and external stakeholders involved in the processes to complete the project builds.",
    "isCSuite": true,
    "contextForAI": "Pate Easy MSc.\n He/Him  \n2nd degree connection\n2nd\nChair Man / Chief Executive Officer\nThe London School of Economics and Political Science (LSE)\nLondon Area, United Kingdom  Contact info\n500+ connections\nIwona Plumpton is a mutual connection\nIwona Plumpton is a mutual connection\nConnect\nMessage\nMore\nAbout\nAbout\nThe aims of Pristiqe's are a dichotomy of focused services to strategically help SME's to better navigate the challenges they face in our modern time and to ensure that their customer exchanges relationship exceeds their customer expectations.\nThe aims of Pristiqe's are a dichotomy of focused services to strategically help SME's to better navigate the challenges they face in our modern time and to ensure that their customer exchanges relationship exceeds their customer expectations.\nActivity\nActivity\n1,219 followers\n1,219 followers\nPate hasn‚Äôt posted yet\nRecent posts Pate shares will be displayed here.\nShow all activity\nExperience\nExperience\nChair Man / CEO\nChair Man / CEO \nChair Man / CEO \nPristiqe Ltd ¬∑ Full-time\nPristiqe Ltd ¬∑ Full-time\nOct 2019 - Mar 2024 ¬∑ 4 yrs 6 mos\nOct 2019 to Mar 2024 ¬∑ 4 yrs 6 mos\nLondon Area, United Kingdom ¬∑ Hybrid\nLondon Area, United Kingdom ¬∑ Hybrid\nAnalyse interpret data and information from datasets to support strategic direction of Pristiqe.\nInitiate market research to identify advantages to increase market share of SME's through strategic consultations.\nAnalyse interpret data and information from datasets to support strategic direction of Pristiqe. Initiate market research to identify advantages to increase market share of SME's through strategic consultations.\nStrategic Lead Property Developer\nStrategic Lead Property Developer\nStrategic Lead Property Developer\nPrivate Developers ¬∑ Full-time\nPrivate Developers ¬∑ Full-time\nJan 2018 - Oct 2023 ¬∑ 5 yrs 10 mos\nJan 2018 to Oct 2023 ¬∑ 5 yrs 10 mos\nHybrid\nHybrid\nWorked as a property project manager by planning, using strategy to set out requirements for resources and people teams to achieve target and overall aim.\nWorked as a property project manager by planning, using strategy to set out requirements for resources and people teams to achieve target and overall aim.\nTeam Leadership, Project Management and +5 skills\nProperty Project Manager\nProperty Project Manager \nProperty Project Manager \nQuality Trades ¬∑ Full-time\nQuality Trades ¬∑ Full-time\nMar 2015 - Dec 2017 ¬∑ 2 yrs 10 mos\nMar 2015 to Dec 2017 ¬∑ 2 yrs 10 mos\nGreater London, England, United Kingdom\nGreater London, England, United Kingdom\nEnsure the effective management of teams and project phases by communicating with internal and external stakeholders involved in the processes to complete the project builds.\nEnsure the effective management of teams and project phases by communicating with internal and external stakeholders involved in the processes to complete the project builds.\nEducation\nEducation\nThe London School of Economics and Political Science (LSE)\nThe London School of Economics and Political Science (LSE)\nProfessional Course, Automation Implementation in Business\nProfessional Course, Automation Implementation in Business\nMar 2022 - Apr 2022\nMar 2022 - Apr 2022\nThe University of Law\nThe University of Law\nMaster (MSc), Strategic Business Management\nMaster (MSc), Strategic Business Management\nJan 2018 - Apr 2019\nJan 2018 - Apr 2019\nActivities and societies: Alumni of the University of Law\nActivities and societies: Alumni of the University of Law\nShow all 4 educations\nSkills\nSkills\nProject Management\nProject Management\nStrategic Lead Property Developer at Private Developers \nStrategic Lead Property Developer at Private Developers \nEndorsed by 1 person in the last 6 months\nEndorsed by 1 person in the last 6 months\n2 endorsements\n2 endorsements\nProject Planning\nProject Planning\nStrategic Lead Property Developer at Private Developers \nStrategic Lead Property Developer at Private Developers \nEndorsed by 1 person in the last 6 months\nEndorsed by 1 person in the last 6 months\n2 endorsements\n2 endorsements\nShow all 8 skills\nInterests\nInterests\nCompanies\nCompanies\nNewsletters\nNewsletters\nSchools\nSchools\nPlayStation\nPlayStation\n1,040,884 followers\n1,040,884 followers\nFollow\nThe London School of Economics and Political Science (LSE)\nThe London School of Economics and Political Science (LSE)\n967,713 followers\n967,713 followers\nFollow\nShow all companies",
    "searchKeyword": "CEO"
  },
  {
    "profileUrl": "https://www.linkedin.com/in/mac-plumpton-3165b044",
    "name": "Mac Plumpton",
    "title": "CEO Hospitality",
    "location": "London, England, United Kingdom",
    "company": "",
    "about": "",
    "experience": "",
    "isCSuite": true,
    "contextForAI": "Mac Plumpton\n He/Him  \n2nd degree connection\n2nd\nCEO Hospitality\nLondon, England, United Kingdom  Contact info",
    "searchKeyword": "CEO"
  },
  {
    "profileUrl": "https://www.linkedin.com/in/jim-glasheen-36510712",
    "name": "Jim Glasheen",
    "title": "Executive / Board Member / Investor",
    "location": "London, England, United Kingdom",
    "company": "Cambridge Enterprise",
    "about": "",
    "experience": "Experience\nExperience\nChief Executive Officer\nChief Executive Officer\nCambridge Enterprise ¬∑ Full-time\nCambridge Enterprise ¬∑ Full-time\nNov 2024 - Present ¬∑ 1 yr 4 mos\nNov 2024 to Present ¬∑ 1 yr 4 mos\nCambridge, England, United Kingdom\nCambridge, England, United Kingdom\nPresident / Co-founder / Board Member\nPresident / Co-founder / Board Member\nClade Therapeutics ¬∑ Full-time\nClade Therapeutics ¬∑ Full-time\n2021 - Dec 2024 ¬∑ 4 yrs\n2021 to Dec 2024 ¬∑ 4 yrs\nCambridge, Massachusetts, United States\nCambridge, Massachusetts, United States\nCo-Founder / President / CEO (2018-2019)/ board member (2018-2020)\nCo-Founder / President / CEO (2018-2019)/ board member (2018-2020)\nAtalanta Therapeutics\nAtalanta Therapeutics\n2018 - 2020 ¬∑ 2 yrs\n2018 to 2020 ¬∑ 2 yrs\nBoston, Massachusetts, United States\nBoston, Massachusetts, United States\nExecutive Vice Chancellor\nExecutive Vice Chancellor\nUniversity of Massachusetts Medical School\nUniversity of Massachusetts Medical School\n2017 - 2020 ¬∑ 3 yrs\n2017 to 2020 ¬∑ 3 yrs\nWorcester, MA // Cambridge, MA\nWorcester, MA // Cambridge, MA\nGeneral Partner\nGeneral Partner\nGeneral Partner\nTechnology Partners Venture Capital\nTechnology Partners Venture Capital\n2002 - 2018 ¬∑ 16 yrs\n2002 to 2018 ¬∑ 16 yrs\nPalo Alto, California, United States\nPalo Alto, California, United States\nHealthcare Venture Capital\nHealthcare Venture Capital\nTechnology Partners\nTechnology Partners\nFocus: Venture capital investors in cleantech and life science companies at all stages.\nFocus: Venture capital investors in cleantech and life science companies at all stages.\nShow all 7 experiences",
    "isCSuite": true,
    "contextForAI": "Jim Glasheen \n2nd degree connection\n2nd\nExecutive / Board Member / Investor\nCambridge Enterprise\nHarvard University\nLondon, England, United Kingdom  Contact info\n500+ connections\nMaxwell (Max) Kahn is a mutual connection\nMaxwell (Max) Kahn is a mutual connection\nConnect\nMessage\nMore\nActivity\nActivity\n3,799 followers\n3,799 followers\nPosts\nComments\nImages\nLoaded 9 Posts posts\nJim Glasheen\nJim Glasheen\n   ‚Ä¢ 2nd\nVerified ‚Ä¢ 2nd\nExecutive / Board Member / Investor\nExecutive / Board Member / Investor\n5mo ‚Ä¢ \n5 months ago ‚Ä¢ Visible to anyone on or off LinkedIn\nWhat a week last week was in Cambridge.\nFrom ‚ÄòIdeas to Reality‚Äô to ‚ÄòSPARK 1.0‚Äô to ‚ÄòBioCentury Grand Rounds‚Äô to ‚ÄòCambridge Tech Week‚Äô it has been a powerful reminder of what is at the core of this ecosystem.\nAt @Cambridge Enterprise‚Äôs Ideas to Reality, we welcomed attendees from across the Cambridge ecosystem and beyond to celebrate the incredible innovation emerging from the University. The twisting path from an early innovation to transformational societal impact was laid bare. As such, Cambridge Enterprise has a diverse toolkit to support founders who are tackling global challenges. The energy in the room was electrifying and carried me throughout the rest of the week.\nAt the SPARK 1.0 Demo Day, a programme created by @Kings E-Lab in partnership with @Founders at the University of Cambridge, I was fortunate to witness 22 ventures from across 17 University departments pitch bold ideas, from climate tech to digital health, to a room full of investors, advisors and peers. The drive, collaboration and ambition on display captured the spirit of Cambridge perfectly.\nMeanwhile, @BioCentury Inc. Grand Rounds brought leading life science investors, academics and biopharma leaders to the city and @Cambridge Tech Week showcased the visionaries and specialists behind Cambridge‚Äôs thriving tech ecosystem.\nThis is a truly special ecosystem, with an exceptional degree of connection and support amongst all stakeholders, and one that I am proud to be a part of.\nhashtag\n#Cambridge \nhashtag\n#Innovation \nhashtag\n#CamTechWeek \nhashtag\n#Startups \nhashtag\n#Networking\n‚Ä¶more\nActivate to view larger image,\nActivate to view larger image,\n181\n11 comments\n2 reposts\nJim Glasheen reposted this\nCambridge Tech Podcast\nCambridge Tech Podcast\n3,449 followers\n3,449 followers\n7mo ‚Ä¢ \n7 months ago ‚Ä¢ Visible to anyone on or off LinkedIn\nWhat happens when a San Francisco VC takes the reins at Cambridge Enterprise?\nSix months into the role, Jim Glasheen joins us to talk about his early moves as incoming CEO, like opening a London office to better plug Cambridge into global capital and talent flows. But this episode goes deeper than strategy.\nüîë Key takeaways:\n‚Ä¢ Cambridge has over 40 entrepreneurship programmes, but Jim questions if we‚Äôre at risk of creating an ‚Äúillusion of entrepreneurship‚Äù without real market pressure.\n‚Ä¢ There‚Äôs a persistent Series B funding gap. His push? Build international investor relationships before companies need to scale.\n‚Ä¢ He wants the ecosystem to get more comfortable with failure and take on more risk. \n‚Ä¢ Cambridge Enterprise now spans licensing, founder support, venture investment, consulting, and ecosystem-building.\nJim‚Äôs set the clock ticking: in 6 months, he‚Äôll report back on how international outreach and risk appetite are shifting. For now, he's off to the BIO conference in Boston to keep building those global ties.\nüéß Listen in for a sharp, honest look at what Cambridge needs next, and how leadership is setting the tone.\nTune in on your chosen podcast platform to subscribe and listen.\nApple podcast: https://apple.co/3P9RegV\nSpotify: https://lnkd.in/enP_4QVr\nAmazon Music: https://amzn.to/3VHqGGs\nYouTube: https://lnkd.in/eAg5Wv42\nhashtag\n#CamTechPod\nIn this week‚Äôs news: MatNex, KPMG, HutanBio, HotHouse Therapeutics, Monumo, Shujiro Imamura, SCI Ventures, Christopher & Dana Reeve Foundation, Healx, Pragmatic Semiconductor, John Quigley, David Moore\n‚Ä¶more\nActivate to view larger image,\nActivate to view larger image,\n188\n8 comments\n14 reposts\nShow all posts\nExperience\nExperience\nChief Executive Officer\nChief Executive Officer\nCambridge Enterprise ¬∑ Full-time\nCambridge Enterprise ¬∑ Full-time\nNov 2024 - Present ¬∑ 1 yr 4 mos\nNov 2024 to Present ¬∑ 1 yr 4 mos\nCambridge, England, United Kingdom\nCambridge, England, United Kingdom\nPresident / Co-founder / Board Member\nPresident / Co-founder / Board Member\nClade Therapeutics ¬∑ Full-time\nClade Therapeutics ¬∑ Full-time\n2021 - Dec 2024 ¬∑ 4 yrs\n2021 to Dec 2024 ¬∑ 4 yrs\nCambridge, Massachusetts, United States\nCambridge, Massachusetts, United States\nCo-Founder / President / CEO (2018-2019)/ board member (2018-2020)\nCo-Founder / President / CEO (2018-2019)/ board member (2018-2020)\nAtalanta Therapeutics\nAtalanta Therapeutics\n2018 - 2020 ¬∑ 2 yrs\n2018 to 2020 ¬∑ 2 yrs\nBoston, Massachusetts, United States\nBoston, Massachusetts, United States\nExecutive Vice Chancellor\nExecutive Vice Chancellor\nUniversity of Massachusetts Medical School\nUniv",
    "searchKeyword": "CEO"
  },
  {
    "profileUrl": "https://www.linkedin.com/in/ACoAAAY9GUIBJGoqdRrNF4T5TcJmD13m4xDOOJw",
    "name": "Maxwell (Max) Kahn",
    "title": "President, Coresight Research",
    "location": "New York, New York, United States",
    "company": "",
    "about": "",
    "experience": "",
    "isCSuite": true,
    "contextForAI": "Maxwell (Max) Kahn\n1st degree connection\n1st\nPresident, Coresight Research\nNew York, New York, United States  Contact info",
    "searchKeyword": "CEO"
  },
  {
    "profileUrl": "https://www.linkedin.com/in/moh-damush-a0779015",
    "name": "Moh Damush",
    "title": "Group CEO at Telecel Group",
    "location": "London, England, United Kingdom",
    "company": "Telecel Group",
    "about": "",
    "experience": "Experience\nExperience\nGroup CEO\nGroup CEO\nTelecel Group\nTelecel Group\nNov 2018 - Present ¬∑ 7 yrs 4 mos\nNov 2018 to Present ¬∑ 7 yrs 4 mos\nGroup Chief Executive Officer\nGroup Chief Executive Officer\nTelecel Global\nTelecel Global\nJan 2017 - Present ¬∑ 9 yrs 2 mos\nJan 2017 to Present ¬∑ 9 yrs 2 mos\nChairman\nChairman\nEuropean Merits Development \nEuropean Merits Development \nMay 2011 - Present ¬∑ 14 yrs 10 mos\nMay 2011 to Present ¬∑ 14 yrs 10 mos\nCommunications' Simplified\nCommunications' Simplified\nFounder\nFounder\nErde Innovations\nErde Innovations\n2006 - Present ¬∑ 20 yrs 2 mos\n2006 to Present ¬∑ 20 yrs 2 mos\nConsultancy and incubator firm which supports startup businesses mainly in Africa\nConsultancy and incubator firm which supports startup businesses mainly in Africa\nFounder and Business Development Manager\nFounder and Business Development Manager\nTaki Computers\nTaki Computers\nMay 2001 - Jan 2007 ¬∑ 5 yrs 9 mos\nMay 2001 to Jan 2007 ¬∑ 5 yrs 9 mos\nDubai, Dubai, United Arab Emirates\nDubai, Dubai, United Arab Emirates\nShow all 6 experiences",
    "isCSuite": true,
    "contextForAI": "Moh Damush \n2nd degree connection\n2nd\nGroup CEO at Telecel Group\nTelecel Group\nLondon, England, United Kingdom  Contact info\n9,599 followers \n500+ connections\nEWEJE, Oyeniyi - CPHR Candidate is a mutual connection\nEWEJE, Oyeniyi - CPHR Candidate is a mutual connection\nFollow\nMessage\nMore\nHighlights\nHighlights\nMoh recently posted on LinkedIn\nMoh recently posted on LinkedIn\nUnderstand what topics Moh posts about to inform your outreach.\nUnderstand what topics Moh posts about to inform your outreach.\nFree insight from Sales Navigator\nFree insight from Sales Navigator\nUnlock more insights about leads\nImprove outreach with sales insights\nTry Sales Navigator for ¬£0\n1-month free. We‚Äôll remind you 7 days before your trial ends.\nAbout\nAbout\nMoh Damush\nCEO | Dynamic Leader in Telecommunications & Technology | Driving Innovation and Growth\nAs the Chief Executive Officer of Telecel Group, I am committed to redefining telecommunications and delivering innovative solutions that empower individuals, businesses, and communities worldwide. With extensive leadership experience across global markets, I focus on harnessing the power of technology to create impactful and sustainable growth.\nAt Telecel Group, I oversee the strategic direction and execution of our global operations, driving innovation across our mobile, digital, and investment portfolios. My leadership is centered on growth, promoting excellence, building strategic partnerships, identifying new opportunities, leading M&A activities, and delivering value to stakeholders while prioritizing accessibility and inclusivity in telecommunications.\nIn addition to my role at Telecel Group, I am the proud founder of the Africa Startup Initiative Program (ASIP), an accelerator program dedicated to nurturing and empowering African startups. ASIP provides a platform for entrepreneurs to innovate, scale, and drive positive change in industries ranging from FinTech to AgriTech, nurturing a new generation of leaders and innovators across the continent.\nPassionate about innovation and collaboration, I am dedicated to creating opportunities that bridge the digital divide and pave the way for a connected, inclusive future. \nLet‚Äôs connect to discuss telecommunications, digital transformation, and opportunities in emerging markets.\nMoh Damush CEO | Dynamic Leader in Telecommunications & Technology | Driving Innovation and Growth As the Chief Executive Officer of Telecel Group, I am committed to redefining telecommunications and delivering innovative solutions that empower individuals, businesses, and communities worldwide. With extensive leadership experience across global markets, I focus on harnessing the power of technology to create impactful and sustainable growth. At Telecel Group, I oversee the strategic direction and execution of our global operations, driving innovation across our mobile, digital, and investment portfolios. My leadership is centered on growth, promoting excellence, building strategic partnerships, identifying new opportunities, leading M&A activities, and delivering value to stakeholders while prioritizing accessibility and inclusivity in telecommunications. In addition to my role at Telecel Group, I am the proud founder of the Africa Startup Initiative Program (ASIP), an accelerator program dedicated to nurturing and empowering African startups. ASIP provides a platform for entrepreneurs to innovate, scale, and drive positive change in industries ranging from FinTech to AgriTech, nurturing a new generation of leaders and innovators across the continent. Passionate about innovation and collaboration, I am dedicated to creating opportunities that bridge the digital divide and pave the way for a connected, inclusive future. Let‚Äôs connect to discuss telecommunications, digital transformation, and opportunities in emerging markets.\n‚Ä¶see more\nActivity\nActivity\n9,599 followers\n9,599 followers\nFollow\nPosts\nComments\nImages\nLoaded 9 Posts posts\nMoh Damush\nMoh Damush\n   ‚Ä¢ 2nd\nVerified ‚Ä¢ 2nd\nGroup CEO at Telecel Group\nGroup CEO at Telecel Group\n3w ‚Ä¢ Edited ‚Ä¢ \n3 weeks ago ‚Ä¢ Edited ‚Ä¢ Visible to anyone on or off LinkedIn\nLast week, I had the privilege of advancing one of the most meaningful dimensions of our mission and the closest to my heart: expanding access and opportunity.\nI signed a partnership agreement between Telecel and King's Trust International represented by its CEO Will Straw CBE, to broaden our collective support for education, digital connectivity, and youth empowerment.\nThrough this collaboration, we aim to equip thousands of students with critical digital skills by providing schools with the technology and tools needed to prepare the next generations for a rapidly evolving digital economy. This partnership reflects our long-term commitment to creating sustainable impact and ensuring that young people have every opportunity to thrive.\nhashtag\n#TelecelGroup \nhashtag\n#KingsTrustInternational \nhashtag\n#DigitalInclusion \nhashtag\n#Education \nhashtag\n#YouthEmpow",
    "searchKeyword": "CEO"
  },
  {
    "profileUrl": "https://www.linkedin.com/in/pradeep-pursnani-7abb1a3",
    "name": "Pradeep Pursnani",
    "title": "Chief Executive Officer at Konexa",
    "location": "London, England, United Kingdom",
    "company": "Konexa",
    "about": "",
    "experience": "Experience\nExperience\nChief Executive Officer\nChief Executive Officer\nKonexa ¬∑ Full-time\nKonexa ¬∑ Full-time\nMay 2019 - Present ¬∑ 6 yrs 10 mos\nMay 2019 to Present ¬∑ 6 yrs 10 mos\nLondon Area, United Kingdom\nLondon Area, United Kingdom\nKonexa is the Energy Company of the Future. Its mission is to transform energy systems across Africa in order to provide reliable, affordable, and sustainable energy for all. Konexa aspires to own and operate grid and off-grid power assets, and is pioneering an integrated utility model that accelerates access to reliable power for all by leveraging cost efficient and disruptive technologies. \nKonexa is the Energy Company of the Future. Its mission is to transform energy systems across Africa in order to provide reliable, affordable, and sustainable energy for all. Konexa aspires to own and operate grid and off-grid power assets, and is pioneering an integrated utility model that accelerates access to reliable power for all by leveraging cost efficient and disruptive technologies. \nShell Foundation\nShell Foundation\n9 yrs 5 mos\n9 yrs 5 mos\nDeputy Director - Chief Operating Officer\nDeputy Director - Chief Operating Officer\nJan 2013 - May 2019 ¬∑ 6 yrs 5 mos\nJan 2013 to May 2019 ¬∑ 6 yrs 5 mos\nLondon Area, United Kingdom\nLondon Area, United Kingdom\nBusiness Director\nBusiness Director\nJan 2010 - Jan 2013 ¬∑ 3 yrs 1 mo\nJan 2010 to Jan 2013 ¬∑ 3 yrs 1 mo\nLondon, United Kingdom\nLondon, United Kingdom\nEnterprise based ‚ÄúVenture Philanthropy‚Äù Foundation with the focus on energy related development issues, managing a portfolio of opportunities, incubating startups and taking them to scale in Asia, Africa and South America\nInvestment: US$30m/year, Endowment US$400m\nEnterprise based ‚ÄúVenture Philanthropy‚Äù Foundation with the focus on energy related development issues, managing a portfolio of opportunities, incubating startups and taking them to scale in Asia, Africa and South America Investment: US$30m/year, Endowment US$400m\nCorporate Strategy & Portfoli",
    "isCSuite": true,
    "contextForAI": "Pradeep Pursnani\n2nd degree connection\n2nd\nChief Executive Officer at Konexa\nKonexa\nLondon Business School\nLondon, England, United Kingdom  Contact info\n500+ connections\nEWEJE, Oyeniyi - CPHR Candidate is a mutual connection\nEWEJE, Oyeniyi - CPHR Candidate is a mutual connection\nConnect\nMessage\nMore\nAbout\nAbout\nHigh performing and entrepreneurial with a solid international business and investment track record. Experience in strategy development and execution, M&A, risk management, corporate turnaround and restructuring, investing and operating in early stage ventures and large scale businesses. Strong leadership skills, with demonstrated capacity to lead multinational teams to drive through change and achieve a common vision. An excellent communicator with a passion for relationship building, business development and deal making. Expertise across the energy, finance and technology sector focused in emerging markets and creating a strong development impact. High regard for personal values and work ethics.\nHigh performing and entrepreneurial with a solid international business and investment track record. Experience in strategy development and execution, M&A, risk management, corporate turnaround and restructuring, investing and operating in early stage ventures and large scale businesses. Strong leadership skills, with demonstrated capacity to lead multinational teams to drive through change and achieve a common vision. An excellent communicator with a passion for relationship building, business development and deal making. Expertise across the energy, finance and technology sector focused in emerging markets and creating a strong development impact. High regard for personal values and work ethics.\n‚Ä¶see more\nFeatured\nFeatured\nPost\nPost\nThe entire Konexa team is humbled by the award for ‚ÄúTransaction of the Year for Distribution‚Äù together with Olaniwun Ajayi\nKonexa was created to focus on addressing the challenges across the power sector value chain, unlocking long term investment and delivering 24/7 power to all in a climate friendly way.\nWe thank all of our partners and investors for their support and look forward to continuing to growing the business in Nigeria and beyond.\nSustainable Energy for All (SEforALL), The Global Energy Alliance for People and Planet Shell Foundation The Rockefeller Foundation Department for International Development (DFID) USAID Climate Fund Managers \n7\n1 comment\nActivity\nActivity\n7,594 followers\n7,594 followers\nPosts\nComments\nImages\nLoaded 9 Posts posts\nPradeep Pursnani reposted this\nAfrica Energy Series\nAfrica Energy Series\n4,719 followers\n4,719 followers\n5h ‚Ä¢ Edited ‚Ä¢ \n5 hours ago ‚Ä¢ Edited ‚Ä¢ Visible to anyone on or off LinkedIn\nWith less than two weeks to go, Nigeria Solar Forum will convene the key players driving investment and development in Nigerian renewables, with a core focus on forging deals, shaping policies, and building the partnerships that will power Nigeria's energy future. The event will focus exclusively on Nigeria's renewable energy market realities, policies, challenges, and opportunities, rather than offering a broad, pan-African sweep, it zeroes in on the unique drivers of Nigeria's solar revolution. \nWe will spotlight the rapid uptake of mini-grids and off-grid systems in underserved communities, the booming commercial and industrial solar market and the rise of innovative financing models.\nWe are thrilled to be joined by a stellar lineup of industry leaders shaping conversations at this year's edition of the event, including;\nüìå Dr Abba Aliyu ‚Äì CEO, Rural Electrification Agency of Nigeria \nüìå Pradeep Pursnani ‚Äì CEO, Konexa \nüìå Yischai Beinisch ‚Äì CEO, Daystar Power Group, Shell Power, Shell E&P Africa\nüìå Dr Segun Solomon Adaju ‚Äì CEO, Consistent Energy Limited \nüìå Damilola Hamid Balogun ‚Äì Clean Energy Adoption Lead - Powering Lagos SMEs\nüìå Chioma Ome ‚Äì Country Director, Nigeria Solar Sister\nüìå Kayode Tinuoye, CFA ‚Äì Country Director Nigeria, Genesis Energy \nüìå Bola Ogidan, CFA ‚Äì Founder & CEO, Pirano Energy \nüìå Sarah O. - Senior Representative, Policy & Investment, GOGLA \nüìå Mohammed Hamza ‚Äì Managing Associate, DalaHill LP\nüìå Aishat Raji, CFA ‚Äì Principal & Co-Head Nigeria Advisory, CrossBoundary Advisory \nüìå Yusuf Umar ‚Äì Managing Director, Ripple\nüìå Femi Adesanya ‚Äì CEO, Rensource Energy \nüìå Chisom Okolie ‚Äì Senior Associate, Udo Udoma & Belo-Osagie \nüìå Emeka Okpukpara Jr. ‚Äì Partner, NexTier Completion Solutions \nüìå Ayoola Dominic - President & Co-Founder, Koolboks \nüìå Josephine Udonsak ‚Äì Partner, Dentons \nüìåRebecca Uchendu ‚Äì Senior Manager Product & Operations, TradeGrid \nWe are excited to be partnering with Pirano Energy, Koolboks, DalaHill, FxBridge, TradeGrid and Sygnite Power and Energy Solutions as sponsors/exhibitors at this year's edition of the Nigeria Solar Forum. \nBe part of this critical conversations and unlock unmatched opportunities to connect with project developers, EPC's, financiers, government representatives, technology providers and investo",
    "searchKeyword": "CEO"
  },
  {
    "profileUrl": "https://www.linkedin.com/in/xazainkhan",
    "name": "Zain Khan",
    "title": "Chief Executive Officer @ AnimalKind",
    "location": "London, England, United Kingdom",
    "company": "AnimalKind",
    "about": "",
    "experience": "Experience\nExperience\nChief Executive Officer\nChief Executive Officer\nAnimalKind ¬∑ Full-time\nAnimalKind ¬∑ Full-time\nMar 2022 - Present ¬∑ 4 yrs\nMar 2022 to Present ¬∑ 4 yrs\nGreater London, England, United Kingdom\nGreater London, England, United Kingdom\nAt AnimalKind, we‚Äôre redefining what veterinary care feels like for pets, people, and the professionals who make it possible.\n\nWe combine genuine compassion with intelligent systems to create clinics that run smarter, care deeper, and put kindness at the heart of every decision.\nAt AnimalKind, we‚Äôre redefining what veterinary care feels like for pets, people, and the professionals who make it possible. We combine genuine compassion with intelligent systems to create clinics that run smarter, care deeper, and put kindness at the heart of every decision.\n‚Ä¶see more\nPartner\nPartner\nMandeleo\nMandeleo\nMar 2020 - Present ¬∑ 6 yrs\nMar 2020 to Present ¬∑ 6 yrs\nGreater London, England, United Kingdom\nGreater London, England, United Kingdom\nMandeleo is a London based investment management company that acquires, assembles, and grows sector-focused ecosystems across the UK to create financial and social value for our stakeholders. We design these ecosystems to provide investors with proprietary access to mid-market deals in growing sectors. \n\nWe aim to acquire majority stakes in small yet competitive/profitable businesses in mature sectors that are poised for digital transformation and future-proof our investments with a data-driven approach by generating powerful insights across the investment process.\n\nThe focus is growth, where material upside can be created through active engagement.\nMandeleo is a London based investment management company that acquires, assembles, and grows sector-focused ecosystems across the UK to create financial and social value for our stakeholders. We design these ecosystems to provide investors with proprietary access to mid-market deals in growing sectors. We aim to acquire majority stakes in small yet co",
    "isCSuite": true,
    "contextForAI": "Zain Khan \n2nd degree connection\n2nd\nChief Executive Officer @ AnimalKind\nAnimalKind\nUniversity of Virginia\nLondon, England, United Kingdom  Contact info\n500+ connections\nRobert Lynch is a mutual connection\nRobert Lynch is a mutual connection\nConnect\nMessage\nMore\nAbout\nAbout\nCEO of AnimalKind, building a kinder version of animal healthcare.\nCEO of AnimalKind, building a kinder version of animal healthcare.\nActivity\nActivity\n1,580 followers\n1,580 followers\nLoaded 9 Posts posts\nZain Khan\nZain Khan\n   ‚Ä¢ 2nd\nVerified ‚Ä¢ 2nd\nChief Executive Officer @ AnimalKind\nChief Executive Officer @ AnimalKind\n2mo ‚Ä¢ \n2 months ago ‚Ä¢ Visible to anyone on or off LinkedIn\nWe've just published AnimalKind's Company Charter.\nIt's intended to be a clear manifesto about what we're building and why. Not a vision deck nor marketing material. Just the principles we've committed to, in writing, publicly, so there's no walking it back.\nThis is a long road, and we're early on it, but our direction is set.\nRead more here: https://lnkd.in/dsAPnxSK\n‚Ä¶more\nAnimalKind\nAnimalKind\n112 followers\n112 followers\nWe've published our Company Charter.\nThese are the principles we're building AnimalKind on, how we treat our teams, make decisions, and care for the animals and people who trust us.\nWe're sharing it publicly to keep us accountable. This is the standard we've set for ourselves.\nRead here: https://lnkd.in/dMqJUdrR\n‚Ä¶more\nAnimalKind | Company Charter\nanimalkind.co\n6\nZain Khan\nZain Khan\n   ‚Ä¢ 2nd\nVerified ‚Ä¢ 2nd\nChief Executive Officer @ AnimalKind\nChief Executive Officer @ AnimalKind\n2mo ‚Ä¢ \n2 months ago ‚Ä¢ Visible to anyone on or off LinkedIn\nWhen we started AnimalKind, we knew the hard part wouldn't be finding practices looking to exit. It would be finding people who think and operate the same way we do. \nPeople who want to build something that lasts. Who care about doing it properly, not just doing it quickly. Who see collaboration as the point, not the obstacle.\nJames Weston is one of those people. Over our conversations, it became clear we were after the same thing, a group built on the right foundations, with the patience to let it compound over time.\nToday, Northwest Referrals joins AnimalKind. James stays as Managing Director and joins us as a Director.\nThere's a version of veterinary consolidation that burns people out and strips practices of what made them good. We're trying to prove there's another way. That you can build a successful business while maintaining the right ethos. That good people want to be part of something like that.\nThis is early proof. Plenty more to do.\nThank you to all our partners, advisors, shareholders and investors who helped us get this over the line.\n‚Ä¶more\nAnimalKind\nAnimalKind\n112 followers\n112 followers\nVeterinary consolidation has a particular reputation. Practices acquired, identities lost, teams stretched thin.\nWe set up AnimalKind to do it differently: \n1- Partner with good people and holistically develop our teams. \n2- Keep local names and double down on community connection. \n3- Support what's already working and amplify it with technology when it makes sense. \n4- Take the long view.\nJames Weston built Northwest Referrals in Wigan, a fantastic team of 35 people with advanced-practitioner expertise, and fixed pricing that gives clients clarity from the start. He chose to work with us because of how we connect with our teams, our company charter and the direction we're headed. \nToday, Northwest Referrals joins AnimalKind. James stays as Managing Director and joins us as a Director. Same name. Same team. Same commitment to all our clients and communities.\nThis is what we mean by doing things differently. We're building something good people want to be part of. A group that others are excited to join. \nRead more: https://lnkd.in/dqUK36q6\nThanks to Shawbrook for Healthcare, HCR Law, and Hazlewoods for their support, as well as all of our trusted shareholders and investors.\n‚Ä¶more\nAnimalKind | Northwest Referrals Joins AnimalKind\nanimalkind.co\n19\n1 comment\nShow all posts\nExperience\nExperience\nChief Executive Officer\nChief Executive Officer\nAnimalKind ¬∑ Full-time\nAnimalKind ¬∑ Full-time\nMar 2022 - Present ¬∑ 4 yrs\nMar 2022 to Present ¬∑ 4 yrs\nGreater London, England, United Kingdom\nGreater London, England, United Kingdom\nAt AnimalKind, we‚Äôre redefining what veterinary care feels like for pets, people, and the professionals who make it possible.\nWe combine genuine compassion with intelligent systems to create clinics that run smarter, care deeper, and put kindness at the heart of every decision.\nAt AnimalKind, we‚Äôre redefining what veterinary care feels like for pets, people, and the professionals who make it possible. We combine genuine compassion with intelligent systems to create clinics that run smarter, care deeper, and put kindness at the heart of every decision.\n‚Ä¶see more\nPartner\nPartner\nMandeleo\nMandeleo\nMar 2020 - Present ¬∑ 6 yrs\nMar 2020 to Present ¬∑ 6 yrs\nGreater London, England, United Kingdom\nGreater Londo",
    "searchKeyword": "CEO"
  },
  {
    "profileUrl": "https://www.linkedin.com/in/ACoAAAB2QLQB8-xW3s6RgMOL-sUJuYtHedSyFFE",
    "name": "Robert Lynch",
    "title": "Creating Software for SMEs | Entrepreneur | Old.St Labs co-Founder | TechStars Mentor | Angel Investor",
    "location": "Greater London, England, United Kingdom",
    "company": "",
    "about": "",
    "experience": "Experience\nExperience\nCo-Founder\nCo-Founder\nOld.St Labs ¬∑ Full-time\nOld.St Labs ¬∑ Full-time\nDec 2020 - Present ¬∑ 5 yrs 3 mos\nDec 2020 to Present ¬∑ 5 yrs 3 mos\nLondon, United Kingdom\nLondon, United Kingdom\nOld.St Labs partners with innovators to turn ideas-on-a-napkin into awesome digital products.\n\nWhat we ultimately build could be an automated AI workflow, a web app, a mobile app - any product within reason. MUCH more importantly, we take the time to deeply understand the problems that our clients are looking to solve. Then, and only then, can the journey of designing and building the solution begin...\nOld.St Labs partners with innovators to turn ideas-on-a-napkin into awesome digital products. What we ultimately build could be an automated AI workflow, a web app, a mobile app - any product within reason. MUCH more importantly, we take the time to deeply understand the problems that our clients are looking to solve. Then, and only then, can the journey of designing and building the solution begin...\n‚Ä¶see more\nCEO\nCEO\nCityMunch\nCityMunch\nMay 2015 - Feb 2023 ¬∑ 7 yrs 10 mos\nMay 2015 to Feb 2023 ¬∑ 7 yrs 10 mos\nLondon\nLondon\nCityMunch brought together restaurants and diners, solving a problem for each. For restaurants, the platform tackled underutilised capacity during quiet times of the day; for consumers, it provided a simple way to save money on dining out.\nCityMunch brought together restaurants and diners, solving a problem for each. For restaurants, the platform tackled underutilised capacity during quiet times of the day; for consumers, it provided a simple way to save money on dining out.\n‚Ä¶see more\nInvestment Manager\nInvestment Manager\nLow Carbon\nLow Carbon\nJul 2012 - Jul 2014 ¬∑ 2 yrs 1 mo\nJul 2012 to Jul 2014 ¬∑ 2 yrs 1 mo\nLondon Area, United Kingdom\nLondon Area, United Kingdom\nLow Carbon is a London-based renewable energy investment firm. As an Investment Manager, my responsibilities included the negotiation and execution of financing deals for renewable energy ",
    "isCSuite": true,
    "contextForAI": "Robert has a {:badgeType} account\ntest\nRobert Lynch \n1st degree connection\n1st\nCreating Software for SMEs | Entrepreneur | Old.St Labs co-Founder | TechStars Mentor | Angel Investor\nUniversity of Cambridge\nGreater London, England, United Kingdom  Contact info\n2,451 followers \n500+ connections\nMessage\nMore\nAbout\nAbout\nAfter starting off in finance, I took the plunge into tech entrepreneurship in 2016, founding a real-time restaurant deals app called CityMunch. We had a good run until the pandemic, with around 80k Londoners and 20k Bristolians using the app, and helping around 400 restaurants fill their quieter times with more customers.\nI like to think I learned a thing or two about building a startup along the way. \nWith that in mind, in 2020 I co-founded Old.St Labs with the other Rob* to help others on their startup journey. We work with entrepreneurs from napkin to launch - we define their product strategy, then get our hands dirty, designing and building their core tech product.\nI love discussing strategy with innovators and helping them turn an idea into something real. So please reach out if you'd like to chat!\n*That'll be Rob Woodhead (https://www.linkedin.com/in/rehwoodhead/)\nThis is us: http://old.st\nAfter starting off in finance, I took the plunge into tech entrepreneurship in 2016, founding a real-time restaurant deals app called CityMunch. We had a good run until the pandemic, with around 80k Londoners and 20k Bristolians using the app, and helping around 400 restaurants fill their quieter times with more customers. I like to think I learned a thing or two about building a startup along the way. With that in mind, in 2020 I co-founded Old.St Labs with the other Rob* to help others on their startup journey. We work with entrepreneurs from napkin to launch - we define their product strategy, then get our hands dirty, designing and building their core tech product. I love discussing strategy with innovators and helping them turn an idea into something real. So please reach out if you'd like to chat! *That'll be Rob Woodhead (https://www.linkedin.com/in/rehwoodhead/) This is us: http://old.st\n‚Ä¶see more\nActivity\nActivity\n2,451 followers\n2,451 followers\nFollowing\nPosts\nComments\nVideos\nImages\nLoaded 9 Posts posts\nRobert Lynch\nRobert Lynch\n   ‚Ä¢ 1st\nPremium ‚Ä¢ 1st\nCreating Software for SMEs | Entrepreneur | Old.St Labs co-Founder | TechStars Mentor | Angel Investor\nCreating Software for SMEs | Entrepreneur | Old.St Labs co-Founder | TechStars Mentor | Angel Investor\n1mo ‚Ä¢ \n1 month ago ‚Ä¢ Visible to anyone on or off LinkedIn\nOld.St Labs is in the Telegraph's New Year Business Guide!\nActivate to view larger image,\nActivate to view larger image,\n49\n7 comments\nRobert Lynch reposted this\nRob Woodhead\nRob Woodhead\n   ‚Ä¢ 2nd\nPremium ‚Ä¢ 2nd\nCo-founder at Old.St Labs | Empowering Innovators with Tech | Techstars Mentor | Investor\nCo-founder at Old.St Labs | Empowering Innovators with Tech | Techstars Mentor | Investor\nVisit my website\n1mo ‚Ä¢ \n1 month ago ‚Ä¢ Visible to anyone on or off LinkedIn\nAfter a bit of a hiatus over the Christmas period, the Old Street Labs podcast is back with a bang. And I couldn‚Äôt have picked a better conversation to return with.\nThis week on the podcast, I‚Äôm joined by Lucy Woodhead, VP of Operations at US Jetting (and also my lovely cousin!)\nThis is not your typical ‚Äútech business‚Äù. US Jetting is a second generation manufacturing company operating in a tough, very physical industry. And yet, they‚Äôre actively embracing technology, from process and ops improvements through to e-commerce and digital platforms.\nWe talked about what it really takes to modernise a business like this without losing what makes it work in the first place.\nWe got into:\n‚Ä¢ Moving from fashion into operations in an industrial environment\n‚Ä¢ What it‚Äôs actually like working inside a family run business\n‚Ä¢ Bringing structure and process to messy, real-world operations\n‚Ä¢ Designing digital experiences for very different customer needs\n‚Ä¢ Helping small businesses feel confident using technology\n‚Ä¢ A thoughtful, practical take on AI in a non-tech-first industry\n‚Ä¢ Leadership, growth, and learning on the job\nIt‚Äôs a great reminder that some of the most interesting tech stories aren‚Äôt coming from shiny startups, but from established businesses quietly evolving and doing the hard work of change.\nEpisode 3 is live now:\nThe Old Street Labs Podcast with Lucy Woodhead\n[link in the comments]\n‚Ä¶more\nActivate to view larger image,\nActivate to view larger image,\n45\n4 comments\n6 reposts\nShow all posts\nExperience\nExperience\nCo-Founder\nCo-Founder\nOld.St Labs ¬∑ Full-time\nOld.St Labs ¬∑ Full-time\nDec 2020 - Present ¬∑ 5 yrs 3 mos\nDec 2020 to Present ¬∑ 5 yrs 3 mos\nLondon, United Kingdom\nLondon, United Kingdom\nOld.St Labs partners with innovators to turn ideas-on-a-napkin into awesome digital products.\nWhat we ultimately build could be an automated AI workflow, a web app, a mobile app - any product within reason. MUCH more importantly, we take the time to",
    "searchKeyword": "CEO"
  },
  {
    "profileUrl": "https://www.linkedin.com/in/colinjstuart",
    "name": "Colin Stuart",
    "title": "CEO & Workplace Strategy Expert | Transforming Workplaces and Estates to Drive Organisational Innovation | Passionate about challenging the way we work to improve wellbeing & productivity",
    "location": "London, England, United Kingdom",
    "company": "Baker Stuart Ltd",
    "about": "",
    "experience": "",
    "isCSuite": true,
    "contextForAI": "Colin Stuart \n2nd degree connection\n2nd\nCEO & Workplace Strategy Expert | Transforming Workplaces and Estates to Drive Organisational Innovation | Passionate about challenging the way we work to improve wellbeing & productivity\nBaker Stuart Ltd\nUniversity of Bristol\nLondon, England, United Kingdom  Contact info\n500+ connections\nIwona Plumpton is a mutual connection\nIwona Plumpton is a mutual connection\nConnect\nFollow\nMore",
    "searchKeyword": "CEO"
  },
  {
    "profileUrl": "https://www.linkedin.com/in/jatinondhia",
    "name": "Jatin Ondhia",
    "title": "CEO at Shojin",
    "location": "London, England, United Kingdom",
    "company": "",
    "about": "",
    "experience": "",
    "isCSuite": true,
    "contextForAI": "Jatin Ondhia\n2nd degree connection\n2nd\nCEO at Shojin\nLondon, England, United Kingdom  Contact info",
    "searchKeyword": "CEO"
  },
  {
    "profileUrl": "https://www.linkedin.com/in/ACoAAAAEI4MB8jjsCt-Dq8IxHQRXYWIWKbTdKWs",
    "name": "Jatin Ondhia",
    "title": "CEO at Shojin",
    "location": "London, England, United Kingdom",
    "company": "Shojin",
    "about": "",
    "experience": "Experience\nExperience\nCEO\nCEO\nShojin ¬∑ Full-time\nShojin ¬∑ Full-time\nJul 2009 - Present ¬∑ 16 yrs 8 mos\nJul 2009 to Present ¬∑ 16 yrs 8 mos\nMayfair\nMayfair\nShojin is an FCA-regulated online investment platform that unlocks lucrative institutional-grade investments in the real estate sector on a fractional basis for investors globally. \n \nOperating in a market forecast to grow from $15bn in 2021 to $800bn by 2027, Shojin specialises in debt and equity investments in mid-market property development projects in the UK and has attracted investors from over 50 countries. \n \nShojin carries out all due diligence, co-invests into all projects and oversees them from start to end, sharing profits rather than taking large upfront fees. Consequently, Shojin puts itself in a first loss position and shares profits at the end. This creates the perfect alignment of interest and is a vast improvement on traditional private equity investment models. \n\nBy choosing between a range of real estate projects with different risk profiles and timescales, backed by a team of property experts, investors have the opportunity to access the property market with unmatched clarity and simplicity.\nShojin is an FCA-regulated online investment platform that unlocks lucrative institutional-grade investments in the real estate sector on a fractional basis for investors globally. Operating in a market forecast to grow from $15bn in 2021 to $800bn by 2027, Shojin specialises in debt and equity investments in mid-market property development projects in the UK and has attracted investors from over 50 countries. Shojin carries out all due diligence, co-invests into all projects and oversees them from start to end, sharing profits rather than taking large upfront fees. Consequently, Shojin puts itself in a first loss position and shares profits at the end. This creates the perfect alignment of interest and is a vast improvement on traditional private equity investment models. By choosing between a range of real ",
    "isCSuite": true,
    "contextForAI": "Jatin Ondhia\n2nd degree connection\n2nd\nCEO at Shojin\nShojin\nThe University of Manchester\nLondon, England, United Kingdom  Contact info\n8,150 followers \n500+ connections\nIwona Plumpton is a mutual connection\nIwona Plumpton is a mutual connection\nFollow\nMessage\nView my services\nMore\nHighlights\nHighlights\nJatin recently posted on LinkedIn\nJatin recently posted on LinkedIn\nUnderstand what topics Jatin posts about to inform your outreach.\nUnderstand what topics Jatin posts about to inform your outreach.\nFree insight from Sales Navigator\nFree insight from Sales Navigator\nUnlock more insights about leads\nImprove outreach with sales insights\nTry Sales Navigator for ¬£0\n1-month free. We‚Äôll remind you 7 days before your trial ends.\nAbout\nAbout\n- Ex investment banker now running a leading fractional real estate investment platform\n- Connecting global capital with opportunities in the UK\n- Specialise in funding experienced UK property developers with junior finance - mezzanine and equity\n- Leading a drive to collaborate with industry peers to create a pan-European marketplace for alternative investments\n- A thought leader and regular keynote speaker and panel participant at industry events\n- Always looking to meet like-minded individuals and entrepreneurs to do great things for current and future generations\n- Ex investment banker now running a leading fractional real estate investment platform - Connecting global capital with opportunities in the UK - Specialise in funding experienced UK property developers with junior finance - mezzanine and equity - Leading a drive to collaborate with industry peers to create a pan-European marketplace for alternative investments - A thought leader and regular keynote speaker and panel participant at industry events - Always looking to meet like-minded individuals and entrepreneurs to do great things for current and future generations\n‚Ä¶see more\nServices\nServices\nWealth Management ‚Ä¢ Commercial Lending ‚Ä¢ Property Management\nWealth Management ‚Ä¢ Commercial Lending ‚Ä¢ Property Management\nShow all services\nFeatured\nFeatured\nPost\nPost\nProud of the team for delivering our first whole loan, but more importantly this proves we can now compete for ¬£20m+ development finance deals.\nSingle-source execution across the capital stack offers benefits to developers and investors: faster decisions through one lender relationship, streamlined documentation, and investor access to both senior and mezzanine risk profiles within larger transactions.\nThis deal demonstrates the capability, now we build on it.\nFor funding opportunities across the entire capital stack, contact funding@shojin.co.uk\n71\n2 comments\nPost\nPost\nWe are excited to be launching our latest investment opportunity -¬†a 21-month junior loan offering a fixed return of between 16-20% per annum, for a residential-led development in Romford, East London.\nThe site is a short walk from Romford Railway Station, offering excellent transport links to Central London via the new Elizabeth Line. \nExpress your interest now to receive the Investment Memorandum: https://lnkd.in/gW6duA69\nCapital at risk.\nhashtag\n#londonpropertyinvestment \nhashtag\n#property \nhashtag\n#investment \nhashtag\n#opportunity \n53\n1 comment\nPost\nPost\n2022‚Äôs interest rate rollercoaster ride has taken one more upward lurch, with the Bank of England delivering another blow in its battle to bring down inflation. This latest hike will wrap up the most aggressive year of monetary policy in four decades. We know it has caused weariness and uncertainty across financial markets, and many are now casting their eyes forward to what 2023 might have in store. \nOn a more positive note, yesterday‚Äôs CPI data suggest that the inflation fever might be starting to break, which could translate into smaller interest rate increments over the next year. Financial markets had priced in a peak of 6% for the base rate at one point, but signs suggest it might not reach these heights. Nevertheless, as the UK enters into recession, agility, diversification and foresight will be key in injecting resilience into investment portfolios and minimising investors' exposure to the current macroeconomic headwinds. \nWith investors juggling risk and opportunity, it should be expected that many will look to balance traditional and alternative investments. Moreover, in light of the recent Autumn Statement, it is likely that tax-efficient investments will see greater demand. I would also expect real estate to remain high on investors‚Äô wish lists, even as house prices recalibrate, with the latest stamp duty cuts likely to increase the market‚Äôs resilience in the face of the wider economic turbulence.\nhashtag\n#boe \nhashtag\n#mpc \nhashtag\n#interestrate \nhashtag\n#uk \nhashtag\n#inflation \n26\n2 comments\nPost\nPost\nWe were absolutely delighted to be shortlisted in three categories and receive the Innovative Lender of the Year award at the recent Alternative Credit Investor Awards! \nThank you Suzie Neuwirth for the great hospitality and cong",
    "searchKeyword": "CEO"
  },
  {
    "profileUrl": "https://www.linkedin.com/in/shobi-khan-london",
    "name": "Shobi Khan",
    "title": "Chief Executive Officer at CWG",
    "location": "London, England, United Kingdom",
    "company": "The British Library",
    "about": "",
    "experience": "Experience\nExperience\nBoard Member\nBoard Member\nThe British Library ¬∑ Part-time\nThe British Library ¬∑ Part-time\nMar 2024 - Present ¬∑ 2 yrs\nMar 2024 to Present ¬∑ 2 yrs\nGreater London, England, United Kingdom\nGreater London, England, United Kingdom\nStrategy and Management\nInternational Advisory Board Member\nInternational Advisory Board Member\nUCL School of Management ¬∑ Part-time\nUCL School of Management ¬∑ Part-time\nMar 2024 - Present ¬∑ 2 yrs\nMar 2024 to Present ¬∑ 2 yrs\nLondon Area, United Kingdom\nLondon Area, United Kingdom\nStrategy and Management\nChief Executive Officer\nChief Executive Officer\nCanary Wharf Group ¬∑ Full-time\nCanary Wharf Group ¬∑ Full-time\nOct 2019 - Present ¬∑ 6 yrs 5 mos\nOct 2019 to Present ¬∑ 6 yrs 5 mos\nLondon Area, United Kingdom\nLondon Area, United Kingdom\nCWG has overseen the largest urban regeneration project in Europe and is a fully integrated private real estate company that develops, manages and currently owns interests approximately 7.5 million square feet of office, 0.9 million square feet of retail and over 1,100 Build to Rent units. The company‚Äôs current ¬£2.4 billion construction activity is composed of 500k square feet of commercial properties and over 1,750 new homes: for sale, for rent, intermediate and affordable. CWG is an industry leader in sustainability including purchasing 100% renewable electricity for the Estate since 2012 and zero waste going to landfill from the managed Estate since 2009. CWG is the largest sustainable developer in the UK with over 10 million square feet of sustainable certified buildings.\nCWG has overseen the largest urban regeneration project in Europe and is a fully integrated private real estate company that develops, manages and currently owns interests approximately 7.5 million square feet of office, 0.9 million square feet of retail and over 1,100 Build to Rent units. The company‚Äôs current ¬£2.4 billion construction activity is composed of 500k square feet of commercial properties and over 1,750 new home",
    "isCSuite": true,
    "contextForAI": "Shobi has a {:badgeType} account\nShobi Khan \n3rd degree connection\n3rd\nChief Executive Officer at CWG\n Top Voice\nThe British Library\nUniversity of California, Berkeley\nLondon, England, United Kingdom  Contact info\nhttps://group.canarywharf.com/\n18,941 followers\nFollowed by EWEJE, Oyeniyi - CPHR Candidate\nFollowed by EWEJE, Oyeniyi - CPHR Candidate\nFollow\nMessage\nMore\nHighlights\nHighlights\nShobi recently posted on LinkedIn\nShobi recently posted on LinkedIn\nUnderstand what topics Shobi posts about to inform your outreach.\nUnderstand what topics Shobi posts about to inform your outreach.\nFree insight from Sales Navigator\nFree insight from Sales Navigator\nUnlock more insights about leads\nImprove outreach with sales insights\nTry Sales Navigator for ¬£0\n1-month free. We‚Äôll remind you 7 days before your trial ends.\nAbout\nAbout\nCEO of Canary Wharf Group (CWG) and I bring more than 30 years of experience in the real estate industry.\nCEO of Canary Wharf Group (CWG) and I bring more than 30 years of experience in the real estate industry.\nActivity\nActivity\n18,941 followers\n18,941 followers\nFollow\nPosts\nComments\nVideos\nImages\nLoaded 9 Posts posts\nShobi Khan\nShobi Khan\n ‚Ä¢ 3rd+\nInfluencer ‚Ä¢ 3rd+\nChief Executive Officer at CWG\nChief Executive Officer at CWG\n6d ‚Ä¢ \n6 days ago ‚Ä¢ Visible to anyone on or off LinkedIn\nLove Fridays at Canary Wharf!\nAlways look forward to Fridays¬†on the Wharf¬†as I host a weekly game of Padel¬†at Padium. This week¬†I was joined by Charlie Jacobs from JPMorganChase, Alan Chang from Fuse Energy and Christopher Beatty from Morgan Stanley.\nPadel is¬†just¬†one of¬†our¬†numerous amenities¬†and competitive socialising brands¬†at Canary Wharf - alongside open water swimming¬†at Sea Lanes this summer, GoBoat, Capital Karts, Pitch London, Clays, Fairgame, THE CUBE and Electric Shuffle.¬†Complemented by our incredible arts and events programme including outdoor movies, live music and a 100+ art sculpture collection - not forgetting our health clubs, saunas and over 5 km of waterside boardwalks.\nCome see¬†and experience it¬†for yourselves. Canary Wharf - Where Ambition Lives!\n‚Ä¶more\nActivate to view larger image,\n1/2\nActivate to view larger image,\n292\n3 comments\n2 reposts\nShobi Khan\nShobi Khan\n ‚Ä¢ 3rd+\nInfluencer ‚Ä¢ 3rd+\nChief Executive Officer at CWG\nChief Executive Officer at CWG\n3w ‚Ä¢ \n3 weeks ago ‚Ä¢ Visible to anyone on or off LinkedIn\nOur most successful Winter Lights!\nAn incredible total of over 3.4m visitors was recorded at this year's festival, with¬†357,000 visitors joining us on the first Saturday night - that's the highest ever recorded footfall in one day on the Wharf, a testament to the power of truly accessible, world-class art and culture.\nThis success reinforces¬†why we've consistently invested in our permanent public art collection, the largest outdoor free to visit collection in London, and cultural programming.¬†¬†Culture and art aren't add-ons to placemaking - they're fundamental to it.\nLooking forward, there's still so much to come in our cultural programme this year.¬†Summer Screens will be showing top movies and sports like Wimbledon and the F1, music and theatre returns to our parks, Run the Wharf is back in September and we'll have some exciting new additions to our public art collection.¬†It's going to be a fantastic year.\nA huge thank you and¬†congratulations¬†to our Arts & Events team for curating something incredibly special for our 10th¬†year of Winter Lights and to the Security, Infrastructure, and Marketing teams alongside our CWG volunteer brand ambassadors. Your collaboration and excellence made this our best year yet.\n‚Ä¶more\n460\n8 comments\n17 reposts\nShow all posts\nExperience\nExperience\nBoard Member\nBoard Member\nThe British Library ¬∑ Part-time\nThe British Library ¬∑ Part-time\nMar 2024 - Present ¬∑ 2 yrs\nMar 2024 to Present ¬∑ 2 yrs\nGreater London, England, United Kingdom\nGreater London, England, United Kingdom\nStrategy and Management\nInternational Advisory Board Member\nInternational Advisory Board Member\nUCL School of Management ¬∑ Part-time\nUCL School of Management ¬∑ Part-time\nMar 2024 - Present ¬∑ 2 yrs\nMar 2024 to Present ¬∑ 2 yrs\nLondon Area, United Kingdom\nLondon Area, United Kingdom\nStrategy and Management\nChief Executive Officer\nChief Executive Officer\nCanary Wharf Group ¬∑ Full-time\nCanary Wharf Group ¬∑ Full-time\nOct 2019 - Present ¬∑ 6 yrs 5 mos\nOct 2019 to Present ¬∑ 6 yrs 5 mos\nLondon Area, United Kingdom\nLondon Area, United Kingdom\nCWG has overseen the largest urban regeneration project in Europe and is a fully integrated private real estate company that develops, manages and currently owns interests approximately 7.5 million square feet of office, 0.9 million square feet of retail and over 1,100 Build to Rent units. The company‚Äôs current ¬£2.4 billion construction activity is composed of 500k square feet of commercial properties and over 1,750 new homes: for sale, for rent, intermediate and affordable. CWG is an industry leader in sustainability including purchasing 100% renewable electricity for th",
    "searchKeyword": "CEO"
  },
  {
    "profileUrl": "https://www.linkedin.com/in/tufanerginbilgic",
    "name": "Tufan Erginbilgic",
    "title": "Chief Executive Officer at Rolls-Royce",
    "location": "London, England, United Kingdom",
    "company": "Rolls-Royce",
    "about": "",
    "experience": "",
    "isCSuite": true,
    "contextForAI": "Tufan has a {:badgeType} account\nTufan Erginbilgic\n3rd degree connection\n3rd\nChief Executive Officer at Rolls-Royce\n Top Voice\nRolls-Royce\nBoƒüazi√ßi University\nLondon, England, United Kingdom  Contact info\n74,490 followers\nFollow\nConnect\nMore",
    "searchKeyword": "CEO"
  },
  {
    "profileUrl": "https://www.linkedin.com/in/charles-akinmade-b14a8a122",
    "name": "charles akinmade",
    "title": "Chief Executive Officer at SkillsDomain",
    "location": "Carshalton, England, United Kingdom",
    "company": "SkillsDomain",
    "about": "",
    "experience": "Experience\nExperience\nChief Executive Officer\nChief Executive Officer\nChief Executive Officer\nSkillsDomain\nSkillsDomain\nJan 2009 - Present ¬∑ 17 yrs 2 mos\nJan 2009 to Present ¬∑ 17 yrs 2 mos\nAmazon Web Services (AWS), Data Structures and +27 skills\nCEO\nCEO\nCEO\nSelf-employed\nSelf-employed\nJan 1996 - Present ¬∑ 30 yrs 2 mos\nJan 1996 to Present ¬∑ 30 yrs 2 mos\nLagos, Nigeria\nLagos, Nigeria\nAmazon Web Services (AWS), Data Structures and +27 skills",
    "isCSuite": true,
    "contextForAI": "charles akinmade\n2nd degree connection\n2nd\nChief Executive Officer at SkillsDomain\nSkillsDomain\nUniversity of Lagos\nCarshalton, England, United Kingdom  Contact info\n2,058 followers \n500+ connections\nEWEJE, Oyeniyi - CPHR Candidate is a mutual connection\nEWEJE, Oyeniyi - CPHR Candidate is a mutual connection\nFollow\nMessage\nMore\nAbout\nAbout\nExperience in the IT industry that spans over a period of 20 years, gainful project delivery experience in Europe and Africa.\nEurope\n‚Ä¢ British Car Auction - Vehicle Remarketing Portal\n‚Ä¢ Land Registry UK ‚Äì Land Registry Portal Direct\n‚Ä¢ National Air Traffic Control Services - Safety Tracking & Reporting System\n‚Ä¢ Vertex Data Services ‚Äì Call Centre Solution & Employee Skills Capabilities Application\nNigeria\n‚Ä¢ Lagos State Ministry of Local Government & Chieftaincy Affairs ‚Äì Lagos State Traditional Rulers Information System.\n‚Ä¢ AstraLogica Nig Ltd ‚Äì e-Voucher Vending Solution\n‚Ä¢ British American Tobacco (Nig) Ltd ‚Äì Legallink\n‚Ä¢ Ogun State Government ‚Äì Biometric Staff Audit Solution.\n‚Ä¢ National Institute of Planning & Administration ‚Äì Biometric Data Capture & Reports to aid future planning for Capacity Building of Head-Teachers across the South-West Zone.\n‚Ä¢ Oyo State Ministry of Education ‚Äì Student Examination Information Processing & Management System (SEIPMS) 2013 & 2014 JSS1 Screening & Placement exercise\n‚Ä¢ First Bank PLC ‚Äì Verified over 20,000 addresses across sixteen branches of First Bank PLC within the agreed TAT period\n‚Ä¢ Ekiti State -‚Äì State Biometric Payroll System Review and Audit & Physical Verification of State Employees\n‚Ä¢ Ekiti State -‚Äì State Biometric Retirees Pension System Review and Audit & Physical Verification of State Retirees\nElectoral Campaign Organizations In Ekiti, Osun, Oyo & Kogi States. Setup the Situation Room to capture election results during election day. Both Presidential, Gubernatorial together with Federal Houses and Senatorial Elections.\nExperience in the IT industry that spans over a period of 20 years, gainful project delivery experience in Europe and Africa. Europe ‚Ä¢ British Car Auction - Vehicle Remarketing Portal ‚Ä¢ Land Registry UK ‚Äì Land Registry Portal Direct ‚Ä¢ National Air Traffic Control Services - Safety Tracking & Reporting System ‚Ä¢ Vertex Data Services ‚Äì Call Centre Solution & Employee Skills Capabilities Application Nigeria ‚Ä¢ Lagos State Ministry of Local Government & Chieftaincy Affairs ‚Äì Lagos State Traditional Rulers Information System. ‚Ä¢ AstraLogica Nig Ltd ‚Äì e-Voucher Vending Solution ‚Ä¢ British American Tobacco (Nig) Ltd ‚Äì Legallink ‚Ä¢ Ogun State Government ‚Äì Biometric Staff Audit Solution. ‚Ä¢ National Institute of Planning & Administration ‚Äì Biometric Data Capture & Reports to aid future planning for Capacity Building of Head-Teachers across the South-West Zone. ‚Ä¢ Oyo State Ministry of Education ‚Äì Student Examination Information Processing & Management System (SEIPMS) 2013 & 2014 JSS1 Screening & Placement exercise ‚Ä¢ First Bank PLC ‚Äì Verified over 20,000 addresses across sixteen branches of First Bank PLC within the agreed TAT period ‚Ä¢ Ekiti State -‚Äì State Biometric Payroll System Review and Audit & Physical Verification of State Employees ‚Ä¢ Ekiti State -‚Äì State Biometric Retirees Pension System Review and Audit & Physical Verification of State Retirees Electoral Campaign Organizations In Ekiti, Osun, Oyo & Kogi States. Setup the Situation Room to capture election results during election day. Both Presidential, Gubernatorial together with Federal Houses and Senatorial Elections. \n‚Ä¶see more\nFeatured\nFeatured\nDocument\nDocument\nSD_Bragging_Rights_Brochure.pdf\nSD_Bragging_Rights_Brochure.pdf\nActivity\nActivity\n2,058 followers\n2,058 followers\nFollow\ncharles hasn‚Äôt posted yet\nRecent posts charles shares will be displayed here.\nShow all activity\nExperience\nExperience\nChief Executive Officer\nChief Executive Officer\nChief Executive Officer\nSkillsDomain\nSkillsDomain\nJan 2009 - Present ¬∑ 17 yrs 2 mos\nJan 2009 to Present ¬∑ 17 yrs 2 mos\nAmazon Web Services (AWS), Data Structures and +27 skills\nCEO\nCEO\nCEO\nSelf-employed\nSelf-employed\nJan 1996 - Present ¬∑ 30 yrs 2 mos\nJan 1996 to Present ¬∑ 30 yrs 2 mos\nLagos, Nigeria\nLagos, Nigeria\nAmazon Web Services (AWS), Data Structures and +27 skills\nEducation\nEducation\nUniversity of Lagos\nUniversity of Lagos\nBachelor's degree, History\nBachelor's degree, History\n1986 - 1990\n1986 - 1990\nKnowledge Acquisition, Dashboard Building and +8 skills\nSkills\nSkills\nAmazon Web Services (AWS)\nAmazon Web Services (AWS)\n2 experiences across SkillsDomain and 1 other company\n2 experiences across SkillsDomain and 1 other company\n1 endorsement\n1 endorsement\nSoftware Development\nSoftware Development\n2 experiences across SkillsDomain and 1 other company\n2 experiences across SkillsDomain and 1 other company\n1 endorsement\n1 endorsement\nShow all 40 skills\nInterests\nInterests\nTop Voices\nTop Voices\nCompanies\nCompanies\nGroups\nGroups\nNewsletters\nNewsletters\nSchools\nSchools\nWinnie Byanyima\nWinnie Byanyima\n¬∑ 3rd\nThird degree connection\nE",
    "searchKeyword": "CEO"
  },
  {
    "profileUrl": "https://www.linkedin.com/in/cheri-read-6b5873a6",
    "name": "Cheri Read",
    "title": "Chief Executive Officer of Restful Homes Group",
    "location": "Walsall, England, United Kingdom",
    "company": "Restful homes group",
    "about": "",
    "experience": "Experience\nExperience\nRestful homes group\nRestful homes group\nRestful homes group\nFull-time ¬∑ 14 yrs 6 mos\nFull-time ¬∑ 14 yrs 6 mos\nChief Executive Officer\nChief Executive Officer\nSep 2011 - Present ¬∑ 14 yrs 6 mos\nSep 2011 to Present ¬∑ 14 yrs 6 mos\nWest Midlands, England, United Kingdom ¬∑ On-site\nWest Midlands, England, United Kingdom ¬∑ On-site\nDirector Of Operations\nDirector Of Operations\nDec 2016 - Sep 2024 ¬∑ 7 yrs 10 mos\nDec 2016 to Sep 2024 ¬∑ 7 yrs 10 mos\nBirmingham, West Midlands, United Kingdom\nBirmingham, West Midlands, United Kingdom\nRESTFUL HOMES GROUP LTD. logo\nManager\nManager\nRESTFUL HOMES GROUP LTD.\nRESTFUL HOMES GROUP LTD.\nAug 2011 - Jul 2016 ¬∑ 5 yrs\nAug 2011 to Jul 2016 ¬∑ 5 yrs\nHeath Hayes, Staffordshire, United Kingdom\nHeath Hayes, Staffordshire, United Kingdom\nI manage a 73 bedded specialist challenging behaviour unit, for residents with all types of dementia illnesses, schizophrenia, Huntington's disease, personality disorder & behavioural problems. I also manage over 250 staff who work as part of the specialist team at Alma Court\nI manage a 73 bedded specialist challenging behaviour unit, for residents with all types of dementia illnesses, schizophrenia, Huntington's disease, personality disorder & behavioural problems. I also manage over 250 staff who work as part of the specialist team at Alma Court\n‚Ä¶see more\nCpn - crisis intervention team\nCpn - crisis intervention team\nBirmingham and Solihull Mental Health NHS Foundation Trust\nBirmingham and Solihull Mental Health NHS Foundation Trust\nFeb 2001 - Jun 2010 ¬∑ 9 yrs 5 mos\nFeb 2001 to Jun 2010 ¬∑ 9 yrs 5 mos\nUk\nUk",
    "isCSuite": true,
    "contextForAI": "Cheri Read\n2nd degree connection\n2nd\nChief Executive Officer of Restful Homes Group\nRestful homes group\nBirmingham City University\nWalsall, England, United Kingdom  Contact info\n2,010 followers \n500+ connections\nIwona Plumpton is a mutual connection\nIwona Plumpton is a mutual connection\nFollow\nMessage\nMore\nAbout\nAbout\nManagement & leadership level 5\nHealth & Safety Level 3\nDementia level 5\nManagement & leadership level 5 Health & Safety Level 3 Dementia level 5\nActivity\nActivity\n2,010 followers\n2,010 followers\nFollow\nPosts\nComments\nImages\nLoaded 9 Posts posts\nCheri Read\nCheri Read\nCheri Read\n ‚Ä¢ 2nd\n2nd\nChief Executive Officer of Restful Homes Group\nChief Executive Officer of Restful Homes Group\n5mo ‚Ä¢ \n5 months ago ‚Ä¢ Visible to anyone on or off LinkedIn\nSo proud of you all, especially Glen and Sam with everything you‚Äôve been through ‚ù§Ô∏è‚ù§Ô∏è‚ù§Ô∏è\nGlen Hale\nGlen Hale\nGlen Hale\n   ‚Ä¢ 3rd+\nVerified ‚Ä¢ 3rd+\nDirector of GH Services (UK) Ltd\nDirector of GH Services (UK) Ltd\nLate night but we all done it The children in need centre is ready to give back to the Joshua‚Äôs tree centre it‚Äôs been a massive effort by all the trades to build a such a big complex in 9 days, we have bean involved in builds for DIYSOS before but this challenge was the BIG ONE and it‚Äôs finished I‚Äôm glad myself and Team GH Services (UK) Ltd , Restful Homes & CL refurbishments for helping out\n‚Ä¶more\nActivate to view larger image,\nActivate to view larger image,\n9\nCheri Read\nCheri Read\nCheri Read\n ‚Ä¢ 2nd\n2nd\nChief Executive Officer of Restful Homes Group\nChief Executive Officer of Restful Homes Group\n7mo ‚Ä¢ \n7 months ago ‚Ä¢ Visible to anyone on or off LinkedIn\nPLEASE everyone donate money, toys, sensory equipment this really is special and needed for the children and their families \nThe Joshua Tree offers respite and support to children with cancer and their families, from the initial diagnosis, through treatment and beyond.\nThe children have access to play spaces, activities and therapy, whilst parents and siblings are encouraged to unwind with talking therapy, complementary treatments or PT sessions.\nThe charity was set up 20 years ago by Dai and Lynda Hill after they found limited support for their own family when their 5 year old son Joshua was diagnosed with Leukemia. Joshua now helps out with PT sessions for children and teens to encourage them back to fitness after treatment.\nThe charity is currently supporting more than 300 families from the local area but the demand for the service they offer is increasing nationwide as families travel further to access treatment from nearby Alder Hey and Manchester Children‚Äôs Hospital.\nDIY SOS & Children in Need invites all trades, volunteers and suppliers to help support our build for this amazing charity, so they can expand and continue the life changing work they already do.\n‚Ä¶more\n14\n1 comment\nShow all posts\nExperience\nExperience\nRestful homes group\nRestful homes group\nRestful homes group\nFull-time ¬∑ 14 yrs 6 mos\nFull-time ¬∑ 14 yrs 6 mos\nChief Executive Officer\nChief Executive Officer\nSep 2011 - Present ¬∑ 14 yrs 6 mos\nSep 2011 to Present ¬∑ 14 yrs 6 mos\nWest Midlands, England, United Kingdom ¬∑ On-site\nWest Midlands, England, United Kingdom ¬∑ On-site\nDirector Of Operations\nDirector Of Operations\nDec 2016 - Sep 2024 ¬∑ 7 yrs 10 mos\nDec 2016 to Sep 2024 ¬∑ 7 yrs 10 mos\nBirmingham, West Midlands, United Kingdom\nBirmingham, West Midlands, United Kingdom\nRESTFUL HOMES GROUP LTD. logo\nManager\nManager\nRESTFUL HOMES GROUP LTD.\nRESTFUL HOMES GROUP LTD.\nAug 2011 - Jul 2016 ¬∑ 5 yrs\nAug 2011 to Jul 2016 ¬∑ 5 yrs\nHeath Hayes, Staffordshire, United Kingdom\nHeath Hayes, Staffordshire, United Kingdom\nI manage a 73 bedded specialist challenging behaviour unit, for residents with all types of dementia illnesses, schizophrenia, Huntington's disease, personality disorder & behavioural problems. I also manage over 250 staff who work as part of the specialist team at Alma Court\nI manage a 73 bedded specialist challenging behaviour unit, for residents with all types of dementia illnesses, schizophrenia, Huntington's disease, personality disorder & behavioural problems. I also manage over 250 staff who work as part of the specialist team at Alma Court\n‚Ä¶see more\nCpn - crisis intervention team\nCpn - crisis intervention team\nBirmingham and Solihull Mental Health NHS Foundation Trust\nBirmingham and Solihull Mental Health NHS Foundation Trust\nFeb 2001 - Jun 2010 ¬∑ 9 yrs 5 mos\nFeb 2001 to Jun 2010 ¬∑ 9 yrs 5 mos\nUk\nUk\nEducation\nEducation\nBirmingham City University\nBirmingham City University\nCheslyn hay high school\nCheslyn hay high school\nCheslyn hay high school\nDiphe mental health, Psychiatric/Mental Health Services\nDiphe mental health, Psychiatric/Mental Health Services\nSkills\nSkills\nCustomer Service\nCustomer Service\nEndorsed by 3 people in the last 6 months\nEndorsed by 3 people in the last 6 months\n7 endorsements\n7 endorsements\nStrategic Planning\nStrategic Planning\nEndorsed by 3 people in the last 6 months\nEndorsed by 3 people in the last 6 months",
    "searchKeyword": "CEO"
  },
  {
    "profileUrl": "https://www.linkedin.com/in/eli-dias-a3936347",
    "name": "Eli Dias",
    "title": "CEO l Galliard Homes",
    "location": "United Kingdom",
    "company": "Galliard Homes",
    "about": "",
    "experience": "Experience\nExperience\nGalliard Homes\nGalliard Homes\n11 yrs 8 mos\n11 yrs 8 mos\nChief Executive Officer\nChief Executive Officer\nFull-time\nFull-time\nApr 2025 - Present ¬∑ 11 mos\nApr 2025 to Present ¬∑ 11 mos\nInvestment and Development Director\nInvestment and Development Director\nMar 2022 - Apr 2025 ¬∑ 3 yrs 2 mos\nMar 2022 to Apr 2025 ¬∑ 3 yrs 2 mos\nInvestment and Development Associate Director\nInvestment and Development Associate Director\nJan 2018 - Mar 2022 ¬∑ 4 yrs 3 mos\nJan 2018 to Mar 2022 ¬∑ 4 yrs 3 mos\nShow all 4 experiences\nDevelopment Analyst\nDevelopment Analyst\nGalliard Homes\nGalliard Homes\nJul 2012 - Aug 2013 ¬∑ 1 yr 2 mos\nJul 2012 to Aug 2013 ¬∑ 1 yr 2 mos\nLondon Area, United Kingdom\nLondon Area, United Kingdom",
    "isCSuite": true,
    "contextForAI": "Eli Dias\n2nd degree connection\n2nd\nCEO l Galliard Homes\nGalliard Homes\nUnited Kingdom  Contact info\n500+ connections\nIwona Plumpton is a mutual connection\nIwona Plumpton is a mutual connection\nConnect\nMessage\nMore\nActivity\nActivity\n1,842 followers\n1,842 followers\nLoaded 5 Posts posts\nEli Dias reposted this\nGalliard Homes\nGalliard Homes\n38,891 followers\n38,891 followers\n6mo ‚Ä¢ Edited ‚Ä¢ \n6 months ago ‚Ä¢ Edited ‚Ä¢ Visible to anyone on or off LinkedIn\nüì£ PLANNING COMMITTEE APPROVAL! College Gardens, Glasgow\nWe‚Äôre thrilled to confirm that The Galliard Apsley Partnership site, College Gardens has received planning committee approval.\nLocated on the former College Street goods yard in Glasgow‚Äôs historic Calton district, right on the edge of the city centre and next to High Street Station, the scheme will reinvigorate this important gateway site.\nThe development will deliver:\nüè† 713 new homes\nüßë‚Äçüéì 999 PBSA beds\nüè¢ 2,600+ sqm of amenity space\nüåø New green spaces, play areas, and improved pedestrian connections\nCollege Gardens will be a landmark new neighbourhood, combining homes, student living, and public realm to create a dynamic community in Glasgow.\nA huge thank you to our team and partners who helped achieve this milestone.\nApsley House Capital PLC Stallan-Brand Gardiner & Theobald LLP Atelier Ten Woolgar Hunter Engineers Ryden LDA Design Steven P.\nhashtag\n#Placemaking \nhashtag\n#UrbanRegeneration \nhashtag\n#PlanningApproved \nhashtag\n#Glasgow \nhashtag\n#CollegeGardens\n‚Ä¶more\nActivate to view larger image,\nSee content credentials\n1/3\nActivate to view larger image,\n264\n8 comments\n10 reposts\nEli Dias reposted this\nGalliard Homes\nGalliard Homes\n38,891 followers\n38,891 followers\n7mo ‚Ä¢ Edited ‚Ä¢ \n7 months ago ‚Ä¢ Edited ‚Ä¢ Visible to anyone on or off LinkedIn\nGalliard Homes in Joint Venture with DS Real Estate is delighted to announce that the Planning Inspector has granted approval for the redevelopment of The Point, 602 Midsummer Boulevard, Milton Keynes.\nOur plans will transform this prominent site, which has been vacant for nearly 20 years, into a dynamic mixed-use destination. The scheme delivers up to 500 new homes, including Build to Rent and private sale, along with flexible ground floor leisure and retail space.\nAt the heart of the proposals is a commitment to celebrating the legacy of The Point. The development will include landscaped public spaces such as ‚ÄúThe Setting Space‚Äù and ‚ÄúThe Gateway Garden‚Äù to encourage community activity and connection. Feature lighting will recreate Milton Keynes‚Äô iconic beacon, paying homage to the site‚Äôs heritage while ushering in a bold new chapter for the city centre.\nThe multi-storey car park will be re-clad and modernised, incorporating a striking rooftop leisure hub with a bar, restaurant and outdoor sports spaces. This ambitious project will revitalise a key location in central Milton Keynes, delivering homes, jobs and vibrant public spaces for residents and visitors to enjoy.\nWe look forward to working with Milton Keynes Council, local stakeholders and the wider community as we bring this vision to life.\nReflex Property Finance Charlie Banner (Lord Banner KC) Spencer Tewis-Allen Jeremy Pickard Laurie Handcock\nhashtag\n#MiltonKeynes \nhashtag\n#UrbanRegeneration \nhashtag\n#ThePointLegacy \nhashtag\n#PlanningApproval\n‚Ä¶more\nActivate to view larger image,\n1/3\nActivate to view larger image,\n300\n27 comments\n11 reposts\nShow all posts\nExperience\nExperience\nGalliard Homes\nGalliard Homes\n11 yrs 8 mos\n11 yrs 8 mos\nChief Executive Officer\nChief Executive Officer\nFull-time\nFull-time\nApr 2025 - Present ¬∑ 11 mos\nApr 2025 to Present ¬∑ 11 mos\nInvestment and Development Director\nInvestment and Development Director\nMar 2022 - Apr 2025 ¬∑ 3 yrs 2 mos\nMar 2022 to Apr 2025 ¬∑ 3 yrs 2 mos\nInvestment and Development Associate Director\nInvestment and Development Associate Director\nJan 2018 - Mar 2022 ¬∑ 4 yrs 3 mos\nJan 2018 to Mar 2022 ¬∑ 4 yrs 3 mos\nShow all 4 experiences\nDevelopment Analyst\nDevelopment Analyst\nGalliard Homes\nGalliard Homes\nJul 2012 - Aug 2013 ¬∑ 1 yr 2 mos\nJul 2012 to Aug 2013 ¬∑ 1 yr 2 mos\nLondon Area, United Kingdom\nLondon Area, United Kingdom\nEducation\nEducation\nNorthumbria University\nNorthumbria University\nBsc (Hons) Building Project Management\nBsc (Hons) Building Project Management\n2010 - 2014\n2010 - 2014\nClassification: first class honours\nClassification: first class honours\nKing Solomon high school\nKing Solomon high school\nKing Solomon high school\n2003 - 2010\n2003 - 2010\nProjects\nProjects\nRegeneration of sports facilities - Zambia, Africa\nRegeneration of sports facilities - Zambia, Africa\nJun 2012 - Jul 2012\nJun 2012 - Jul 2012\nShow project\nHonors & awards\nHonors & awards\nBest final year performance\nBest final year performance\nIssued by Northumbria University ¬∑ Jul 2014\nIssued by Northumbria University ¬∑ Jul 2014\nAssociated with Northumbria University\nAssociated with Northumbria University\nBest student achievement\nBest student achievement\nIssued by Northumbria University ¬∑ Jul 2014\nIssued b",
    "searchKeyword": "CEO"
  },
  {
    "profileUrl": "https://www.linkedin.com/in/martylegg",
    "name": "Marty Legg",
    "title": "Chief Executive Officer @ takara.ai | Co-Founder | AWS Pioneer | AI Evangelist",
    "location": "Greater Northampton Area, United Kingdom",
    "company": "takara.ai",
    "about": "",
    "experience": "Experience\nExperience\nChief Executive Officer\nChief Executive Officer\ntakara.ai ¬∑ Full-time\ntakara.ai ¬∑ Full-time\nJul 2024 - Present ¬∑ 1 yr 8 mos\nJul 2024 to Present ¬∑ 1 yr 8 mos\nLondon Area, United Kingdom ¬∑ Hybrid\nLondon Area, United Kingdom ¬∑ Hybrid\nBuilding amazing teams that deliver engineering excellence and outstanding customer experience.\nBuilding amazing teams that deliver engineering excellence and outstanding customer experience.\nChief Revenue Officer (CRO)\nChief Revenue Officer (CRO)\nRebura LTD. ¬∑ Full-time\nRebura LTD. ¬∑ Full-time\nNov 2022 - Jul 2024 ¬∑ 1 yr 9 mos\nNov 2022 to Jul 2024 ¬∑ 1 yr 9 mos\nGreater London, England, United Kingdom\nGreater London, England, United Kingdom\nCloud Managed Services, Cloud Professional Services and +3 skills\nEMEA Head of Sales and Marketing for Helecloud\nEMEA Head of Sales and Marketing for Helecloud\nHeleCloud ¬∑ Full-time\nHeleCloud ¬∑ Full-time\nSep 2020 - Nov 2022 ¬∑ 2 yrs 3 mos\nSep 2020 to Nov 2022 ¬∑ 2 yrs 3 mos\nGreater London, England, United Kingdom\nGreater London, England, United Kingdom\nMD/SD\nMD/SD\nMD/SD\nIGX Global\nIGX Global\nOct 2017 - Sep 2020 ¬∑ 3 yrs\nOct 2017 to Sep 2020 ¬∑ 3 yrs\nLondon Area, United Kingdom\nLondon Area, United Kingdom\nMy role is to lead, inspire and drive the UK and Europe team to explosive growth for IGX Global/Eplus.\n\nIGX Global/Eplus is at the forefront of digital transformation. We help organisations design, build and run transformative infrastructures that span seamlessly across the data centre, campus and cloud for the most visionary companies in the world. \n\nOur rich heritage and experience, technical leadership and outstanding service has enabled us to maximise and translate technology advancements that enable our customers to innovate how they deliver services more effectively, efficiently and securely. From strategy to fulfillment to managed services, our engineering centric solutions enable our clients to realise what it means for technology to do more. \nMy role is to lead, inspire and driv",
    "isCSuite": true,
    "contextForAI": "Marty has a {:badgeType} account\nMarty Legg\n2nd degree connection\n2nd\nChief Executive Officer @ takara.ai | Co-Founder | AWS Pioneer | AI Evangelist\ntakara.ai\nGreater Northampton Area, United Kingdom  Contact info\n500+ connections\nConnect\nMessage\nMore\nHighlights\nHighlights\nMarty recently posted on LinkedIn\nMarty recently posted on LinkedIn\nUnderstand what topics Marty posts about to inform your outreach.\nUnderstand what topics Marty posts about to inform your outreach.\nFree insight from Sales Navigator\nFree insight from Sales Navigator\nUnlock more insights about leads\nImprove outreach with sales insights\nTry Sales Navigator for ¬£0\n1-month free. We‚Äôll remind you 7 days before your trial ends.\nActivity\nActivity\n3,564 followers\n3,564 followers\nPosts\nComments\nImages\nLoaded 9 Posts posts\nMarty Legg\nMarty Legg\n   ‚Ä¢ 2nd\nPremium ‚Ä¢ 2nd\nChief Executive Officer @ takara.ai | Co-Founder | AWS Pioneer | AI Evangelist\nChief Executive Officer @ takara.ai | Co-Founder | AWS Pioneer | AI Evangelist\n1d ‚Ä¢ \n1 day ago ‚Ä¢ Visible to anyone on or off LinkedIn\nSpending time with my son and Co-founder, traveling the world, making friends and sharing all the amazing things the exceptional takara.ai team have built for customers is an exceptional gift. \nWe continue to be very appreciative of all the support that our partners at Amazon Web Services (AWS) and Cockroach Labs give us and our exception team that make it possible to push the boundaries of what is possible with AI.\n‚Ä¶more\nActivate to view larger image,\nActivate to view larger image,\n95\n7 comments\nMarty Legg\nMarty Legg\n   ‚Ä¢ 2nd\nPremium ‚Ä¢ 2nd\nChief Executive Officer @ takara.ai | Co-Founder | AWS Pioneer | AI Evangelist\nChief Executive Officer @ takara.ai | Co-Founder | AWS Pioneer | AI Evangelist\n1mo ‚Ä¢ \n1 month ago ‚Ä¢ Visible to anyone on or off LinkedIn\nICE Barcelona presenting how DS1 and our team are creating outrageous solutions and entertainment experiences. \nBig shout out to the support from Amazon Web Services (AWS) and Cockroach Labs. ¬†Their collaboration with us and DS1 to present industry leading personalisation in real-time AI applications was incredibly valuable.\n‚Ä¶more\nActivate to view larger image,\nActivate to view larger image,\n59\n7 comments\nShow all posts\nExperience\nExperience\nChief Executive Officer\nChief Executive Officer\ntakara.ai ¬∑ Full-time\ntakara.ai ¬∑ Full-time\nJul 2024 - Present ¬∑ 1 yr 8 mos\nJul 2024 to Present ¬∑ 1 yr 8 mos\nLondon Area, United Kingdom ¬∑ Hybrid\nLondon Area, United Kingdom ¬∑ Hybrid\nBuilding amazing teams that deliver engineering excellence and outstanding customer experience.\nBuilding amazing teams that deliver engineering excellence and outstanding customer experience.\nChief Revenue Officer (CRO)\nChief Revenue Officer (CRO)\nRebura LTD. ¬∑ Full-time\nRebura LTD. ¬∑ Full-time\nNov 2022 - Jul 2024 ¬∑ 1 yr 9 mos\nNov 2022 to Jul 2024 ¬∑ 1 yr 9 mos\nGreater London, England, United Kingdom\nGreater London, England, United Kingdom\nCloud Managed Services, Cloud Professional Services and +3 skills\nEMEA Head of Sales and Marketing for Helecloud\nEMEA Head of Sales and Marketing for Helecloud\nHeleCloud ¬∑ Full-time\nHeleCloud ¬∑ Full-time\nSep 2020 - Nov 2022 ¬∑ 2 yrs 3 mos\nSep 2020 to Nov 2022 ¬∑ 2 yrs 3 mos\nGreater London, England, United Kingdom\nGreater London, England, United Kingdom\nMD/SD\nMD/SD\nMD/SD\nIGX Global\nIGX Global\nOct 2017 - Sep 2020 ¬∑ 3 yrs\nOct 2017 to Sep 2020 ¬∑ 3 yrs\nLondon Area, United Kingdom\nLondon Area, United Kingdom\nMy role is to lead, inspire and drive the UK and Europe team to explosive growth for IGX Global/Eplus.\nIGX Global/Eplus is at the forefront of digital transformation. We help organisations design, build and run transformative infrastructures that span seamlessly across the data centre, campus and cloud for the most visionary companies in the world. \nOur rich heritage and experience, technical leadership and outstanding service has enabled us to maximise and translate technology advancements that enable our customers to innovate how they deliver services more effectively, efficiently and securely. From strategy to fulfillment to managed services, our engineering centric solutions enable our clients to realise what it means for technology to do more. \nMy role is to lead, inspire and drive the UK and Europe team to explosive growth for IGX Global/Eplus. IGX Global/Eplus is at the forefront of digital transformation. We help organisations design, build and run transformative infrastructures that span seamlessly across the data centre, campus and cloud for the most visionary companies in the world. Our rich heritage and experience, technical leadership and outstanding service has enabled us to maximise and translate technology advancements that enable our customers to innovate how they deliver services more effectively, efficiently and securely. From strategy to fulfillment to managed services, our engineering centric solutions enable our clients to realise what it means for technology to do more. \nSales Director\nSales Director\nSales Dire",
    "searchKeyword": "CEO"
  },
  {
    "profileUrl": "https://www.linkedin.com/in/chrisedworthy",
    "name": "Chris Edworthy",
    "title": "Chief Executive Officer at Vectoring",
    "location": "Crawley Down, England, United Kingdom",
    "company": "VECTORING",
    "about": "",
    "experience": "Experience\nExperience\nChief Executive Officer\nChief Executive Officer\nVECTORING ¬∑ Full-time\nVECTORING ¬∑ Full-time\nAug 2021 - Present ¬∑ 4 yrs 7 mos\nAug 2021 to Present ¬∑ 4 yrs 7 mos\nGreater London, England, United Kingdom\nGreater London, England, United Kingdom\nGeorge Hotel Henfield logo\nManaging Director\nManaging Director\nGeorge Hotel Henfield\nGeorge Hotel Henfield\nFeb 2018 - Present ¬∑ 8 yrs 1 mo\nFeb 2018 to Present ¬∑ 8 yrs 1 mo\nHenfield, West Sussex, United Kingdom\nHenfield, West Sussex, United Kingdom\nManaging Director\nManaging Director\nManaging Director\nWhite Hart - Henfield ¬∑ Full-time\nWhite Hart - Henfield ¬∑ Full-time\nFeb 2021 - Nov 2025 ¬∑ 4 yrs 10 mos\nFeb 2021 to Nov 2025 ¬∑ 4 yrs 10 mos\nHenfield \nHenfield \nManaging Director\nManaging Director\nManaging Director\nZimple Property Ltd ¬∑ Full-time\nZimple Property Ltd ¬∑ Full-time\nJun 2020 - Nov 2025 ¬∑ 5 yrs 6 mos\nJun 2020 to Nov 2025 ¬∑ 5 yrs 6 mos\nEastbourne, England, United Kingdom\nEastbourne, England, United Kingdom\nManaging Director\nManaging Director\nManaging Director\nDriven (Sussex) Ltd ¬∑ Full-time\nDriven (Sussex) Ltd ¬∑ Full-time\nFeb 2020 - Nov 2025 ¬∑ 5 yrs 10 mos\nFeb 2020 to Nov 2025 ¬∑ 5 yrs 10 mos\nHenfield, England, United Kingdom\nHenfield, England, United Kingdom\nShow all 8 experiences",
    "isCSuite": true,
    "contextForAI": "Chris Edworthy \n2nd degree connection\n2nd\nChief Executive Officer at Vectoring\nVECTORING\nCollege of Richard Collyer\nCrawley Down, England, United Kingdom  Contact info\n500+ connections\nIwona Plumpton is a mutual connection\nIwona Plumpton is a mutual connection\nConnect\nMessage\nMore\nActivity\nActivity\n2,566 followers\n2,566 followers\nLoaded 9 Posts posts\nChris Edworthy\nChris Edworthy\n   ‚Ä¢ 2nd\nVerified ‚Ä¢ 2nd\nChief Executive Officer at Vectoring\nChief Executive Officer at Vectoring\n8mo ‚Ä¢ \n8 months ago ‚Ä¢ Visible to anyone on or off LinkedIn\nYou have a powerful computer in your pocket, VectorBook is designed to turn your phone into a laptop!\nVECTORING\nVECTORING\n33 followers\n33 followers\nGo from phone to full desktop in 3 simple steps. The VectorBook makes it that easy.\nStep 1: Unbox your new productivity powerhouse. \nStep 2: Connect your smartphone with a single cable. \nStep 3: Enjoy a full, seamless desktop experience.\nIt‚Äôs time to work, play, and create anywhere, anytime.\nSwipe left to see how simple it is! üëâ\nhashtag\n#VectorBook \nhashtag\n#HowItWorks \nhashtag\n#StepByStep \nhashtag\n#EasyTech \nhashtag\n#FutureOfWork \nhashtag\n#Gadget \nhashtag\n#TechTutorial\n‚Ä¶more\nActivate to view larger image,\n1/3\nActivate to view larger image,\n5\nChris Edworthy\nChris Edworthy\n   ‚Ä¢ 2nd\nVerified ‚Ä¢ 2nd\nChief Executive Officer at Vectoring\nChief Executive Officer at Vectoring\n1yr ‚Ä¢ \n1 year ago ‚Ä¢ Visible to anyone on or off LinkedIn\nI speak to lots of business owners looking to sell. It amazes me that from small ¬£100k turnover businesses through to ¬£10m turnover businesses, very few are ready to sell. \nDid you know 80% of businesses never sell... I'm not surprised! \nhashtag\n#businessesforsale \nhashtag\n#businessbroker \nhashtag\n#accountancy \nhashtag\n#businessmentor \nhashtag\n#businessadvice\n14\nShow all posts\nExperience\nExperience\nChief Executive Officer\nChief Executive Officer\nVECTORING ¬∑ Full-time\nVECTORING ¬∑ Full-time\nAug 2021 - Present ¬∑ 4 yrs 7 mos\nAug 2021 to Present ¬∑ 4 yrs 7 mos\nGreater London, England, United Kingdom\nGreater London, England, United Kingdom\nGeorge Hotel Henfield logo\nManaging Director\nManaging Director\nGeorge Hotel Henfield\nGeorge Hotel Henfield\nFeb 2018 - Present ¬∑ 8 yrs 1 mo\nFeb 2018 to Present ¬∑ 8 yrs 1 mo\nHenfield, West Sussex, United Kingdom\nHenfield, West Sussex, United Kingdom\nManaging Director\nManaging Director\nManaging Director\nWhite Hart - Henfield ¬∑ Full-time\nWhite Hart - Henfield ¬∑ Full-time\nFeb 2021 - Nov 2025 ¬∑ 4 yrs 10 mos\nFeb 2021 to Nov 2025 ¬∑ 4 yrs 10 mos\nHenfield \nHenfield \nManaging Director\nManaging Director\nManaging Director\nZimple Property Ltd ¬∑ Full-time\nZimple Property Ltd ¬∑ Full-time\nJun 2020 - Nov 2025 ¬∑ 5 yrs 6 mos\nJun 2020 to Nov 2025 ¬∑ 5 yrs 6 mos\nEastbourne, England, United Kingdom\nEastbourne, England, United Kingdom\nManaging Director\nManaging Director\nManaging Director\nDriven (Sussex) Ltd ¬∑ Full-time\nDriven (Sussex) Ltd ¬∑ Full-time\nFeb 2020 - Nov 2025 ¬∑ 5 yrs 10 mos\nFeb 2020 to Nov 2025 ¬∑ 5 yrs 10 mos\nHenfield, England, United Kingdom\nHenfield, England, United Kingdom\nShow all 8 experiences\nEducation\nEducation\nCollege of Richard Collyer\nCollege of Richard Collyer\nCollege of Richard Collyer\nBusiness, Economics and Law\nBusiness, Economics and Law\n1999\n1999\nSkills\nSkills\nBusiness Planning\nBusiness Planning\nEndorsed by Mark Williams who is highly skilled at this\nEndorsed by Mark Williams who is highly skilled at this\n20 endorsements\n20 endorsements\nBusiness Strategy\nBusiness Strategy\nEndorsed by Mark Williams and 1 other who is highly skilled at this\nEndorsed by Mark Williams and 1 other who is highly skilled at this\n22 endorsements\n22 endorsements\nShow all 20 skills\nRecommendations\nRecommendations\nReceived\nReceived\nGiven\nGiven\nKent Rhodes - The Mindset Coach\nKent Rhodes - The Mindset Coach\n¬∑ 3rd\nThird degree connection\nGrowing your Profits * Strategic Planning * Creating High Performance Teams * Franchise Expert * Business Investor *\nGrowing your Profits * Strategic Planning * Creating High Performance Teams * Franchise Expert * Business Investor *\nFebruary 21, 2010, Kent Rhodes worked with Chris on the same team\nFebruary 21, 2010, Kent Rhodes worked with Chris on the same team\nChris is a business owner who is serious about growing his business and reputation. He places a lot of importance on his customers and providing a service that not only satisfies his customers but enhances the performance of his team. His personal drive and focus will insure that he delivers what he promises.\nChris is a business owner who is serious about growing his business and reputation. He places a lot of importance on his customers and providing a service that not only satisfies his customers but enhances the performance of his team. His personal drive and focus will insure that he delivers what he promises.\nInterests\nInterests\nTop Voices\nTop Voices\nCompanies\nCompanies\nGroups\nGroups\nNewsletters\nNewsletters\nTony Robbins\nTony Robbins\n¬∑ 3rd\nThird degree connection\n#1 New York Times best-selling author, life and busi",
    "searchKeyword": "CEO"
  },
  {
    "profileUrl": "https://www.linkedin.com/in/petermayhead",
    "name": "Peter Mayhead, MBA, FCCA",
    "title": "CEO at Pebble Beach Systems Group PLC",
    "location": "Weybridge, England, United Kingdom",
    "company": "",
    "about": "",
    "experience": "",
    "isCSuite": true,
    "contextForAI": "Peter Mayhead, MBA, FCCA\n2nd degree connection\n2nd\nCEO at Pebble Beach Systems Group PLC\nWeybridge, England, United Kingdom  Contact info",
    "searchKeyword": "CEO"
  },
  {
    "profileUrl": "https://www.linkedin.com/in/sifelani-soko-a68b3914",
    "name": "Sifelani Soko",
    "title": "Director",
    "location": "United Kingdom",
    "company": "Learnutec Technology Academy",
    "about": "",
    "experience": "Experience\nExperience\nChief Executive Officer\nChief Executive Officer\nChief Executive Officer\nLearnutec Technology Academy ¬∑ Full-time\nLearnutec Technology Academy ¬∑ Full-time\nAug 2009 - Present ¬∑ 16 yrs 7 mos\nAug 2009 to Present ¬∑ 16 yrs 7 mos\nEngland, United Kingdom ¬∑ On-site\nEngland, United Kingdom ¬∑ On-site\nResponsibilities;\nÔÄ™ Primary contact for the Microsoft partner programme.\nÔÄ™ Provide Microsoft certification training through Instructor-led and Online classes;\n Directly, or through Microsoft partners (in a freelance role) such as:\n ‚Ä¢ 365IT Training (formerly) Deverill, Poole\n ‚Ä¢ ITOPSEC, Wales\n ‚Ä¢ LearningTree, London\n ‚Ä¢ New Horizons, London\n ‚Ä¢ BT Training, Belfast\n ‚Ä¢ SureSkills, Belfast\n ‚Ä¢ Datrix Training, liverpool\n ‚Ä¢ Acuity Training, Guildford, Surrey\n ‚Ä¢ Nexus Training, Exeter, Devon\n \nÔÄ™ Provide post course reports, and support to delegates.\nÔÄ™ Setup the training environment in accordance with industry standards.\nÔÄ™ Design and develop bespoke training as requested by clients\nÔÄ™ Training needs analysis for individuals and small to large corporate companies.\nÔÄ™ Pre-Sales support.\nÔÄ™ Microsoft certification exam preparation services.\n\nResponsibilities; ÔÄ™ Primary contact for the Microsoft partner programme. ÔÄ™ Provide Microsoft certification training through Instructor-led and Online classes; Directly, or through Microsoft partners (in a freelance role) such as: ‚Ä¢ 365IT Training (formerly) Deverill, Poole ‚Ä¢ ITOPSEC, Wales ‚Ä¢ LearningTree, London ‚Ä¢ New Horizons, London ‚Ä¢ BT Training, Belfast ‚Ä¢ SureSkills, Belfast ‚Ä¢ Datrix Training, liverpool ‚Ä¢ Acuity Training, Guildford, Surrey ‚Ä¢ Nexus Training, Exeter, Devon ÔÄ™ Provide post course reports, and support to delegates. ÔÄ™ Setup the training environment in accordance with industry standards. ÔÄ™ Design and develop bespoke training as requested by clients ÔÄ™ Training needs analysis for individuals and small to large corporate companies. ÔÄ™ Pre-Sales support. ÔÄ™ Microsoft certification exam preparation services. \n‚Ä¶see more\nPresentat",
    "isCSuite": true,
    "contextForAI": "Sifelani Soko \n2nd degree connection\n2nd\nDirector\nLearnutec Technology Academy\nUnited Kingdom  Contact info\n500+ connections\nConnect\nMessage\nMore\nAbout\nAbout\nI am the Founder and CEO of Learnutec Technology Academy, an innovative IT training institution dedicated to preparing the next generation of Microsoft Cloud professionals. In this role, I lead the strategic direction of the academy, oversee curriculum development, manage instructor-led programs, and drive partnerships that support student career outcomes and employer needs. My goal is to make high-quality, hands-on technical education accessible to individuals looking to launch or elevate careers in IT.\nWith over 30+ years of experience in the information technology industry, I bring a deep technical foundation and a passion for teaching. My career has spanned roles from hardware and software deployment engineer to networking consultant and Microsoft Certified Trainer, working with global technology leaders including ICL Fujitsu, HP, IBM, Dell, Cisco, Citrix, and Microsoft.\nI have delivered IT solutions and training across the UK, Europe, Africa, and the US, serving clients such as the British Ministry of Defence, Texaco, and various private-sector organisations. This international exposure has shaped my global outlook on technology education and digital transformation.\nToday, I specialise in guiding individuals and organisations through their transition to Microsoft Cloud technologies. Through Learnutec, I provide virtual and instructor-led training focused on Azure and Microsoft 365 platforms, helping learners achieve certification and workplace readiness.\nI am the Founder and CEO of Learnutec Technology Academy, an innovative IT training institution dedicated to preparing the next generation of Microsoft Cloud professionals. In this role, I lead the strategic direction of the academy, oversee curriculum development, manage instructor-led programs, and drive partnerships that support student career outcomes and employer needs. My goal is to make high-quality, hands-on technical education accessible to individuals looking to launch or elevate careers in IT. With over 30+ years of experience in the information technology industry, I bring a deep technical foundation and a passion for teaching. My career has spanned roles from hardware and software deployment engineer to networking consultant and Microsoft Certified Trainer, working with global technology leaders including ICL Fujitsu, HP, IBM, Dell, Cisco, Citrix, and Microsoft. I have delivered IT solutions and training across the UK, Europe, Africa, and the US, serving clients such as the British Ministry of Defence, Texaco, and various private-sector organisations. This international exposure has shaped my global outlook on technology education and digital transformation. Today, I specialise in guiding individuals and organisations through their transition to Microsoft Cloud technologies. Through Learnutec, I provide virtual and instructor-led training focused on Azure and Microsoft 365 platforms, helping learners achieve certification and workplace readiness.\n‚Ä¶see more\nTop skills\nTop skills\nTeamwork ‚Ä¢ Infrastructure ‚Ä¢ SQL ‚Ä¢ Networking ‚Ä¢ Communication\nTeamwork ‚Ä¢ Infrastructure ‚Ä¢ SQL ‚Ä¢ Networking ‚Ä¢ Communication\nActivity\nActivity\n3,309 followers\n3,309 followers\nPosts\nComments\nLoaded 9 Posts posts\nSifelani Soko\nSifelani Soko\nSifelani Soko\n   ‚Ä¢ 2nd\nVerified ‚Ä¢ 2nd\nDirector\nDirector\n8mo ‚Ä¢ \n8 months ago ‚Ä¢ Visible to anyone on or off LinkedIn\n\"Before Learnutec, I had no IT experience. Now I'm certified and preparing for my first job interview!\"\nüí¨ Real feedback from our students who take control of their careers with Learnutec.\nhashtag\n#StudentSuccess \nhashtag\n#LearnutecJourney \nhashtag\n#ITTrainingUK\n‚Ä¶more\nLearnutec Technology Academy\nLearnutec Technology Academy\n251 followers\n251 followers\nüí° Ready to become a Microsoft 365 Support Engineer?\nOur hands-on, instructor-led program covers:\n- MS-900, MD-102, MS-102, MS-700, MS-721\n- Real-world labs & career mentoring\n- Job placement support from month 6\nüëâ Apply today: www.learnutec.com\nhashtag\n#CloudTraining \nhashtag\n#MicrosoftCertifications \nhashtag\n#TechCareers\n‚Ä¶more\nHome\nlearnutec.com\n6\nSifelani Soko\nSifelani Soko\nSifelani Soko\n   ‚Ä¢ 2nd\nVerified ‚Ä¢ 2nd\nDirector\nDirector\n5yr ‚Ä¢ \n5 years ago ‚Ä¢ Visible to anyone on or off LinkedIn\nView my verified achievement from Microsoft.\nExam 743: Upgrading Your Skills to MCSA: Windows Server 2016 was issued by Microsoft to SIFELANI SOKO.\nyouracclaim.com\n1\nShow all posts\nExperience\nExperience\nChief Executive Officer\nChief Executive Officer\nChief Executive Officer\nLearnutec Technology Academy ¬∑ Full-time\nLearnutec Technology Academy ¬∑ Full-time\nAug 2009 - Present ¬∑ 16 yrs 7 mos\nAug 2009 to Present ¬∑ 16 yrs 7 mos\nEngland, United Kingdom ¬∑ On-site\nEngland, United Kingdom ¬∑ On-site\nResponsibilities;\nÔÄ™ Primary contact for the Microsoft partner programme.\nÔÄ™ Provide Microsoft certification training through Instructor-led and Onli",
    "searchKeyword": "CEO"
  },
  {
    "profileUrl": "https://www.linkedin.com/in/giles-hurley-0391032b7",
    "name": "Giles Hurley",
    "title": "Chief Executive Officer at Aldi UK",
    "location": "Atherstone, England, United Kingdom",
    "company": "Aldi UK",
    "about": "",
    "experience": "Experience\nExperience\nAldi UK\nAldi UK\nFull-time ¬∑ 12 yrs 2 mos\nFull-time ¬∑ 12 yrs 2 mos\nChief Executive Officer\nChief Executive Officer\nMay 2018 - Present ¬∑ 7 yrs 10 mos\nMay 2018 to Present ¬∑ 7 yrs 10 mos\nGroup Managing Director\nGroup Managing Director\nSep 2015 - May 2018 ¬∑ 2 yrs 9 mos\nSep 2015 to May 2018 ¬∑ 2 yrs 9 mos\nGroup Managing Director\nGroup Managing Director\nSep 2015 - May 2018 ¬∑ 2 yrs 9 mos\nSep 2015 to May 2018 ¬∑ 2 yrs 9 mos\nShow all 4 experiences\nRegional Managing Director\nRegional Managing Director\nAldi Ireland ¬∑ Full-time\nAldi Ireland ¬∑ Full-time\n2013 - 2014 ¬∑ 1 yr\n2013 to 2014 ¬∑ 1 yr\nRegional Managing Director\nRegional Managing Director\nAldi UK ¬∑ Full-time\nAldi UK ¬∑ Full-time\n2010 - 2013 ¬∑ 3 yrs\n2010 to 2013 ¬∑ 3 yrs\nAldi Ireland\nAldi Ireland\nFull-time ¬∑ 10 yrs 1 mo\nFull-time ¬∑ 10 yrs 1 mo\nGroup Buying Director\nGroup Buying Director\n2007 - 2010 ¬∑ 3 yrs\n2007 to 2010 ¬∑ 3 yrs\nTrading Director\nTrading Director\n2002 - 2007 ¬∑ 5 yrs\n2002 to 2007 ¬∑ 5 yrs\nArea Manager\nArea Manager\n2000 - 2002 ¬∑ 2 yrs\n2000 to 2002 ¬∑ 2 yrs",
    "isCSuite": true,
    "contextForAI": "Giles has a {:badgeType} account\nGiles Hurley \n3rd degree connection\n3rd\nChief Executive Officer at Aldi UK\nAldi UK\nAtherstone, England, United Kingdom  Contact info\n58,796 followers \n415 connections\nFollow\nMessage\nMore\nHighlights\nHighlights\nGiles recently posted on LinkedIn\nGiles recently posted on LinkedIn\nUnderstand what topics Giles posts about to inform your outreach.\nUnderstand what topics Giles posts about to inform your outreach.\nFree insight from Sales Navigator\nFree insight from Sales Navigator\nUnlock more insights about leads\nImprove outreach with sales insights\nTry Sales Navigator for ¬£0\n1-month free. We‚Äôll remind you 7 days before your trial ends.\nAbout\nAbout\nAldi GB & IE operates over 1,170 stores and employs more than 44,000 colleagues. It is the undisputed cheapest supermarket, setting the industry benchmark for quality and value.\nGiles joined Aldi in 2000, as an Area Manager in Ireland, and became CEO in 2018. Under his leadership the company has become the fourth largest supermarket in the UK and is a major supporter of domestic producers in Britain and Ireland.\nAldi is a proud sponsor of Team GB, ParalympicsGB and the Irish RFU, as part of its commitment to encouraging healthy, active lifestyles, and supports children‚Äôs charities including Teenage Cancer Trust in the UK and Barnardo‚Äôs Ireland.\nAldi GB & IE operates over 1,170 stores and employs more than 44,000 colleagues. It is the undisputed cheapest supermarket, setting the industry benchmark for quality and value. Giles joined Aldi in 2000, as an Area Manager in Ireland, and became CEO in 2018. Under his leadership the company has become the fourth largest supermarket in the UK and is a major supporter of domestic producers in Britain and Ireland. Aldi is a proud sponsor of Team GB, ParalympicsGB and the Irish RFU, as part of its commitment to encouraging healthy, active lifestyles, and supports children‚Äôs charities including Teenage Cancer Trust in the UK and Barnardo‚Äôs Ireland.\n‚Ä¶see more\nFeatured\nFeatured\nPost\nPost\nChristmas at Aldi UK is officially here, and I couldn't be prouder of the exceptional work our teams have delivered across the business.\nFrom product innovation to store preparation, everyone has played a crucial role in making this a standout season. Our new Specially Selected Ultimate range is just one example of the team's dedication to providing the very best in quality this year.\nOur Marketing Team have also outdone themselves with a fantastic campaign that I know will resonate with our customers‚Äîand yes, it does see the return of everyone's favourite carrot!\nOn top of that, we‚Äôve been recognised as the Best Overall Grocer in Good Housekeeping's Christmas Taste Test 2024. This accolade is a testament to the hard work and commitment of our excellent Buying team. From our famous Mince Pies to centrepiece Turkeys - each and every detail of our award-winning products has been meticulously crafted to deliver excellence.\nLastly, a huge thank you to our store and warehouse teams, who are prepped and ready to welcome thousands of shoppers this festive season. Your dedication ensures we‚Äôll deliver an Aldi Amazing Christmas once again.\nThis is one of my favourite times of year, and I‚Äôm incredibly impressed by everything we‚Äôve achieved together at Aldi.\nhashtag\n#AldiAmazingChristmas \nhashtag\n#KevinTheCarrot \nhashtag\n#Christmas2024\n914\n26 comments\nPost\nPost\nOn Monday night, BBC Panorama aired an investigation that revealed some eye-opening findings about supermarket price-matching. They found that many of Tesco‚Äôs products, which claim to be price-matched with Aldi, are not like-for-like. \nThe programme, which aired on BBC One, highlighted that nearly a third of Tesco‚Äôs matched products contain less of the main ingredient compared to Aldi‚Äôs. This really reinforces what we‚Äôve always believed: Aldi is the only supermarket where you can count on both top-quality products and low prices.\nAt Aldi, we believe that fresh, healthy, great-quality food is a right, not a privilege. That‚Äôs why we‚Äôre so committed to bringing our customers the best at the most affordable prices. And while we put all our energy into maintaining these standards, we‚Äôre aware that no one is perfect, including ourselves. We are always striving to improve, and we welcome feedback from our valued customers to help us do just that.\nWe‚Äôre aware that other retailers might claim to match our prices, but as this research shows, these claims are not always what they appear to be. We welcome the investigation by Panorama, as it supports what we passionately believe: at Aldi, you don‚Äôt have to compromise on quality to get great value.\nWe work tirelessly to ensure our exclusive products are not only affordable but meet the highest standards, often with a higher specification than equivalent own-label products sold by our competitors. This dedication has been recognised, with Aldi winning over 530 individual awards for quality over the last 12 months, including Quality Food Aw",
    "searchKeyword": "CEO"
  },
  {
    "profileUrl": "https://www.linkedin.com/in/harmeet-ahuja-2002374",
    "name": "Harmeet Ahuja",
    "title": "CEO at Sun Mark Group | CEO of the Year 2019, 2021 (Thames Valley 250)",
    "location": "Greenford, England, United Kingdom",
    "company": "Sun Mark",
    "about": "",
    "experience": "Experience\nExperience\nSun Mark\nSun Mark\n23 yrs 7 mos\n23 yrs 7 mos\nGroup CEO\nGroup CEO\nAug 2002 - Present ¬∑ 23 yrs 7 mos\nAug 2002 to Present ¬∑ 23 yrs 7 mos\nLondon, United Kingdom\nLondon, United Kingdom\nInterpersonal Skills, International Expansion and +6 skills\nCEO\nCEO\nAug 2002 - Present ¬∑ 23 yrs 7 mos\nAug 2002 to Present ¬∑ 23 yrs 7 mos\nLondon Area, United Kingdom\nLondon Area, United Kingdom\nInterpersonal Skills, International Expansion and +5 skills",
    "isCSuite": true,
    "contextForAI": "Harmeet has a {:badgeType} account\nHarmeet Ahuja\n2nd degree connection\n2nd\nCEO at Sun Mark Group | CEO of the Year 2019, 2021 (Thames Valley 250)\nSun Mark\nKing's College London\nGreenford, England, United Kingdom  Contact info\n500+ connections\nEWEJE, Oyeniyi - CPHR Candidate is a mutual connection\nEWEJE, Oyeniyi - CPHR Candidate is a mutual connection\nConnect\nMessage\nMore\nAbout\nAbout\nAs the Group CEO of Sun Mark, a leading FMCG distribution/wholesale/retail company, I have been leading the strategic direction, operations, and growth of the business for over 10 years. I have a passion for delivering excellence, innovation, and value to our customers, partners, and stakeholders across the globe.\nI have served on the board of Directors for a number of companies across diverse activities including Property and Hospitality and fulfilled all of my fiduciary duties as well as taken an active role in the development of those organisations. \nI have a proven track record of achieving profitable growth and profit, as evidenced by the multiple awards and recognitions I have received as a CEO of the year. I have extensive experience in new business development, key account management, commercial strategic planning, logistics and distribution, and supply chain and logistics. I have strong problem solving, negotiation, and analytical abilities that enable me to overcome challenges and seize opportunities in the dynamic and competitive FMCG and wholesale/retail industry. I enjoy working with international teams and fostering a culture of collaboration, performance, and fun.\nAs the Group CEO of Sun Mark, a leading FMCG distribution/wholesale/retail company, I have been leading the strategic direction, operations, and growth of the business for over 10 years. I have a passion for delivering excellence, innovation, and value to our customers, partners, and stakeholders across the globe. I have served on the board of Directors for a number of companies across diverse activities including Property and Hospitality and fulfilled all of my fiduciary duties as well as taken an active role in the development of those organisations. I have a proven track record of achieving profitable growth and profit, as evidenced by the multiple awards and recognitions I have received as a CEO of the year. I have extensive experience in new business development, key account management, commercial strategic planning, logistics and distribution, and supply chain and logistics. I have strong problem solving, negotiation, and analytical abilities that enable me to overcome challenges and seize opportunities in the dynamic and competitive FMCG and wholesale/retail industry. I enjoy working with international teams and fostering a culture of collaboration, performance, and fun.\n‚Ä¶see more\nTop skills\nTop skills\nNegotiation ‚Ä¢ Leadership Development\nNegotiation ‚Ä¢ Leadership Development\nActivity\nActivity\n6,565 followers\n6,565 followers\nPosts\nComments\nLoaded 9 Posts posts\nHarmeet Ahuja reposted this\nAnasudhin Azeez\nAnasudhin Azeez\n ‚Ä¢ 3rd+\n3rd+\nMD, Executive Editor - London Daily\nMD, Executive Editor - London Daily\n4mo ‚Ä¢ \n4 months ago ‚Ä¢ Visible to anyone on or off LinkedIn\nLondon business community to discuss opportunities and obstacles for growth on 9th October. Prominent speakers are attending. Please attend Harmeet Ahuja Anasudhin Azeez\n‚Ä¶more\nActivate to view larger image,\nActivate to view larger image,\n21\n1 comment\n1 repost\nHarmeet Ahuja\nHarmeet Ahuja\n   ‚Ä¢ 2nd\nPremium ‚Ä¢ 2nd\nCEO at Sun Mark Group | CEO of the Year 2019, 2021 (Thames Valley 250)\nCEO at Sun Mark Group | CEO of the Year 2019, 2021 (Thames Valley 250)\n5mo ‚Ä¢ Edited ‚Ä¢ \n5 months ago ‚Ä¢ Edited ‚Ä¢ Visible to anyone on or off LinkedIn\nCongratulations to the team for building a fantastic brand which has a very bright future, and also to our excellent distribution partners for working closely with us over the years. Thank you to our deal team: Chris Murphy; Bruna Teixeira; Nayaz Qazi; @Dirk Maris; and to Lord Rami Ranger FRSA for his leadership.\n‚Ä¶more\nSun Mark Ltd.\nSun Mark Ltd.\n4,524 followers\n4,524 followers\nSun Mark Intl. sells Bullet brand to Champion Breweries, Nigeria\nSun Mark International has announced the sale of its popular Bullet ready-to-drink alcoholic and energy beverage brand to Champion Breweries Plc, Nigeria, in a landmark asset carve-out deal.\nUnder the agreement, Bullet‚Äôs assets will be sold with Champion Breweries Plc taking a majority stake and Sun Mark‚Äôs Belgian majority shareholder, Vinar N.V., will have a minority holding.\nThe Bullet brand created by Lord Rami Ranger over 15 years ago, has developed a strong presence across 14 African markets, with Nigeria as its largest. Bullet Black remains Nigeria‚Äôs leading RTD brand, while Bullet Blue is among the country‚Äôs top six energy drinks.\nThis change will not affect its longstanding commercial relationship with J.I. Ejison International, its long-standing partner in Nigeria and that this remains intact and central to its future market g",
    "searchKeyword": "CEO"
  },
  {
    "profileUrl": "https://www.linkedin.com/in/andrew-bloom-16a8a89",
    "name": "Andrew Bloom",
    "title": "Chief Executive Officer, Non-Executive Director and Investor",
    "location": "Greater London, England, United Kingdom",
    "company": "",
    "about": "",
    "experience": "Experience\nExperience\nMasthaven Finance\nMasthaven Finance\n4 yrs 5 mos\n4 yrs 5 mos\nOn-site\nOn-site\nChief Executive Officer & Owner\nChief Executive Officer & Owner\nFull-time\nFull-time\nJun 2023 - Present ¬∑ 2 yrs 9 mos\nJun 2023 to Present ¬∑ 2 yrs 9 mos\nLondon, United Kingdom\nLondon, United Kingdom\nExecutive Chairman & Owner\nExecutive Chairman & Owner\nPart-time\nPart-time\nOct 2021 - May 2023 ¬∑ 1 yr 8 mos\nOct 2021 to May 2023 ¬∑ 1 yr 8 mos\nBorehamwood, England, United Kingdom\nBorehamwood, England, United Kingdom\nIn October 2024, I completed on my purchase and reacquired Masthaven. On 10th February 2025, Masthaven merged with Spring Finance and the combined entity will trade as Masthaven Finance.\n\nI purchased the majority stake in Spring Finance in October 2021.\n\nI was the founder, chief executive and majority shareholder of Masthaven between 2005 and 2020, where I sold my majority stake and stepped down as chief executive. \n\nMasthaven was launched as a specialist finance provider in January 2005 and in April 2016 because a UK retail bank. Over the following years it became an established challenger bank lending billions of pounds and having tens of thousands of retail saving customers. \n\nSpring Finance has been providing a flexible and personalised approach to secured lending since 2011 and whose sole focus is on serving the specialist lending market. Our range of products including first and second charge mortgages, bridging loans and development finance.\nIn October 2024, I completed on my purchase and reacquired Masthaven. On 10th February 2025, Masthaven merged with Spring Finance and the combined entity will trade as Masthaven Finance. I purchased the majority stake in Spring Finance in October 2021. I was the founder, chief executive and majority shareholder of Masthaven between 2005 and 2020, where I sold my majority stake and stepped down as chief executive. Masthaven was launched as a specialist finance provider in January 2005 and in April 2016 because a UK retail ",
    "isCSuite": true,
    "contextForAI": "Andrew Bloom \n2nd degree connection\n2nd\nChief Executive Officer, Non-Executive Director and Investor\nGreater London, England, United Kingdom  Contact info\n7,488 followers \n500+ connections\nIwona Plumpton is a mutual connection\nIwona Plumpton is a mutual connection\nFollow\nMessage\nMore\nHighlights\nHighlights\nAndrew recently posted on LinkedIn\nAndrew recently posted on LinkedIn\nUnderstand what topics Andrew posts about to inform your outreach.\nUnderstand what topics Andrew posts about to inform your outreach.\nFree insight from Sales Navigator\nFree insight from Sales Navigator\nUnlock more insights about leads\nImprove outreach with sales insights\nTry Sales Navigator for ¬£0\n1-month free. We‚Äôll remind you 7 days before your trial ends.\nAbout\nAbout\nMy focus is on investing in financial technology and specialist finance lending businesses, both banks and non-banks. I‚Äôm equally happy to take either a majority or a minority stake. It all depends on the opportunity and the quality of the management team. \nI‚Äôm also willing to share my expertise in successfully scaling lending businesses by joining the board as either a non-executive director or chairman.\nI was a significant Pre-Seed, Seed, and Series A investor in Abound, a technology-driven lending fintech that uses AI and open banking to make lending decisions. Post-launch, I joined the Board to assist with the growth strategy. \nWithin four years, Abound had lent more than ¬£1 billion of consumer loans and, in January 2026, was ranked No. 1 in the Sunday Times Tech 100 list of the fastest-growing technology companies in the UK with revenues of ¬£67m\nMy focus is on investing in financial technology and specialist finance lending businesses, both banks and non-banks. I‚Äôm equally happy to take either a majority or a minority stake. It all depends on the opportunity and the quality of the management team. I‚Äôm also willing to share my expertise in successfully scaling lending businesses by joining the board as either a non-executive director or chairman. I was a significant Pre-Seed, Seed, and Series A investor in Abound, a technology-driven lending fintech that uses AI and open banking to make lending decisions. Post-launch, I joined the Board to assist with the growth strategy. Within four years, Abound had lent more than ¬£1 billion of consumer loans and, in January 2026, was ranked No. 1 in the Sunday Times Tech 100 list of the fastest-growing technology companies in the UK with revenues of ¬£67m\n‚Ä¶see more\nFeatured\nFeatured\nPost\nPost\nCongratulations to everyone at Abound.\nI'm proud to be one of their significant Pre-Seed, Seed and Series A investors as well as one of the original board directors.\n39\n4 comments\nActivity\nActivity\n7,488 followers\n7,488 followers\nFollow\nPosts\nComments\nImages\nDocuments\nLoaded 9 Posts posts\nAndrew Bloom\nAndrew Bloom\n   ‚Ä¢ 2nd\nVerified ‚Ä¢ 2nd\nChief Executive Officer, Non-Executive Director and Investor\nChief Executive Officer, Non-Executive Director and Investor\n4w ‚Ä¢ Edited ‚Ä¢ \n0 months ago ‚Ä¢ Edited ‚Ä¢ Visible to anyone on or off LinkedIn\nCongratulations to everyone at Abound.\nI'm proud to be one of their significant Pre-Seed, Seed and Series A investors as well as one of the original board directors.\n‚Ä¶more\nAbound\nAbound\n8,144 followers\n8,144 followers\nWe‚Äôre extremely proud to be named as the fastest growing tech company in the UK by The Times!\nWe‚Äôve come a long way in our first five years but truly believe we‚Äôre just getting started.\nWe‚Äôve built a platform that makes fairer credit decisions allowing more people to access loans at better rates. And, we‚Äôve lent over ¬£1bn and saved customers millions in the process.\nWe‚Äôll be launching more products and markets this year. \nIf you‚Äôre interested in joining a team where you can have an instant impact, learn quickly, and grow as we do, please reach out\n‚Ä¶more\nActivate to view larger image,\nActivate to view larger image,\n39\n4 comments\nAndrew Bloom\nAndrew Bloom\n   ‚Ä¢ 2nd\nVerified ‚Ä¢ 2nd\nChief Executive Officer, Non-Executive Director and Investor\nChief Executive Officer, Non-Executive Director and Investor\n3mo ‚Ä¢ \n3 months ago ‚Ä¢ Visible to anyone on or off LinkedIn\nI'm excited to be speaking at the Specialist Lender¬†Finance Conference in London on November 24, 2025, where I will be joining fellow industry leaders speaking on the panel:¬†\"The CEO's Roundtable: Sharing the Originator's Journey\". \nCheck out full agendas here: https://hubs.la/Q03Q3tGv0\nhashtag\n#SLF \nhashtag\n#SpecialistLender \nhashtag\n#GetDealsDone @DealCatalyst\n‚Ä¶more\nActivate to view larger image,\nActivate to view larger image,\n93\n1 comment\n2 reposts\nShow all posts\nExperience\nExperience\nMasthaven Finance\nMasthaven Finance\n4 yrs 5 mos\n4 yrs 5 mos\nOn-site\nOn-site\nChief Executive Officer & Owner\nChief Executive Officer & Owner\nFull-time\nFull-time\nJun 2023 - Present ¬∑ 2 yrs 9 mos\nJun 2023 to Present ¬∑ 2 yrs 9 mos\nLondon, United Kingdom\nLondon, United Kingdom\nExecutive Chairman & Owner\nExecutive Chairman & Owner\nPart-time\nPart-time\nOct 2021 - May 2023 ¬∑ 1 y",
    "searchKeyword": "CEO"
  },
  {
    "profileUrl": "https://www.linkedin.com/in/lawrence-chitwa-2ba42032",
    "name": "Lawrence Chitwa",
    "title": "Property Developer, Landlord, Property Manager, Founder/CEO at Onyx Global Investments Ltd, Director at Elia Estates Ltd",
    "location": "London, England, United Kingdom",
    "company": "",
    "about": "",
    "experience": "",
    "isCSuite": true,
    "contextForAI": "Lawrence Chitwa\n2nd degree connection\n2nd\nProperty Developer, Landlord, Property Manager, Founder/CEO at Onyx Global Investments Ltd, Director at Elia Estates Ltd\nLondon, England, United Kingdom  Contact info",
    "searchKeyword": "CEO"
  },
  {
    "profileUrl": "https://www.linkedin.com/in/dirkhahnhays",
    "name": "Dirk Hahn",
    "title": "Chief Executive Officer @ Hays plc",
    "location": "United Kingdom",
    "company": "Hays",
    "about": "",
    "experience": "Experience\nExperience\nHays\nHays\nFull-time ¬∑ 25 yrs 2 mos\nFull-time ¬∑ 25 yrs 2 mos\nChief Executive Officer Hays plc\nChief Executive Officer Hays plc\nSep 2023 - Present ¬∑ 2 yrs 6 mos\nSep 2023 to Present ¬∑ 2 yrs 6 mos\nGreater London, England, United Kingdom\nGreater London, England, United Kingdom\nChief Executive Officer, Hays CEMEA\nChief Executive Officer, Hays CEMEA\nNov 2021 - Aug 2023 ¬∑ 1 yr 10 mos\nNov 2021 to Aug 2023 ¬∑ 1 yr 10 mos\nChief Executive Officer, Hays Germany and GSCN\nChief Executive Officer, Hays Germany and GSCN\nFeb 2020 - Aug 2023 ¬∑ 3 yrs 7 mos\nFeb 2020 to Aug 2023 ¬∑ 3 yrs 7 mos\nMannheim, Baden-W√ºrttemberg, Germany\nMannheim, Baden-W√ºrttemberg, Germany\nShow all 8 experiences\nDepartment Manager Key Account Management \nDepartment Manager Key Account Management \nHays ¬∑ Full-time\nHays ¬∑ Full-time\n1999 - 2000 ¬∑ 1 yr\n1999 to 2000 ¬∑ 1 yr\nMannheim, Baden-W√ºrttemberg, Germany\nMannheim, Baden-W√ºrttemberg, Germany\nSales Representative\nSales Representative\nHays\nHays\n1997 - 1998 ¬∑ 1 yr\n1997 to 1998 ¬∑ 1 yr\nMannheim, Baden-W√ºrttemberg, Germany\nMannheim, Baden-W√ºrttemberg, Germany",
    "isCSuite": true,
    "contextForAI": "Dirk has a {:badgeType} account\nDirk Hahn \n3rd degree connection\n3rd\nChief Executive Officer @ Hays plc\n Top Voice\nHays\nEberhard-Karls-Universit√§t T√ºbingen / University of Tuebingen\nUnited Kingdom  Contact info\n27,024 followers\nFollow\nMessage\nMore\nAbout\nAbout\nDeveloping candidates and their talents, empowering people and businesses to succeed, and advancing the digital transformation in the world of work. That is my passion. \nWorking at Hays for over 25 years, I started off as a department and division manager in Germany, continuing as Director of Sales, later Chief Operating Officer, Chief Executive Officer for Germany and CEMEA, and now CEO of Hays plc. \nCommunication, business strategy, and culture is very important to me. I believe the personnel challenges of the future can best be solved through exchange of ideas, especially in turbulent times like these. I'm looking forward to sharing insights regularly into my work as CEO, and the developments in our company on LinkedIn.\nDeveloping candidates and their talents, empowering people and businesses to succeed, and advancing the digital transformation in the world of work. That is my passion. Working at Hays for over 25 years, I started off as a department and division manager in Germany, continuing as Director of Sales, later Chief Operating Officer, Chief Executive Officer for Germany and CEMEA, and now CEO of Hays plc. Communication, business strategy, and culture is very important to me. I believe the personnel challenges of the future can best be solved through exchange of ideas, especially in turbulent times like these. I'm looking forward to sharing insights regularly into my work as CEO, and the developments in our company on LinkedIn.\n‚Ä¶see more\nFeatured\nFeatured\nNewsletter\nNewsletter\nWorkforce Connect\nWorkforce Connect\nPublished monthly ¬∑ 12,465 subscribers\nPublished monthly ¬∑ 12,465 subscribers\nInsights from Hays CEO, Dirk Hahn to help you navigate the future of work\nInsights from Hays CEO, Dirk Hahn to help you navigate the future of work\nSubscribe\nPost\nPost\nI am honoured to be included in this year‚Äôs Europe Staffing 100 list by Staffing Industry Analysts, alongside so many respected peers in the industry. \nMy career in recruitment began in 1997 and over the past 28 years I‚Äôve built a rewarding career at Hays. It‚Äôs more than a company to me and it‚Äôs a privilege to lead this wonderful organisation and work with some many talented and dedicated colleagues around the world.\nI am also pleased to see my colleagues James Hilton and Nigel Kirkham on the list. Their inclusion is well-deserved and reflects their hard work and commitment to Hays and the wider industry.\nLink in the comments.\nhashtag\n#hays \nhashtag\n#ceo \nhashtag\n#recognition \nhashtag\n#Staffing100\n388\n46 comments\nPost\nPost\nWe‚Äôre delighted to welcome Mark Dearnley to Hays as our new Chief Digital and Technology Officer and a member of our Executive Leadership Team.\nMark joins us at a pivotal moment in our journey. As part of our global strategy to build a more resilient, profitable, and growing Hays, we are committed to investing in innovation, digitisation, and data. This is fundamental as we evolve our business and continue to deliver an exceptional service to our customers worldwide.\nWith extensive experience leading digital and IT transformation across global organisations in telecoms, retail, consulting, and the public sector, Mark brings a proven track record of using technology to enhance customer experience, drive innovation, and deliver meaningful outcomes.\nAt Hays, we believe the future of work lies in the powerful combination of¬†human expertise and digital innovation. Mark‚Äôs leadership will be instrumental as we invest further in technology, data, and digital tools to deliver faster, smarter, and more personalised experiences for our customers and candidates worldwide.\nFinally, I‚Äôd like to thank Tim Fulton, our outgoing Chief Technology Officer, for his outstanding leadership over the past two years. Tim has played a pivotal role in laying the foundations for our global technology strategy, and we wish him every success as he returns to interim and advisory work.\nWelcome, Mark and thank you, Tim.\nhashtag\n#Leadership \nhashtag\n#ExecutiveLeadership \nhashtag\n#TechLeadership\n1,041\n105 comments\nPost\nPost\nAs workforce expectations shift and new pressures emerge, organisations must be proactive by shaping strategies that build agility, spark innovation, and support long-term growth.\nEach month, I‚Äôll share a snapshot of the latest workforce insights, help us stay informed and ready for what comes next. Here are the key trends we‚Äôre seeing now:\nùó†ùó∂ùòÅùó∂ùó≤ ùóøùó≤ùóΩùóºùóøùòÅ ùóøùó≤ùòÉùó≤ùóÆùóπùòÄ ùóÆ \"ùó£ùóøùóºùó±ùòÇùó∞ùòÅùó∂ùòÉùó∂ùòÅùòÜ ùóïùóπùóÆùó∞ùó∏ ùóõùóºùóπùó≤\" ùó∂ùóª ùó®ùóû ùòÑùóºùóøùóΩùóπùóÆùó∞ùó≤ùòÄ\nSurvey by Mitie highlights a growing challenge around workplace efficiency. On average, UK employees are estimated to lose 68 minutes each week on tasks that don‚Äôt add value, such as solving unclear processes or organising their worksp",
    "searchKeyword": "CEO"
  },
  {
    "profileUrl": "https://www.linkedin.com/in/sukh-mann-4b4a97212",
    "name": "Sukh Mann",
    "title": "Chief Operating Officer",
    "location": "London, England, United Kingdom",
    "company": "",
    "about": "",
    "experience": "Experience\nExperience\nChief Operating Officer\nChief Operating Officer\nXE Jet Limited ¬∑ Full-time\nXE Jet Limited ¬∑ Full-time\nFeb 2024 - Present ¬∑ 2 yrs 1 mo\nFeb 2024 to Present ¬∑ 2 yrs 1 mo\nLagos, Lagos State, Nigeria ¬∑ On-site\nLagos, Lagos State, Nigeria ¬∑ On-site\nBased in Lagos, Nigeria, I run the day to day operations of XE Jet. \n\nWe are a young and dynamic airline with robust plans to grow well into the future. \n\nSince undertaking the role we have launched XEJet's commercial airline serving domestic operations in Nigeria and more recently I was the Startup Manager for Air Sierra Leone; a group subsidiary that is based in Freetown. In addition to operating in the West African region the airline now operates a direct route to London Gatwick.\nBased in Lagos, Nigeria, I run the day to day operations of XE Jet. We are a young and dynamic airline with robust plans to grow well into the future. Since undertaking the role we have launched XEJet's commercial airline serving domestic operations in Nigeria and more recently I was the Startup Manager for Air Sierra Leone; a group subsidiary that is based in Freetown. In addition to operating in the West African region the airline now operates a direct route to London Gatwick.\n‚Ä¶see more\nAir Transportation, Quality Assurance and +2 skills\nXEJet at the NIGAV Awards\nXEJet at the NIGAV Awards\nDelighted to attend the NIGAV Awards with the team where they were recognised for their high standard of Quality Assurance and Safety Compliance, good to be back in Nigeria.\nDelighted to attend the NIGAV Awards with the team where they were recognised for their high standard of Quality Assurance and Safety Compliance, good to be back in Nigeria.\nManaging Partner\nManaging Partner\ndre aviation (Syon Lane Capital Limited) ¬∑ Full-time\ndre aviation (Syon Lane Capital Limited) ¬∑ Full-time\nApr 2020 - Feb 2024 ¬∑ 3 yrs 11 mos\nApr 2020 to Feb 2024 ¬∑ 3 yrs 11 mos\nI develop the company's airline business portfolio and manage the day to day financial and",
    "isCSuite": true,
    "contextForAI": "Sukh Mann\n2nd degree connection\n2nd\nChief Operating Officer\nUniversity of West London\nLondon, England, United Kingdom  Contact info\n500+ connections\nConnect\nMessage\nMore\nAbout\nAbout\nA versatile business, operational and finance professional with a demonstrable track record of delivery and career development. \nSkilled in Negotiation, Business Planning, Operations Management, Quality Management, and Building Successful Teams.\nSeasoned business development professional with a BA Economics (Honours) from the University of West London. \nKey Areas of Specialism include\nSeasoned Finance Professional from Entry to C Level Experience in variety of roles and locations\nCommercial Aviation & Airline Operations and Management\nGround Handling (Passenger and Cargo) Operations and Management \nEmerging Market Aviation Business Development\nAirport & FBO Management Experience\nBusiness Management; including: Finance, Legal, Operations, HR and Business Development\nKey Strengths\n33 Years of Industry Experience From Entry To C Level \nEntrepreneurial & Commercially Focused Finance & Operational Professional\nStrong Internal Controls and Compliance Background\nResults Driven with Demonstrable Track Record of Delivery\nExcellent Interpersonal Skills\nCulturally Aware\nGeographical Work Experience\nHands on ‚Äì UK, Russia, Ukraine, Finland, Latvia, Lithuania, Bulgaria, Romania, Serbia & Former Yugoslavia, Denmark, Norway, Sweden, Poland, Hungary, Slovakia, Czech Republic, Bulgaria, Romania, Nigeria, Ghana, Senegal, Gambia, Sierra Leone, Liberia, Cameroon, North Africa, Israel, Germany, Austria & Switzerland.\nProject based experience ‚Äì USA, Albania, Uganda, Germany, France, the UAE and India.\nA versatile business, operational and finance professional with a demonstrable track record of delivery and career development. Skilled in Negotiation, Business Planning, Operations Management, Quality Management, and Building Successful Teams. Seasoned business development professional with a BA Economics (Honours) from the University of West London. Key Areas of Specialism include Seasoned Finance Professional from Entry to C Level Experience in variety of roles and locations Commercial Aviation & Airline Operations and Management Ground Handling (Passenger and Cargo) Operations and Management Emerging Market Aviation Business Development Airport & FBO Management Experience Business Management; including: Finance, Legal, Operations, HR and Business Development Key Strengths 33 Years of Industry Experience From Entry To C Level Entrepreneurial & Commercially Focused Finance & Operational Professional Strong Internal Controls and Compliance Background Results Driven with Demonstrable Track Record of Delivery Excellent Interpersonal Skills Culturally Aware Geographical Work Experience Hands on ‚Äì UK, Russia, Ukraine, Finland, Latvia, Lithuania, Bulgaria, Romania, Serbia & Former Yugoslavia, Denmark, Norway, Sweden, Poland, Hungary, Slovakia, Czech Republic, Bulgaria, Romania, Nigeria, Ghana, Senegal, Gambia, Sierra Leone, Liberia, Cameroon, North Africa, Israel, Germany, Austria & Switzerland. Project based experience ‚Äì USA, Albania, Uganda, Germany, France, the UAE and India.\n‚Ä¶see more\nTop skills\nTop skills\nLeadership ‚Ä¢ Management ‚Ä¢ Accounting ‚Ä¢ Operations Management ‚Ä¢ Commercial Aviation\nLeadership ‚Ä¢ Management ‚Ä¢ Accounting ‚Ä¢ Operations Management ‚Ä¢ Commercial Aviation\nActivity\nActivity\n2,003 followers\n2,003 followers\nLoaded 1 Comments post\nSukh Mann commented on a post ‚Ä¢ 9mo\n9mo\nMay the departed souls find peace. A very sad for global aviation.\nMay the departed souls find peace. A very sad for global aviation. \nShow all comments\nExperience\nExperience\nChief Operating Officer\nChief Operating Officer\nXE Jet Limited ¬∑ Full-time\nXE Jet Limited ¬∑ Full-time\nFeb 2024 - Present ¬∑ 2 yrs 1 mo\nFeb 2024 to Present ¬∑ 2 yrs 1 mo\nLagos, Lagos State, Nigeria ¬∑ On-site\nLagos, Lagos State, Nigeria ¬∑ On-site\nBased in Lagos, Nigeria, I run the day to day operations of XE Jet. \nWe are a young and dynamic airline with robust plans to grow well into the future. \nSince undertaking the role we have launched XEJet's commercial airline serving domestic operations in Nigeria and more recently I was the Startup Manager for Air Sierra Leone; a group subsidiary that is based in Freetown. In addition to operating in the West African region the airline now operates a direct route to London Gatwick.\nBased in Lagos, Nigeria, I run the day to day operations of XE Jet. We are a young and dynamic airline with robust plans to grow well into the future. Since undertaking the role we have launched XEJet's commercial airline serving domestic operations in Nigeria and more recently I was the Startup Manager for Air Sierra Leone; a group subsidiary that is based in Freetown. In addition to operating in the West African region the airline now operates a direct route to London Gatwick.\n‚Ä¶see more\nAir Transportation, Quality Assurance and +2 skills\nXEJet at the NIGAV Awards\nXEJet at the NIGAV Awards\nD",
    "searchKeyword": "CEO"
  },
  {
    "profileUrl": "https://www.linkedin.com/in/stefano1982",
    "name": "Stefano Salerno",
    "title": "Enterpreneur | Partner & General Manager Italy Hive Energy | CEO & Founder Sunleonard Energy | Retail Trader |",
    "location": "London, England, United Kingdom",
    "company": "",
    "about": "",
    "experience": "Experience\nExperience\nCEO & Founder\nCEO & Founder\nSunleonard Energy ¬∑ Full-time\nSunleonard Energy ¬∑ Full-time\nMay 2021 - Present ¬∑ 4 yrs 10 mos\nMay 2021 to Present ¬∑ 4 yrs 10 mos\nWestminster | London\nWestminster | London\nPartner | General Manager Italy\nPartner | General Manager Italy\nHive Energy ¬∑ Self-employed\nHive Energy ¬∑ Self-employed\nMay 2021 - Present ¬∑ 4 yrs 10 mos\nMay 2021 to Present ¬∑ 4 yrs 10 mos\nSt James | London\nSt James | London\nQuercus Real Assets\nQuercus Real Assets\n2 yrs 1 mo\n2 yrs 1 mo\nMayfair | London\nMayfair | London\nPartner Italian Platform | Managing Director Development\nPartner Italian Platform | Managing Director Development\nMay 2020 - Apr 2021 ¬∑ 1 yr\nMay 2020 to Apr 2021 ¬∑ 1 yr\nSPV Director | Head of Asset Management\nSPV Director | Head of Asset Management\nApr 2019 - Apr 2020 ¬∑ 1 yr 1 mo\nApr 2019 to Apr 2020 ¬∑ 1 yr 1 mo\nPartner India Platform | Head of Asset Management\nPartner India Platform | Head of Asset Management\nArmstrong Energy Global\nArmstrong Energy Global\nAug 2017 - Apr 2019 ¬∑ 1 yr 9 mos\nAug 2017 to Apr 2019 ¬∑ 1 yr 9 mos\nCity of London | London\nCity of London | London\nPartner | Chief Operating Officer\nPartner | Chief Operating Officer\nAmaranto Global Asset Management\nAmaranto Global Asset Management\nSep 2016 - Aug 2017 ¬∑ 1 yr\nSep 2016 to Aug 2017 ¬∑ 1 yr\nMayfair | London\nMayfair | London\nShow all 11 experiences",
    "isCSuite": true,
    "contextForAI": "Stefano Salerno \n2nd degree connection\n2nd\nEnterpreneur | Partner & General Manager Italy Hive Energy | CEO & Founder Sunleonard Energy | Retail Trader |\nUniversit√† degli Studi di Ferrara\nLondon, England, United Kingdom  Contact info\n500+ connections\nRobert Lynch is a mutual connection\nRobert Lynch is a mutual connection\nConnect\nMessage\nMore\nAbout\nAbout\nStefano has a wealth of experience in renewable energy gathered over a decade of expertise and practice within the sector. Stefano has previously worked as the Managing Director for Development at Quercus Real Assets, the Head of Portfolio Management at Next Energy Capital and Head Operation and Maintenance at Belelectric.\nStefano has worked in other senior roles in a range of private equity and investment funds. Having always had an interest in investment, Stefano started his asset management career in 2008 for Novenergia II, with more than 1 billion renewable assets under management. In 2016 and 2020 Stefano launched and managed two development platforms established in both India and Italy bringing his knowledges and practices to the front-line. \nStefano's passion for investments has grown immensely and has started trading derivates and securities as a retailer trader applying well-known instruments in the industry\nStefano has a wealth of experience in renewable energy gathered over a decade of expertise and practice within the sector. Stefano has previously worked as the Managing Director for Development at Quercus Real Assets, the Head of Portfolio Management at Next Energy Capital and Head Operation and Maintenance at Belelectric. Stefano has worked in other senior roles in a range of private equity and investment funds. Having always had an interest in investment, Stefano started his asset management career in 2008 for Novenergia II, with more than 1 billion renewable assets under management. In 2016 and 2020 Stefano launched and managed two development platforms established in both India and Italy bringing his knowledges and practices to the front-line. Stefano's passion for investments has grown immensely and has started trading derivates and securities as a retailer trader applying well-known instruments in the industry\n‚Ä¶see more\nActivity\nActivity\n6,368 followers\n6,368 followers\nPosts\nComments\nLoaded 9 Posts posts\nStefano Salerno reposted this\nJurchen Technology GmbH\nJurchen Technology GmbH\n3,743 followers\n3,743 followers\n1w ‚Ä¢ \n1 week ago ‚Ä¢ Visible to anyone on or off LinkedIn\nThe hype is real - PEG¬Æ is on the rise - \nthanks to its intentionally engineered simplicity! üí° \nThere is currently a clear trend in the industry toward ultra-light, sustainable, and economical system designs for large solar and battery storage projects such as Jurchen Technology GmbH's PEG¬Æ. This is currently highlighted by an online article of Renew Economy from autor Sophie Vorrath about a new project in the South Burnett region of Queensland that focuses on precisely these requirements. \nThe key message of the article is: \nthe advantages of PEG¬Æ are obvious!\n¬∑¬†¬†¬†¬†¬†¬†PEG¬Æ does not require concrete - no heavy foundations\n¬∑¬†¬†¬†¬†¬†¬†PEG¬Æ reduces material and logistics costs\n¬∑¬†¬†¬†¬†¬†¬†PEG¬Æ enables quick installation - with standard hand tools. \n¬∑¬†¬†¬†¬†¬†¬†PEG¬Æ stands for high land utilization and low visual impact. \n¬∑¬†¬†¬†¬†¬†¬†PEG¬Æ optimizes the cost-effectiveness of projects. (Fewer machines, less logistics, less steel, and shorter construction phases mean lower overall costs and reduced risks).\nProjects such as the one in Queensland highlight the importance of substructures - like the highly efficient PEG¬Æ solar mounting system - for the energy transition in terms of sustainability, approvability, and cost-effectiveness.\nCheck out the full RENEW ECONOMY article. (Link in comments!) \nhashtag\n#SolarEnergy \nhashtag\n#RenewableEnergy \nhashtag\n#PV \nhashtag\n#BESS \nhashtag\n#EnergyTransition \nhashtag\n#PEG\n‚Ä¶more\nActivate to view larger image,\nActivate to view larger image,\n42\n1 comment\n6 reposts\nStefano Salerno\nStefano Salerno\n   ‚Ä¢ 2nd\nVerified ‚Ä¢ 2nd\nEnterpreneur | Partner & General Manager Italy Hive Energy | CEO & Founder Sunleonard Energy | Retail Trader |\nEnterpreneur | Partner & General Manager Italy Hive Energy | CEO & Founder Sunleonard Energy | Retail Trader |\n3mo ‚Ä¢ \n3 months ago ‚Ä¢ Visible to anyone on or off LinkedIn\nhashtag\n#EastsWestFix \nhashtag\n#Gable \nhashtag\n#FERX \nhashtag\n#NegativePricing \nhashtag\n#maximiserevenues \nhashtag\n#Leadingdevelopment\nJurchen Technology US\nJurchen Technology US\n2,698 followers\n2,698 followers\nüåû From Design to Reality ‚Äì 7.8 MWp Solar PV Project | Acate, Sicily üáÆüáπ\nProud to see this impressive utility-scale project in Acate, Sicily, come to life ‚Äî built on the PEG EW substructure by Jurchen Technology GmbH. What started as an innovative design concept is now a fully operational 7.8 MWp solar plant generating clean energy for the Italian grid.\nThe PEG EW system was chosen for its ultra-compact, terrain-adaptive design, offering exceptional land-use efficiency a",
    "searchKeyword": "CEO"
  },
  {
    "profileUrl": "https://www.linkedin.com/in/mikhail-belyaev-ai",
    "name": "Mikhail Beliaev",
    "title": "Founder & CEO at AUMI AI",
    "location": "United Kingdom",
    "company": "AUMI.ai",
    "about": "",
    "experience": "Experience\nExperience\nChief Executive Officer\nChief Executive Officer\nAUMI.ai ¬∑ Full-time\nAUMI.ai ¬∑ Full-time\nMar 2023 - Present ¬∑ 3 yrs\nMar 2023 to Present ¬∑ 3 yrs\nGreater London, England, United Kingdom\nGreater London, England, United Kingdom\nCEO & Founder\nCEO & Founder\nIRA Labs\nIRA Labs\nMay 2020 - Sep 2023 ¬∑ 3 yrs 5 mos\nMay 2020 to Sep 2023 ¬∑ 3 yrs 5 mos\nTransformed a research team to a MedTech startup with $1.7m annual revenue.\nTransformed a research team to a MedTech startup with $1.7m annual revenue.\nAssistant Professor\nAssistant Professor\nSkoltech\nSkoltech\nJan 2019 - Aug 2021 ¬∑ 2 yrs 8 mos\nJan 2019 to Aug 2021 ¬∑ 2 yrs 8 mos\nCreated a research group with a solid performance in medical image analysis. We published our research at the best international venues, including MICCAI and Medical Image Analysis.\nCreated a research group with a solid performance in medical image analysis. We published our research at the best international venues, including MICCAI and Medical Image Analysis.\nResearch Group Lead\nResearch Group Lead\nInstitute for Problems of Information Transmission\nInstitute for Problems of Information Transmission\nJun 2015 - Dec 2018 ¬∑ 3 yrs 7 mos\nJun 2015 to Dec 2018 ¬∑ 3 yrs 7 mos\nExplored brain-computer interfaces, neuroscience, and other areas of biomedicine, looking for a problem that a scalable AI solution can address.\nExplored brain-computer interfaces, neuroscience, and other areas of biomedicine, looking for a problem that a scalable AI solution can address.\nSenior Data Scientist\nSenior Data Scientist\npSeven\npSeven\nJul 2010 - May 2015 ¬∑ 4 yrs 11 mos\nJul 2010 to May 2015 ¬∑ 4 yrs 11 mos\nCreated AI-based products and provided data science consultations for engineers at Airbus and other industry leaders in the EU and Japan.\nCreated AI-based products and provided data science consultations for engineers at Airbus and other industry leaders in the EU and Japan.\nShow all 6 experiences",
    "isCSuite": true,
    "contextForAI": "Mikhail Beliaev\n2nd degree connection\n2nd\nFounder & CEO at AUMI AI\nAUMI.ai\nUnited Kingdom  Contact info\n500+ connections\nConnect\nMessage\nMore\nAbout\nAbout\nWith over 15 years of experience in AI product development across various industries and academia, I am passionate about leveraging artificial intelligence to drive innovation and impact.\nMy career began as a data scientist at pSeven, where I developed AI products for industry leaders such as Airbus, IHI, Mitsubishi, and even a Formula 1 team.\nTransitioning to academia, I created and led a data science research team focused on biomedicine. Our work in medical imaging AI resulted in over two dozen publications in top-tier venues like MICCAI and Medical Image Analysis, earning over 1,500 citations.\nMy next venture was transforming our research into a MedTech startup. We developed a unique AI product that has benefitted over 1 million patients and bootstraped the company to $1.7 million in annual revenue.\nWith over 15 years of experience in AI product development across various industries and academia, I am passionate about leveraging artificial intelligence to drive innovation and impact. My career began as a data scientist at pSeven, where I developed AI products for industry leaders such as Airbus, IHI, Mitsubishi, and even a Formula 1 team. Transitioning to academia, I created and led a data science research team focused on biomedicine. Our work in medical imaging AI resulted in over two dozen publications in top-tier venues like MICCAI and Medical Image Analysis, earning over 1,500 citations. My next venture was transforming our research into a MedTech startup. We developed a unique AI product that has benefitted over 1 million patients and bootstraped the company to $1.7 million in annual revenue.\n‚Ä¶see more\nActivity\nActivity\n562 followers\n562 followers\nMikhail hasn‚Äôt posted yet\nRecent posts Mikhail shares will be displayed here.\nShow all activity\nExperience\nExperience\nChief Executive Officer\nChief Executive Officer\nAUMI.ai ¬∑ Full-time\nAUMI.ai ¬∑ Full-time\nMar 2023 - Present ¬∑ 3 yrs\nMar 2023 to Present ¬∑ 3 yrs\nGreater London, England, United Kingdom\nGreater London, England, United Kingdom\nCEO & Founder\nCEO & Founder\nIRA Labs\nIRA Labs\nMay 2020 - Sep 2023 ¬∑ 3 yrs 5 mos\nMay 2020 to Sep 2023 ¬∑ 3 yrs 5 mos\nTransformed a research team to a MedTech startup with $1.7m annual revenue.\nTransformed a research team to a MedTech startup with $1.7m annual revenue.\nAssistant Professor\nAssistant Professor\nSkoltech\nSkoltech\nJan 2019 - Aug 2021 ¬∑ 2 yrs 8 mos\nJan 2019 to Aug 2021 ¬∑ 2 yrs 8 mos\nCreated a research group with a solid performance in medical image analysis. We published our research at the best international venues, including MICCAI and Medical Image Analysis.\nCreated a research group with a solid performance in medical image analysis. We published our research at the best international venues, including MICCAI and Medical Image Analysis.\nResearch Group Lead\nResearch Group Lead\nInstitute for Problems of Information Transmission\nInstitute for Problems of Information Transmission\nJun 2015 - Dec 2018 ¬∑ 3 yrs 7 mos\nJun 2015 to Dec 2018 ¬∑ 3 yrs 7 mos\nExplored brain-computer interfaces, neuroscience, and other areas of biomedicine, looking for a problem that a scalable AI solution can address.\nExplored brain-computer interfaces, neuroscience, and other areas of biomedicine, looking for a problem that a scalable AI solution can address.\nSenior Data Scientist\nSenior Data Scientist\npSeven\npSeven\nJul 2010 - May 2015 ¬∑ 4 yrs 11 mos\nJul 2010 to May 2015 ¬∑ 4 yrs 11 mos\nCreated AI-based products and provided data science consultations for engineers at Airbus and other industry leaders in the EU and Japan.\nCreated AI-based products and provided data science consultations for engineers at Airbus and other industry leaders in the EU and Japan.\nShow all 6 experiences\nEducation\nEducation\nInstitute for Information Transmission Problems\nInstitute for Information Transmission Problems\nInstitute for Information Transmission Problems\nDoctor of Philosophy - PhD, Data science\nDoctor of Philosophy - PhD, Data science\nJul 2010 - Dec 2015\nJul 2010 - Dec 2015\nMoscow Institute of Physics and Technology (State University) (MIPT)\nMoscow Institute of Physics and Technology (State University) (MIPT)\nMaster's degree, Computational and Applied Mathematics\nMaster's degree, Computational and Applied Mathematics\n2008 - 2010\n2008 - 2010\nShow all 3 educations\nSkills\nSkills\nMachine Learning\nMachine Learning\nEndorsed by Maxim Panov and 1 other who is highly skilled at this\nEndorsed by Maxim Panov and 1 other who is highly skilled at this\nEndorsed by 5 colleagues at Skolkovo Institute of Science and Technology\nEndorsed by 5 colleagues at Skolkovo Institute of Science and Technology\n23 endorsements\n23 endorsements\nData Mining\nData Mining\nEndorsed by Maxim Panov who is highly skilled at this\nEndorsed by Maxim Panov who is highly skilled at this\nEndorsed by 3 colleagues at Skolkovo Institute of Science and Te",
    "searchKeyword": "CEO"
  },
  {
    "profileUrl": "https://www.linkedin.com/in/oliver-nevel-9999706",
    "name": "Oliver Nevel",
    "title": "CEO - W Executive",
    "location": "United Kingdom",
    "company": "W Executive",
    "about": "",
    "experience": "Experience\nExperience\nCEO\nCEO\nW Executive ¬∑ Full-time\nW Executive ¬∑ Full-time\nAug 2023 - Present ¬∑ 2 yrs 7 mos\nAug 2023 to Present ¬∑ 2 yrs 7 mos\nGreater London, England, United Kingdom\nGreater London, England, United Kingdom\nAs the Founder and CEO of W Executive and W Talent UK, I lead a team of exceptional professionals dedicated to establishing an innovative and ambitious challenger brand in Executive Search.\n\nWith the robust financial support of W Group, one of Europe's rapidly expanding executive recruitment brands, we are shaping a truly collaborative talent organisation. Our team boasts remarkable expertise and proven track records across Executive Search, Interim, and Leadership Advisory Services.\nAs the Founder and CEO of W Executive and W Talent UK, I lead a team of exceptional professionals dedicated to establishing an innovative and ambitious challenger brand in Executive Search. With the robust financial support of W Group, one of Europe's rapidly expanding executive recruitment brands, we are shaping a truly collaborative talent organisation. Our team boasts remarkable expertise and proven track records across Executive Search, Interim, and Leadership Advisory Services.\n‚Ä¶see more\nCEO\nCEO\nW Talent ¬∑ Full-time\nW Talent ¬∑ Full-time\nAug 2023 - Present ¬∑ 2 yrs 7 mos\nAug 2023 to Present ¬∑ 2 yrs 7 mos\nLondon Area, United Kingdom\nLondon Area, United Kingdom\nW Talent is a challenger brand founded in 2023 and part of W Executive. We are building a team of experienced and passionate people dedicated to placing top talent. We pride ourselves on hiring and developing high-quality consultants with a wealth of experience and tenure in their specialist industry. \n\n\nWith offices in London, Birmingham and Sheffield we have teams covering Technology, Financial Services, Finance & Accounting, Marketing & Digital, Engineering & Manufacturing, Procurement & Supply Chain and Healthcare.\nW Talent is a challenger brand founded in 2023 and part of W Executive. We are building a ",
    "isCSuite": true,
    "contextForAI": "Oliver has a {:badgeType} account\nOliver Nevel\n3rd degree connection\n3rd\nCEO - W Executive\nW Executive\nEllesmere College\nUnited Kingdom  Contact info\n500+ connections\nConnect\nMessage\nMore\nHighlights\nHighlights\nOliver recently posted on LinkedIn\nOliver recently posted on LinkedIn\nUnderstand what topics Oliver posts about to inform your outreach.\nUnderstand what topics Oliver posts about to inform your outreach.\nFree insight from Sales Navigator\nFree insight from Sales Navigator\nUnlock more insights about leads\nImprove outreach with sales insights\nTry Sales Navigator for ¬£0\n1-month free. We‚Äôll remind you 7 days before your trial ends.\nActivity\nActivity\n5,632 followers\n5,632 followers\nPosts\nComments\nVideos\nImages\nLoaded 9 Posts posts\nOliver Nevel\nOliver Nevel\n   ‚Ä¢ 3rd+\nPremium ‚Ä¢ 3rd+\nCEO - W Executive\nCEO - W Executive\n1w ‚Ä¢ \n1 week ago ‚Ä¢ Visible to anyone on or off LinkedIn\nI‚Äôve spent the last few days in Milan with Federico Vione.\nIt‚Äôs where W Executive Italy is headquartered and it‚Äôs a fantastic place to be discussing our growth plan and vision. \nThere's still a very real entrepreneurial feel at W Executive and W Talent and there always will be.¬†We‚Äôve been busy building teams, refining how we operate, investing in some of the best people in the industry and making decisions quickly, free from the red tape of a corporate.\nBut the level of ambition we have is beyond what most start-ups are capable of. \nBeing part of a billion-euro group gives us room to think bigger. It gives us access to experience across markets, the ability to collaborate across disciplines and the confidence to invest in growth. Sitting with the leadership team this week, mapping out the years ahead, it‚Äôs clear that we have such a unique proposition.\nIt‚Äôs been an exciting few days.\nAnd if you want to be part of a business with genuine growth plans, where you can build something meaningful without doing it alone, I‚Äôm always open to a confidential conversation.\n‚Ä¶more\nActivate to view larger image,\n1/3\nActivate to view larger image,\n138\n5 comments\n4 reposts\nOliver Nevel\nOliver Nevel\n   ‚Ä¢ 3rd+\nPremium ‚Ä¢ 3rd+\nCEO - W Executive\nCEO - W Executive\n1mo ‚Ä¢ \n1 month ago ‚Ä¢ Visible to anyone on or off LinkedIn\nAnother reminder of why proximity matters so much in leadership.\nStaying close enough to support our team, clients we work with and the markets we operate in makes it easier to lead with clarity rather than assumption.\nSince the start of the year, I‚Äôve spent time across different parts of the UK, followed by a week in NYC meeting clients and building our network as we continue to grow both the W Executive and W Talent businesses.\nFor a business like ours, you can‚Äôt lead effectively when you‚Äôre stuck behind a desk.\n If you‚Äôre only focused on the internal mechanics, you miss too much of what‚Äôs happening outside the business. January so far has been about listening to clients to understand their 2026 priorities. And I‚Äôve been doing that alongside our brilliant teams in both businesses.\nThose conversations and the miles that come with them, have also reinforced the value of the wider W-Group for our clients.\nThat scale matters, but only when it‚Äôs informed by proximity. Being close to markets allows us to think and deliver internationally.\nAs a CEO, that‚Äôs the balance I care most about. Staying close enough to reality to make better decisions, while building a platform that helps our clients do the same.\nIt‚Äôs been a strong start. And I‚Äôm already looking forward to what comes next.\n‚Ä¶more\nActivate to view larger image,\nActivate to view larger image,\n68\n1 comment\n1 repost\nShow all posts\nExperience\nExperience\nCEO\nCEO\nW Executive ¬∑ Full-time\nW Executive ¬∑ Full-time\nAug 2023 - Present ¬∑ 2 yrs 7 mos\nAug 2023 to Present ¬∑ 2 yrs 7 mos\nGreater London, England, United Kingdom\nGreater London, England, United Kingdom\nAs the Founder and CEO of W Executive and W Talent UK, I lead a team of exceptional professionals dedicated to establishing an innovative and ambitious challenger brand in Executive Search.\nWith the robust financial support of W Group, one of Europe's rapidly expanding executive recruitment brands, we are shaping a truly collaborative talent organisation. Our team boasts remarkable expertise and proven track records across Executive Search, Interim, and Leadership Advisory Services.\nAs the Founder and CEO of W Executive and W Talent UK, I lead a team of exceptional professionals dedicated to establishing an innovative and ambitious challenger brand in Executive Search. With the robust financial support of W Group, one of Europe's rapidly expanding executive recruitment brands, we are shaping a truly collaborative talent organisation. Our team boasts remarkable expertise and proven track records across Executive Search, Interim, and Leadership Advisory Services.\n‚Ä¶see more\nCEO\nCEO\nW Talent ¬∑ Full-time\nW Talent ¬∑ Full-time\nAug 2023 - Present ¬∑ 2 yrs 7 mos\nAug 2023 to Present ¬∑ 2 yrs 7 mos\nLondon Area, United Kingdom\nLondon Area, United Kingdom\nW Talent is",
    "searchKeyword": "CEO"
  },
  {
    "profileUrl": "https://www.linkedin.com/in/nicholaskirk",
    "name": "Nicholas Kirk",
    "title": "Chief Executive Officer at PageGroup plc",
    "location": "London, England, United Kingdom",
    "company": "PageGroup",
    "about": "",
    "experience": "Experience\nExperience\nPageGroup\nPageGroup\n31 yrs 1 mo\n31 yrs 1 mo\nChief Executive Officer\nChief Executive Officer\nFull-time\nFull-time\nJan 2023 - Present ¬∑ 3 yrs 2 mos\nJan 2023 to Present ¬∑ 3 yrs 2 mos\nGreater London, England, United Kingdom ¬∑ Hybrid\nGreater London, England, United Kingdom ¬∑ Hybrid\nExecutive Board Director and Regional Managing Director, UK&I and North America\nExecutive Board Director and Regional Managing Director, UK&I and North America\nFull-time\nFull-time\nJan 2021 - Dec 2022 ¬∑ 2 yrs\nJan 2021 to Dec 2022 ¬∑ 2 yrs\nGreater London, England, United Kingdom\nGreater London, England, United Kingdom\nUK&I Managing Director\nUK&I Managing Director\nJul 2018 - Jan 2021 ¬∑ 2 yrs 7 mos\nJul 2018 to Jan 2021 ¬∑ 2 yrs 7 mos\nGreater Reading Area\nGreater Reading Area\nShow all 9 experiences\nSales Executive\nSales Executive\nHeineken UK\nHeineken UK\nSep 1993 - Jan 1995 ¬∑ 1 yr 5 mos\nSep 1993 to Jan 1995 ¬∑ 1 yr 5 mos",
    "isCSuite": true,
    "contextForAI": "Nicholas has a {:badgeType} account\nNicholas Kirk \n3rd degree connection\n3rd\nChief Executive Officer at PageGroup plc\n Top Voice\nPageGroup\nNorthumbria University\nLondon, England, United Kingdom  Contact info\n17,098 followers\nFollow\nMessage\nMore\nHighlights\nHighlights\nNicholas recently posted on LinkedIn\nNicholas recently posted on LinkedIn\nUnderstand what topics Nicholas posts about to inform your outreach.\nUnderstand what topics Nicholas posts about to inform your outreach.\nFree insight from Sales Navigator\nFree insight from Sales Navigator\nUnlock more insights about leads\nImprove outreach with sales insights\nTry Sales Navigator for ¬£0\n1-month free. We‚Äôll remind you 7 days before your trial ends.\nAbout\nAbout\nIn the 30 years I‚Äôve been part of PageGroup, I‚Äôve seen us grow into one of the world‚Äôs leading recruitment companies. There‚Äôs no doubt that we do some things differently now compared to when I joined, but one thing remains the same; the unshakeable passion we have for changing people‚Äôs lives.\nWe‚Äôre proud to play a part in important life-moments ‚Äì for the candidates we help reach their potential, the clients who deserve the best talent, and for our people who we see grow and develop along the way.\nOur approach is simple: organic growth by region and sector, a focus on growth markets, development of home-grown management expertise and a structure that champions our own talent. Having joined as a consultant all those years ago to becoming the CEO, my own career is testament to that.\nTo be at the helm of an organisation that is not only leading the sector, but that plays such a proud part in changing people‚Äôs lives, is a position I‚Äôm honoured to hold.\nIn the 30 years I‚Äôve been part of PageGroup, I‚Äôve seen us grow into one of the world‚Äôs leading recruitment companies. There‚Äôs no doubt that we do some things differently now compared to when I joined, but one thing remains the same; the unshakeable passion we have for changing people‚Äôs lives. We‚Äôre proud to play a part in important life-moments ‚Äì for the candidates we help reach their potential, the clients who deserve the best talent, and for our people who we see grow and develop along the way. Our approach is simple: organic growth by region and sector, a focus on growth markets, development of home-grown management expertise and a structure that champions our own talent. Having joined as a consultant all those years ago to becoming the CEO, my own career is testament to that. To be at the helm of an organisation that is not only leading the sector, but that plays such a proud part in changing people‚Äôs lives, is a position I‚Äôm honoured to hold.\n‚Ä¶see more\nFeatured\nFeatured\nPost\nPost\nWhen I joined PageGroup as a consultant in 1995, we were a company operating in just 6 countries, with a dedicated team of 600. Fast forward 28 years, and we've grown into a truly global organisation of 8,600 talented individuals, spanning 37 dynamic markets. \nAs I look back on our remarkable journey, I am immensely proud of everything our incredible team has achieved. It's testament to our unwavering commitment to the success of our clients, candidates and employees. \nLast week, the Executive Board and I unveiled PageGroup's new strategy that will guide us through to 2030. This strategy builds upon our existing strengths and focuses on what we‚Äôre famous for. \nOur path forward will be defined by a set of strategic goals designed to unlock our full potential and amplify our impact.¬†These are based around delivering an ambitious operating profit, driving social impact by changing one million lives, and offering best-in-class customer experience. \nOur approach centres around maximising our core business and building on our market-leading position. Additionally, we'll leverage our existing global platforms and harness the \nhashtag\n#PowerofPage, expanding our technology recruitment business, growing Page Executive, and nurturing strategic partnerships, seizing opportunities that will allow us to stand out in specific areas and markets. \nEnabling our success, we will draw on the global technology and insights platforms now in place and used every day by our teams worldwide. Our investments in these areas mean we are well positioned to leverage opportunities globally across our business in innovation, especially when it comes to AI. \nI am looking forward to this exciting new chapter in PageGroup's history and leading a business that is customer led, people powered, and insights driven. \nThank you to our incredible team and partners for being part of this journey. Together, we will continue to achieve our ambitious targets and make a meaningful impact. \nhashtag\n#PageGroup2023 \nhashtag\n#PeoplePowered \nhashtag\n#CustomerLed \nhashtag\n#InsightDriven \n1,096\n23 comments\nPost\nPost\nùóóùó∂ùó± ùòÜùóºùòÇ ùó∏ùóªùóºùòÑ ùó∂ùòÅ ùó∞ùóÆùóª ùòÅùóÆùó∏ùó≤ ùóªùó≤ùóÆùóøùóπùòÜ ùó≥ùó∂ùòÉùó≤ ùó¥ùó≤ùóªùó≤ùóøùóÆùòÅùó∂ùóºùóªùòÄ ùó≥ùóºùóø ùó∞ùóµùó∂ùóπùó±ùóøùó≤ùóª ùó≥ùóøùóºùó∫ ùóπùóºùòÑùó≤ùóø ùòÄùóºùó∞ùó∂ùóºùó≤ùó∞ùóºùóªùóºùó∫ùó∂ùó∞ ùóØùóÆùó∞ùó∏ùó¥ùóøùóºùòÇùóªùó±ùòÄ ùòÅùóº ùóøùó≤ùóÆùó∞ùóµ ùòÅùóµùó≤ ùóÆùòÉùó≤ùóøùóÆùó¥",
    "searchKeyword": "CEO"
  },
  {
    "profileUrl": "https://www.linkedin.com/in/ingrid-williams-hinds-b4252185",
    "name": "Ingrid WILLIAMS (HINDS)",
    "title": "Making Connections & Networking",
    "location": "London, England, United Kingdom",
    "company": "Hinds Investment Properties (HIP)",
    "about": "",
    "experience": "Experience\nExperience\nProperty Developer\nProperty Developer\nHinds Investment Properties (HIP)\nHinds Investment Properties (HIP)\nJul 2014 - Present ¬∑ 11 yrs 8 mos\nJul 2014 to Present ¬∑ 11 yrs 8 mos\nGreater London, England, United Kingdom\nGreater London, England, United Kingdom\nAXA Investment Managers\nAXA Investment Managers\nFull-time ¬∑ 5 yrs\nFull-time ¬∑ 5 yrs\nLondon Area, United Kingdom\nLondon Area, United Kingdom\nExecutive Assistant To Chief Executive Officer\nExecutive Assistant To Chief Executive Officer\nAug 2018 - Dec 2019 ¬∑ 1 yr 5 mos\nAug 2018 to Dec 2019 ¬∑ 1 yr 5 mos\nKey Responsibilities:\n‚Ä¢ Reported to the Chief Executive Officer.\n‚Ä¢ Organised, schedule and minute, Management Board and Regulatory Board meetings.\n‚Ä¢ Liaised with the Marketing Department for press releases and media meetings.\n‚Ä¢ Arranged all travel, expenses, invoices, timesheets, client meetings and general administration.\n‚Ä¢ Anticipate client demands and liaise with client relationship managers.\n‚Ä¢ Collaborated with the Global Heads of Human Resources/Finance/Technology/Salesforce and Legal Departments.\n\nKey Responsibilities: ‚Ä¢ Reported to the Chief Executive Officer. ‚Ä¢ Organised, schedule and minute, Management Board and Regulatory Board meetings. ‚Ä¢ Liaised with the Marketing Department for press releases and media meetings. ‚Ä¢ Arranged all travel, expenses, invoices, timesheets, client meetings and general administration. ‚Ä¢ Anticipate client demands and liaise with client relationship managers. ‚Ä¢ Collaborated with the Global Heads of Human Resources/Finance/Technology/Salesforce and Legal Departments. \n‚Ä¶see more\nPersonal Assistant to Global Head of Fixed Income & Structured Finance\nPersonal Assistant to Global Head of Fixed Income & Structured Finance\nJan 2015 - Aug 2018 ¬∑ 3 yrs 8 mos\nJan 2015 to Aug 2018 ¬∑ 3 yrs 8 mos\nKey Responsibilities:\n‚Ä¢ Reported to former Global Head of Fixed Income and Structured Finance (Management Board Member).\n‚Ä¢ Prepared packs for Compliance, Legal, MB Board, Excom Board ",
    "isCSuite": true,
    "contextForAI": "Ingrid WILLIAMS (HINDS)\n2nd degree connection\n2nd\nMaking Connections & Networking\nHinds Investment Properties (HIP)\nUniversity of Westminster\nLondon, England, United Kingdom  Contact info\n500+ connections\nIwona Plumpton is a mutual connection\nIwona Plumpton is a mutual connection\nConnect\nMessage\nMore\nAbout\nAbout\nExperienced Executive Assistant to Chief Executive Officer (CEO) with a demonstrated history of working in the financial services and real estate industry. Skilled in Communication, Asset Management, Team Building, Management and Property Development. BA (Hons) Business Studies focused in Law from The Open University. \nKey Skills:\n‚Ä¢ Excellent interpersonal skills used to build and maintain successful working relationships.\n‚Ä¢ Outstanding verbal and written communication skills, with a sharp eye for detail.\n‚Ä¢ Self-motivated and driven, with the ability to work in a fast-paced environment.\n‚Ä¢ Highly organised with exceptional time-management skills.\n‚Ä¢ Reliably meets demanding deadlines and targets whilst working under pressure.\n‚Ä¢ Confident in planning, implementation, diplomacy and change management.\n‚Ä¢ Proficient data monitoring and evaluation skills.\n‚Ä¢ Demonstrable public speaking, negotiation, leadership and project management skills.\n‚Ä¢ Creative and innovative approach towards solving problems and providing direction.\n‚Ä¢ Provides adaptable support out of hours to meet the needs of others.\n‚Ä¢ Skilled with MS Office Word, Excel, PowerPoint, Publisher, Adobe, and SharePoint packages.\nExperienced Executive Assistant to Chief Executive Officer (CEO) with a demonstrated history of working in the financial services and real estate industry. Skilled in Communication, Asset Management, Team Building, Management and Property Development. BA (Hons) Business Studies focused in Law from The Open University. Key Skills: ‚Ä¢ Excellent interpersonal skills used to build and maintain successful working relationships. ‚Ä¢ Outstanding verbal and written communication skills, with a sharp eye for detail. ‚Ä¢ Self-motivated and driven, with the ability to work in a fast-paced environment. ‚Ä¢ Highly organised with exceptional time-management skills. ‚Ä¢ Reliably meets demanding deadlines and targets whilst working under pressure. ‚Ä¢ Confident in planning, implementation, diplomacy and change management. ‚Ä¢ Proficient data monitoring and evaluation skills. ‚Ä¢ Demonstrable public speaking, negotiation, leadership and project management skills. ‚Ä¢ Creative and innovative approach towards solving problems and providing direction. ‚Ä¢ Provides adaptable support out of hours to meet the needs of others. ‚Ä¢ Skilled with MS Office Word, Excel, PowerPoint, Publisher, Adobe, and SharePoint packages. \n‚Ä¶see more\nActivity\nActivity\n1,088 followers\n1,088 followers\nIngrid hasn‚Äôt posted yet\nRecent posts Ingrid shares will be displayed here.\nShow all activity\nExperience\nExperience\nProperty Developer\nProperty Developer\nHinds Investment Properties (HIP)\nHinds Investment Properties (HIP)\nJul 2014 - Present ¬∑ 11 yrs 8 mos\nJul 2014 to Present ¬∑ 11 yrs 8 mos\nGreater London, England, United Kingdom\nGreater London, England, United Kingdom\nAXA Investment Managers\nAXA Investment Managers\nFull-time ¬∑ 5 yrs\nFull-time ¬∑ 5 yrs\nLondon Area, United Kingdom\nLondon Area, United Kingdom\nExecutive Assistant To Chief Executive Officer\nExecutive Assistant To Chief Executive Officer\nAug 2018 - Dec 2019 ¬∑ 1 yr 5 mos\nAug 2018 to Dec 2019 ¬∑ 1 yr 5 mos\nKey Responsibilities:\n‚Ä¢ Reported to the Chief Executive Officer.\n‚Ä¢ Organised, schedule and minute, Management Board and Regulatory Board meetings.\n‚Ä¢ Liaised with the Marketing Department for press releases and media meetings.\n‚Ä¢ Arranged all travel, expenses, invoices, timesheets, client meetings and general administration.\n‚Ä¢ Anticipate client demands and liaise with client relationship managers.\n‚Ä¢ Collaborated with the Global Heads of Human Resources/Finance/Technology/Salesforce and Legal Departments.\nKey Responsibilities: ‚Ä¢ Reported to the Chief Executive Officer. ‚Ä¢ Organised, schedule and minute, Management Board and Regulatory Board meetings. ‚Ä¢ Liaised with the Marketing Department for press releases and media meetings. ‚Ä¢ Arranged all travel, expenses, invoices, timesheets, client meetings and general administration. ‚Ä¢ Anticipate client demands and liaise with client relationship managers. ‚Ä¢ Collaborated with the Global Heads of Human Resources/Finance/Technology/Salesforce and Legal Departments. \n‚Ä¶see more\nPersonal Assistant to Global Head of Fixed Income & Structured Finance\nPersonal Assistant to Global Head of Fixed Income & Structured Finance\nJan 2015 - Aug 2018 ¬∑ 3 yrs 8 mos\nJan 2015 to Aug 2018 ¬∑ 3 yrs 8 mos\nKey Responsibilities:\n‚Ä¢ Reported to former Global Head of Fixed Income and Structured Finance (Management Board Member).\n‚Ä¢ Prepared packs for Compliance, Legal, MB Board, Excom Board and UK Board meetings.\n‚Ä¢ Planned Town Hall Meetings, locally and globally.\n‚Ä¢ Set-up Fixed Income weekly/monthly/quarterly team meetings.\nKey ",
    "searchKeyword": "CEO"
  },
  {
    "profileUrl": "https://www.linkedin.com/in/lutz-schueler",
    "name": "Lutz SchuÃàler",
    "title": "Chief Executive Officer at Virgin Media O2",
    "location": "London, England, United Kingdom",
    "company": "Virgin Media O2",
    "about": "",
    "experience": "Experience\nExperience\nChief Executive Officer\nChief Executive Officer\nVirgin Media O2\nVirgin Media O2\nJun 2021 - Present ¬∑ 4 yrs 9 mos\nJun 2021 to Present ¬∑ 4 yrs 9 mos\nVirgin Media\nVirgin Media\nFull-time ¬∑ 2 yrs 11 mos\nFull-time ¬∑ 2 yrs 11 mos\nGreater London, England, United Kingdom\nGreater London, England, United Kingdom\nCEO\nCEO\nMay 2019 - Jun 2021 ¬∑ 2 yrs 2 mos\nMay 2019 to Jun 2021 ¬∑ 2 yrs 2 mos\nChief Operating Officer, Virgin Media Ltd\nChief Operating Officer, Virgin Media Ltd\nAug 2018 - May 2019 ¬∑ 10 mos\nAug 2018 to May 2019 ¬∑ 10 mos\nChief Executive Officer\nChief Executive Officer\nUnitymedia ¬∑ Full-time\nUnitymedia ¬∑ Full-time\nJan 2011 - Jul 2018 ¬∑ 7 yrs 7 mos\nJan 2011 to Jul 2018 ¬∑ 7 yrs 7 mos\nGermany\nGermany\nHanseNet Telekommunikation GmbH logo\nChief Executive Officer\nChief Executive Officer\nHanseNet Telekommunikation GmbH ¬∑ Full-time\nHanseNet Telekommunikation GmbH ¬∑ Full-time\nJan 2010 - Dec 2010 ¬∑ 1 yr\nJan 2010 to Dec 2010 ¬∑ 1 yr\nHamburg, Germany\nHamburg, Germany\nMD, Marketing, Sales & Customer Services\nMD, Marketing, Sales & Customer Services\nMD, Marketing, Sales & Customer Services\nTelef√≥nica Germany GmbH & Co. OHG (Viag Interkom) ¬∑ Full-time\nTelef√≥nica Germany GmbH & Co. OHG (Viag Interkom) ¬∑ Full-time\nAug 1998 - Dec 2009 ¬∑ 11 yrs 5 mos\nAug 1998 to Dec 2009 ¬∑ 11 yrs 5 mos\nGermany\nGermany\nShow all 7 experiences",
    "isCSuite": true,
    "contextForAI": "Lutz has a {:badgeType} account\nLutz SchuÃàler \n He/Him  \n3rd degree connection\n3rd\nChief Executive Officer at Virgin Media O2\n Top Voice\nVirgin Media O2\nLondon, England, United Kingdom  Contact info\nhttps://news.virginmediao2.co.uk/\n17,501 followers\nFollow\nMessage\nMore\nHighlights\nHighlights\nLutz recently posted on LinkedIn\nLutz recently posted on LinkedIn\nUnderstand what topics Lutz posts about to inform your outreach.\nUnderstand what topics Lutz posts about to inform your outreach.\nFree insight from Sales Navigator\nFree insight from Sales Navigator\nUnlock more insights about leads\nImprove outreach with sales insights\nTry Sales Navigator for ¬£0\n1-month free. We‚Äôll remind you 7 days before your trial ends.\nAbout\nAbout\nCEO of Virgin Media O2. Helping the UK stay connected. Passionate about building teams that have plenty of fun and success.\nCEO of Virgin Media O2. Helping the UK stay connected. Passionate about building teams that have plenty of fun and success.\nFeatured\nFeatured\nPost\nPost\nI‚Äôm thrilled to share some exciting news that marks a major milestone for us at Virgin Media O2. \nWe‚Äôre combining Virgin Media O2 Business with Daisy Group to create a new B2B powerhouse in the UK business communications and IT sector. \nThis perfect pairing will see us establish a dedicated, focused, and digital-first B2B business serving hundreds of thousands of customers across small, medium and large enterprises, as well as the public sector, all underpinned by our next generation fixed and mobile infrastructure. The new entity will be led by a talented team, with Daisy founder, Matthew Riley, as Chair and Jo Bertram as CEO, ensuring we hit the ground running from day one. \nFor us, it‚Äôs a big step forward in our journey to boost B2B growth and provide UK businesses of all sizes with the best digital and connectivity offerings. \nWe‚Äôre incredibly proud of this moment, and a big thank you to all of the people who have worked tirelessly to make this happen ‚Äî I can‚Äôt wait to get started on this next chapter in our B2B story. \nHead to our News page for full details ‚û°Ô∏è https://vmo2.co/VMO2Daisy \n1,180\n34 comments\nPost\nPost\nToday we‚Äôre announcing our Q4 and full year 2024 financial results as Virgin Media O2. \nWe said 2024 was a year of investing to support our long-term growth and these results reflect that. We close the first chapter of Virgin Media O2 having delivered our full year guidance and hitting our JV synergy targets 18 months ahead of schedule, meaning we are well set for the future.\nWe ended the year with another quarter of fixed customer and ARPU growth, positive mobile contract additions and improved customer satisfaction through a relentless focus on customer experience.\nOur investments of more than ¬£2 billion across the year helped us to significantly boost our \nhashtag\n#5G coverage, improve mobile network quality and enhance rural connectivity. We also expanded our fibre footprint faster than ever as we build on our existing gigabit leadership and push ahead with creating the biggest fibre challenger in the UK along with nexfibre.\nIn 2024 we laid the foundations for future success, and in 2025 we will get back to growth in core revenues and profitability while continuing investment in our networks and services. Throughout the year we‚Äôll also deliver on key strategic moves, including the creation of a fixed NetCo and the expected acquisition of spectrum from Vodafone-Three which will further improve mobile performance. This is the start of a new chapter for Virgin Media O2. \nOur Earnings Release here ‚û°Ô∏è https://lnkd.in/eMmSAqNK\nhashtag\n#VirginMediaO2Results \nhashtag\n#TeamVirginMediaO2 \n372\n10 comments\nPost\nPost\nTwo brand new campaigns in one day! \nOur O2 Switch Up and Virgin Media broadband campaigns have launched today, showcasing the fantastic offering from the Virgin Media O2 brands. \nI‚Äôm also thrilled Virgin Media broadband has recently been awarded ‚ÄòBest Broadband Experience‚Äô by Global Wireless Solutions, Inc. ‚Äì the network benchmarking specialist. \nFantastic work from the whole \nhashtag\n#VirginMediaO2 family. \nüì± Only O2 Switch up: https://vmo2.co/3WVqcys\nüåê Walrus Whizzer: https://lnkd.in/e4ZC3egS \nhashtag\n#TeamVirginMediaO2 \nhashtag\n#O2 \nhashtag\n#VirginMedia \nhashtag\n#Mobile \nhashtag\n#Broadband \nhashtag\n#SwitchUp \nhashtag\n#Bubl \nhashtag\n#Walrus \nhashtag\n#Smoooooth Virgin Media O2\n134\n11 comments\nPost\nPost\nToday we share our Q1 2023 results as Virgin Media O2. \nI‚Äôm pleased that we delivered a solid performance as we laid the groundwork for further progress through the remainder of the year. \nAs the leading gigabit network in the country, we continue to maintain our position in speed leadership, providing customers with broadband that is five times faster than the UK average. Our ongoing investment in upgrading and expanding our footprint has us on track to cover 80% of the country with full fibre. Additionally, our efforts to bring 5G services to more areas and reach half of the UK this year is a signific",
    "searchKeyword": "CEO"
  },
  {
    "profileUrl": "https://www.linkedin.com/in/haris-qais-90b209313",
    "name": "Haris Qais",
    "title": "Chief Executive Officer @ AI Cities | AI-driven future",
    "location": "United Kingdom",
    "company": "AI Cities",
    "about": "",
    "experience": "Experience\nExperience\nChief Executive Officer\nChief Executive Officer\nAI Cities ¬∑ Full-time\nAI Cities ¬∑ Full-time\nAug 2024 - Present ¬∑ 1 yr 7 mos\nAug 2024 to Present ¬∑ 1 yr 7 mos\nWe are a global community committed to ensuring that artificial intelligence is used responsibly, focusing on ethics, governance and the upskilling of individuals for the future of work.\nWe are a global community committed to ensuring that artificial intelligence is used responsibly, focusing on ethics, governance and the upskilling of individuals for the future of work.\nCEOs",
    "isCSuite": true,
    "contextForAI": "Haris Qais\n2nd degree connection\n2nd\nChief Executive Officer @ AI Cities | AI-driven future\nAI Cities\nUnited Kingdom  Contact info\n500+ connections\nConnect\nMessage\nMore\nAbout\nAbout\nAt AI Cities, we‚Äôre building a global community focused on ensuring that artificial intelligence is used with integrity, ethics, and transparency. Our mission is to educate and upskill people for the new world of work, while emphasizing the importance of governance and doing what‚Äôs right. We believe in fostering a collaborative environment where businesses and individuals alike can learn, grow, and ensure that AI enhances lives in sustainable and equitable ways, creating a positive future for all.\nJoin us in shaping a better world through AI!\nAt AI Cities, we‚Äôre building a global community focused on ensuring that artificial intelligence is used with integrity, ethics, and transparency. Our mission is to educate and upskill people for the new world of work, while emphasizing the importance of governance and doing what‚Äôs right. We believe in fostering a collaborative environment where businesses and individuals alike can learn, grow, and ensure that AI enhances lives in sustainable and equitable ways, creating a positive future for all. Join us in shaping a better world through AI!\n‚Ä¶see more\nActivity\nActivity\n1,204 followers\n1,204 followers\nPosts\nComments\nLoaded 9 Posts posts\nHaris Qais\nHaris Qais\n ‚Ä¢ 2nd\n2nd\nChief Executive Officer @ AI Cities | AI-driven future\nChief Executive Officer @ AI Cities | AI-driven future\n7mo ‚Ä¢ \n7 months ago ‚Ä¢ Visible to anyone on or off LinkedIn\nHi everyone,\nA friend of mine is currently recruiting for a Legal Conveyancer to join their growing law firm based in Solihull.\nIf you‚Äôre a conveyancer looking for a new opportunity ‚Äî or know someone who might be ‚Äî feel free to drop me a message directly and I‚Äôll be happy to put you in touch.\nThanks in advance for any recommendations!\nBest regards,\n5\nHaris Qais\nHaris Qais\n ‚Ä¢ 2nd\n2nd\nChief Executive Officer @ AI Cities | AI-driven future\nChief Executive Officer @ AI Cities | AI-driven future\n7mo ‚Ä¢ \n7 months ago ‚Ä¢ Visible to anyone on or off LinkedIn\nVery Exciting Times...\nAI in Business ‚Äì Where‚Äôs the UK Market Headed in 2025?\nAI Cities\nShow all posts\nExperience\nExperience\nChief Executive Officer\nChief Executive Officer\nAI Cities ¬∑ Full-time\nAI Cities ¬∑ Full-time\nAug 2024 - Present ¬∑ 1 yr 7 mos\nAug 2024 to Present ¬∑ 1 yr 7 mos\nWe are a global community committed to ensuring that artificial intelligence is used responsibly, focusing on ethics, governance and the upskilling of individuals for the future of work.\nWe are a global community committed to ensuring that artificial intelligence is used responsibly, focusing on ethics, governance and the upskilling of individuals for the future of work.\nCEOs\nSkills\nSkills\nCEOs\nCEOs\nChief Executive Officer at AI Cities\nChief Executive Officer at AI Cities\n1 endorsement\n1 endorsement\nInterests\nInterests\nTop Voices\nTop Voices\nCompanies\nCompanies\nGroups\nGroups\nNewsletters\nNewsletters\nAravind Srinivas\nAravind Srinivas\n¬∑ 3rd\nThird degree connection\nCofounder & CEO, Perplexity\nCofounder & CEO, Perplexity\n798,949 followers\n798,949 followers\nFollow\nYann LeCun\nYann LeCun\n¬∑ 3rd\nThird degree connection\nExecutive Chairman, AMI Labs - Prof NYU\nExecutive Chairman, AMI Labs - Prof NYU\n1,189,064 followers\n1,189,064 followers\nFollow\nShow all Top Voices",
    "searchKeyword": "CEO"
  },
  {
    "profileUrl": "https://www.linkedin.com/in/konstantinkruglov",
    "name": "Konstantin Kruglov",
    "title": "AI Tech Entrepreneur, founder of Aiphoria, founder of Aiuta",
    "location": "London, England, United Kingdom",
    "company": "Aiphoria",
    "about": "",
    "experience": "Experience\nExperience\nFounder\nFounder\nAiphoria\nAiphoria\nFeb 2022 - Present ¬∑ 4 yrs 1 mo\nFeb 2022 to Present ¬∑ 4 yrs 1 mo\nGreater London, England, United Kingdom\nGreater London, England, United Kingdom\nNext-gen platform for Virtual Employees (AI Agents)\nNext-gen platform for Virtual Employees (AI Agents)\nFounder\nFounder\nAiuta\nAiuta\nFeb 2022 - Present ¬∑ 4 yrs 1 mo\nFeb 2022 to Present ¬∑ 4 yrs 1 mo\nGreater London, England, United Kingdom\nGreater London, England, United Kingdom\nVirtual Try-On Solution for Apparel and Fashion Businesses\nVirtual Try-On Solution for Apparel and Fashion Businesses\nCEO\nCEO\nCEO\nAlbion Tech Ltd ¬∑ Full-time\nAlbion Tech Ltd ¬∑ Full-time\nMar 2024 - Present ¬∑ 2 yrs\nMar 2024 to Present ¬∑ 2 yrs\nGreater London, England, United Kingdom\nGreater London, England, United Kingdom\nStrategic AI consulting\nStrategic AI consulting\nCEO @ SberDevices\nCEO @ SberDevices\nSberDevices ¬∑ Full-time\nSberDevices ¬∑ Full-time\nFeb 2019 - Feb 2022 ¬∑ 3 yrs 1 mo\nFeb 2019 to Feb 2022 ¬∑ 3 yrs 1 mo\nMoscow, Moscow City, Russia\nMoscow, Moscow City, Russia\nhttps://sberdevices.ru/\n\nCreated a team of 2000+ talents and expertise in building best-in-class voice assistants and Smart Devices. As a result, created a 20M MAU voice assistant and millions of devices sold.\nhttps://sberdevices.ru/ Created a team of 2000+ talents and expertise in building best-in-class voice assistants and Smart Devices. As a result, created a 20M MAU voice assistant and millions of devices sold.\nSmart Devices Programme Director @ Yandex\nSmart Devices Programme Director @ Yandex\nYandex ¬∑ Full-time\nYandex ¬∑ Full-time\nFeb 2016 - Feb 2019 ¬∑ 3 yrs 1 mo\nFeb 2016 to Feb 2019 ¬∑ 3 yrs 1 mo\nMoscow, Moscow City, Russia\nMoscow, Moscow City, Russia\nhttps://yandex.ru/alice/station\n\nCreated the first Smart Speaker in Russia with voice assistant Alice. \nBuilt from scratch hardware expertise in Yandex. \nAs a result, 3+ million devices were sold with Alice assistant on board.\nhttps://yandex.ru/alice/station Created the first Smart",
    "isCSuite": true,
    "contextForAI": "Konstantin has a {:badgeType} account\nKonstantin Kruglov\n He/Him  \n2nd degree connection\n2nd\nAI Tech Entrepreneur, founder of Aiphoria, founder of Aiuta\nAiphoria\nLondon, England, United Kingdom  Contact info\naiphoria.ai\n7,226 followers \n500+ connections\nFollow\nMessage\nMore\nAbout\nAbout\nAI entrepreneur with a proven track record of building impactful products and companies.\nFounder of Aiphoria Pro Platform ‚Äì a cutting-edge solution for creating and deploying AI agents.\nFounder of Aiuta ‚Äì an AI-powered fashion stylist that redefines personal style and boosts efficiency for fashion e-commerce.\nPreviously led the creation of award-winning smart device ecosystems and multi-character voice assistant platforms. Spearheaded the launch of the first smart device for Yandex featuring assistant Alice. Served as Head of Sber‚Äôs virtual assistant and smart devices AI platform.\nAI entrepreneur with a proven track record of building impactful products and companies. Founder of Aiphoria Pro Platform ‚Äì a cutting-edge solution for creating and deploying AI agents. Founder of Aiuta ‚Äì an AI-powered fashion stylist that redefines personal style and boosts efficiency for fashion e-commerce. Previously led the creation of award-winning smart device ecosystems and multi-character voice assistant platforms. Spearheaded the launch of the first smart device for Yandex featuring assistant Alice. Served as Head of Sber‚Äôs virtual assistant and smart devices AI platform.\n‚Ä¶see more\nFeatured\nFeatured\nLink\nLink\nAiphoria Pros - Next-Gen Employees to enhance operational efficiency and reduce costs\nAiphoria Pros - Next-Gen Employees to enhance operational efficiency and reduce costs\naiphoria.ai\naiphoria.ai\nLink\nLink\nAiuta ‚Äî the next generation personal AI-stylist\nAiuta ‚Äî the next generation personal AI-stylist\naiuta.com\naiuta.com\nImage\nImage\nCreator of innovative Smart Devices product line\nCreator of innovative Smart Devices product line\n‚Ä¢ Two RedDot 2021 awards\n‚Ä¢ iF Design Award 2021\n‚Ä¢ CES Innovation Award 2022\n‚Ä¢ Two RedDot 2021 awards ‚Ä¢ iF Design Award 2021 ‚Ä¢ CES Innovation Award 2022\nImage\nImage\nAward-winning set-top box with smart camera\nAward-winning set-top box with smart camera\nAward-winning (CES Innovation Award 2022) set-top box with smart camera, gesture recognition, voice assistant, cloud gaming and a lot of other entertainment features.\nAward-winning (CES Innovation Award 2022) set-top box with smart camera, gesture recognition, voice assistant, cloud gaming and a lot of other entertainment features.\nImage\nImage\nAward-winning Smart Display with amazing sound by Harman/Kardon\nAward-winning Smart Display with amazing sound by Harman/Kardon\nTwo RedDot awards in 2021.\nTwo RedDot awards in 2021.\nActivity\nActivity\n7,226 followers\n7,226 followers\nFollow\nLoaded 9 Posts posts\nKonstantin Kruglov reposted this\nAiphoria\nAiphoria\n3,588 followers\n3,588 followers\n1mo ‚Ä¢ \n1 month ago ‚Ä¢ Visible to anyone on or off LinkedIn\nüåç ùó™ùó≤‚Äôùóøùó≤ ùóµùó≤ùóÆùó±ùó∂ùóªùó¥ ùòÅùóº ùóîùóØùòÇ ùóóùóµùóÆùóØùó∂! üöÄ\nAt the end of this month, the Aiphoria team is heading to Machines Can See (and Think!) ùüÆùü¨ùüÆùü≤ ‚Äì¬†ùóîùóú ùóîùó±ùóºùóΩùòÅùó≤ùóøùòÄ ùó¶ùòÇùó∫ùó∫ùó∂ùòÅ on ùóùùóÆùóªùòÇùóÆùóøùòÜ ùüÆùü≤‚ÄìùüÆùü≥, ùüÆùü¨ùüÆùü≤, at Park Hyatt Saadiyat Island, Abu Dhabi. \nWe absolutely love how this event blends ùòÄùòÅùóøùóÆùòÅùó≤ùó¥ùó∂ùó∞ ùóØùòÇùòÄùó∂ùóªùó≤ùòÄùòÄ ùó∞ùóºùóªùòÉùó≤ùóøùòÄùóÆùòÅùó∂ùóºùóªùòÄ with ùó±ùó≤ùó≤ùóΩ ùòÅùó≤ùó∞ùóµùóªùóºùóπùóºùó¥ùòÜ ùó∂ùóªùòÄùó∂ùó¥ùóµùòÅùòÄ, and we‚Äôre thrilled to join and contribute to this vibrant AI community.\nMachines Can Think unites ùó¥ùóπùóºùóØùóÆùóπ ùóîùóú ùóπùó≤ùóÆùó±ùó≤ùóøùòÄ, ùóøùó≤ùòÄùó≤ùóÆùóøùó∞ùóµùó≤ùóøùòÄ, ùóÆùóªùó± ùóΩùóøùóÆùó∞ùòÅùó∂ùòÅùó∂ùóºùóªùó≤ùóøùòÄ who are shaping real-world AI systems ‚Äì from foundational infrastructure to production-grade solutions across industries. \nüîä We‚Äôre especially excited to be part of a ùó∫ùóÆùó∂ùóª-ùòÄùòÅùóÆùó¥ùó≤ ùóΩùóÆùóªùó≤ùóπ ùóºùóª:\nùóßùóµùó≤ ùó©ùóºùó∂ùó∞ùó≤ ùó§ùòÇùóÆùóπùó∂ùòÅùòÜ ùó†ùòÜùòÅùóµ: ùó™ùóµùóÆùòÅ ùó†ùóÆùó∏ùó≤ùòÄ ùóîùóú ùóîùó¥ùó≤ùóªùòÅùòÄ ùóîùó∞ùòÅùòÇùóÆùóπùóπùòÜ ùó™ùó∂ùóª?\nIn this session, we‚Äôll challenge the industry‚Äôs fixation on voice quality as the key success factor for AI agents in CX ‚Äì and dig into what actually drives meaningful outcomes.\nWe‚Äôll explore why factors like ùó∞ùóÆùóπùóπ ùóΩùó≤ùóøùó≥ùóºùóøùó∫ùóÆùóªùó∞ùó≤, ùòÄùóµùóºùóøùòÅùó≤ùóø ùó∞ùóÆùóπùóπ ùó±ùòÇùóøùóÆùòÅùó∂ùóºùóª, ùó∞ùóºùòÄùòÅ ùó≤ùó≥ùó≥ùó∂ùó∞ùó∂ùó≤ùóªùó∞ùòÜ, ùó±ùó∂ùóÆùóπùóºùó¥ ùó≥ùóπùóºùòÑ ùó≥ùóπùó≤ùòÖùó∂ùóØùó∂ùóπùó∂ùòÅùòÜ, ùóÆùóªùó± ùó≥ùòÇùóªùó∞ùòÅùó∂ùóºùóªùóÆùóπ ùóµùòÇùó∫ùóÆùóª-ùóπùó∂ùó∏ùó≤ ùóØùó≤ùóµùóÆùòÉùó∂ùóºùóø matter more than aesthetics alone.\nBut that‚Äôs not all!\nüéØ Our technical team will also be sharing ùóµùóºùòÑ ùòÑùó≤ ùó∏ùó≤ùó≤ùóΩ ùóîùóú ùóÆùó¥ùó≤ùóªùòÅùòÄ ùóπùóÆùòÄùó≤ùóø-ùó≥ùóºùó∞ùòÇùòÄùó≤ùó± ùóºùóª ùòÜùóºùòÇùóø ùóØùòÇùòÄùó∂ùóªùó≤ùòÄùòÄ ùó¥ùóºùóÆùóπùòÄ, and we‚Äôll be hosting an in-depth workshop:\n‚ÄúùóõùóºùòÑ ùòÅùóº ùóïùòÇùó∂ùóπùó± ùó£ùóøùóºùóΩùóøùó∂ùó≤ùòÅùóÆùóøùòÜ ùó¶ùóΩùó≤ùó≤ùó∞ùóµùóßùó≤ùó∞ùóµ ùó≥ùóøùóºùó∫ ùòÅùóµùó≤ ùóöùóøùóºùòÇùóªùó± ùó®ùóΩ‚Äù\nA practical, behind-the-scenes session on designing, developing, deploying, and maintaining production-ready Speech Technologies (ASR & TTS) in real operational environments.\nüëá If you‚Äôd like to join us at the full summit (and save with a special rate), register here: https://lnkd.in/gspJc5r2 \nSee you in Abu Dhabi! üá¶üá™\nhashtag\n#AI \nhashtag\n#CX \nhashtag\n#AIAgent",
    "searchKeyword": "CEO"
  },
  {
    "profileUrl": "https://www.linkedin.com/in/adrian-wood-073bb31",
    "name": "Adrian Wood",
    "title": "Baylis Digital / Celsation Group",
    "location": "United Kingdom",
    "company": "Baylis Digital Africa",
    "about": "",
    "experience": "Experience\nExperience\nChief Executive\nChief Executive\nBaylis Digital Africa ¬∑ Contract\nBaylis Digital Africa ¬∑ Contract\nMar 2022 - Present ¬∑ 4 yrs\nMar 2022 to Present ¬∑ 4 yrs\nBaylis Digital Africa is a telecom, IT and fintech infrastructure investment fund. Baylis Digital, part of Baylis Emerging Markets Funds Group of NYC, is seeking to build a strong pan-African portfolio of investments in sector-leading digital infrastructure technology companies.\nBaylis Digital Africa is a telecom, IT and fintech infrastructure investment fund. Baylis Digital, part of Baylis Emerging Markets Funds Group of NYC, is seeking to build a strong pan-African portfolio of investments in sector-leading digital infrastructure technology companies.\n‚Ä¶see more\nDirector\nDirector\nDirector\nCelsation Group\nCelsation Group\nDec 2019 - Present ¬∑ 6 yrs 3 mos\nDec 2019 to Present ¬∑ 6 yrs 3 mos\nUK, Uganda, Nigeria, South Africa\nUK, Uganda, Nigeria, South Africa\nCelsation has been established to acquire, restructure and develop underperforming TMT businesses, in emerging markets. Formed by 12 industry veterans with >350 years of cumulative front-line telecom and IT management experience, Celsation works with regulators, banks, investors and other stakeholders to build sustainable, market leading operations. Areas of operation are Africa and the Middle East.\nCelsation has been established to acquire, restructure and develop underperforming TMT businesses, in emerging markets. Formed by 12 industry veterans with >350 years of cumulative front-line telecom and IT management experience, Celsation works with regulators, banks, investors and other stakeholders to build sustainable, market leading operations. Areas of operation are Africa and the Middle East.\n‚Ä¶see more\nDirector\nDirector\nDirector\nTeleology Group\nTeleology Group\nJun 2016 - Dec 2019 ¬∑ 3 yrs 7 mos\nJun 2016 to Dec 2019 ¬∑ 3 yrs 7 mos\nGreat Britain\nGreat Britain\nTeleology is a telecom and media project development and management business leveraging t",
    "isCSuite": true,
    "contextForAI": "Adrian Wood\n He/Him  \n2nd degree connection\n2nd\nBaylis Digital / Celsation Group\nBaylis Digital Africa\nUniversity of New South Wales\nUnited Kingdom  Contact info\n500+ connections\nEWEJE, Oyeniyi - CPHR Candidate is a mutual connection\nEWEJE, Oyeniyi - CPHR Candidate is a mutual connection\nConnect\nMessage\nMore\nAbout\nAbout\nInternational technology and investment executive with leadership background, experienced throughout AustralAsia, Europe, Africa and the Middle East.\n* Wide hands-on operational management in telecom, IT, and digital media across >20 countries on four continents. Career roles with major operators such as Telstra, Portugal Telecom, Telecom Finland-Sonera, France Telecom, Orange UK, Telenor, MTN Group;\n* Direct line management and Board level corporate background, including cross-border joint ventures, strategic investor partnerships, capital-raising, privatizations & IPOs, responsible for B2C FMCG distributor channel development and B2B commercial transactions;\n* Financial planning, budget control and P&L management, large scale infrastructure roll out with annual spend >US$900 million, senior management recruitment & development, small team to large employee group management, business optimization, change management, transformations and turnarounds;\n* Expertise in complex, geographically and culturally diverse businesses, brand development, growth in a regulated environment, capacity building, government & community relations.\nInternational technology and investment executive with leadership background, experienced throughout AustralAsia, Europe, Africa and the Middle East. * Wide hands-on operational management in telecom, IT, and digital media across >20 countries on four continents. Career roles with major operators such as Telstra, Portugal Telecom, Telecom Finland-Sonera, France Telecom, Orange UK, Telenor, MTN Group; * Direct line management and Board level corporate background, including cross-border joint ventures, strategic investor partnerships, capital-raising, privatizations & IPOs, responsible for B2C FMCG distributor channel development and B2B commercial transactions; * Financial planning, budget control and P&L management, large scale infrastructure roll out with annual spend >US$900 million, senior management recruitment & development, small team to large employee group management, business optimization, change management, transformations and turnarounds; * Expertise in complex, geographically and culturally diverse businesses, brand development, growth in a regulated environment, capacity building, government & community relations.\n‚Ä¶see more\nActivity\nActivity\n4,674 followers\n4,674 followers\nLoaded 1 Comments post\nAdrian Wood commented on a post ‚Ä¢ 10mo\n10mo\nFarewell to my Nigerian godfather who supported me and guided me through some turbulent times. My best wishes to the Dozie family Kind regards to all, Adrian Wood\nFarewell to my Nigerian godfather who supported me and guided me through some turbulent times.\nMy best wishes to the Dozie family\nKind regards to all, Adrian Wood\nShow all comments\nExperience\nExperience\nChief Executive\nChief Executive\nBaylis Digital Africa ¬∑ Contract\nBaylis Digital Africa ¬∑ Contract\nMar 2022 - Present ¬∑ 4 yrs\nMar 2022 to Present ¬∑ 4 yrs\nBaylis Digital Africa is a telecom, IT and fintech infrastructure investment fund. Baylis Digital, part of Baylis Emerging Markets Funds Group of NYC, is seeking to build a strong pan-African portfolio of investments in sector-leading digital infrastructure technology companies.\nBaylis Digital Africa is a telecom, IT and fintech infrastructure investment fund. Baylis Digital, part of Baylis Emerging Markets Funds Group of NYC, is seeking to build a strong pan-African portfolio of investments in sector-leading digital infrastructure technology companies.\n‚Ä¶see more\nDirector\nDirector\nDirector\nCelsation Group\nCelsation Group\nDec 2019 - Present ¬∑ 6 yrs 3 mos\nDec 2019 to Present ¬∑ 6 yrs 3 mos\nUK, Uganda, Nigeria, South Africa\nUK, Uganda, Nigeria, South Africa\nCelsation has been established to acquire, restructure and develop underperforming TMT businesses, in emerging markets. Formed by 12 industry veterans with >350 years of cumulative front-line telecom and IT management experience, Celsation works with regulators, banks, investors and other stakeholders to build sustainable, market leading operations. Areas of operation are Africa and the Middle East.\nCelsation has been established to acquire, restructure and develop underperforming TMT businesses, in emerging markets. Formed by 12 industry veterans with >350 years of cumulative front-line telecom and IT management experience, Celsation works with regulators, banks, investors and other stakeholders to build sustainable, market leading operations. Areas of operation are Africa and the Middle East.\n‚Ä¶see more\nDirector\nDirector\nDirector\nTeleology Group\nTeleology Group\nJun 2016 - Dec 2019 ¬∑ 3 yrs 7 mos\nJun 2016 to Dec 2019 ¬∑ 3 yrs 7 mos\nGreat Britain\nGreat Britain\nTeleol",
    "searchKeyword": "CEO"
  },
  {
    "profileUrl": "https://www.linkedin.com/in/stecollins",
    "name": "Steven Collins",
    "title": "CEO and Founder",
    "location": "Haslington, England, United Kingdom",
    "company": "GreenPerks.io",
    "about": "",
    "experience": "Experience\nExperience\nFounder\nFounder\nGreenPerks.io ¬∑ Full-time\nGreenPerks.io ¬∑ Full-time\nMay 2024 - Present ¬∑ 1 yr 10 mos\nMay 2024 to Present ¬∑ 1 yr 10 mos\nManchester Area, United Kingdom ¬∑ Hybrid\nManchester Area, United Kingdom ¬∑ Hybrid\nSenior Client Partner\nSenior Client Partner\n6 Group ¬∑ Full-time\n6 Group ¬∑ Full-time\nJul 2023 - May 2024 ¬∑ 11 mos\nJul 2023 to May 2024 ¬∑ 11 mos\nGreater London, England, United Kingdom ¬∑ Remote\nGreater London, England, United Kingdom ¬∑ Remote\n6 Group is a global search and talent intelligence firm focused on the identification, engagement and development of the world‚Äôs standout talent\n6 Group is a global search and talent intelligence firm focused on the identification, engagement and development of the world‚Äôs standout talent\nChaseman Global\nChaseman Global\n4 yrs 2 mos\n4 yrs 2 mos\nGlobal Account Manager - Agtech\nGlobal Account Manager - Agtech\nFull-time\nFull-time\nApr 2021 - Jul 2023 ¬∑ 2 yrs 4 mos\nApr 2021 to Jul 2023 ¬∑ 2 yrs 4 mos\nChaseman Global is a retained search consultancy specialising in Global Bio & Life Sciences in Agriculture and Food. With offices covering the Americas, EMEA and APAC regions, we operate with a Global Research and Local Delivery mindset that is applied to every one of our Client Mandates enabling us to find the best possible talent around the world for our clients, whilst at the same time maintaining local regional client relationship management and support.\nChaseman Global is a retained search consultancy specialising in Global Bio & Life Sciences in Agriculture and Food. With offices covering the Americas, EMEA and APAC regions, we operate with a Global Research and Local Delivery mindset that is applied to every one of our Client Mandates enabling us to find the best possible talent around the world for our clients, whilst at the same time maintaining local regional client relationship management and support.\n‚Ä¶see more\nResearch and Delivery Lead - Agtech\nResearch and Delivery Lead - Agtech\nJun 2019 - Ju",
    "isCSuite": true,
    "contextForAI": "Steven has a {:badgeType} account\nSteven Collins \n2nd degree connection\n2nd\nCEO and Founder\nGreenPerks.io\nHaslington, England, United Kingdom  Contact info\n500+ connections\nRobert Lynch is a mutual connection\nRobert Lynch is a mutual connection\nConnect\nMessage\nMore\nAbout\nAbout\nAt the helm of GreenPerks.io, my focus is on fostering innovative environmental incentives through strategic entrepreneurship.\nAt the helm of GreenPerks.io, my focus is on fostering innovative environmental incentives through strategic entrepreneurship.\nActivity\nActivity\n9,232 followers\n9,232 followers\nPosts\nComments\nImages\nLoaded 9 Posts posts\nSteven Collins\nSteven Collins\n   ‚Ä¢ 2nd\nPremium ‚Ä¢ 2nd\nCEO and Founder\nCEO and Founder\n4mo ‚Ä¢ \n4 months ago ‚Ä¢ Visible to anyone on or off LinkedIn\nThis weekend I completed my first ever half marathon, The Cardiff Half ‚Äî and my first event in the SuperHalfs series.\nMy target was to break 2 hours, and I crossed the line in 1:54. Really happy with that for a first go.\nIt‚Äôs another step towards the London Marathon ‚Äî and good to see the training moving in the right direction.\nThanks to all the businesses who‚Äôve sponsored my run in London and supported my fundraising for Stickler Syndrome UK. Your backing genuinely makes a difference.\nCheshire Business Coaching Small Giants Collective AC Promos Town and Country Property Auctions Adam Barness at Adams Cards,Titan Electrical Ltd Powdr Harry Massey at HM Sounds and Events, Positive Fire Safety Training Ltd and PadelDrop UK.\nAnybody else who would like to contibute to this incredible charity can do so here - https://lnkd.in/e4FzuAKf\n‚Ä¶more\nActivate to view larger image,\nActivate to view larger image,\n43\n7 comments\nSteven Collins\nSteven Collins\n   ‚Ä¢ 2nd\nPremium ‚Ä¢ 2nd\nCEO and Founder\nCEO and Founder\n6mo ‚Ä¢ \n6 months ago ‚Ä¢ Visible to anyone on or off LinkedIn\nI‚Äôve been genuinely blown away by the support from my network ‚Äî thank you to everyone who‚Äôs backed me so far in raising funds for Stickler Syndrome UK.\nThis is a small charity doing big things for families living with a rare genetic condition, and every bit of support makes a real difference.\nI‚Äôve now only got 4 slots left on my race shirt if anyone would like to grab one. These are placements 5, 9, 10 and 11 ‚Äî each is ¬£25, and the logo will be printed clearly on the shirt I‚Äôll wear at every race leading up to the London Marathon, including the Cardiff Half in October.\nIf you'd like to get involved (or know a business that might), just drop me a message ‚Äî would love to fill these last few spots.\nhashtag\n#LondonMarathon \nhashtag\n#SticklerSyndromeUK \nhashtag\n#CharityRun \nhashtag\n#Fundraising \nhashtag\n#BusinessForGood\n‚Ä¶more\nActivate to view larger image,\n1/2\nActivate to view larger image,\n27\n10 comments\n2 reposts\nShow all posts\nExperience\nExperience\nFounder\nFounder\nGreenPerks.io ¬∑ Full-time\nGreenPerks.io ¬∑ Full-time\nMay 2024 - Present ¬∑ 1 yr 10 mos\nMay 2024 to Present ¬∑ 1 yr 10 mos\nManchester Area, United Kingdom ¬∑ Hybrid\nManchester Area, United Kingdom ¬∑ Hybrid\nSenior Client Partner\nSenior Client Partner\n6 Group ¬∑ Full-time\n6 Group ¬∑ Full-time\nJul 2023 - May 2024 ¬∑ 11 mos\nJul 2023 to May 2024 ¬∑ 11 mos\nGreater London, England, United Kingdom ¬∑ Remote\nGreater London, England, United Kingdom ¬∑ Remote\n6 Group is a global search and talent intelligence firm focused on the identification, engagement and development of the world‚Äôs standout talent\n6 Group is a global search and talent intelligence firm focused on the identification, engagement and development of the world‚Äôs standout talent\nChaseman Global\nChaseman Global\n4 yrs 2 mos\n4 yrs 2 mos\nGlobal Account Manager - Agtech\nGlobal Account Manager - Agtech\nFull-time\nFull-time\nApr 2021 - Jul 2023 ¬∑ 2 yrs 4 mos\nApr 2021 to Jul 2023 ¬∑ 2 yrs 4 mos\nChaseman Global is a retained search consultancy specialising in Global Bio & Life Sciences in Agriculture and Food. With offices covering the Americas, EMEA and APAC regions, we operate with a Global Research and Local Delivery mindset that is applied to every one of our Client Mandates enabling us to find the best possible talent around the world for our clients, whilst at the same time maintaining local regional client relationship management and support.\nChaseman Global is a retained search consultancy specialising in Global Bio & Life Sciences in Agriculture and Food. With offices covering the Americas, EMEA and APAC regions, we operate with a Global Research and Local Delivery mindset that is applied to every one of our Client Mandates enabling us to find the best possible talent around the world for our clients, whilst at the same time maintaining local regional client relationship management and support.\n‚Ä¶see more\nResearch and Delivery Lead - Agtech\nResearch and Delivery Lead - Agtech\nJun 2019 - Jul 2023 ¬∑ 4 yrs 2 mos\nJun 2019 to Jul 2023 ¬∑ 4 yrs 2 mos\nKnutsford\nKnutsford\nVarious Recruitment Agencies logo\nRecruitment Specialist - Technology\nRecruitment Specialist - Technology\nVarious Recruitment Agencies ¬∑ Full-time\nVa",
    "searchKeyword": "CEO"
  },
  {
    "profileUrl": "https://www.linkedin.com/in/alexandre-gruca",
    "name": "Alexandre Gruca",
    "title": "Head of Special Situations - Real Estate Private Equity",
    "location": "United Kingdom",
    "company": "Round Hill Capital",
    "about": "",
    "experience": "Experience\nExperience\nRound Hill Capital\nRound Hill Capital\nFull-time ¬∑ 3 yrs 6 mos\nFull-time ¬∑ 3 yrs 6 mos\nOn-site\nOn-site\nHead of Special Situations\nHead of Special Situations\nMar 2024 - Present ¬∑ 2 yrs\nMar 2024 to Present ¬∑ 2 yrs\nLondon Area, United Kingdom\nLondon Area, United Kingdom\nHead of Asset Management\nHead of Asset Management\nSep 2022 - Feb 2024 ¬∑ 1 yr 6 mos\nSep 2022 to Feb 2024 ¬∑ 1 yr 6 mos\nGreater London, England, United Kingdom\nGreater London, England, United Kingdom\nStrategic Advisor - Real Estate Private Equity\nStrategic Advisor - Real Estate Private Equity\nStrategic Advisor - Real Estate Private Equity\nStrategic Advisory and Implementation\nStrategic Advisory and Implementation\nMay 2021 - Sep 2022 ¬∑ 1 yr 5 mos\nMay 2021 to Sep 2022 ¬∑ 1 yr 5 mos\nLondon Area, United Kingdom\nLondon Area, United Kingdom\nRestructurimg, platform growth and scale up and asset management/disposal strategies\nClients included:\n- Zetland Capital\n- Various high growth start ups\nRestructurimg, platform growth and scale up and asset management/disposal strategies Clients included: - Zetland Capital - Various high growth start ups\n‚Ä¶see more\nLyvly\nLyvly\n2 yrs 8 mos\n2 yrs 8 mos\nChief Commercial Officer (CCO)\nChief Commercial Officer (CCO)\nApr 2019 - Apr 2021 ¬∑ 2 yrs 1 mo\nApr 2019 to Apr 2021 ¬∑ 2 yrs 1 mo\nLondon Area, United Kingdom\nLondon Area, United Kingdom\nCompany strategy and scale up / growth\nSupply / Demand balance\nPortfolio Management\nDisposal to PE Fund process management\nCompany strategy and scale up / growth Supply / Demand balance Portfolio Management Disposal to PE Fund process management\n‚Ä¶see more\nInterim Chief Financial Officer (CFO) and Strategy\nInterim Chief Financial Officer (CFO) and Strategy\nSep 2018 - Jan 2021 ¬∑ 2 yrs 5 mos\nSep 2018 to Jan 2021 ¬∑ 2 yrs 5 mos\nGreater London, England, United Kingdom\nGreater London, England, United Kingdom\nManagement Accounts\nBusiness planning\nLiquidity\nManagement Accounts Business planning Liquidity\nOfficiis Properties logo\nIndepende",
    "isCSuite": true,
    "contextForAI": "Alexandre Gruca \n He/Him  \n2nd degree connection\n2nd\nHead of Special Situations - Real Estate Private Equity\nRound Hill Capital\nUniversity of Pennsylvania - The Wharton School\nUnited Kingdom  Contact info\n500+ connections\nIwona Plumpton is a mutual connection\nIwona Plumpton is a mutual connection\nConnect\nMessage\nMore\nActivity\nActivity\n20,479 followers\n20,479 followers\nLoaded 9 Posts posts\nAlexandre Gruca\nAlexandre Gruca\n   ‚Ä¢ 2nd\nVerified ‚Ä¢ 2nd\nHead of Special Situations - Real Estate Private Equity\nHead of Special Situations - Real Estate Private Equity\n9mo ‚Ä¢ \n9 months ago ‚Ä¢ Visible to anyone on or off LinkedIn\nJames Weiss is \nhashtag\n#hiring. Know anyone who might be interested?\nHigh Jewelry Setter - Upper East Side, NY\nJob by David Webb\nNew York, New York, United States (On-site)\nView job\nView job\n39\nAlexandre Gruca\nAlexandre Gruca\n   ‚Ä¢ 2nd\nVerified ‚Ä¢ 2nd\nHead of Special Situations - Real Estate Private Equity\nHead of Special Situations - Real Estate Private Equity\n10mo ‚Ä¢ \n10 months ago ‚Ä¢ Visible to anyone on or off LinkedIn\nKimberley Ong is \nhashtag\n#hiring. Know anyone who might be interested?\nVice President / Principal\nJob by Nordstar\nGreater London, England, United Kingdom (On-site)\nView job\nView job\n16\nShow all posts\nExperience\nExperience\nRound Hill Capital\nRound Hill Capital\nFull-time ¬∑ 3 yrs 6 mos\nFull-time ¬∑ 3 yrs 6 mos\nOn-site\nOn-site\nHead of Special Situations\nHead of Special Situations\nMar 2024 - Present ¬∑ 2 yrs\nMar 2024 to Present ¬∑ 2 yrs\nLondon Area, United Kingdom\nLondon Area, United Kingdom\nHead of Asset Management\nHead of Asset Management\nSep 2022 - Feb 2024 ¬∑ 1 yr 6 mos\nSep 2022 to Feb 2024 ¬∑ 1 yr 6 mos\nGreater London, England, United Kingdom\nGreater London, England, United Kingdom\nStrategic Advisor - Real Estate Private Equity\nStrategic Advisor - Real Estate Private Equity\nStrategic Advisor - Real Estate Private Equity\nStrategic Advisory and Implementation\nStrategic Advisory and Implementation\nMay 2021 - Sep 2022 ¬∑ 1 yr 5 mos\nMay 2021 to Sep 2022 ¬∑ 1 yr 5 mos\nLondon Area, United Kingdom\nLondon Area, United Kingdom\nRestructurimg, platform growth and scale up and asset management/disposal strategies\nClients included:\n- Zetland Capital\n- Various high growth start ups\nRestructurimg, platform growth and scale up and asset management/disposal strategies Clients included: - Zetland Capital - Various high growth start ups\n‚Ä¶see more\nLyvly\nLyvly\n2 yrs 8 mos\n2 yrs 8 mos\nChief Commercial Officer (CCO)\nChief Commercial Officer (CCO)\nApr 2019 - Apr 2021 ¬∑ 2 yrs 1 mo\nApr 2019 to Apr 2021 ¬∑ 2 yrs 1 mo\nLondon Area, United Kingdom\nLondon Area, United Kingdom\nCompany strategy and scale up / growth\nSupply / Demand balance\nPortfolio Management\nDisposal to PE Fund process management\nCompany strategy and scale up / growth Supply / Demand balance Portfolio Management Disposal to PE Fund process management\n‚Ä¶see more\nInterim Chief Financial Officer (CFO) and Strategy\nInterim Chief Financial Officer (CFO) and Strategy\nSep 2018 - Jan 2021 ¬∑ 2 yrs 5 mos\nSep 2018 to Jan 2021 ¬∑ 2 yrs 5 mos\nGreater London, England, United Kingdom\nGreater London, England, United Kingdom\nManagement Accounts\nBusiness planning\nLiquidity\nManagement Accounts Business planning Liquidity\nOfficiis Properties logo\nIndependent Board Member\nIndependent Board Member\nOfficiis Properties\nOfficiis Properties\nJul 2015 - Nov 2020 ¬∑ 5 yrs 5 mos\nJul 2015 to Nov 2020 ¬∑ 5 yrs 5 mos\nParis, √éle-de-France, France\nParis, √éle-de-France, France\nREIT listed on Paris stock exchange\nREIT listed on Paris stock exchange\nCEO & Co-Founder\nCEO & Co-Founder\nCEO & Co-Founder\nJoivy\nJoivy\nJul 2015 - Oct 2018 ¬∑ 3 yrs 4 mos\nJul 2015 to Oct 2018 ¬∑ 3 yrs 4 mos\nJoivy was an AI-driven recruiting platform. Focus on culture fit through psychometric assessment and matching.\nAs Co-Founder and CEO, focused on building the first versions of the product, raise funds (¬£2.5m in total) and build the team.\nJoivy was an AI-driven recruiting platform. Focus on culture fit through psychometric assessment and matching. As Co-Founder and CEO, focused on building the first versions of the product, raise funds (¬£2.5m in total) and build the team.\nShow all 14 experiences\nEducation\nEducation\nThe Wharton School\nThe Wharton School\nMBA, Strategic Management\nMBA, Strategic Management\n2002 - 2004\n2002 - 2004\nESCP Business School\nESCP Business School\nDiplome Grande Ecole (Masters), Finance\nDiplome Grande Ecole (Masters), Finance\n1995 - 1998\n1995 - 1998\nVolunteering\nVolunteering\nMentor\nMentor\nMentor\nWharton Alumni Mentoring for Startups (WHAM)\nWharton Alumni Mentoring for Startups (WHAM)\nJun 2021 - Present ¬∑ 4 yrs 9 mos\nJun 2021 - Present ¬∑ 4 yrs 9 mos\nEducation\nEducation\nMentoring founders and entrepreneurs to accelerate the growth of their start-ups and prepare them for fund raising.\nMentoring founders and entrepreneurs to accelerate the growth of their start-ups and prepare them for fund raising.\nSkills\nSkills\nLeadership\nLeadership\nEndorsed by 6 colleagues at Lyvly\nEndorsed by 6 colleagues at Lyvly\nEndor",
    "searchKeyword": "CEO"
  },
  {
    "profileUrl": "https://www.linkedin.com/in/uzor-daniel-uwabuofu",
    "name": "Uzor Daniel Uwabuofu",
    "title": "Senior Manager, Operations, Sony Music Publishing, Nigeria",
    "location": "United Kingdom",
    "company": "Sony Music Publishing",
    "about": "",
    "experience": "Experience\nExperience\nSony Music Publishing\nSony Music Publishing\nFull-time ¬∑ 3 yrs 6 mos\nFull-time ¬∑ 3 yrs 6 mos\nNigeria\nNigeria\nSenior Operations Manager\nSenior Operations Manager\nMar 2025 - Present ¬∑ 1 yr\nMar 2025 to Present ¬∑ 1 yr\nOn-site\nOn-site\nHands-on management, direction, and supervision of the operational activities of the Nigerian Company for Sony Music Publishing catalogues, covering all Western & Eastern African countries/societies within scope - both local and international repertoire.\nHands-on management, direction, and supervision of the operational activities of the Nigerian Company for Sony Music Publishing catalogues, covering all Western & Eastern African countries/societies within scope - both local and international repertoire.\nCoordination Skills, Effective organizational skills and +16 skills\nManager Admin & Sync\nManager Admin & Sync\nSep 2022 - Mar 2025 ¬∑ 2 yrs 7 mos\nSep 2022 to Mar 2025 ¬∑ 2 yrs 7 mos\nHybrid\nHybrid\nChief Executive Officer\nChief Executive Officer\nDurozy International ¬∑ Full-time\nDurozy International ¬∑ Full-time\nJul 2020 - Sep 2022 ¬∑ 2 yrs 3 mos\nJul 2020 to Sep 2022 ¬∑ 2 yrs 3 mos\nLagos, Nigeria\nLagos, Nigeria\nGeneral Manager\nGeneral Manager\nclovekids ¬∑ Full-time\nclovekids ¬∑ Full-time\nMar 2018 - Sep 2022 ¬∑ 4 yrs 7 mos\nMar 2018 to Sep 2022 ¬∑ 4 yrs 7 mos\nLagos State, Nigeria\nLagos State, Nigeria\nGeneral Manager and Co founder\nGeneral Manager and Co founder\n18 Records ¬∑ Full-time\n18 Records ¬∑ Full-time\nMar 2021 - Feb 2022 ¬∑ 1 yr\nMar 2021 to Feb 2022 ¬∑ 1 yr\nLagos State, Nigeria\nLagos State, Nigeria\nProject Manager\nProject Manager\nTEEKY GROUP\nTEEKY GROUP\nNov 2017 - Feb 2022 ¬∑ 4 yrs 4 mos\nNov 2017 to Feb 2022 ¬∑ 4 yrs 4 mos\nLagos, Nigeria\nLagos, Nigeria\nShow all 9 experiences",
    "isCSuite": true,
    "contextForAI": "Uzor Daniel Uwabuofu \n2nd degree connection\n2nd\nSenior Manager, Operations, Sony Music Publishing, Nigeria\nSony Music Publishing\nUnited Kingdom  Contact info\n500+ connections\nConnect\nMessage\nMore\nAbout\nAbout\nA high caliber individual with gravitas and a proven record of Entertainment expertise through methodical, thorough and diligent work.\n‚Ä¢ Music Publisher\n‚Ä¢ Music Royalty Expert\n‚Ä¢ Musicians Rights Advocator\nA high caliber individual with gravitas and a proven record of Entertainment expertise through methodical, thorough and diligent work. ‚Ä¢ Music Publisher ‚Ä¢ Music Royalty Expert ‚Ä¢ Musicians Rights Advocator\n‚Ä¶see more\nServices\nServices\nCopywriting ‚Ä¢ Project Management ‚Ä¢ Business Consulting ‚Ä¢ Management Consulting\nCopywriting ‚Ä¢ Project Management ‚Ä¢ Business Consulting ‚Ä¢ Management Consulting\nRequest services\nShow all services\nFeatured\nFeatured\nPost\nPost\nKeep Moving‚Ä¶\n1\nActivity\nActivity\n2,290 followers\n2,290 followers\nPosts\nComments\nVideos\nImages\nLoaded 9 Posts posts\nUzor Daniel Uwabuofu\nUzor Daniel Uwabuofu\n   ‚Ä¢ 2nd\nVerified ‚Ä¢ 2nd\nSenior Manager, Operations, Sony Music Publishing, Nigeria\nSenior Manager, Operations, Sony Music Publishing, Nigeria\n2mo ‚Ä¢ \n2 months ago ‚Ä¢ Visible to anyone on or off LinkedIn\nThe Wealth Cycle of a Song goes from Creation to Multi-Generational Impact.\nThis emphasizes music as data, data as wealth, and wealth as transferable.\nLegacy. Authenticity. Ownership. Pensionable data.\nhashtag\n#afrobeatrebellionlagos \nhashtag\n#thefixer\n‚Ä¶more\n27\n1 comment\nUzor Daniel Uwabuofu\nUzor Daniel Uwabuofu\n   ‚Ä¢ 2nd\nVerified ‚Ä¢ 2nd\nSenior Manager, Operations, Sony Music Publishing, Nigeria\nSenior Manager, Operations, Sony Music Publishing, Nigeria\n5mo ‚Ä¢ \n5 months ago ‚Ä¢ Visible to anyone on or off LinkedIn\n3 Years Strong! üéâ\nAll glory and praise to God for making this journey possible.\nFrom signed deals to hosting camps, traveling the world, attending conferences, and experiencing growth on so many levels, it has truly been an incredible ride.\nTo my amazing team at Sony Music Publishing International, thank you! \nGuy Henderson Daniel Nelson Jo Edwards Aylin A. Rachael Welham Daniel Martin Vanessa Obi Callum Chamberlain Alex Batterbee Jash Udeshi Martin Down Haydn Griffiths Nasra Artan Wale Davies \nTo my Nigerian squad: \nGodwin Tom your leadership, broad oversight, and mentorship have been invaluable, thank you for believing in me. Sharon Okereke your strength and support during overwhelming times has kept us going, thank you!\nTo the incredible writers we‚Äôve signed, thank you for trusting us and joining us on this journey of redefining what‚Äôs possible.\nWe keep working. We keep FIXING. We keep Winning.\nHappy 3rd Year Anniversary to me. ‚ú®\nhashtag\n#TheFixer \nhashtag\n#sonymusicpubwestafrica\n‚Ä¶more\nActivate to view larger image,\n1/20\nActivate to view larger image,\n137\n18 comments\n3 reposts\nShow all posts\nExperience\nExperience\nSony Music Publishing\nSony Music Publishing\nFull-time ¬∑ 3 yrs 6 mos\nFull-time ¬∑ 3 yrs 6 mos\nNigeria\nNigeria\nSenior Operations Manager\nSenior Operations Manager\nMar 2025 - Present ¬∑ 1 yr\nMar 2025 to Present ¬∑ 1 yr\nOn-site\nOn-site\nHands-on management, direction, and supervision of the operational activities of the Nigerian Company for Sony Music Publishing catalogues, covering all Western & Eastern African countries/societies within scope - both local and international repertoire.\nHands-on management, direction, and supervision of the operational activities of the Nigerian Company for Sony Music Publishing catalogues, covering all Western & Eastern African countries/societies within scope - both local and international repertoire.\nCoordination Skills, Effective organizational skills and +16 skills\nManager Admin & Sync\nManager Admin & Sync\nSep 2022 - Mar 2025 ¬∑ 2 yrs 7 mos\nSep 2022 to Mar 2025 ¬∑ 2 yrs 7 mos\nHybrid\nHybrid\nChief Executive Officer\nChief Executive Officer\nDurozy International ¬∑ Full-time\nDurozy International ¬∑ Full-time\nJul 2020 - Sep 2022 ¬∑ 2 yrs 3 mos\nJul 2020 to Sep 2022 ¬∑ 2 yrs 3 mos\nLagos, Nigeria\nLagos, Nigeria\nGeneral Manager\nGeneral Manager\nclovekids ¬∑ Full-time\nclovekids ¬∑ Full-time\nMar 2018 - Sep 2022 ¬∑ 4 yrs 7 mos\nMar 2018 to Sep 2022 ¬∑ 4 yrs 7 mos\nLagos State, Nigeria\nLagos State, Nigeria\nGeneral Manager and Co founder\nGeneral Manager and Co founder\n18 Records ¬∑ Full-time\n18 Records ¬∑ Full-time\nMar 2021 - Feb 2022 ¬∑ 1 yr\nMar 2021 to Feb 2022 ¬∑ 1 yr\nLagos State, Nigeria\nLagos State, Nigeria\nProject Manager\nProject Manager\nTEEKY GROUP\nTEEKY GROUP\nNov 2017 - Feb 2022 ¬∑ 4 yrs 4 mos\nNov 2017 to Feb 2022 ¬∑ 4 yrs 4 mos\nLagos, Nigeria\nLagos, Nigeria\nShow all 9 experiences\nEducation\nEducation\nUniversity of Benin\nUniversity of Benin\nBachelor's degree, Industrial Chemistry\nBachelor's degree, Industrial Chemistry\n2008 - 2015\n2008 - 2015\nGrade: Second Class\nGrade: Second Class\n‚Ä¢ Conduct qualitative and quantitative chemical analyses\n‚Ä¢ Carried out experiments in laboratories for quality and process control\n‚Ä¢ Trained in : \n - Industrial pollution\n - Nomenclature\n - Environmental ch",
    "searchKeyword": "CEO"
  },
  {
    "profileUrl": "https://www.linkedin.com/in/ACoAABztPo8BWVu4zXRQlR3hl7GjKNTvU2e1oQw",
    "name": "Uzor Daniel Uwabuofu",
    "title": "Senior Manager, Operations, Sony Music Publishing, Nigeria",
    "location": "United Kingdom",
    "company": "Sony Music Publishing",
    "about": "",
    "experience": "Experience\nExperience\nSony Music Publishing\nSony Music Publishing\nFull-time ¬∑ 3 yrs 6 mos\nFull-time ¬∑ 3 yrs 6 mos\nNigeria\nNigeria\nSenior Operations Manager\nSenior Operations Manager\nMar 2025 - Present ¬∑ 1 yr\nMar 2025 to Present ¬∑ 1 yr\nOn-site\nOn-site\nHands-on management, direction, and supervision of the operational activities of the Nigerian Company for Sony Music Publishing catalogues, covering all Western & Eastern African countries/societies within scope - both local and international repertoire.\nHands-on management, direction, and supervision of the operational activities of the Nigerian Company for Sony Music Publishing catalogues, covering all Western & Eastern African countries/societies within scope - both local and international repertoire.\nCoordination Skills, Effective organizational skills and +16 skills\nManager Admin & Sync\nManager Admin & Sync\nSep 2022 - Mar 2025 ¬∑ 2 yrs 7 mos\nSep 2022 to Mar 2025 ¬∑ 2 yrs 7 mos\nHybrid\nHybrid\nChief Executive Officer\nChief Executive Officer\nDurozy International ¬∑ Full-time\nDurozy International ¬∑ Full-time\nJul 2020 - Sep 2022 ¬∑ 2 yrs 3 mos\nJul 2020 to Sep 2022 ¬∑ 2 yrs 3 mos\nLagos, Nigeria\nLagos, Nigeria\nGeneral Manager\nGeneral Manager\nclovekids ¬∑ Full-time\nclovekids ¬∑ Full-time\nMar 2018 - Sep 2022 ¬∑ 4 yrs 7 mos\nMar 2018 to Sep 2022 ¬∑ 4 yrs 7 mos\nLagos State, Nigeria\nLagos State, Nigeria\nGeneral Manager and Co founder\nGeneral Manager and Co founder\n18 Records ¬∑ Full-time\n18 Records ¬∑ Full-time\nMar 2021 - Feb 2022 ¬∑ 1 yr\nMar 2021 to Feb 2022 ¬∑ 1 yr\nLagos State, Nigeria\nLagos State, Nigeria\nProject Manager\nProject Manager\nTEEKY GROUP\nTEEKY GROUP\nNov 2017 - Feb 2022 ¬∑ 4 yrs 4 mos\nNov 2017 to Feb 2022 ¬∑ 4 yrs 4 mos\nLagos, Nigeria\nLagos, Nigeria\nShow all 9 experiences",
    "isCSuite": true,
    "contextForAI": "Uzor Daniel Uwabuofu \n2nd degree connection\n2nd\nSenior Manager, Operations, Sony Music Publishing, Nigeria\nSony Music Publishing\nUnited Kingdom  Contact info\n500+ connections\nConnect\nMessage\nMore\nAbout\nAbout\nA high caliber individual with gravitas and a proven record of Entertainment expertise through methodical, thorough and diligent work.\n‚Ä¢ Music Publisher\n‚Ä¢ Music Royalty Expert\n‚Ä¢ Musicians Rights Advocator\nA high caliber individual with gravitas and a proven record of Entertainment expertise through methodical, thorough and diligent work. ‚Ä¢ Music Publisher ‚Ä¢ Music Royalty Expert ‚Ä¢ Musicians Rights Advocator\n‚Ä¶see more\nServices\nServices\nCopywriting ‚Ä¢ Project Management ‚Ä¢ Business Consulting ‚Ä¢ Management Consulting\nCopywriting ‚Ä¢ Project Management ‚Ä¢ Business Consulting ‚Ä¢ Management Consulting\nRequest services\nShow all services\nFeatured\nFeatured\nPost\nPost\nKeep Moving‚Ä¶\n1\nActivity\nActivity\n2,290 followers\n2,290 followers\nPosts\nComments\nVideos\nImages\nLoaded 9 Posts posts\nUzor Daniel Uwabuofu\nUzor Daniel Uwabuofu\n   ‚Ä¢ 2nd\nVerified ‚Ä¢ 2nd\nSenior Manager, Operations, Sony Music Publishing, Nigeria\nSenior Manager, Operations, Sony Music Publishing, Nigeria\n2mo ‚Ä¢ \n2 months ago ‚Ä¢ Visible to anyone on or off LinkedIn\nThe Wealth Cycle of a Song goes from Creation to Multi-Generational Impact.\nThis emphasizes music as data, data as wealth, and wealth as transferable.\nLegacy. Authenticity. Ownership. Pensionable data.\nhashtag\n#afrobeatrebellionlagos \nhashtag\n#thefixer\n‚Ä¶more\n27\n1 comment\nUzor Daniel Uwabuofu\nUzor Daniel Uwabuofu\n   ‚Ä¢ 2nd\nVerified ‚Ä¢ 2nd\nSenior Manager, Operations, Sony Music Publishing, Nigeria\nSenior Manager, Operations, Sony Music Publishing, Nigeria\n5mo ‚Ä¢ \n5 months ago ‚Ä¢ Visible to anyone on or off LinkedIn\n3 Years Strong! üéâ\nAll glory and praise to God for making this journey possible.\nFrom signed deals to hosting camps, traveling the world, attending conferences, and experiencing growth on so many levels, it has truly been an incredible ride.\nTo my amazing team at Sony Music Publishing International, thank you! \nGuy Henderson Daniel Nelson Jo Edwards Aylin A. Rachael Welham Daniel Martin Vanessa Obi Callum Chamberlain Alex Batterbee Jash Udeshi Martin Down Haydn Griffiths Nasra Artan Wale Davies \nTo my Nigerian squad: \nGodwin Tom your leadership, broad oversight, and mentorship have been invaluable, thank you for believing in me. Sharon Okereke your strength and support during overwhelming times has kept us going, thank you!\nTo the incredible writers we‚Äôve signed, thank you for trusting us and joining us on this journey of redefining what‚Äôs possible.\nWe keep working. We keep FIXING. We keep Winning.\nHappy 3rd Year Anniversary to me. ‚ú®\nhashtag\n#TheFixer \nhashtag\n#sonymusicpubwestafrica\n‚Ä¶more\nActivate to view larger image,\n1/20\nActivate to view larger image,\n137\n18 comments\n3 reposts\nShow all posts\nExperience\nExperience\nSony Music Publishing\nSony Music Publishing\nFull-time ¬∑ 3 yrs 6 mos\nFull-time ¬∑ 3 yrs 6 mos\nNigeria\nNigeria\nSenior Operations Manager\nSenior Operations Manager\nMar 2025 - Present ¬∑ 1 yr\nMar 2025 to Present ¬∑ 1 yr\nOn-site\nOn-site\nHands-on management, direction, and supervision of the operational activities of the Nigerian Company for Sony Music Publishing catalogues, covering all Western & Eastern African countries/societies within scope - both local and international repertoire.\nHands-on management, direction, and supervision of the operational activities of the Nigerian Company for Sony Music Publishing catalogues, covering all Western & Eastern African countries/societies within scope - both local and international repertoire.\nCoordination Skills, Effective organizational skills and +16 skills\nManager Admin & Sync\nManager Admin & Sync\nSep 2022 - Mar 2025 ¬∑ 2 yrs 7 mos\nSep 2022 to Mar 2025 ¬∑ 2 yrs 7 mos\nHybrid\nHybrid\nChief Executive Officer\nChief Executive Officer\nDurozy International ¬∑ Full-time\nDurozy International ¬∑ Full-time\nJul 2020 - Sep 2022 ¬∑ 2 yrs 3 mos\nJul 2020 to Sep 2022 ¬∑ 2 yrs 3 mos\nLagos, Nigeria\nLagos, Nigeria\nGeneral Manager\nGeneral Manager\nclovekids ¬∑ Full-time\nclovekids ¬∑ Full-time\nMar 2018 - Sep 2022 ¬∑ 4 yrs 7 mos\nMar 2018 to Sep 2022 ¬∑ 4 yrs 7 mos\nLagos State, Nigeria\nLagos State, Nigeria\nGeneral Manager and Co founder\nGeneral Manager and Co founder\n18 Records ¬∑ Full-time\n18 Records ¬∑ Full-time\nMar 2021 - Feb 2022 ¬∑ 1 yr\nMar 2021 to Feb 2022 ¬∑ 1 yr\nLagos State, Nigeria\nLagos State, Nigeria\nProject Manager\nProject Manager\nTEEKY GROUP\nTEEKY GROUP\nNov 2017 - Feb 2022 ¬∑ 4 yrs 4 mos\nNov 2017 to Feb 2022 ¬∑ 4 yrs 4 mos\nLagos, Nigeria\nLagos, Nigeria\nShow all 9 experiences\nEducation\nEducation\nUniversity of Benin\nUniversity of Benin\nBachelor's degree, Industrial Chemistry\nBachelor's degree, Industrial Chemistry\n2008 - 2015\n2008 - 2015\nGrade: Second Class\nGrade: Second Class\n‚Ä¢ Conduct qualitative and quantitative chemical analyses\n‚Ä¢ Carried out experiments in laboratories for quality and process control\n‚Ä¢ Trained in : \n - Industrial pollution\n - Nomenclature\n - Environmental ch",
    "searchKeyword": "CEO"
  },
  {
    "profileUrl": "https://www.linkedin.com/in/sergio-de-sousa-78ba9337",
    "name": "Sergio De Sousa",
    "title": "CEO at EcoSmart Assessoria Ltda",
    "location": "London, England, United Kingdom",
    "company": "EcoSmart Assessoria Ltd",
    "about": "",
    "experience": "Experience\nExperience\nCEO at EcoSmart Assessoria Ltd\nCEO at EcoSmart Assessoria Ltd\nCEO at EcoSmart Assessoria Ltd\nEcoSmart Assessoria Ltd ¬∑ Full-time\nEcoSmart Assessoria Ltd ¬∑ Full-time\nOct 2024 - Present ¬∑ 1 yr 5 mos\nOct 2024 to Present ¬∑ 1 yr 5 mos\nLondon Area, United Kingdom ¬∑ Remote\nLondon Area, United Kingdom ¬∑ Remote\nEcosmart is a leader in Latin America in the development of carbon credit projects and corporate management of Sustainability and Climate Change.\n\nOur solutions connect communities, the private and public sectors committed to sustainable development from north to south of Brazil.\nEcosmart is a leader in Latin America in the development of carbon credit projects and corporate management of Sustainability and Climate Change. Our solutions connect communities, the private and public sectors committed to sustainable development from north to south of Brazil.\n‚Ä¶see more",
    "isCSuite": true,
    "contextForAI": "Sergio De Sousa\n He/Him  \n2nd degree connection\n2nd\nCEO at EcoSmart Assessoria Ltda\nEcoSmart Assessoria Ltd\nBirkbeck, University of London\nLondon, England, United Kingdom  Contact info\nhttps://www.ecosmartassessoria.com\n500+ connections\nIwona Plumpton is a mutual connection\nIwona Plumpton is a mutual connection\nConnect\nMessage\nMore\nActivity\nActivity\n4,283 followers\n4,283 followers\nPosts\nVideos\nImages\nLoaded 9 Posts posts\nSergio De Sousa\nSergio De Sousa\n ‚Ä¢ 2nd\n2nd\nCEO at EcoSmart Assessoria Ltda\nCEO at EcoSmart Assessoria Ltda\n2mo ‚Ä¢ \n2 months ago ‚Ä¢ Visible to anyone on or off LinkedIn\nCarbon credits are no longer a \"future thing\". They are a strategic asset.\nIf you still think carbon credits are just for giant corporations or green marketing, it is time to update your market perspective.\nAt EcoSmart, we can see that the game has changed. This isn't about trends or greenwashing. It is pure strategy, compliance, and competitive survival.\nToday, licensed carbon credits are essential tools to:\n‚úÖ Strengthen ESG goals (which are no longer optional). ‚úÖ Meet regulatory requirements that are becoming stricter by the day. ‚úÖ Enhance brand value for investors and conscious consumers. ‚úÖ Open doors to demanding international markets.\nThe question is no longer if your company should join the new economy, but when. Those who act fast reap the best results.\nWe have credits available for sale, ready for businesses seeking real impact and legal certainty.\nThe market doesn't wait. Those who don't adapt will get left behind.\n‚û°Ô∏è Want to understand how to acquire them? Click the link in our bio and let‚Äôs talk.\n‚Ä¶more\nActivate to view larger image,\nActivate to view larger image,\n3\n1 repost\nSergio De Sousa\nSergio De Sousa\n ‚Ä¢ 2nd\n2nd\nCEO at EcoSmart Assessoria Ltda\nCEO at EcoSmart Assessoria Ltda\n6mo ‚Ä¢ \n6 months ago ‚Ä¢ Visible to anyone on or off LinkedIn\nReal Carbon Credits. Real Environmental Impact.\nüåç Carbon neutrality isn‚Äôt just a buzzword, it‚Äôs a business imperative.\nWe‚Äôre offering Brazilian-certified carbon credits, available for use in voluntary sustainability and ESG initiatives across Europe.\nOur carbon credits are linked to real projects that preserve native forests, protect biodiversity, and strengthen local communities.\n‚úÖ Verified under respected Brazilian and international voluntary standards\n‚úÖ Traceable and audit-ready for corporate ESG reporting\n‚úÖ High-integrity for companies committed to climate action\nIf you're looking to back your sustainability claims with credible voluntary offsets, we‚Äôre ready to help.\nüì© Let‚Äôs talk carbon.\n‚Ä¶more\nActivate to view larger image,\nActivate to view larger image,\n5\n1 comment\n2 reposts\nShow all posts\nExperience\nExperience\nCEO at EcoSmart Assessoria Ltd\nCEO at EcoSmart Assessoria Ltd\nCEO at EcoSmart Assessoria Ltd\nEcoSmart Assessoria Ltd ¬∑ Full-time\nEcoSmart Assessoria Ltd ¬∑ Full-time\nOct 2024 - Present ¬∑ 1 yr 5 mos\nOct 2024 to Present ¬∑ 1 yr 5 mos\nLondon Area, United Kingdom ¬∑ Remote\nLondon Area, United Kingdom ¬∑ Remote\nEcosmart is a leader in Latin America in the development of carbon credit projects and corporate management of Sustainability and Climate Change.\nOur solutions connect communities, the private and public sectors committed to sustainable development from north to south of Brazil.\nEcosmart is a leader in Latin America in the development of carbon credit projects and corporate management of Sustainability and Climate Change. Our solutions connect communities, the private and public sectors committed to sustainable development from north to south of Brazil.\n‚Ä¶see more\nEducation\nEducation\nBirkbeck, University of London\nBirkbeck, University of London\nFoundation degree, Accounting and Business/Management\nFoundation degree, Accounting and Business/Management\n2011 - 2015\n2011 - 2015\nSkills\nSkills\nFacilities Management\nFacilities Management\n9 endorsements\n9 endorsements\nOperations Management\nOperations Management\nEndorsed by 1 person in the last 6 months\nEndorsed by 1 person in the last 6 months\n25 endorsements\n25 endorsements\nShow all 36 skills\nLanguages\nLanguages\nPortuguese\nPortuguese\nInterests\nInterests\nTop Voices\nTop Voices\nCompanies\nCompanies\nGroups\nGroups\nNewsletters\nNewsletters\nSchools\nSchools\nMel Robbins\nMel Robbins\n¬∑ 3rd\nThird degree connection\n#1 NYT Best Selling Author of The Let Them Theory | Host of Award-Winning The Mel Robbins Podcast | CEO, 143 Studios | Co-Founder, Pure Genius Protein\n#1 NYT Best Selling Author of The Let Them Theory | Host of Award-Winning The Mel Robbins Podcast | CEO, 143 Studios | Co-Founder, Pure Genius Protein\n1,575,609 followers\n1,575,609 followers\nFollow\nJames Caan CBE\nJames Caan CBE\n¬∑ 3rd\nThird degree connection\nHamilton Bradshaw | Serial Entrepreneur | Investor on BBC's Dragons‚Äô Den (2007-2010)\nHamilton Bradshaw | Serial Entrepreneur | Investor on BBC's Dragons‚Äô Den (2007-2010)\n3,286,399 followers\n3,286,399 followers\nFollow\nShow all Top Voices",
    "searchKeyword": "CEO"
  },
  {
    "profileUrl": "https://www.linkedin.com/in/ahmed-gamal-abedrabo",
    "name": "Ahmed Gamal",
    "title": "Founder & Chief Executive Officer at Rentd.",
    "location": "Ealing, England, United Kingdom",
    "company": "Rentd.",
    "about": "",
    "experience": "Experience\nExperience\nFounder\nFounder\nRentd.\nRentd.\nMar 2021 - Present ¬∑ 5 yrs\nMar 2021 to Present ¬∑ 5 yrs\nLondon, Greater London, United Kingdom\nLondon, Greater London, United Kingdom\nRentd is a tech-powered rental platform designed to make renting smarter, fairer, and more rewarding.\nRentd is a tech-powered rental platform designed to make renting smarter, fairer, and more rewarding.\nDirector\nDirector\nDirector\nSphinx Consultancy\nSphinx Consultancy\nAug 2010 - Dec 2020 ¬∑ 10 yrs 5 mos\nAug 2010 to Dec 2020 ¬∑ 10 yrs 5 mos\nLondon Area, United Kingdom ¬∑ On-site\nLondon Area, United Kingdom ¬∑ On-site\nSphinx Consultancy specialised in searching for and acquiring real estate on behalf of clients, delivering tailored property solutions aligned with their investment objectives.\nSphinx Consultancy specialised in searching for and acquiring real estate on behalf of clients, delivering tailored property solutions aligned with their investment objectives.",
    "isCSuite": true,
    "contextForAI": "Ahmed Gamal\n3rd degree connection\n3rd\nFounder & Chief Executive Officer at Rentd.\nRentd.\nUniversity of the Arts London\nEaling, England, United Kingdom  Contact info\n500+ connections\nConnect\nMessage\nMore\nAbout\nAbout\nRentd is a tech-powered rental platform designed to make renting smarter, fairer, and more rewarding. For renters, it offers a seamless way to find and secure homes, while turning rent payments into real value through its innovative rewards card, helping renters get more back from their biggest monthly expense. The platform ensures transparency, ease of use, and financial benefits that go beyond traditional renting.\nFor landlords, Rentd provides direct access to a wide pool of verified renters, while ensuring on-time, secure payments through its integrated system. With powerful digital tools to manage listings, streamline communication, and maximise occupancy, landlords save time while reducing risk.\nTogether, Rentd is building a future where renting works better for everyone, creating lasting value for both renters and landlords.\nRentd is a tech-powered rental platform designed to make renting smarter, fairer, and more rewarding. For renters, it offers a seamless way to find and secure homes, while turning rent payments into real value through its innovative rewards card, helping renters get more back from their biggest monthly expense. The platform ensures transparency, ease of use, and financial benefits that go beyond traditional renting. For landlords, Rentd provides direct access to a wide pool of verified renters, while ensuring on-time, secure payments through its integrated system. With powerful digital tools to manage listings, streamline communication, and maximise occupancy, landlords save time while reducing risk. Together, Rentd is building a future where renting works better for everyone, creating lasting value for both renters and landlords.\n‚Ä¶see more\nServices\nServices\nReal Estate ‚Ä¢ Financial Planning\nReal Estate ‚Ä¢ Financial Planning\nRequest services\nShow all services\nActivity\nActivity\n13,759 followers\n13,759 followers\nLoaded 3 Comments posts\nAhmed Gamal commented on a post ‚Ä¢ 1mo\n1mo\nCongratulations Youssef Salem\nCongratulations Youssef Salem\nAhmed Gamal commented on a post ‚Ä¢ 3mo\n3mo\nLooking forward to it! Thank you for having me Youssef Salem\nLooking forward to it! Thank you for having me Youssef Salem\nAhmed Gamal commented on a post ‚Ä¢ 3mo\n3mo\nRamiz Reza thank you very much for the kind words!\nRamiz Reza thank you very much for the kind words!\nShow all comments\nExperience\nExperience\nFounder\nFounder\nRentd.\nRentd.\nMar 2021 - Present ¬∑ 5 yrs\nMar 2021 to Present ¬∑ 5 yrs\nLondon, Greater London, United Kingdom\nLondon, Greater London, United Kingdom\nRentd is a tech-powered rental platform designed to make renting smarter, fairer, and more rewarding.\nRentd is a tech-powered rental platform designed to make renting smarter, fairer, and more rewarding.\nDirector\nDirector\nDirector\nSphinx Consultancy\nSphinx Consultancy\nAug 2010 - Dec 2020 ¬∑ 10 yrs 5 mos\nAug 2010 to Dec 2020 ¬∑ 10 yrs 5 mos\nLondon Area, United Kingdom ¬∑ On-site\nLondon Area, United Kingdom ¬∑ On-site\nSphinx Consultancy specialised in searching for and acquiring real estate on behalf of clients, delivering tailored property solutions aligned with their investment objectives.\nSphinx Consultancy specialised in searching for and acquiring real estate on behalf of clients, delivering tailored property solutions aligned with their investment objectives.\nEducation\nEducation\nUniversity of the Arts London\nUniversity of the Arts London\nBachelor of Arts - BA, Graphic Design\nBachelor of Arts - BA, Graphic Design\nSt. Benedict‚Äôs School\nSt. Benedict‚Äôs School\nSt. Benedict‚Äôs School\nA Levels - Art / Maths / IT\nA Levels - Art / Maths / IT\nSt Benedict‚Äôs - Home\nSt Benedict‚Äôs - Home\nSt Benedict‚Äôs is London‚Äôs leading independent, Catholic, co-educational school.\nSt Benedict‚Äôs is London‚Äôs leading independent, Catholic, co-educational school.\nSkills\nSkills\nSeeking Opportunities in the Real Estate Sector\nSeeking Opportunities in the Real Estate Sector\nRutvik Kanani and 70 connections have given endorsements for this skill\nRutvik Kanani and 70 connections have given endorsements for this skill\n82 endorsements\n82 endorsements\nBusiness Development\nBusiness Development\nEndorsed by Oliver Ribic and 3 others who are highly skilled at this\nEndorsed by Oliver Ribic and 3 others who are highly skilled at this\nEndorsed by 10 people in the last 6 months\nEndorsed by 10 people in the last 6 months\n90 endorsements\n90 endorsements\nShow all 8 skills\nRecommendations\nRecommendations\nReceived\nReceived\nGiven\nGiven\nNothing to see for now\nNothing to see for now\nRecommendations that Ahmed receives will appear here.\nRecommendations that Ahmed receives will appear here.\nInterests\nInterests\nTop Voices\nTop Voices\nCompanies\nCompanies\nGroups\nGroups\nNewsletters\nNewsletters\nSchools\nSchools\nDr. Wladimir Klitschko\nDr. Wladimir Klitschko\n¬∑ 3rd\nThird degree connection\nFACE THE CHALLENGE I ",
    "searchKeyword": "CEO"
  },
  {
    "profileUrl": "https://www.linkedin.com/in/ACoAACg5oW0ByVVQ6nmSpoSMq__Lgql0VfZAyr4",
    "name": "Ahmed Gamal",
    "title": "Founder & Chief Executive Officer at Rentd.",
    "location": "Ealing, England, United Kingdom",
    "company": "Rentd.",
    "about": "",
    "experience": "Experience\nExperience\nFounder\nFounder\nRentd.\nRentd.\nMar 2021 - Present ¬∑ 5 yrs\nMar 2021 to Present ¬∑ 5 yrs\nLondon, Greater London, United Kingdom\nLondon, Greater London, United Kingdom\nRentd is a tech-powered rental platform designed to make renting smarter, fairer, and more rewarding.\nRentd is a tech-powered rental platform designed to make renting smarter, fairer, and more rewarding.\nDirector\nDirector\nDirector\nSphinx Consultancy\nSphinx Consultancy\nAug 2010 - Dec 2020 ¬∑ 10 yrs 5 mos\nAug 2010 to Dec 2020 ¬∑ 10 yrs 5 mos\nLondon Area, United Kingdom ¬∑ On-site\nLondon Area, United Kingdom ¬∑ On-site\nSphinx Consultancy specialised in searching for and acquiring real estate on behalf of clients, delivering tailored property solutions aligned with their investment objectives.\nSphinx Consultancy specialised in searching for and acquiring real estate on behalf of clients, delivering tailored property solutions aligned with their investment objectives.",
    "isCSuite": true,
    "contextForAI": "Ahmed Gamal\n3rd degree connection\n3rd\nFounder & Chief Executive Officer at Rentd.\nRentd.\nUniversity of the Arts London\nEaling, England, United Kingdom  Contact info\n500+ connections\nConnect\nMessage\nMore\nAbout\nAbout\nRentd is a tech-powered rental platform designed to make renting smarter, fairer, and more rewarding. For renters, it offers a seamless way to find and secure homes, while turning rent payments into real value through its innovative rewards card, helping renters get more back from their biggest monthly expense. The platform ensures transparency, ease of use, and financial benefits that go beyond traditional renting.\nFor landlords, Rentd provides direct access to a wide pool of verified renters, while ensuring on-time, secure payments through its integrated system. With powerful digital tools to manage listings, streamline communication, and maximise occupancy, landlords save time while reducing risk.\nTogether, Rentd is building a future where renting works better for everyone, creating lasting value for both renters and landlords.\nRentd is a tech-powered rental platform designed to make renting smarter, fairer, and more rewarding. For renters, it offers a seamless way to find and secure homes, while turning rent payments into real value through its innovative rewards card, helping renters get more back from their biggest monthly expense. The platform ensures transparency, ease of use, and financial benefits that go beyond traditional renting. For landlords, Rentd provides direct access to a wide pool of verified renters, while ensuring on-time, secure payments through its integrated system. With powerful digital tools to manage listings, streamline communication, and maximise occupancy, landlords save time while reducing risk. Together, Rentd is building a future where renting works better for everyone, creating lasting value for both renters and landlords.\n‚Ä¶see more\nServices\nServices\nReal Estate ‚Ä¢ Financial Planning\nReal Estate ‚Ä¢ Financial Planning\nRequest services\nShow all services\nActivity\nActivity\n13,759 followers\n13,759 followers\nLoaded 3 Comments posts\nAhmed Gamal commented on a post ‚Ä¢ 1mo\n1mo\nCongratulations Youssef Salem\nCongratulations Youssef Salem\nAhmed Gamal commented on a post ‚Ä¢ 3mo\n3mo\nLooking forward to it! Thank you for having me Youssef Salem\nLooking forward to it! Thank you for having me Youssef Salem\nAhmed Gamal commented on a post ‚Ä¢ 3mo\n3mo\nRamiz Reza thank you very much for the kind words!\nRamiz Reza thank you very much for the kind words!\nShow all comments\nExperience\nExperience\nFounder\nFounder\nRentd.\nRentd.\nMar 2021 - Present ¬∑ 5 yrs\nMar 2021 to Present ¬∑ 5 yrs\nLondon, Greater London, United Kingdom\nLondon, Greater London, United Kingdom\nRentd is a tech-powered rental platform designed to make renting smarter, fairer, and more rewarding.\nRentd is a tech-powered rental platform designed to make renting smarter, fairer, and more rewarding.\nDirector\nDirector\nDirector\nSphinx Consultancy\nSphinx Consultancy\nAug 2010 - Dec 2020 ¬∑ 10 yrs 5 mos\nAug 2010 to Dec 2020 ¬∑ 10 yrs 5 mos\nLondon Area, United Kingdom ¬∑ On-site\nLondon Area, United Kingdom ¬∑ On-site\nSphinx Consultancy specialised in searching for and acquiring real estate on behalf of clients, delivering tailored property solutions aligned with their investment objectives.\nSphinx Consultancy specialised in searching for and acquiring real estate on behalf of clients, delivering tailored property solutions aligned with their investment objectives.\nEducation\nEducation\nUniversity of the Arts London\nUniversity of the Arts London\nBachelor of Arts - BA, Graphic Design\nBachelor of Arts - BA, Graphic Design\nSt. Benedict‚Äôs School\nSt. Benedict‚Äôs School\nSt. Benedict‚Äôs School\nA Levels - Art / Maths / IT\nA Levels - Art / Maths / IT\nSt Benedict‚Äôs - Home\nSt Benedict‚Äôs - Home\nSt Benedict‚Äôs is London‚Äôs leading independent, Catholic, co-educational school.\nSt Benedict‚Äôs is London‚Äôs leading independent, Catholic, co-educational school.\nSkills\nSkills\nSeeking Opportunities in the Real Estate Sector\nSeeking Opportunities in the Real Estate Sector\nRutvik Kanani and 70 connections have given endorsements for this skill\nRutvik Kanani and 70 connections have given endorsements for this skill\n82 endorsements\n82 endorsements\nBusiness Development\nBusiness Development\nEndorsed by Oliver Ribic and 3 others who are highly skilled at this\nEndorsed by Oliver Ribic and 3 others who are highly skilled at this\nEndorsed by 10 people in the last 6 months\nEndorsed by 10 people in the last 6 months\n90 endorsements\n90 endorsements\nShow all 8 skills\nRecommendations\nRecommendations\nReceived\nReceived\nGiven\nGiven\nNothing to see for now\nNothing to see for now\nRecommendations that Ahmed receives will appear here.\nRecommendations that Ahmed receives will appear here.\nInterests\nInterests\nTop Voices\nTop Voices\nCompanies\nCompanies\nGroups\nGroups\nNewsletters\nNewsletters\nSchools\nSchools\nSam Boboev\nSam Boboev\n¬∑ 3rd\nThird degree connection\nFounder & CEO at Fintech Wrap Up | Payments |",
    "searchKeyword": "CEO"
  },
  {
    "profileUrl": "https://www.linkedin.com/in/james-davies-2a120054",
    "name": "James Davies",
    "title": "Acting Executive Director at West London Synagogue",
    "location": "London, England, United Kingdom",
    "company": "West London Synagogue of British Jews",
    "about": "",
    "experience": "Experience\nExperience\nActing Executive Director\nActing Executive Director\nWest London Synagogue of British Jews ¬∑ Full-time\nWest London Synagogue of British Jews ¬∑ Full-time\nJan 2025 - Present ¬∑ 1 yr 2 mos\nJan 2025 to Present ¬∑ 1 yr 2 mos\nDirector of Operations\nDirector of Operations\nDirector of Operations\nWest London Synagogue of British Jews ¬∑ Full-time\nWest London Synagogue of British Jews ¬∑ Full-time\nAug 2023 - Feb 2025 ¬∑ 1 yr 7 mos\nAug 2023 to Feb 2025 ¬∑ 1 yr 7 mos\nGreater London, England, United Kingdom ¬∑ On-site\nGreater London, England, United Kingdom ¬∑ On-site\nQuo Vadis Trust\nQuo Vadis Trust\nFull-time ¬∑ 4 yrs 6 mos\nFull-time ¬∑ 4 yrs 6 mos\nGreater London, England, United Kingdom\nGreater London, England, United Kingdom\nDirector Of Operations\nDirector Of Operations\nJan 2022 - May 2023 ¬∑ 1 yr 5 mos\nJan 2022 to May 2023 ¬∑ 1 yr 5 mos\nLeadership, Board Governance and +11 skills\nHead Of Operations\nHead Of Operations\nDec 2018 - Jan 2022 ¬∑ 3 yrs 2 mos\nDec 2018 to Jan 2022 ¬∑ 3 yrs 2 mos\nLeadership, Board Governance and +11 skills\nAssistant Director\nAssistant Director\nHillside Clubhouse ¬∑ Full-time\nHillside Clubhouse ¬∑ Full-time\nMay 2016 - Dec 2018 ¬∑ 2 yrs 8 mos\nMay 2016 to Dec 2018 ¬∑ 2 yrs 8 mos\nGreater London, England, United Kingdom\nGreater London, England, United Kingdom\nLeadership, Board Governance and +11 skills\nHead of Services \nHead of Services \nhalow project ¬∑ Full-time\nhalow project ¬∑ Full-time\nMay 2015 - May 2016 ¬∑ 1 yr 1 mo\nMay 2015 to May 2016 ¬∑ 1 yr 1 mo\nSurrey, England, United Kingdom\nSurrey, England, United Kingdom\nLeadership, Board Governance and +11 skills\nShow all 7 experiences",
    "isCSuite": true,
    "contextForAI": "James Davies\n He/Him  \n2nd degree connection\n2nd\nActing Executive Director at West London Synagogue\nWest London Synagogue of British Jews\nUniversity of Portsmouth\nLondon, England, United Kingdom  Contact info\n234 connections\nIwona Plumpton is a mutual connection\nIwona Plumpton is a mutual connection\nConnect\nMessage\nMore\nAbout\nAbout\nI have over 25 years‚Äô experience of working as a senior manager within the voluntary and statutory sectors. I am passionate about supporting people achieve their goals. I have a strong track record of increasing outcomes for service users‚Äô whist improving service delivery across multiple projects. I have extensive experience of managing large staff teams, dealing with complex budgets and increasing business opportunities. I am now looking for my next challenge, utilising both my strategic and operational experience.\nI have over 25 years‚Äô experience of working as a senior manager within the voluntary and statutory sectors. I am passionate about supporting people achieve their goals. I have a strong track record of increasing outcomes for service users‚Äô whist improving service delivery across multiple projects. I have extensive experience of managing large staff teams, dealing with complex budgets and increasing business opportunities. I am now looking for my next challenge, utilising both my strategic and operational experience.\n‚Ä¶see more\nActivity\nActivity\n242 followers\n242 followers\nLoaded 3 Comments posts\nJames Davies commented on a post ‚Ä¢ 6mo\n6mo\nCongratulations! üéâ\nCongratulations! üéâ\nJames Davies commented on a post ‚Ä¢ 6mo\n6mo\nCongrats and good luck üëèüèº\nCongrats and good luck üëèüèº\nJames Davies commented on a post ‚Ä¢ 6mo\n6mo\nBrilliant work Naddy üëèüèº\nBrilliant work Naddy üëèüèº\nShow all comments\nExperience\nExperience\nActing Executive Director\nActing Executive Director\nWest London Synagogue of British Jews ¬∑ Full-time\nWest London Synagogue of British Jews ¬∑ Full-time\nJan 2025 - Present ¬∑ 1 yr 2 mos\nJan 2025 to Present ¬∑ 1 yr 2 mos\nDirector of Operations\nDirector of Operations\nDirector of Operations\nWest London Synagogue of British Jews ¬∑ Full-time\nWest London Synagogue of British Jews ¬∑ Full-time\nAug 2023 - Feb 2025 ¬∑ 1 yr 7 mos\nAug 2023 to Feb 2025 ¬∑ 1 yr 7 mos\nGreater London, England, United Kingdom ¬∑ On-site\nGreater London, England, United Kingdom ¬∑ On-site\nQuo Vadis Trust\nQuo Vadis Trust\nFull-time ¬∑ 4 yrs 6 mos\nFull-time ¬∑ 4 yrs 6 mos\nGreater London, England, United Kingdom\nGreater London, England, United Kingdom\nDirector Of Operations\nDirector Of Operations\nJan 2022 - May 2023 ¬∑ 1 yr 5 mos\nJan 2022 to May 2023 ¬∑ 1 yr 5 mos\nLeadership, Board Governance and +11 skills\nHead Of Operations\nHead Of Operations\nDec 2018 - Jan 2022 ¬∑ 3 yrs 2 mos\nDec 2018 to Jan 2022 ¬∑ 3 yrs 2 mos\nLeadership, Board Governance and +11 skills\nAssistant Director\nAssistant Director\nHillside Clubhouse ¬∑ Full-time\nHillside Clubhouse ¬∑ Full-time\nMay 2016 - Dec 2018 ¬∑ 2 yrs 8 mos\nMay 2016 to Dec 2018 ¬∑ 2 yrs 8 mos\nGreater London, England, United Kingdom\nGreater London, England, United Kingdom\nLeadership, Board Governance and +11 skills\nHead of Services \nHead of Services \nhalow project ¬∑ Full-time\nhalow project ¬∑ Full-time\nMay 2015 - May 2016 ¬∑ 1 yr 1 mo\nMay 2015 to May 2016 ¬∑ 1 yr 1 mo\nSurrey, England, United Kingdom\nSurrey, England, United Kingdom\nLeadership, Board Governance and +11 skills\nShow all 7 experiences\nEducation\nEducation\nUniversity of Portsmouth\nUniversity of Portsmouth\nMSc, Psychology\nMSc, Psychology\nSkills\nSkills\nFinancial Planning\nFinancial Planning\n5 experiences across Quo Vadis Trust and 3 other companies\n5 experiences across Quo Vadis Trust and 3 other companies\nOperations Management\nOperations Management\n5 experiences across Quo Vadis Trust and 3 other companies\n5 experiences across Quo Vadis Trust and 3 other companies\nEndorsed by 1 person in the last 6 months\nEndorsed by 1 person in the last 6 months\n1 endorsement\n1 endorsement\nShow all 13 skills\nHonors & awards\nHonors & awards\nNational Care Award for Innovation\nNational Care Award for Innovation\nIssued by National care Awards ¬∑ Jan 2021\nIssued by National care Awards ¬∑ Jan 2021\nAssociated with Quo Vadis Trust\nAssociated with Quo Vadis Trust\nAwarded a National Care Award for innovation for developing rough sleepers scheme in partnership with Lewisham Borough Council\nAwarded a National Care Award for innovation for developing rough sleepers scheme in partnership with Lewisham Borough Council\nInterests\nInterests\nCompanies\nCompanies\nGroups\nGroups\nNewsletters\nNewsletters\nSchools\nSchools\nNational Institute of Mental Health (NIMH)\nNational Institute of Mental Health (NIMH)\n559,868 followers\n559,868 followers\nFollow\nUniversity of Portsmouth\nUniversity of Portsmouth\n214,199 followers\n214,199 followers\nFollow\nShow all companies",
    "searchKeyword": "CEO"
  },
  {
    "profileUrl": "https://www.linkedin.com/in/abigail-egharevba-8a467311b",
    "name": "Abigail Egharevba",
    "title": "Managing Director / Chief Executive Officer at Meegail Services Limited",
    "location": "Nigeria",
    "company": "Meegail Services Limited",
    "about": "",
    "experience": "Experience\nExperience\nMD / CEO\nMD / CEO \nMD / CEO \nMeegail Services Limited\nMeegail Services Limited\nSep 2016 - Present ¬∑ 9 yrs 6 mos\nSep 2016 to Present ¬∑ 9 yrs 6 mos\nLagos, Nigeria\nLagos, Nigeria\nHealth and Safety Manager\nHealth and Safety Manager\nHealth and Safety Manager\nGuinness Nigeria ( a diageo Company)\nGuinness Nigeria ( a diageo Company)\nNov 2000 - Apr 2016 ¬∑ 15 yrs 6 mos\nNov 2000 to Apr 2016 ¬∑ 15 yrs 6 mos\nLagos\nLagos\nFocused and very experienced in Occupational health and safety practice.. An Occupational Health Nurse with 19years experience in the areas of occupational Health and Safety management, emergency management services and safety prevention programs. \n( 15 years of Occupational Health and 4 years of safety practice).\n\nFocused and very experienced in Occupational health and safety practice.. An Occupational Health Nurse with 19years experience in the areas of occupational Health and Safety management, emergency management services and safety prevention programs. ( 15 years of Occupational Health and 4 years of safety practice). \n‚Ä¶see more\nNursing Manager\nNursing Manager\nGuinness Nigeria\nGuinness Nigeria\nNov 2000 - Jun 2012 ¬∑ 11 yrs 8 mos\nNov 2000 to Jun 2012 ¬∑ 11 yrs 8 mos\nLagos, Nigeria\nLagos, Nigeria\nEvaluated clinical care services and all administrative operations and activities. Maintained the structure and staffing of the clinic to effectively meet the needs of the patients by the suitable application of Nurse Practice standards.\n\nÔÉò Proper History taking, prompt diagnosis and on the spot provision of evidence based caring interventions\n\nÔÉò Implemented drug monitoring system to ensure availability of quality drugs within approved budget\n\nÔÉò Provide and coordinate patient care, educate patients and staff community about various health conditions( e.g. Global health threats)\n\nÔÉò Provided emotional support and encouraged patients to be active participants in their recovery\n\nEvaluated clinical care services and all administrative operations and ac",
    "isCSuite": true,
    "contextForAI": "Abigail Egharevba\n2nd degree connection\n2nd\nManaging Director / Chief Executive Officer at Meegail Services Limited\nMeegail Services Limited\nNigeria  Contact info\n230 connections\nEWEJE, Oyeniyi - CPHR Candidate is a mutual connection\nEWEJE, Oyeniyi - CPHR Candidate is a mutual connection\nConnect\nMessage\nMore\nActivity\nActivity\n233 followers\n233 followers\nPosts\nComments\nLoaded 2 Posts posts\nAbigail Egharevba\nAbigail Egharevba\n ‚Ä¢ 2nd\n2nd\nManaging Director / Chief Executive Officer at Meegail Services Limited\nManaging Director / Chief Executive Officer at Meegail Services Limited\n6mo ‚Ä¢ \n6 months ago ‚Ä¢ Visible to anyone on or off LinkedIn\nThis is a very inspiring place to be. I urge all teachers to leverage this all time privilege.\nsee you there!\nOluwakemi Ajayi\nOluwakemi Ajayi\n   ‚Ä¢ 3rd+\nVerified ‚Ä¢ 3rd+\nCEO & Founder, Giant Strides Online School | Building a global EdTech platform delivering academics & future-ready tech skills üîµ Raising confident learners | Empowering parents | Founder, Techy Teacherpreneur Community\nCEO & Founder, Giant Strides Online School | Building a global EdTech platform delivering academics & future-ready tech skills üîµ Raising confident learners | Empowering parents | Founder, Techy Teacherpreneur Community\nhashtag\n#SPONSOR SPOTLIGHT!\nWe‚Äôre thrilled to introduce GMIND AI as one of our official sponsors for the TAP Conference 2025,\nThe Empowered Teacher Edition üéâ\nGMIND AI is redefining virtual education with innovation and excellence. \nWith their revolutionary Class Hub, \nhashtag\n#educators can now enjoy:\n‚úÖ Smart lesson planning\n‚úÖ Real-time interaction\n‚úÖ Personalized learning paths\n‚úÖ AI-powered tools for feedback and assessment\nWhether you're teaching remotely or learning from home, \nGMIND AI ensures a seamless, powerful, and stress-free teaching experience all in one platform.\nWe are proud to partner with a \nhashtag\n#brand that shares our vision of making \nhashtag\n#education simple, accessible, and transformational for every \nhashtag\n#teacher.\nJoin us on 2nd August, 2025 at CEDS Hall, Covenant University, Ota as we build brands, income, and impact for 21st-century educators.\nüìå Learn more and register now: https://lnkd.in/dSNXAV5u\nüìû For Enquiries: +2349073141035\nYour \nhashtag\n#Teaching. \nGMIND AI Technology. \nOne Powerful Experience.\nhashtag\n#TAPConference2025 \nhashtag\n#TheEmpoweredTeacher \nhashtag\n#GmindAI \nhashtag\n#AIinEducation \nhashtag\n#EdTechInnovation \nhashtag\n#GiantStridesEduTech \nhashtag\n#VirtualLearning \nhashtag\n#SmartTeachingTools \nhashtag\n#TeacherTransformation\n‚Ä¶more\nActivate to view larger image,\nActivate to view larger image,\n1\n2 comments\nAbigail Egharevba reposted this\nùêèùê´ùê¢ùêßùêúùêû ùêñùê®ùêßùê®ùêùùê¢\nùêèùê´ùê¢ùêßùêúùêû ùêñùê®ùêßùê®ùêùùê¢\n ‚Ä¢ 3rd+\n3rd+\nProfessional Forex Trader (The Forex Magician) | Oil & Gas Specialist | Cybersecurity Expert | Educator | News Reporter | Traveler | Website Developer | Creator of Valuable Video Content | Professional Degital Marketer\nProfessional Forex Trader (The Forex Magician) | Oil & Gas Specialist | Cybersecurity Expert | Educator | News Reporter | Traveler | Website Developer | Creator of Valuable Video Content | Professional Degital Marketer\n9mo ‚Ä¢ \n9 months ago ‚Ä¢ Visible to anyone on or off LinkedIn\nSENTENCED TO DE√ÅTH BECAUSE OF ONE MINUTE CALL FROM HIS PHONE BY A STRANGER.\nA stranger comes to you and says help me with only one minute of call from your phone. My phone is de@d and I need to call someone urgently, and you, being a nice person, say no problem, take and make the call.\nDo you know what you have done? If your phone is used to call someone they want to go and k¬°ll or someone they just poisoned and when investigation starts and they have to check who called them last and your number shows up‚Ä¶.\nLet me break down what will happen to you so that you will learn something today from this.\nFirst of all, you will be arrested for whatever cr|me because your phone was used to make that call and it will be considered that you know the person that‚Äôs why you gave the person your phone and it‚Äôs a known deal between both of you.\nSecondly, since the inception of Mobile Networks, your phone is your personal property that you will answer for anything that happens on it or through it.\nSo, for these reasons, you will be arrested and kept in detention until all investigations are\ncompleted. Even if the investigation takes 6 months or 2 years, that means you will be locked up for that period of time over the fact that you just lent someone your phone to make a one minute call.\nDo you now see that your good heart that is void of carefulness can lead you to something so b@d? *And ignorance of the law is not an excuse before the law.\nDon‚Äôt be stingy with this information. Share it with your family and friends so they can learn from this.\n‚Ä¶more\nActivate to view larger image,\nActivate to view larger image,\n264\n65 comments\n35 reposts\nShow all posts\nExperience\nExperience\nMD / CEO\nMD / CEO \nMD / CEO \nMeegail Services Limited\nMeegail Services Limited\nSep 2016 - Present",
    "searchKeyword": "CEO"
  },
  {
    "profileUrl": "https://www.linkedin.com/in/chantal-free-111565a",
    "name": "Chantal Free",
    "title": "Former Chief Executive Officer, Ocorian",
    "location": "London, England, United Kingdom",
    "company": "Latymer Upper School",
    "about": "",
    "experience": "Experience\nExperience\nGovernor and Trustee\nGovernor and Trustee\nLatymer Upper School\nLatymer Upper School\nJan 2018 - Present ¬∑ 8 yrs 2 mos\nJan 2018 to Present ¬∑ 8 yrs 2 mos\nLondon Area, United Kingdom\nLondon Area, United Kingdom\nBoard Governor as well as Member of the Audit & Risk Committee and Member of Nomination, Remuneration & Governance Committee\nBoard Governor as well as Member of the Audit & Risk Committee and Member of Nomination, Remuneration & Governance Committee\nEducation and NED\nChief Executive Officer\nChief Executive Officer\nOcorian\nOcorian\nSep 2023 - Feb 2026 ¬∑ 2 yrs 6 mos\nSep 2023 to Feb 2026 ¬∑ 2 yrs 6 mos\nCapita\nCapita\nFull-time ¬∑ 3 yrs 10 mos\nFull-time ¬∑ 3 yrs 10 mos\nLondon, United Kingdom\nLondon, United Kingdom\nChief Executive Officer, Capita Portfolio\nChief Executive Officer, Capita Portfolio\nAug 2021 - Jul 2023 ¬∑ 2 yrs\nAug 2021 to Jul 2023 ¬∑ 2 yrs\nChantal leads Capita's Portfolio Division, consisting of all non-core assets that are earmarked for disposal. Assets are in industries as varied as technology, software, property, people, travel, business solutions and agri-science. The role involves strategic planning for each business in light of the disposal objective, P&L management of the assets as well as planning and execution of transactions.\nChantal leads Capita's Portfolio Division, consisting of all non-core assets that are earmarked for disposal. Assets are in industries as varied as technology, software, property, people, travel, business solutions and agri-science. The role involves strategic planning for each business in light of the disposal objective, P&L management of the assets as well as planning and execution of transactions.\nStrategy, Employee Engagement and +2 skills\nExecutive Officer, People Solutions\nExecutive Officer, People Solutions\nOct 2019 - Aug 2021 ¬∑ 1 yr 11 mos\nOct 2019 to Aug 2021 ¬∑ 1 yr 11 mos\nChantal joined Capita to lead and transform its People Solutions Division, a division of ¬£600m in revenue and employing over 6",
    "isCSuite": true,
    "contextForAI": "Chantal Free \n3rd degree connection\n3rd\nFormer Chief Executive Officer, Ocorian\nLatymer Upper School\nImperial College London\nLondon, England, United Kingdom  Contact info\n500+ connections\nConnect\nMessage\nMore\nHighlights\nHighlights\nChantal recently posted on LinkedIn\nChantal recently posted on LinkedIn\nUnderstand what topics Chantal posts about to inform your outreach.\nUnderstand what topics Chantal posts about to inform your outreach.\nFree insight from Sales Navigator\nFree insight from Sales Navigator\nUnlock more insights about leads\nImprove outreach with sales insights\nTry Sales Navigator for ¬£0\n1-month free. We‚Äôll remind you 7 days before your trial ends.\nAbout\nAbout\nChantal is a global business leader with over 25 years experience in leading successful businesses, frequently in transformation. She leads through strategic mindset, client focused approach, technology adoption and shrewd financial discipline.\nChantal joined Ocorian, a global leader in fund administration, capital markets, corporate and fiduciary services, as CEO in September 2023. The organisation manage over 15,000 structures on behalf of 8,000+ clients, including financial institutions, large-scale international organisations and high-net-worth individuals, across more than 20 jurisdictions. \nPrior to joining Ocorian, Chantal was CEO for Capita‚Äôs Portfolio Division. The division comprised of over 30 businesses that were considered non-core to Capita and were exited over a two year period. Chantal's role included leading these businesses successfully as well as preparing them for and executing upon their disposals. She took on this role after leading Capita's People Solutions division (a ¬£600m division comprising various HR businesses) for about two years.\nPrior to joining Capita, Chantal held a number of senior roles at Willis Towers Watson, with her last role being the leadership of the Human Capital & Benefits business in Western Europe.\nChantal graduated from Imperial College, London with an MBA and spent her professional career in Europe and in Asia. She speaks a number of European languages. She also has the privilege to serve as a Governor of Latymer Upper School and as Trustee of the Latymer Foundation.\nChantal is a global business leader with over 25 years experience in leading successful businesses, frequently in transformation. She leads through strategic mindset, client focused approach, technology adoption and shrewd financial discipline. Chantal joined Ocorian, a global leader in fund administration, capital markets, corporate and fiduciary services, as CEO in September 2023. The organisation manage over 15,000 structures on behalf of 8,000+ clients, including financial institutions, large-scale international organisations and high-net-worth individuals, across more than 20 jurisdictions. Prior to joining Ocorian, Chantal was CEO for Capita‚Äôs Portfolio Division. The division comprised of over 30 businesses that were considered non-core to Capita and were exited over a two year period. Chantal's role included leading these businesses successfully as well as preparing them for and executing upon their disposals. She took on this role after leading Capita's People Solutions division (a ¬£600m division comprising various HR businesses) for about two years. Prior to joining Capita, Chantal held a number of senior roles at Willis Towers Watson, with her last role being the leadership of the Human Capital & Benefits business in Western Europe. Chantal graduated from Imperial College, London with an MBA and spent her professional career in Europe and in Asia. She speaks a number of European languages. She also has the privilege to serve as a Governor of Latymer Upper School and as Trustee of the Latymer Foundation.\n‚Ä¶see more\nActivity\nActivity\n2,596 followers\n2,596 followers\nPosts\nComments\nLoaded 9 Posts posts\nChantal Free\nChantal Free\n   ‚Ä¢ 3rd+\nVerified ‚Ä¢ 3rd+\nFormer Chief Executive Officer, Ocorian\nFormer Chief Executive Officer, Ocorian\n2w ‚Ä¢ \n2 weeks ago ‚Ä¢ Visible to anyone on or off LinkedIn\nCongratulations to Craig Buick and Yegor Lanovenko on their appointment as Co-CEOs of Ocorian. During the last few years, we positioned Ocorian to become a global premier asset servicing business. With our move into a Continuation Fund, it was the right time for me to pass the baton. Craig and Yegor are ideally positioned to take it forward. \nI feel very privileged to have been the CEO of Ocorian. Thanks to all my colleagues at Ocorian who always kept our clients at the centre of what we do. Thanks also to our Inflexion partners Florencia Kassai, George Collier and Marcus W. our Non-Exec directors Nick Cawley, Rick Medlock and Martin Block, and our past Chair Frederik van Tuyll for their unwavering support and counsel.\nI now look forward to the next chapter which, I hope, will involve moving to a portfolio career.\n‚Ä¶more\nOcorian\nOcorian\n80,019 followers\n80,019 followers\nAs Ocorian continues to grow and evolve, we are¬†pleased to announce that Cra",
    "searchKeyword": "CEO"
  },
  {
    "profileUrl": "https://www.linkedin.com/in/harry-elkington-1275a5b5",
    "name": "Harry Elkington",
    "title": "Chief Operating Officer at H&P Executive Search",
    "location": "Greater London, England, United Kingdom",
    "company": "H&P Executive Search",
    "about": "",
    "experience": "Experience\nExperience\nH&P Executive Search\nH&P Executive Search\nFull-time ¬∑ 5 yrs 8 mos\nFull-time ¬∑ 5 yrs 8 mos\nGreater London, England, United Kingdom\nGreater London, England, United Kingdom\nChief Operating Officer\nChief Operating Officer\nFeb 2024 - Present ¬∑ 2 yrs 1 mo\nFeb 2024 to Present ¬∑ 2 yrs 1 mo\nOn-site\nOn-site\nHead of People Operations\nHead of People Operations\nJul 2020 - Feb 2024 ¬∑ 3 yrs 8 mos\nJul 2020 to Feb 2024 ¬∑ 3 yrs 8 mos\nBusiness Partner\nBusiness Partner\nPhaidon International ¬∑ Part-time\nPhaidon International ¬∑ Part-time\nFeb 2020 - Apr 2020 ¬∑ 3 mos\nFeb 2020 to Apr 2020 ¬∑ 3 mos\nLondon Area, United Kingdom\nLondon Area, United Kingdom\nBusiness Partner\nBusiness Partner\nInvestigo ¬∑ Part-time\nInvestigo ¬∑ Part-time\nAug 2019 - Jan 2020 ¬∑ 6 mos\nAug 2019 to Jan 2020 ¬∑ 6 mos\nLondon Area, United Kingdom\nLondon Area, United Kingdom\nGQR Global Markets\nGQR Global Markets\n2 yrs 3 mos\n2 yrs 3 mos\nAssociate Vice President\nAssociate Vice President\nApr 2018 - Aug 2019 ¬∑ 1 yr 5 mos\nApr 2018 to Aug 2019 ¬∑ 1 yr 5 mos\nNew York, United States ¬∑ Hybrid\nNew York, United States ¬∑ Hybrid\nSenior Associate\nSenior Associate\nJun 2017 - Apr 2018 ¬∑ 11 mos\nJun 2017 to Apr 2018 ¬∑ 11 mos\nLondon Area, United Kingdom\nLondon Area, United Kingdom\nPhaidon International\nPhaidon International\n2 yrs 4 mos\n2 yrs 4 mos\nLondon Area, United Kingdom\nLondon Area, United Kingdom\nInternal Recruiter - London\nInternal Recruiter - London\nFeb 2016 - Jun 2017 ¬∑ 1 yr 5 mos\nFeb 2016 to Jun 2017 ¬∑ 1 yr 5 mos\nRecruitment Consultant (DSJ Global, Part of Phaidon International)\nRecruitment Consultant (DSJ Global, Part of Phaidon International)\nMar 2015 - Feb 2016 ¬∑ 1 yr\nMar 2015 to Feb 2016 ¬∑ 1 yr",
    "isCSuite": true,
    "contextForAI": "Harry has a {:badgeType} account\nHarry Elkington\n3rd degree connection\n3rd\nChief Operating Officer at H&P Executive Search\nH&P Executive Search\nPoint Blank Music School\nGreater London, England, United Kingdom  Contact info\n500+ connections\nConnect\nMessage\nMore\nHighlights\nHighlights\nHarry recently posted on LinkedIn\nHarry recently posted on LinkedIn\nUnderstand what topics Harry posts about to inform your outreach.\nUnderstand what topics Harry posts about to inform your outreach.\nFree insight from Sales Navigator\nFree insight from Sales Navigator\nUnlock more insights about leads\nImprove outreach with sales insights\nTry Sales Navigator for ¬£0\n1-month free. We‚Äôll remind you 7 days before your trial ends.\nActivity\nActivity\n18,003 followers\n18,003 followers\nPosts\nComments\nVideos\nImages\nLoaded 9 Posts posts\nHarry Elkington\nHarry Elkington\n   ‚Ä¢ 3rd+\nPremium ‚Ä¢ 3rd+\nChief Operating Officer at H&P Executive Search\nChief Operating Officer at H&P Executive Search\n1d ‚Ä¢ \n1 day ago ‚Ä¢ Visible to anyone on or off LinkedIn\nYou can‚Äôt bolt automation onto a rubbish pile and expect magic...\nI‚Äôve been implementing more AI internally and having pretty regular conversations with providers ‚Äì about 4 or 5 a month.\nIf I'm honest, lots of them¬†are doing similar things. \nAnd the position I keep coming back to is: none of it really matters unless your data is clean, structured, and built properly.\nSo, the real question is ‚Äì what are we selling that an internal recruitment function with AI can‚Äôt replicate?\nFor us, it‚Äôs our dataset, IP, and our¬†team‚Äôs market insight, context and judgement.\nAI will keep levelling up, and when it does, we‚Äôll innovate again to stay ahead. That‚Äôs¬†more exciting than daunting in my opinion.\nI‚Äôve shared some more thoughts you can read here: \nhttps://lnkd.in/edfaigbF\n‚Ä¶more\nSmarter, faster, but not wiser ‚Äì yet: The limits of AI in recruitment - H&P Executive Search\nhpexec.com\n28\n9 comments\n1 repost\nHarry Elkington\nHarry Elkington\n   ‚Ä¢ 3rd+\nPremium ‚Ä¢ 3rd+\nChief Operating Officer at H&P Executive Search\nChief Operating Officer at H&P Executive Search\n1mo ‚Ä¢ \n1 month ago ‚Ä¢ Visible to anyone on or off LinkedIn\nJust wanted to shout out Zac Turner for his unreal start at the business. I think its safe to say, changing market specificity after 10 years in industry would be daunting for anyone. But one thing that is essential in getting up and running in a new vertical is perseverance. \nI am sure Zac wouldn't mind me saying that there were a lot of long nights and set backs, especially in first 3 months, to get him to where he is now. Going from a business leader to a learner of a new market is a difficult thing for some people to comprehend. This requires a few things, but most importantly, leaving the ego at the door. I think anyone who has met Zac inside the business will say his humility so far has been admirable. \nOne thing we have now got an excellent track record of across the business is recruiting from other markets and integrating them into high performing teams internally. We are currently hiring across a few business units internally both in London and Miami, and as ever, we are considering people to change market. \nIf you would be interested in hearing about what a market change could look like for you, please reach out.\n‚Ä¶more\nH&P Executive Search\nH&P Executive Search\n78,549 followers\n78,549 followers\nA great milestone for Zac Turner, who closed his first placements at H&P this week ‚Äì $175,000 and $125,000 on the same day.\nZac joined us only a few months ago as an experienced hire and made a market transition on arrival. Delivering two placements in one day, including the largest of his career to date, reflects both his experience and execution.\nThis is exactly what H&P is about ‚Äì creating an environment that helps people unlock a new level in their career, whether they are early on or already well established.\nHuge congratulations, Zac. An exceptional start!\nIf you‚Äôre curious about what that next step could look like for you, feel free to get in touch Jack Hayes, Harry Elkington\nhashtag\n#recruitment \nhashtag\n#hiring \nhashtag\n#careers\n‚Ä¶more\nActivate to view larger image,\nActivate to view larger image,\n31\n11 comments\nShow all posts\nExperience\nExperience\nH&P Executive Search\nH&P Executive Search\nFull-time ¬∑ 5 yrs 8 mos\nFull-time ¬∑ 5 yrs 8 mos\nGreater London, England, United Kingdom\nGreater London, England, United Kingdom\nChief Operating Officer\nChief Operating Officer\nFeb 2024 - Present ¬∑ 2 yrs 1 mo\nFeb 2024 to Present ¬∑ 2 yrs 1 mo\nOn-site\nOn-site\nHead of People Operations\nHead of People Operations\nJul 2020 - Feb 2024 ¬∑ 3 yrs 8 mos\nJul 2020 to Feb 2024 ¬∑ 3 yrs 8 mos\nBusiness Partner\nBusiness Partner\nPhaidon International ¬∑ Part-time\nPhaidon International ¬∑ Part-time\nFeb 2020 - Apr 2020 ¬∑ 3 mos\nFeb 2020 to Apr 2020 ¬∑ 3 mos\nLondon Area, United Kingdom\nLondon Area, United Kingdom\nBusiness Partner\nBusiness Partner\nInvestigo ¬∑ Part-time\nInvestigo ¬∑ Part-time\nAug 2019 - Jan 2020 ¬∑ 6 mos\nAug 2019 to Jan 2020 ¬∑ 6 mos\nLon",
    "searchKeyword": "CEO"
  },
  {
    "profileUrl": "https://www.linkedin.com/in/isla-taylor-a73a17168",
    "name": "Isla Taylor",
    "title": "Operating Partner @ Isomorphic Labs (Ex-Google DeepMind)",
    "location": "London, England, United Kingdom",
    "company": "Isomorphic Labs",
    "about": "",
    "experience": "Experience\nExperience\nIsomorphic Labs\nIsomorphic Labs\nFull-time ¬∑ 1 yr 11 mos\nFull-time ¬∑ 1 yr 11 mos\nOperating Partner\nOperating Partner\nDec 2024 - Present ¬∑ 1 yr 3 mos\nDec 2024 to Present ¬∑ 1 yr 3 mos\nExecutive Assistant to the President & Chief People Officer\nExecutive Assistant to the President & Chief People Officer\nApr 2024 - Dec 2024 ¬∑ 9 mos\nApr 2024 to Dec 2024 ¬∑ 9 mos\nLondon Area, United Kingdom\nLondon Area, United Kingdom\nExecutive Assistant (Administrative Business Partner)\nExecutive Assistant (Administrative Business Partner)\nGoogle DeepMind ¬∑ Full-time\nGoogle DeepMind ¬∑ Full-time\nAug 2022 - Dec 2024 ¬∑ 2 yrs 5 mos\nAug 2022 to Dec 2024 ¬∑ 2 yrs 5 mos\nGreater London, England, United Kingdom\nGreater London, England, United Kingdom\nRecruiting Coordinator\nRecruiting Coordinator\nGoogle ¬∑ Full-time\nGoogle ¬∑ Full-time\nJan 2022 - Aug 2022 ¬∑ 8 mos\nJan 2022 to Aug 2022 ¬∑ 8 mos\nGreater London, England, United Kingdom\nGreater London, England, United Kingdom\nRecruitment Executive\nRecruitment Executive\nSnug ‚Äì The Sofa in a Box Company ¬∑ Full-time\nSnug ‚Äì The Sofa in a Box Company ¬∑ Full-time\nJul 2021 - Jan 2022 ¬∑ 7 mos\nJul 2021 to Jan 2022 ¬∑ 7 mos\nRecruitment Consultant\nRecruitment Consultant\nSilver Swan Recruitment ¬∑ Full-time\nSilver Swan Recruitment ¬∑ Full-time\nOct 2018 - Mar 2021 ¬∑ 2 yrs 6 mos\nOct 2018 to Mar 2021 ¬∑ 2 yrs 6 mos\nLondon Area, United Kingdom\nLondon Area, United Kingdom",
    "isCSuite": true,
    "contextForAI": "Isla Taylor \n She/Her  \n2nd degree connection\n2nd\nOperating Partner @ Isomorphic Labs (Ex-Google DeepMind)\nIsomorphic Labs\nUniversity of Leeds\nLondon, England, United Kingdom  Contact info\n500+ connections\nMessage\nMore\nFeatured\nFeatured\nImage\nImage\nA team and their totes\nA team and their totes\nImage\nImage\nPlastic Patrol Clean Up\nPlastic Patrol Clean Up\nActivity\nActivity\n1,015 followers\n1,015 followers\nIsla hasn‚Äôt posted yet\nRecent posts Isla shares will be displayed here.\nShow all activity\nExperience\nExperience\nIsomorphic Labs\nIsomorphic Labs\nFull-time ¬∑ 1 yr 11 mos\nFull-time ¬∑ 1 yr 11 mos\nOperating Partner\nOperating Partner\nDec 2024 - Present ¬∑ 1 yr 3 mos\nDec 2024 to Present ¬∑ 1 yr 3 mos\nExecutive Assistant to the President & Chief People Officer\nExecutive Assistant to the President & Chief People Officer\nApr 2024 - Dec 2024 ¬∑ 9 mos\nApr 2024 to Dec 2024 ¬∑ 9 mos\nLondon Area, United Kingdom\nLondon Area, United Kingdom\nExecutive Assistant (Administrative Business Partner)\nExecutive Assistant (Administrative Business Partner)\nGoogle DeepMind ¬∑ Full-time\nGoogle DeepMind ¬∑ Full-time\nAug 2022 - Dec 2024 ¬∑ 2 yrs 5 mos\nAug 2022 to Dec 2024 ¬∑ 2 yrs 5 mos\nGreater London, England, United Kingdom\nGreater London, England, United Kingdom\nRecruiting Coordinator\nRecruiting Coordinator\nGoogle ¬∑ Full-time\nGoogle ¬∑ Full-time\nJan 2022 - Aug 2022 ¬∑ 8 mos\nJan 2022 to Aug 2022 ¬∑ 8 mos\nGreater London, England, United Kingdom\nGreater London, England, United Kingdom\nRecruitment Executive\nRecruitment Executive\nSnug ‚Äì The Sofa in a Box Company ¬∑ Full-time\nSnug ‚Äì The Sofa in a Box Company ¬∑ Full-time\nJul 2021 - Jan 2022 ¬∑ 7 mos\nJul 2021 to Jan 2022 ¬∑ 7 mos\nRecruitment Consultant\nRecruitment Consultant\nSilver Swan Recruitment ¬∑ Full-time\nSilver Swan Recruitment ¬∑ Full-time\nOct 2018 - Mar 2021 ¬∑ 2 yrs 6 mos\nOct 2018 to Mar 2021 ¬∑ 2 yrs 6 mos\nLondon Area, United Kingdom\nLondon Area, United Kingdom\nEducation\nEducation\nUniversity of Leeds\nUniversity of Leeds\nBachelor of Arts - BA, Politics\nBachelor of Arts - BA, Politics\n2015 - 2018\n2015 - 2018\nRecommendations\nRecommendations\nReceived\nReceived\nGiven\nGiven\nNothing to see for now\nNothing to see for now\nRecommendations that Isla receives will appear here.\nRecommendations that Isla receives will appear here.\nInterests\nInterests\nTop Voices\nTop Voices\nCompanies\nCompanies\nNewsletters\nNewsletters\nSchools\nSchools\nDemis Hassabis\nDemis Hassabis\n¬∑ 3rd\nThird degree connection\nCo-Founder & CEO, Google DeepMind\nCo-Founder & CEO, Google DeepMind\n233,932 followers\n233,932 followers\nFollow\nMayor of London, Sadiq Khan\nMayor of London, Sadiq Khan\nMayor of London at Greater London Authority\nMayor of London at Greater London Authority\n644,152 followers\n644,152 followers\nFollow",
    "searchKeyword": "CEO"
  },
  {
    "profileUrl": "https://www.linkedin.com/in/jo-barratt-93473a10",
    "name": "Jo Barratt",
    "title": "Founder and CEO Forest Freedom",
    "location": "Greater London, England, United Kingdom",
    "company": "FOREST FREEDOM",
    "about": "",
    "experience": "Experience\nExperience\nChief Executive Officer\nChief Executive Officer\nChief Executive Officer\nFOREST FREEDOM ¬∑ Self-employed\nFOREST FREEDOM ¬∑ Self-employed\nSep 2021 - Present ¬∑ 4 yrs 6 mos\nSep 2021 to Present ¬∑ 4 yrs 6 mos\nGreater London, England, United Kingdom\nGreater London, England, United Kingdom\nWHAT WE OFFER:\nWe are a Forest School Activity club based in Wandsworth and Merton across various sites. Offering imaginative and creative sessions for 1 ‚Äì 11 year olds, and local nurseries who don‚Äôt have their own Forest School. Sessions are run during the day for our tadpoles and we run after school, weekend and holiday clubs for our froglets and above. We also run some Frogatastic parties at the weekends! \n\nHOW WE DO IT:\nWe get children enjoying and exploring the great outdoors, in all seasons! Using the Forest School ethos, we deliver imaginative and creative sessions to ensure children grow and develop their self esteem and confidence. Nurturing their curiosity and sense of adventure through teamwork and independent play, developing fine and gross motor skills, in a safe and fun environment. Sessions include nature exploration, arts & crafts, storytelling, sensory play, music, games, den building, bushcraft and so much more!\nWHAT WE OFFER: We are a Forest School Activity club based in Wandsworth and Merton across various sites. Offering imaginative and creative sessions for 1 ‚Äì 11 year olds, and local nurseries who don‚Äôt have their own Forest School. Sessions are run during the day for our tadpoles and we run after school, weekend and holiday clubs for our froglets and above. We also run some Frogatastic parties at the weekends! HOW WE DO IT: We get children enjoying and exploring the great outdoors, in all seasons! Using the Forest School ethos, we deliver imaginative and creative sessions to ensure children grow and develop their self esteem and confidence. Nurturing their curiosity and sense of adventure through teamwork and independent play, developing fine an",
    "isCSuite": true,
    "contextForAI": "Jo Barratt\n2nd degree connection\n2nd\nFounder and CEO Forest Freedom\nFOREST FREEDOM\nUniversity of Exeter\nGreater London, England, United Kingdom  Contact info\n500+ connections\nRobert Lynch is a mutual connection\nRobert Lynch is a mutual connection\nConnect\nMessage\nMore\nAbout\nAbout\nI am the proud founder and owner of Forest Freedom. A children‚Äôs activity club based on the principles of Forest school, but focused on the mission of getting children playing. Based in South West London we run sessions for local schools and nurseries, holiday camps and children‚Äôs parties. \nPreviously I have worked across multiple industries. In start-ups, private equity and large corporations. I‚Äôve been a consultant, MD, OD and a ROM, managed large multi-disciplinary teams, implemented many strategic projects, grown hospitality brands and delivered significant profit growth for businesses.\nI am the proud founder and owner of Forest Freedom. A children‚Äôs activity club based on the principles of Forest school, but focused on the mission of getting children playing. Based in South West London we run sessions for local schools and nurseries, holiday camps and children‚Äôs parties. Previously I have worked across multiple industries. In start-ups, private equity and large corporations. I‚Äôve been a consultant, MD, OD and a ROM, managed large multi-disciplinary teams, implemented many strategic projects, grown hospitality brands and delivered significant profit growth for businesses.\n‚Ä¶see more\nActivity\nActivity\n585 followers\n585 followers\nJo hasn‚Äôt posted yet\nRecent posts Jo shares will be displayed here.\nShow all activity\nExperience\nExperience\nChief Executive Officer\nChief Executive Officer\nChief Executive Officer\nFOREST FREEDOM ¬∑ Self-employed\nFOREST FREEDOM ¬∑ Self-employed\nSep 2021 - Present ¬∑ 4 yrs 6 mos\nSep 2021 to Present ¬∑ 4 yrs 6 mos\nGreater London, England, United Kingdom\nGreater London, England, United Kingdom\nWHAT WE OFFER:\nWe are a Forest School Activity club based in Wandsworth and Merton across various sites. Offering imaginative and creative sessions for 1 ‚Äì 11 year olds, and local nurseries who don‚Äôt have their own Forest School. Sessions are run during the day for our tadpoles and we run after school, weekend and holiday clubs for our froglets and above. We also run some Frogatastic parties at the weekends! \nHOW WE DO IT:\nWe get children enjoying and exploring the great outdoors, in all seasons! Using the Forest School ethos, we deliver imaginative and creative sessions to ensure children grow and develop their self esteem and confidence. Nurturing their curiosity and sense of adventure through teamwork and independent play, developing fine and gross motor skills, in a safe and fun environment. Sessions include nature exploration, arts & crafts, storytelling, sensory play, music, games, den building, bushcraft and so much more!\nWHAT WE OFFER: We are a Forest School Activity club based in Wandsworth and Merton across various sites. Offering imaginative and creative sessions for 1 ‚Äì 11 year olds, and local nurseries who don‚Äôt have their own Forest School. Sessions are run during the day for our tadpoles and we run after school, weekend and holiday clubs for our froglets and above. We also run some Frogatastic parties at the weekends! HOW WE DO IT: We get children enjoying and exploring the great outdoors, in all seasons! Using the Forest School ethos, we deliver imaginative and creative sessions to ensure children grow and develop their self esteem and confidence. Nurturing their curiosity and sense of adventure through teamwork and independent play, developing fine and gross motor skills, in a safe and fun environment. Sessions include nature exploration, arts & crafts, storytelling, sensory play, music, games, den building, bushcraft and so much more!\n‚Ä¶see more\nHospitality and Operations consultant (post maternity leave project)\nHospitality and Operations consultant (post maternity leave project)\nHospitality and Operations consultant (post maternity leave project)\nHospitaliy and Operations Consultant Sri Lanka ¬∑ Self-employed\nHospitaliy and Operations Consultant Sri Lanka ¬∑ Self-employed\nAug 2019 - Jul 2020 ¬∑ 1 yr\nAug 2019 to Jul 2020 ¬∑ 1 yr\nSri Lanka\nSri Lanka\nHired by Ticket to Ride Ltd to project manage the build of a new hotel, restaurant and surf house in Sri Lanka. Then implementing all operational, guest and financial processes.\nHired by Ticket to Ride Ltd to project manage the build of a new hotel, restaurant and surf house in Sri Lanka. Then implementing all operational, guest and financial processes.\nManaging Director\nManaging Director\nPoncho 8\nPoncho 8\nOct 2016 - Oct 2017 ¬∑ 1 yr 1 mo\nOct 2016 to Oct 2017 ¬∑ 1 yr 1 mo\nMexican Fast Food Chain in London, based across 6 sites. Employed to evaluate business model and create strategy for business of growth, closure or diversify.\nMexican Fast Food Chain in London, based across 6 sites. Employed to evaluate business model and create strategy for business of growth, closur",
    "searchKeyword": "CEO"
  },
  {
    "profileUrl": "https://www.linkedin.com/in/murray-auchincloss-33bba580",
    "name": "Murray Auchincloss",
    "title": "On gardening leave",
    "location": "London, England, United Kingdom",
    "company": "",
    "about": "",
    "experience": "Experience\nExperience\nAdvisor\nAdvisor\nAdvisor\nSelf-employed\nSelf-employed\nJan 2026 - Present ¬∑ 2 mos\nJan 2026 to Present ¬∑ 2 mos\nbp\nbp\n26 yrs 2 mos\n26 yrs 2 mos\nChief Executive Officer\nChief Executive Officer\nFull-time\nFull-time\nJan 2024 - Feb 2026 ¬∑ 2 yrs 2 mos\nJan 2024 to Feb 2026 ¬∑ 2 yrs 2 mos\nGreater London, England, United Kingdom ¬∑ On-site\nGreater London, England, United Kingdom ¬∑ On-site\nChief Financial Officer\nChief Financial Officer\nFull-time\nFull-time\nMar 2020 - Jan 2024 ¬∑ 3 yrs 11 mos\nMar 2020 to Jan 2024 ¬∑ 3 yrs 11 mos\nGreater London, England, United Kingdom\nGreater London, England, United Kingdom\nUpstream CFO\nUpstream CFO\nFeb 2015 - Jul 2020 ¬∑ 5 yrs 6 mos\nFeb 2015 to Jul 2020 ¬∑ 5 yrs 6 mos\nLondon, United Kingdom\nLondon, United Kingdom\nShow all 9 experiences\nAmoco\nAmoco\nFull-time ¬∑ 7 yrs 9 mos\nFull-time ¬∑ 7 yrs 9 mos\nOn-site\nOn-site\nSenior Tax Manager\nSenior Tax Manager\nMay 1994 - Jan 2000 ¬∑ 5 yrs 9 mos\nMay 1994 to Jan 2000 ¬∑ 5 yrs 9 mos\nChicago, Illinois, United States\nChicago, Illinois, United States\nSenior Tax Analyst\nSenior Tax Analyst\nMay 1992 - May 1994 ¬∑ 2 yrs 1 mo\nMay 1992 to May 1994 ¬∑ 2 yrs 1 mo\nCalgary, Alberta, Canada\nCalgary, Alberta, Canada",
    "isCSuite": true,
    "contextForAI": "Murray Auchincloss\n3rd degree connection\n3rd\nOn gardening leave\nCFA Institute\nLondon, England, United Kingdom  Contact info\n13,647 followers \n500+ connections\nFollow\nMessage\nMore\nActivity\nActivity\n13,647 followers\n13,647 followers\nFollow\nMurray hasn‚Äôt posted yet\nRecent posts Murray shares will be displayed here.\nShow all activity\nExperience\nExperience\nAdvisor\nAdvisor\nAdvisor\nSelf-employed\nSelf-employed\nJan 2026 - Present ¬∑ 2 mos\nJan 2026 to Present ¬∑ 2 mos\nbp\nbp\n26 yrs 2 mos\n26 yrs 2 mos\nChief Executive Officer\nChief Executive Officer\nFull-time\nFull-time\nJan 2024 - Feb 2026 ¬∑ 2 yrs 2 mos\nJan 2024 to Feb 2026 ¬∑ 2 yrs 2 mos\nGreater London, England, United Kingdom ¬∑ On-site\nGreater London, England, United Kingdom ¬∑ On-site\nChief Financial Officer\nChief Financial Officer\nFull-time\nFull-time\nMar 2020 - Jan 2024 ¬∑ 3 yrs 11 mos\nMar 2020 to Jan 2024 ¬∑ 3 yrs 11 mos\nGreater London, England, United Kingdom\nGreater London, England, United Kingdom\nUpstream CFO\nUpstream CFO\nFeb 2015 - Jul 2020 ¬∑ 5 yrs 6 mos\nFeb 2015 to Jul 2020 ¬∑ 5 yrs 6 mos\nLondon, United Kingdom\nLondon, United Kingdom\nShow all 9 experiences\nAmoco\nAmoco\nFull-time ¬∑ 7 yrs 9 mos\nFull-time ¬∑ 7 yrs 9 mos\nOn-site\nOn-site\nSenior Tax Manager\nSenior Tax Manager\nMay 1994 - Jan 2000 ¬∑ 5 yrs 9 mos\nMay 1994 to Jan 2000 ¬∑ 5 yrs 9 mos\nChicago, Illinois, United States\nChicago, Illinois, United States\nSenior Tax Analyst\nSenior Tax Analyst\nMay 1992 - May 1994 ¬∑ 2 yrs 1 mo\nMay 1992 to May 1994 ¬∑ 2 yrs 1 mo\nCalgary, Alberta, Canada\nCalgary, Alberta, Canada\nEducation\nEducation\nCFA Institute\nCFA Institute\nCFA Institute\nChartered Financial Analyst, Business Administration and Management, General\nChartered Financial Analyst, Business Administration and Management, General\nJan 1992 - Jan 1995\nJan 1992 - Jan 1995\nUniversity of Calgary\nUniversity of Calgary\nBachelor of Commerce (B.Com.), Finance, General\nBachelor of Commerce (B.Com.), Finance, General\n1988 - 1992\n1988 - 1992\nSkills\nSkills\nEnergy\nEnergy\nEndorsed by Tim Harrington and 2 others who are highly skilled at this\nEndorsed by Tim Harrington and 2 others who are highly skilled at this\nEndorsed by 6 colleagues at bp\nEndorsed by 6 colleagues at bp\n7 endorsements\n7 endorsements\nUpstream\nUpstream\nEndorsed by Guillermo Quintero and 1 other who is highly skilled at this\nEndorsed by Guillermo Quintero and 1 other who is highly skilled at this\nEndorsed by 8 colleagues at bp\nEndorsed by 8 colleagues at bp\n8 endorsements\n8 endorsements\nInterests\nInterests\nTop Voices\nTop Voices\nCompanies\nCompanies\nNewsletters\nNewsletters\nSchools\nSchools\nDr. Charles Woodburn\nDr. Charles Woodburn\n¬∑ 3rd\nThird degree connection\nGroup Chief Executive Officer, BAE Systems\nGroup Chief Executive Officer, BAE Systems\n39,575 followers\n39,575 followers\nFollow",
    "searchKeyword": "CEO"
  },
  {
    "profileUrl": "https://www.linkedin.com/in/charles-nzechi-mba-76a9b119a",
    "name": "Charles Nzechi, MBA",
    "title": "Aviation Lawyer l Corporate Lawyer l Aviation Management Consultant l Airline Business Management Consultant l Tourism and Hospitality Management Consultant l Scholar",
    "location": "United Kingdom",
    "company": "LAW ESSENCE - BARRISTERS, SOLICITORS, CONSULTANTS",
    "about": "",
    "experience": "Experience\nExperience\nPrincipal Counsel\nPrincipal Counsel\nPrincipal Counsel\nLAW ESSENCE - BARRISTERS, SOLICITORS, CONSULTANTS\nLAW ESSENCE - BARRISTERS, SOLICITORS, CONSULTANTS\nJul 2023 - Present ¬∑ 2 yrs 8 mos\nJul 2023 to Present ¬∑ 2 yrs 8 mos\nAbuja, Federal Capital Territory, Nigeria\nAbuja, Federal Capital Territory, Nigeria\nExecutive Director\nExecutive Director\nExecutive Director\nMultiple Suites Ltd \nMultiple Suites Ltd \nDec 2013 - Present ¬∑ 12 yrs 3 mos\nDec 2013 to Present ¬∑ 12 yrs 3 mos\nLagos, Lagos State, Nigeria\nLagos, Lagos State, Nigeria\nPresident\nPresident\nPresident\nCharles Nzechi Foundation \nCharles Nzechi Foundation \nJun 2012 - Present ¬∑ 13 yrs 9 mos\nJun 2012 to Present ¬∑ 13 yrs 9 mos\nUmuahia, Abia State, Nigeria\nUmuahia, Abia State, Nigeria\nMultiple Travel Ltd\nMultiple Travel Ltd \nMultiple Travel Ltd \n13 yrs 9 mos\n13 yrs 9 mos\nChairman\nChairman\nJun 2012 - Present ¬∑ 13 yrs 9 mos\nJun 2012 to Present ¬∑ 13 yrs 9 mos\nAbuja, Federal Capital Territory, Nigeria\nAbuja, Federal Capital Territory, Nigeria\nChief Executive Officer\nChief Executive Officer\nJun 2012 - Jun 2022 ¬∑ 10 yrs 1 mo\nJun 2012 to Jun 2022 ¬∑ 10 yrs 1 mo\nAbuja, Federal Capital Territory, Nigeria\nAbuja, Federal Capital Territory, Nigeria\nManaging Director\nManaging Director\nJun 2012 - Dec 2017 ¬∑ 5 yrs 7 mos\nJun 2012 to Dec 2017 ¬∑ 5 yrs 7 mos\nAbuja, Federal Capital Territory, Nigeria\nAbuja, Federal Capital Territory, Nigeria\nCustomer Service Consultant\nCustomer Service Consultant\nDHL Express UK\nDHL Express UK\nOct 2022 - Feb 2023 ¬∑ 5 mos\nOct 2022 to Feb 2023 ¬∑ 5 mos\nEast Midlands Airport Derby Uk\nEast Midlands Airport Derby Uk\nShow all 9 experiences",
    "isCSuite": true,
    "contextForAI": "Charles Nzechi, MBA\n2nd degree connection\n2nd\nAviation Lawyer l Corporate Lawyer l Aviation Management Consultant l Airline Business Management Consultant l Tourism and Hospitality Management Consultant l Scholar\nLAW ESSENCE - BARRISTERS, SOLICITORS, CONSULTANTS\nUnited Kingdom  Contact info\n7,583 followers \n500+ connections\nFollow\nMessage\nMore\nActivity\nActivity\n7,583 followers\n7,583 followers\nFollow\nCharles hasn‚Äôt posted yet\nRecent posts Charles shares will be displayed here.\nShow all activity\nExperience\nExperience\nPrincipal Counsel\nPrincipal Counsel\nPrincipal Counsel\nLAW ESSENCE - BARRISTERS, SOLICITORS, CONSULTANTS\nLAW ESSENCE - BARRISTERS, SOLICITORS, CONSULTANTS\nJul 2023 - Present ¬∑ 2 yrs 8 mos\nJul 2023 to Present ¬∑ 2 yrs 8 mos\nAbuja, Federal Capital Territory, Nigeria\nAbuja, Federal Capital Territory, Nigeria\nExecutive Director\nExecutive Director\nExecutive Director\nMultiple Suites Ltd \nMultiple Suites Ltd \nDec 2013 - Present ¬∑ 12 yrs 3 mos\nDec 2013 to Present ¬∑ 12 yrs 3 mos\nLagos, Lagos State, Nigeria\nLagos, Lagos State, Nigeria\nPresident\nPresident\nPresident\nCharles Nzechi Foundation \nCharles Nzechi Foundation \nJun 2012 - Present ¬∑ 13 yrs 9 mos\nJun 2012 to Present ¬∑ 13 yrs 9 mos\nUmuahia, Abia State, Nigeria\nUmuahia, Abia State, Nigeria\nMultiple Travel Ltd\nMultiple Travel Ltd \nMultiple Travel Ltd \n13 yrs 9 mos\n13 yrs 9 mos\nChairman\nChairman\nJun 2012 - Present ¬∑ 13 yrs 9 mos\nJun 2012 to Present ¬∑ 13 yrs 9 mos\nAbuja, Federal Capital Territory, Nigeria\nAbuja, Federal Capital Territory, Nigeria\nChief Executive Officer\nChief Executive Officer\nJun 2012 - Jun 2022 ¬∑ 10 yrs 1 mo\nJun 2012 to Jun 2022 ¬∑ 10 yrs 1 mo\nAbuja, Federal Capital Territory, Nigeria\nAbuja, Federal Capital Territory, Nigeria\nManaging Director\nManaging Director\nJun 2012 - Dec 2017 ¬∑ 5 yrs 7 mos\nJun 2012 to Dec 2017 ¬∑ 5 yrs 7 mos\nAbuja, Federal Capital Territory, Nigeria\nAbuja, Federal Capital Territory, Nigeria\nCustomer Service Consultant\nCustomer Service Consultant\nDHL Express UK\nDHL Express UK\nOct 2022 - Feb 2023 ¬∑ 5 mos\nOct 2022 to Feb 2023 ¬∑ 5 mos\nEast Midlands Airport Derby Uk\nEast Midlands Airport Derby Uk\nShow all 9 experiences\nSkills\nSkills\nLaw\nLaw\n1 endorsement\n1 endorsement\nOperations Management\nOperations Management\n1 endorsement\n1 endorsement\nShow all 20 skills\nInterests\nInterests\nCompanies\nCompanies\nGroups\nGroups\nNewsletters\nNewsletters\nSchools\nSchools\nIBM\nIBM\n19,237,187 followers\n19,237,187 followers\nFollow\nOracle\nOracle\n11,211,461 followers\n11,211,461 followers\nFollow\nShow all companies",
    "searchKeyword": "CEO"
  },
  {
    "profileUrl": "https://www.linkedin.com/in/davidshields-",
    "name": "David Shields",
    "title": "Chief Executive Officer",
    "location": "Chester, England, United Kingdom",
    "company": "Value Match",
    "about": "",
    "experience": "Experience\nExperience\nCo-Founder\nCo-Founder\nValue Match\nValue Match\nJul 2013 - Present ¬∑ 12 yrs 8 mos\nJul 2013 to Present ¬∑ 12 yrs 8 mos\nGreater Cheshire West and Chester Area\nGreater Cheshire West and Chester Area\nThrough our people and relationships Value Match applies our procurement expertise to enhance the value created in our communities and environment. We work with customers, candidates, suppliers, and other stakeholders to put understanding of value and the creation of value at the core of the solutions and services we offer.\n\nAt Value Match we are always conscious of creating value for people, relationships, community, and environment. We are able to do this through the services we offer, the causes we support and through the Value Match Foundation, you can read about these in our community stories.\n\nValue Match provides a complete solution to meet the procurement needs of all organisations and support suppliers to successfully bid into procurement. We have 4 service lines: \n\nResourcing ‚Äì Matching talent with opportunity. \nConsultancy ‚Äì Matching expertise with purpose. \nTraining ‚Äì Matching capability with knowledge \nBid Management ‚Äì Matching suppliers with buyers\n\nThe Value Match Foundation provides support to organisations with charitable purposes at their heart, aiming to increase their financial sustainability through commercial activity. Matching socially purposed buyers with suppliers, our aim is to enable buyers to source all their requirements from suppliers that are pursuing a social mission.\n\nThrough our people and relationships Value Match applies our procurement expertise to enhance the value created in our communities and environment. We work with customers, candidates, suppliers, and other stakeholders to put understanding of value and the creation of value at the core of the solutions and services we offer. At Value Match we are always conscious of creating value for people, relationships, community, and environment. We are able to do this th",
    "isCSuite": true,
    "contextForAI": "David has a {:badgeType} account\nDavid Shields \n3rd degree connection\n3rd\nChief Executive Officer\n Top Voice\nValue Match\nThe University of Manchester\nChester, England, United Kingdom  Contact info\n23,300 followers\nFollowed by EWEJE, Oyeniyi - CPHR Candidate\nFollowed by EWEJE, Oyeniyi - CPHR Candidate\nFollow\nConnect\nView my services\nMore\nProfile enhanced with Premium\nHighlights\nHighlights\nDavid recently posted on LinkedIn\nDavid recently posted on LinkedIn\nUnderstand what topics David posts about to inform your outreach.\nUnderstand what topics David posts about to inform your outreach.\nFree insight from Sales Navigator\nFree insight from Sales Navigator\nUnlock more insights about leads\nImprove outreach with sales insights\nTry Sales Navigator for ¬£0\n1-month free. We‚Äôll remind you 7 days before your trial ends.\nAbout\nAbout\nI work across the public and private sectors helping organisations develop procurement and commercial strategies, building capability while using technology and data to deliver sustained impact. Interested, let's talk +44(0)7920768370 \nI lead the team at Value Match and we provide solutions for procurement and commercial teams in the UK and globally built around consultancy, resourcing and bid management.\nAs part of my role at Social Value UK, I have launched a programme called Contract for Change, which seeks to harness the Social Value created by embedding social value as an integral part of an organisation‚Äôs purpose and mission, whilst ensuring that this focus provides direction to the organisation‚Äôs commissioning and procurement activity. The approach will provide direction on how to position, plan, procure, and provide for the creation of greater Social Value by organisations.\nI am also a NED at the Blackpool Council owned, Blackpool Operating Company Ltd, supporting the Executive Team in further delivering operational excellence while stimulating economic growth.\nI am a Fellow of the Chartered Institute of Purchasing and Supply.\nSpecialties: Transformational change management, eCommerce, procurement and commercial experience in both public and private sectors. Incorporating social value and environmental think into procurement and commercial strategies and operations.\nI work across the public and private sectors helping organisations develop procurement and commercial strategies, building capability while using technology and data to deliver sustained impact. Interested, let's talk +44(0)7920768370 I lead the team at Value Match and we provide solutions for procurement and commercial teams in the UK and globally built around consultancy, resourcing and bid management. As part of my role at Social Value UK, I have launched a programme called Contract for Change, which seeks to harness the Social Value created by embedding social value as an integral part of an organisation‚Äôs purpose and mission, whilst ensuring that this focus provides direction to the organisation‚Äôs commissioning and procurement activity. The approach will provide direction on how to position, plan, procure, and provide for the creation of greater Social Value by organisations. I am also a NED at the Blackpool Council owned, Blackpool Operating Company Ltd, supporting the Executive Team in further delivering operational excellence while stimulating economic growth. I am a Fellow of the Chartered Institute of Purchasing and Supply. Specialties: Transformational change management, eCommerce, procurement and commercial experience in both public and private sectors. Incorporating social value and environmental think into procurement and commercial strategies and operations.\n‚Ä¶see more\nServices\nServices\nWe deliver procurement and sustainability services to both the public and private sectors, from strategy development to the delivery of all aspects of procurement and supply chain service delivery. We focus specifically on ensuring improved outcomes are delivered with measurable positive sustainability and social value impact.\nThe Value Match team can work remotely or on-site and can be flexibly deployed on an ad-hoc basis to support a project or on a retained basis, 1 or 2 days per week.\nWe deliver procurement and sustainability services to both the public and private sectors, from strategy development to the delivery of all aspects of procurement and supply chain service delivery. We focus specifically on ensuring improved outcomes are delivered with measurable positive sustainability and social value impact. The Value Match team can work remotely or on-site and can be flexibly deployed on an ad-hoc basis to support a project or on a retained basis, 1 or 2 days per week.\n‚Ä¶see more\nBusiness Consulting ‚Ä¢ Project Management ‚Ä¢ Change Management ‚Ä¢ Program Management ‚Ä¢ Customer Service ‚Ä¢ Outsourcing\nBusiness Consulting ‚Ä¢ Project Management ‚Ä¢ Change Management ‚Ä¢ Program Management ‚Ä¢ Customer Service ‚Ä¢ Outsourcing\nShow all services\nFeatured\nFeatured\nPost\nPost\nSave the Children International and The Centre for Child Rights and Busines",
    "searchKeyword": "CEO"
  },
  {
    "profileUrl": "https://www.linkedin.com/in/ACoAAABQEGMBNtjS5EC_GsRcOBLIZYnNlN5H3hs",
    "name": "David Shields",
    "title": "Chief Executive Officer",
    "location": "Chester, England, United Kingdom",
    "company": "Value Match",
    "about": "",
    "experience": "Experience\nExperience\nCo-Founder\nCo-Founder\nValue Match\nValue Match\nJul 2013 - Present ¬∑ 12 yrs 8 mos\nJul 2013 to Present ¬∑ 12 yrs 8 mos\nGreater Cheshire West and Chester Area\nGreater Cheshire West and Chester Area\nThrough our people and relationships Value Match applies our procurement expertise to enhance the value created in our communities and environment. We work with customers, candidates, suppliers, and other stakeholders to put understanding of value and the creation of value at the core of the solutions and services we offer.\n\nAt Value Match we are always conscious of creating value for people, relationships, community, and environment. We are able to do this through the services we offer, the causes we support and through the Value Match Foundation, you can read about these in our community stories.\n\nValue Match provides a complete solution to meet the procurement needs of all organisations and support suppliers to successfully bid into procurement. We have 4 service lines: \n\nResourcing ‚Äì Matching talent with opportunity. \nConsultancy ‚Äì Matching expertise with purpose. \nTraining ‚Äì Matching capability with knowledge \nBid Management ‚Äì Matching suppliers with buyers\n\nThe Value Match Foundation provides support to organisations with charitable purposes at their heart, aiming to increase their financial sustainability through commercial activity. Matching socially purposed buyers with suppliers, our aim is to enable buyers to source all their requirements from suppliers that are pursuing a social mission.\n\nThrough our people and relationships Value Match applies our procurement expertise to enhance the value created in our communities and environment. We work with customers, candidates, suppliers, and other stakeholders to put understanding of value and the creation of value at the core of the solutions and services we offer. At Value Match we are always conscious of creating value for people, relationships, community, and environment. We are able to do this th",
    "isCSuite": true,
    "contextForAI": "David has a {:badgeType} account\nDavid Shields \n3rd degree connection\n3rd\nChief Executive Officer\n Top Voice\nValue Match\nThe University of Manchester\nChester, England, United Kingdom  Contact info\n23,300 followers\nFollowed by EWEJE, Oyeniyi - CPHR Candidate\nFollowed by EWEJE, Oyeniyi - CPHR Candidate\nFollow\nConnect\nView my services\nMore\nProfile enhanced with Premium\nHighlights\nHighlights\nDavid recently posted on LinkedIn\nDavid recently posted on LinkedIn\nUnderstand what topics David posts about to inform your outreach.\nUnderstand what topics David posts about to inform your outreach.\nFree insight from Sales Navigator\nFree insight from Sales Navigator\nUnlock more insights about leads\nImprove outreach with sales insights\nTry Sales Navigator for ¬£0\n1-month free. We‚Äôll remind you 7 days before your trial ends.\nAbout\nAbout\nI work across the public and private sectors helping organisations develop procurement and commercial strategies, building capability while using technology and data to deliver sustained impact. Interested, let's talk +44(0)7920768370 \nI lead the team at Value Match and we provide solutions for procurement and commercial teams in the UK and globally built around consultancy, resourcing and bid management.\nAs part of my role at Social Value UK, I have launched a programme called Contract for Change, which seeks to harness the Social Value created by embedding social value as an integral part of an organisation‚Äôs purpose and mission, whilst ensuring that this focus provides direction to the organisation‚Äôs commissioning and procurement activity. The approach will provide direction on how to position, plan, procure, and provide for the creation of greater Social Value by organisations.\nI am also a NED at the Blackpool Council owned, Blackpool Operating Company Ltd, supporting the Executive Team in further delivering operational excellence while stimulating economic growth.\nI am a Fellow of the Chartered Institute of Purchasing and Supply.\nSpecialties: Transformational change management, eCommerce, procurement and commercial experience in both public and private sectors. Incorporating social value and environmental think into procurement and commercial strategies and operations.\nI work across the public and private sectors helping organisations develop procurement and commercial strategies, building capability while using technology and data to deliver sustained impact. Interested, let's talk +44(0)7920768370 I lead the team at Value Match and we provide solutions for procurement and commercial teams in the UK and globally built around consultancy, resourcing and bid management. As part of my role at Social Value UK, I have launched a programme called Contract for Change, which seeks to harness the Social Value created by embedding social value as an integral part of an organisation‚Äôs purpose and mission, whilst ensuring that this focus provides direction to the organisation‚Äôs commissioning and procurement activity. The approach will provide direction on how to position, plan, procure, and provide for the creation of greater Social Value by organisations. I am also a NED at the Blackpool Council owned, Blackpool Operating Company Ltd, supporting the Executive Team in further delivering operational excellence while stimulating economic growth. I am a Fellow of the Chartered Institute of Purchasing and Supply. Specialties: Transformational change management, eCommerce, procurement and commercial experience in both public and private sectors. Incorporating social value and environmental think into procurement and commercial strategies and operations.\n‚Ä¶see more\nServices\nServices\nWe deliver procurement and sustainability services to both the public and private sectors, from strategy development to the delivery of all aspects of procurement and supply chain service delivery. We focus specifically on ensuring improved outcomes are delivered with measurable positive sustainability and social value impact.\nThe Value Match team can work remotely or on-site and can be flexibly deployed on an ad-hoc basis to support a project or on a retained basis, 1 or 2 days per week.\nWe deliver procurement and sustainability services to both the public and private sectors, from strategy development to the delivery of all aspects of procurement and supply chain service delivery. We focus specifically on ensuring improved outcomes are delivered with measurable positive sustainability and social value impact. The Value Match team can work remotely or on-site and can be flexibly deployed on an ad-hoc basis to support a project or on a retained basis, 1 or 2 days per week.\n‚Ä¶see more\nBusiness Consulting ‚Ä¢ Project Management ‚Ä¢ Change Management ‚Ä¢ Program Management ‚Ä¢ Customer Service ‚Ä¢ Outsourcing\nBusiness Consulting ‚Ä¢ Project Management ‚Ä¢ Change Management ‚Ä¢ Program Management ‚Ä¢ Customer Service ‚Ä¢ Outsourcing\nShow all services\nFeatured\nFeatured\nPost\nPost\nSave the Children International and The Centre for Child Rights and Busines",
    "searchKeyword": "CEO"
  },
  {
    "profileUrl": "https://www.linkedin.com/in/gregsjackson",
    "name": "Greg Jackson",
    "title": "Founder and CEO, Octopus Energy. *Due to volume of spam LinkedIn is not a good place to reach me* Reached 30k Connections. Follow only",
    "location": "London, England, United Kingdom",
    "company": "Octopus Energy",
    "about": "",
    "experience": "Experience\nExperience\nFounder, CEO\nFounder, CEO\nOctopus Energy\nOctopus Energy\nOct 2015 - Present ¬∑ 10 yrs 5 mos\nOct 2015 to Present ¬∑ 10 yrs 5 mos\nLondon\nLondon\nWe've started Octopus Energy because we passionately want to bring fairer practices and better value to the people of Britain. We all need energy but the way we buy and consume it is broken. Watch this space as we take on the job of fixing it (or better still, join us at http://octopus.energy )\nWe've started Octopus Energy because we passionately want to bring fairer practices and better value to the people of Britain. We all need energy but the way we buy and consume it is broken. Watch this space as we take on the job of fixing it (or better still, join us at http://octopus.energy )\n‚Ä¶see more\nChairman\nChairman\nConsultant Connect UK\nConsultant Connect UK\nSep 2015 - Present ¬∑ 10 yrs 6 mos\nSep 2015 to Present ¬∑ 10 yrs 6 mos\nOxford\nOxford\nConsultant Connect is a technology platform which benefits Patients, GPs and Consultants by getting patients the right treatment quickly and eliminating unnecessary delays through inappropriate referrals. Patients are delighted and the integration between primary and secondary care saves the NHS significant sums.\nConsultant Connect is a technology platform which benefits Patients, GPs and Consultants by getting patients the right treatment quickly and eliminating unnecessary delays through inappropriate referrals. Patients are delighted and the integration between primary and secondary care saves the NHS significant sums.\n‚Ä¶see more\nNon-executive Director\nNon-executive Director\nZopa\nZopa\nSep 2010 - Jan 2018 ¬∑ 7 yrs 5 mos\nSep 2010 to Jan 2018 ¬∑ 7 yrs 5 mos\nZopa is the global pioneer of online peer to peer lending. It provides lenders with a far higher return than existing retail savings products, and borrowers with rates which are typically at the top of the best buy charts. Zopa is now an established UK lender, and is growing rapidly.\nMy key interest in Zopa is in the areas of",
    "isCSuite": true,
    "contextForAI": "Greg has a {:badgeType} account\nGreg Jackson \n3rd degree connection\n3rd\nFounder and CEO, Octopus Energy. *Due to volume of spam LinkedIn is not a good place to reach me* Reached 30k Connections. Follow only\nOctopus Energy\nUniversity of Cambridge\nLondon, England, United Kingdom  Contact info\n500+ connections\nFollow\nMessage\nMore\nAbout\nAbout\nPassionate, creative, innovative CEO, entrepreneur and investor. Love building organisations around people, disrupting industries which underserve customers and society.\nSpecialties: Technology innovation, strategy and implementation, e-commerce, marketing strategy and implementation, startups, acquisitions, business development, board membership, financial services, home services, energy.\nPassionate, creative, innovative CEO, entrepreneur and investor. Love building organisations around people, disrupting industries which underserve customers and society. Specialties: Technology innovation, strategy and implementation, e-commerce, marketing strategy and implementation, startups, acquisitions, business development, board membership, financial services, home services, energy.\n‚Ä¶see more\nActivity\nActivity\n54,452 followers\n54,452 followers\nPosts\nComments\nImages\nLoaded 9 Posts posts\nGreg Jackson\nGreg Jackson\n   ‚Ä¢ 3rd+\nPremium ‚Ä¢ 3rd+\nFounder and CEO, Octopus Energy. *Due to volume of spam LinkedIn is not a good place to reach me* Reached 30k Connections. Follow only\nFounder and CEO, Octopus Energy. *Due to volume of spam LinkedIn is not a good place to reach me* Reached 30k Connections. Follow only\n1mo ‚Ä¢ Edited ‚Ä¢ \n1 month ago ‚Ä¢ Edited ‚Ä¢ Visible to anyone on or off LinkedIn\nA sense of balance is important in business - I know we‚Äôve achieved a lot with Octopus Energy and Kraken - and I‚Äôm intensely proud of that - but I also know we‚Äôre far from perfect.\nIf I post about customer service - inevitably (and totally rightly) some customers will post comments about where we‚Äôve gone wrong. If I post about tech, people will rightly highlight weaknesses.\nAnd internally, I caution the team about getting high on their own supply - we should be proud and confident but humble about where others are better - not just because there‚Äôs a fine line between pride and arrogance, but otherwise how do we learn, improve and grow?\nWhen we get compliments I‚Äôm usually quick to mention our shortcomings, and I won‚Äôt allow us to be described as ‚Äúsuccessful‚Äù (as Kenny Rogers put it - \"never count your money when you're sitting at the table\").\nSo I rarely feel unalloyed joy. Indeed, there‚Äôve been three moments of uncaveated pride in the history of our company.\nOne was when we first became a unicorn, and could deliver on the promise to our team - all of whom are shareholders, and many took a risk on a startup with big ambitions (a lot of mums and dads quizzed them why they were joining an unknown company with a dozen people in a small office in Hammersmith. This justified their faith). I was equally proud when Al Gore‚Äôs fund invested - and we introduced him to the entire company on Zoom - the emoji reactions told me that the team felt the way I did.\nAnd last week - among some of the most impressive businesses in the UK, Octopus was named Britain‚Äôs Most Admired Company (https://lnkd.in/etAr-d_y).\nNo caveats (‚Äúmost admired young company‚Äù or ‚Äúmost admired tech company‚Äù or whatever) simply ‚Äúmost admired company‚Äù.\nI stood there next to the Most Admired Leader (Tufan Erginbilgi√ß) at the London Stock Exchange and really felt this was a coming of age for our business.\nIt capped a remarkable few weeks. We‚Äôd announced the demerger of Kraken - we‚Äôd built it from nothing and now it‚Äôs a fantastic $9bn monster - freed to meet its full potential (I‚Äôll write about that soon!) And we‚Äôd learned that we‚Äôd been awarded Which? Recommended for the 9th year in a row. Which? Is just about the most stringent award you can win - and to do so 9 years in a row is huge external recognition for the work our team do for customers.\nSo - we‚Äôre not perfect - but I did take a deep breath (it was a breathtaking moment) - and decide it was ok to enjoy a moment of pride. Before setting off back to the office with a renewed sense or purpose, and huge pride in what our team have built. But I‚Äôm not gonna lie - it felt good. And I think that‚Äôs ok, just occasionally.\n‚Ä¶more\nActivate to view larger image,\n1/4\nActivate to view larger image,\n2,305\n90 comments\n91 reposts\nGreg Jackson\nGreg Jackson\n   ‚Ä¢ 3rd+\nPremium ‚Ä¢ 3rd+\nFounder and CEO, Octopus Energy. *Due to volume of spam LinkedIn is not a good place to reach me* Reached 30k Connections. Follow only\nFounder and CEO, Octopus Energy. *Due to volume of spam LinkedIn is not a good place to reach me* Reached 30k Connections. Follow only\n1mo ‚Ä¢ \n1 month ago ‚Ä¢ Visible to anyone on or off LinkedIn\nIn my early 40s, I'd built and sold a couple of businesses, and was in the wilderness - I wanted to start another but nothing seemed big enough, or doable enough. And I got a call from someone working for Sir Richard Harp",
    "searchKeyword": "CEO"
  },
  {
    "profileUrl": "https://www.linkedin.com/in/andy-edmonds-thinkbase",
    "name": "Andy Edmonds PhD",
    "title": "Inventor at ThinkBase LLC",
    "location": "United Kingdom",
    "company": "ThinkBase LLC",
    "about": "",
    "experience": "Experience\nExperience\nInventor\nInventor\nThinkBase LLC ¬∑ Full-time\nThinkBase LLC ¬∑ Full-time\nNov 2021 - Present ¬∑ 4 yrs 4 mos\nNov 2021 to Present ¬∑ 4 yrs 4 mos\nWyoming, United States ¬∑ Remote\nWyoming, United States ¬∑ Remote\nThinkBase LLC creates the ThinkBase Knowledge Graph SaaS product.\nThinkBase LLC creates the ThinkBase Knowledge Graph SaaS product.\nInventor\nInventor\nInventor\nDR ANDY'S IP LTD ¬∑ Full-time\nDR ANDY'S IP LTD ¬∑ Full-time\nJun 2017 - Sep 2021 ¬∑ 4 yrs 4 mos\nJun 2017 to Sep 2021 ¬∑ 4 yrs 4 mos\nUK ¬∑ Remote\nUK ¬∑ Remote\nWe license intellectual property in the fields of AI, Machine Learning and Natural Language Processing. We specialize in Whitebox systems that can learn from data, but whose derived models can be understood and audited by humans.\nWe license intellectual property in the fields of AI, Machine Learning and Natural Language Processing. We specialize in Whitebox systems that can learn from data, but whose derived models can be understood and audited by humans.\nChief Executive Officer\nChief Executive Officer\nChief Executive Officer\nNeural Computer sciences ¬∑ Full-time\nNeural Computer sciences ¬∑ Full-time\nJun 1987 - Jun 1990 ¬∑ 3 yrs 1 mo\nJun 1987 to Jun 1990 ¬∑ 3 yrs 1 mo\nCity Of Southampton, England, United Kingdom ¬∑ Remote\nCity Of Southampton, England, United Kingdom ¬∑ Remote\nFounded Europe's first AI company\nFounded Europe's first AI company",
    "isCSuite": true,
    "contextForAI": "Andy Edmonds PhD \n2nd degree connection\n2nd\nInventor at ThinkBase LLC\nThinkBase LLC\nUniversity of Bedfordshire\nUnited Kingdom  Contact info\nhttp://thinkbase.ai\n500+ connections\nConnect\nMessage\nBook an appointment\nMore\nAbout\nAbout\nI founded the UK's, and one of the world's, first AI companies back in the 80s. I specialise in creating AI tools that other companies can use to build solutions making use of AI, ML and NLP. My principal interest is in ML algorithms that can explain what they have learned, and that can reproduce human knowledge. \nI founded the UK's, and one of the world's, first AI companies back in the 80s. I specialise in creating AI tools that other companies can use to build solutions making use of AI, ML and NLP. My principal interest is in ML algorithms that can explain what they have learned, and that can reproduce human knowledge. \nServices\nServices\nConsultancy in AI, especially ethical and transparent systems such as Fuzzy Logic rule induction, Knowledge graphs, Genetic Programming and Genetic Algorithms. I have created solutions for clients in finance, medical diagnosis, Grand Prix racing, recommendation engines for marketing and many other areas.\nConsultancy in AI, especially ethical and transparent systems such as Fuzzy Logic rule induction, Knowledge graphs, Genetic Programming and Genetic Algorithms. I have created solutions for clients in finance, medical diagnosis, Grand Prix racing, recommendation engines for marketing and many other areas.\n‚Ä¶see more\nIT Consulting ‚Ä¢ Business Consulting ‚Ä¢ Custom Software Development ‚Ä¢ Cloud Application Development\nIT Consulting ‚Ä¢ Business Consulting ‚Ä¢ Custom Software Development ‚Ä¢ Cloud Application Development\nRequest services\nShow all services\nFeatured\nFeatured\nPost\nPost\nOur pitch deck:\nhttps://lnkd.in/epBpHMVr\nOneDrive for Business\nthinkbaseai-my.sharepoint.com\nActivity\nActivity\n1,731 followers\n1,731 followers\nPosts\nComments\nImages\nLoaded 9 Posts posts\nAndy Edmonds PhD\nAndy Edmonds PhD\n   ‚Ä¢ 2nd\nVerified ‚Ä¢ 2nd\nInventor at ThinkBase LLC\nInventor at ThinkBase LLC\nBook an appointment\n3mo ‚Ä¢ \n3 months ago ‚Ä¢ Visible to anyone on or off LinkedIn\nhttps://lnkd.in/eFyNwKqt\nThis is another example of an online Knowledge Base, this time created from a chapter of Dr Alexander Edmonds' PhD thesis and Book. This was created from a single upload of a PDF, in seconds. Once again you can ask questions of the source data using the chat interface.\nWhy stories matter. Cuneiform royal literature and its survival in later sources\nscientio.com\n2\nAndy Edmonds PhD\nAndy Edmonds PhD\n   ‚Ä¢ 2nd\nVerified ‚Ä¢ 2nd\nInventor at ThinkBase LLC\nInventor at ThinkBase LLC\nBook an appointment\n3mo ‚Ä¢ \n3 months ago ‚Ä¢ Visible to anyone on or off LinkedIn\nhttps://lnkd.in/em4XjdjT \nThis is an example of an online Knowledge Base, a set of related items of knowledge tied together with a knowledge graph and interrogatable via a chat interface and AI. This Knowledge Base was created in about 5 minutes. It's a competitor analysis for Scientio and other similar products.\nContact me for a demo. More Knowledge Bases to come.\nWebexample5\nscientio.com\nShow all posts\nExperience\nExperience\nInventor\nInventor\nThinkBase LLC ¬∑ Full-time\nThinkBase LLC ¬∑ Full-time\nNov 2021 - Present ¬∑ 4 yrs 4 mos\nNov 2021 to Present ¬∑ 4 yrs 4 mos\nWyoming, United States ¬∑ Remote\nWyoming, United States ¬∑ Remote\nThinkBase LLC creates the ThinkBase Knowledge Graph SaaS product.\nThinkBase LLC creates the ThinkBase Knowledge Graph SaaS product.\nInventor\nInventor\nInventor\nDR ANDY'S IP LTD ¬∑ Full-time\nDR ANDY'S IP LTD ¬∑ Full-time\nJun 2017 - Sep 2021 ¬∑ 4 yrs 4 mos\nJun 2017 to Sep 2021 ¬∑ 4 yrs 4 mos\nUK ¬∑ Remote\nUK ¬∑ Remote\nWe license intellectual property in the fields of AI, Machine Learning and Natural Language Processing. We specialize in Whitebox systems that can learn from data, but whose derived models can be understood and audited by humans.\nWe license intellectual property in the fields of AI, Machine Learning and Natural Language Processing. We specialize in Whitebox systems that can learn from data, but whose derived models can be understood and audited by humans.\nChief Executive Officer\nChief Executive Officer\nChief Executive Officer\nNeural Computer sciences ¬∑ Full-time\nNeural Computer sciences ¬∑ Full-time\nJun 1987 - Jun 1990 ¬∑ 3 yrs 1 mo\nJun 1987 to Jun 1990 ¬∑ 3 yrs 1 mo\nCity Of Southampton, England, United Kingdom ¬∑ Remote\nCity Of Southampton, England, United Kingdom ¬∑ Remote\nFounded Europe's first AI company\nFounded Europe's first AI company\nEducation\nEducation\nUniversity of Bedfordshire\nUniversity of Bedfordshire\nDoctor of Philosophy - PhD, Chaos theory, time series analysis and machine learning\nDoctor of Philosophy - PhD, Chaos theory, time series analysis and machine learning\n1993 - 1996\n1993 - 1996\nSkills\nSkills\nMachine Learning\nMachine Learning\nEndorsed by 1 person in the last 6 months\nEndorsed by 1 person in the last 6 months\n4 endorsements\n4 endorsements\nNatural Language Processing (NLP)\nNatural Language Processing (NLP",
    "searchKeyword": "CEO"
  },
  {
    "profileUrl": "https://www.linkedin.com/in/ACoAACsuBiQBv3bmPeJQMyTkZ9teBTKCVBkEBJE",
    "name": "Andy Edmonds PhD",
    "title": "Inventor at ThinkBase LLC",
    "location": "United Kingdom",
    "company": "ThinkBase LLC",
    "about": "",
    "experience": "Experience\nExperience\nInventor\nInventor\nThinkBase LLC ¬∑ Full-time\nThinkBase LLC ¬∑ Full-time\nNov 2021 - Present ¬∑ 4 yrs 4 mos\nNov 2021 to Present ¬∑ 4 yrs 4 mos\nWyoming, United States ¬∑ Remote\nWyoming, United States ¬∑ Remote\nThinkBase LLC creates the ThinkBase Knowledge Graph SaaS product.\nThinkBase LLC creates the ThinkBase Knowledge Graph SaaS product.\nInventor\nInventor\nInventor\nDR ANDY'S IP LTD ¬∑ Full-time\nDR ANDY'S IP LTD ¬∑ Full-time\nJun 2017 - Sep 2021 ¬∑ 4 yrs 4 mos\nJun 2017 to Sep 2021 ¬∑ 4 yrs 4 mos\nUK ¬∑ Remote\nUK ¬∑ Remote\nWe license intellectual property in the fields of AI, Machine Learning and Natural Language Processing. We specialize in Whitebox systems that can learn from data, but whose derived models can be understood and audited by humans.\nWe license intellectual property in the fields of AI, Machine Learning and Natural Language Processing. We specialize in Whitebox systems that can learn from data, but whose derived models can be understood and audited by humans.\nChief Executive Officer\nChief Executive Officer\nChief Executive Officer\nNeural Computer sciences ¬∑ Full-time\nNeural Computer sciences ¬∑ Full-time\nJun 1987 - Jun 1990 ¬∑ 3 yrs 1 mo\nJun 1987 to Jun 1990 ¬∑ 3 yrs 1 mo\nCity Of Southampton, England, United Kingdom ¬∑ Remote\nCity Of Southampton, England, United Kingdom ¬∑ Remote\nFounded Europe's first AI company\nFounded Europe's first AI company",
    "isCSuite": true,
    "contextForAI": "Andy Edmonds PhD \n2nd degree connection\n2nd\nInventor at ThinkBase LLC\nThinkBase LLC\nUniversity of Bedfordshire\nUnited Kingdom  Contact info\nhttp://thinkbase.ai\n500+ connections\nConnect\nMessage\nBook an appointment\nMore\nAbout\nAbout\nI founded the UK's, and one of the world's, first AI companies back in the 80s. I specialise in creating AI tools that other companies can use to build solutions making use of AI, ML and NLP. My principal interest is in ML algorithms that can explain what they have learned, and that can reproduce human knowledge. \nI founded the UK's, and one of the world's, first AI companies back in the 80s. I specialise in creating AI tools that other companies can use to build solutions making use of AI, ML and NLP. My principal interest is in ML algorithms that can explain what they have learned, and that can reproduce human knowledge. \nServices\nServices\nConsultancy in AI, especially ethical and transparent systems such as Fuzzy Logic rule induction, Knowledge graphs, Genetic Programming and Genetic Algorithms. I have created solutions for clients in finance, medical diagnosis, Grand Prix racing, recommendation engines for marketing and many other areas.\nConsultancy in AI, especially ethical and transparent systems such as Fuzzy Logic rule induction, Knowledge graphs, Genetic Programming and Genetic Algorithms. I have created solutions for clients in finance, medical diagnosis, Grand Prix racing, recommendation engines for marketing and many other areas.\n‚Ä¶see more\nIT Consulting ‚Ä¢ Business Consulting ‚Ä¢ Custom Software Development ‚Ä¢ Cloud Application Development\nIT Consulting ‚Ä¢ Business Consulting ‚Ä¢ Custom Software Development ‚Ä¢ Cloud Application Development\nRequest services\nShow all services\nFeatured\nFeatured\nPost\nPost\nOur pitch deck:\nhttps://lnkd.in/epBpHMVr\nOneDrive for Business\nthinkbaseai-my.sharepoint.com\nActivity\nActivity\n1,731 followers\n1,731 followers\nPosts\nComments\nImages\nLoaded 9 Posts posts\nAndy Edmonds PhD\nAndy Edmonds PhD\n   ‚Ä¢ 2nd\nVerified ‚Ä¢ 2nd\nInventor at ThinkBase LLC\nInventor at ThinkBase LLC\nBook an appointment\n3mo ‚Ä¢ \n3 months ago ‚Ä¢ Visible to anyone on or off LinkedIn\nhttps://lnkd.in/eFyNwKqt\nThis is another example of an online Knowledge Base, this time created from a chapter of Dr Alexander Edmonds' PhD thesis and Book. This was created from a single upload of a PDF, in seconds. Once again you can ask questions of the source data using the chat interface.\nWhy stories matter. Cuneiform royal literature and its survival in later sources\nscientio.com\n2\nAndy Edmonds PhD\nAndy Edmonds PhD\n   ‚Ä¢ 2nd\nVerified ‚Ä¢ 2nd\nInventor at ThinkBase LLC\nInventor at ThinkBase LLC\nBook an appointment\n3mo ‚Ä¢ \n3 months ago ‚Ä¢ Visible to anyone on or off LinkedIn\nhttps://lnkd.in/em4XjdjT \nThis is an example of an online Knowledge Base, a set of related items of knowledge tied together with a knowledge graph and interrogatable via a chat interface and AI. This Knowledge Base was created in about 5 minutes. It's a competitor analysis for Scientio and other similar products.\nContact me for a demo. More Knowledge Bases to come.\nWebexample5\nscientio.com\nShow all posts\nExperience\nExperience\nInventor\nInventor\nThinkBase LLC ¬∑ Full-time\nThinkBase LLC ¬∑ Full-time\nNov 2021 - Present ¬∑ 4 yrs 4 mos\nNov 2021 to Present ¬∑ 4 yrs 4 mos\nWyoming, United States ¬∑ Remote\nWyoming, United States ¬∑ Remote\nThinkBase LLC creates the ThinkBase Knowledge Graph SaaS product.\nThinkBase LLC creates the ThinkBase Knowledge Graph SaaS product.\nInventor\nInventor\nInventor\nDR ANDY'S IP LTD ¬∑ Full-time\nDR ANDY'S IP LTD ¬∑ Full-time\nJun 2017 - Sep 2021 ¬∑ 4 yrs 4 mos\nJun 2017 to Sep 2021 ¬∑ 4 yrs 4 mos\nUK ¬∑ Remote\nUK ¬∑ Remote\nWe license intellectual property in the fields of AI, Machine Learning and Natural Language Processing. We specialize in Whitebox systems that can learn from data, but whose derived models can be understood and audited by humans.\nWe license intellectual property in the fields of AI, Machine Learning and Natural Language Processing. We specialize in Whitebox systems that can learn from data, but whose derived models can be understood and audited by humans.\nChief Executive Officer\nChief Executive Officer\nChief Executive Officer\nNeural Computer sciences ¬∑ Full-time\nNeural Computer sciences ¬∑ Full-time\nJun 1987 - Jun 1990 ¬∑ 3 yrs 1 mo\nJun 1987 to Jun 1990 ¬∑ 3 yrs 1 mo\nCity Of Southampton, England, United Kingdom ¬∑ Remote\nCity Of Southampton, England, United Kingdom ¬∑ Remote\nFounded Europe's first AI company\nFounded Europe's first AI company\nEducation\nEducation\nUniversity of Bedfordshire\nUniversity of Bedfordshire\nDoctor of Philosophy - PhD, Chaos theory, time series analysis and machine learning\nDoctor of Philosophy - PhD, Chaos theory, time series analysis and machine learning\n1993 - 1996\n1993 - 1996\nSkills\nSkills\nMachine Learning\nMachine Learning\nEndorsed by 1 person in the last 6 months\nEndorsed by 1 person in the last 6 months\n4 endorsements\n4 endorsements\nNatural Language Processing (NLP)\nNatural Language Processing (NLP",
    "searchKeyword": "CEO"
  },
  {
    "profileUrl": "https://www.linkedin.com/in/olufemiaina",
    "name": "Olufemi A.",
    "title": "Co-Founder at Cooper",
    "location": "United Kingdom",
    "company": "Cooper Social Finance Ltd",
    "about": "",
    "experience": "Experience\nExperience\nFounder\nFounder\nFounder\nCooper Social Finance Ltd\nCooper Social Finance Ltd\nMay 2025 - Present ¬∑ 10 mos\nMay 2025 to Present ¬∑ 10 mos\n\nLeveraging over a decade of cross-sector consulting and innovation leadership, I founded Cooper to build scalable, compliant fintech infrastructure for emerging markets. My prior experience includes: ‚Ä¢ Enterprise transformation across healthcare, finance, aviation, and ICT, leading strategic programs in project management, Lean Six Sigma, and operational excellence. ‚Ä¢ Innovation leadership in global healthcare, designing and implementing quality and compliance systems that improved service delivery and customer experience. ‚Ä¢ Financial advisory and systems design, supporting corporate clients with health insurance, financial management, and digital transformation.\n Leveraging over a decade of cross-sector consulting and innovation leadership, I founded Cooper to build scalable, compliant fintech infrastructure for emerging markets. My prior experience includes: ‚Ä¢ Enterprise transformation across healthcare, finance, aviation, and ICT, leading strategic programs in project management, Lean Six Sigma, and operational excellence. ‚Ä¢ Innovation leadership in global healthcare, designing and implementing quality and compliance systems that improved service delivery and customer experience. ‚Ä¢ Financial advisory and systems design, supporting corporate clients with health insurance, financial management, and digital transformation.\n‚Ä¶see more\nStart-up Ventures and Early Stage Ventures\nChief Innovation Officer\nChief Innovation Officer\nChief Innovation Officer\nBest Rated Hospitals\nBest Rated Hospitals\nMay 2014 - Mar 2020 ¬∑ 5 yrs 11 mos\nMay 2014 to Mar 2020 ¬∑ 5 yrs 11 mos\nbestratedhospitals_edit_edit.png\nbestratedhospitals_edit_edit.png\nAesculapius Healthcare Consultants\nAesculapius Healthcare Consultants\n10 yrs 1 mo\n10 yrs 1 mo\nMaster TeamSTEPPS Trainer\nMaster TeamSTEPPS Trainer\nJan 2012 - Mar 2020 ¬∑ 8 yrs 3 mos\nJan 2012 to ",
    "isCSuite": true,
    "contextForAI": "Olufemi A.\n2nd degree connection\n2nd\nCo-Founder at Cooper\nCooper Social Finance Ltd\nUniversity of London\nUnited Kingdom  Contact info\n500+ connections\nEWEJE, Oyeniyi - CPHR Candidate is a mutual connection\nEWEJE, Oyeniyi - CPHR Candidate is a mutual connection\nConnect\nMessage\nMore\nAbout\nAbout\nDynamic and versatile executive with 15+ years of experience spanning healthcare, consulting, and financial services, now focused on leading innovative fintech ventures. As CEO and business transformation leader, I bring a rare combination of clinical discipline, accounting/finance acumen, and regulatory governance expertise. I am uniquely positioned to bridge rigorous governance with financial innovation.Proven track record in:Leading multi-sector organisations through growth and transformation.Navigating complex regulatory environments, including FCA frameworks.Scaling operations with sound financial management, quality assurance, and technology adoption.Building trust with stakeholders through transparent governance, compliance, and strategic vision.Currently seeking to leverage my expertise to lead a fintech firm through FCA authorisation and beyond, ensuring operational resilience, regulatory compliance, and sustainable growth.\nDynamic and versatile executive with 15+ years of experience spanning healthcare, consulting, and financial services, now focused on leading innovative fintech ventures. As CEO and business transformation leader, I bring a rare combination of clinical discipline, accounting/finance acumen, and regulatory governance expertise. I am uniquely positioned to bridge rigorous governance with financial innovation.Proven track record in:Leading multi-sector organisations through growth and transformation.Navigating complex regulatory environments, including FCA frameworks.Scaling operations with sound financial management, quality assurance, and technology adoption.Building trust with stakeholders through transparent governance, compliance, and strategic vision.Currently seeking to leverage my expertise to lead a fintech firm through FCA authorisation and beyond, ensuring operational resilience, regulatory compliance, and sustainable growth.\n‚Ä¶see more\nFeatured\nFeatured\nLink\nLink\nAVN Consulting Brochure\nAVN Consulting Brochure\nSlideShare\nSlideShare\nLink\nLink\nAHIA presentation\nAHIA presentation\nSlideShare\nSlideShare\nAHIA√¢¬Ñ¬¢ is a trademark product of AVN Consulting.\nDeploying AHIA√¢¬Ñ¬¢ entails getting to know your Organization, your People and the best Strategies to bring out the best your system can offer.\nWith our expertise and experience, and our strategic alliance with experienced Consultants in different fields, we develop in conjunction with your staff, Strategies to deliver superior quality service to your patients and position your Hospital amongst your peers.\nAHIA√¢¬Ñ¬¢ aims to position your hospital as the hospital of choice for your customers.\nAHIA√¢¬Ñ¬¢ follows the DMAIC steps (Define, Measure, Analyze, Improve and Control) of Lean Six Sigma.\nAHIA√¢¬Ñ¬¢ project is typically deployed by the Organization√¢¬Ä¬ôs management on the problem areas of the Organization and Improvement projects of paramount importance to the hospital management. \n The project focuses on Quality of products or service from the customer√¢¬Ä¬ôs (both internal and external) perspective.\nAHIA√¢¬Ñ¬¢ study your processes to understand the AS-IS situation to identify areas for improvements.\nAHIA√¢¬Ñ¬¢ is a trademark product of AVN Consulting. Deploying AHIA√¢¬Ñ¬¢ entails getting to know your Organization, your People and the best Strategies to bring out the best your system can offer. With our expertise and experience, and our strategic alliance with experienced Consultants in different fields, we develop in conjunction with your staff, Strategies to deliver superior quality service to your patients and position your Hospital amongst your peers. AHIA√¢¬Ñ¬¢ aims to position your hospital as the hospital of choice for your customers. AHIA√¢¬Ñ¬¢ follows the DMAIC steps (Define, Measure, Analyze, Improve and Control) of Lean Six Sigma. AHIA√¢¬Ñ¬¢ project is typically deployed by the Organization√¢¬Ä¬ôs management on the problem areas of the Organization and Improvement projects of paramount importance to the hospital management. The project focuses on Quality of products or service from the customer√¢¬Ä¬ôs (both internal and external) perspective. AHIA√¢¬Ñ¬¢ study your processes to understand the AS-IS situation to identify areas for improvements. \nLink\nLink\nBenefits Of Dmaic\nBenefits Of Dmaic\nSlideShare\nSlideShare\n2 Slide presentation on Benefits of DMAIC, and deployment steps of Six Sigma\n2 Slide presentation on Benefits of DMAIC, and deployment steps of Six Sigma\nLink\nLink\nReturn On Investment(Roi) In Staff Training\nReturn On Investment(Roi) In Staff Training\nSlideShare\nSlideShare\nThis is to enable Human Resource Managers and other Executives justify and maximize investments on staff training and development\nThis is to enable Human Resource Managers and other Executive",
    "searchKeyword": "CEO"
  },
  {
    "profileUrl": "https://www.linkedin.com/in/fredrick-isaac-b254b827",
    "name": "Fredrick (O) Isaac",
    "title": "Mining/Real Estate/Oil And Gas/And General Merchandise..",
    "location": "Nigeria",
    "company": "chief executive officer",
    "about": "",
    "experience": "Experience\nExperience\nCEO\nCEO\nCEO\nchief executive officer \nchief executive officer \nJan 2009 - Present ¬∑ 17 yrs 2 mos\nJan 2009 to Present ¬∑ 17 yrs 2 mos\nLagos/Nigeria\nLagos/Nigeria",
    "isCSuite": true,
    "contextForAI": "Fredrick (O) Isaac\n2nd degree connection\n2nd\nMining/Real Estate/Oil And Gas/And General Merchandise..\nchief executive officer\nYaba School Of Technology Yaba Lagos State\nNigeria  Contact info\n500+ connections\nEWEJE, Oyeniyi - CPHR Candidate is a mutual connection\nEWEJE, Oyeniyi - CPHR Candidate is a mutual connection\nConnect\nMessage\nMore\nAbout\nAbout\nWe are a company that source and act as broker.... We also have access to individuals that deals on gold,diamond and many other gems and industrial stones in large quantities across African rich mining fields......\nSpecialties: We are ready to deal with buyers agent and mandates..\nWe are a company that source and act as broker.... We also have access to individuals that deals on gold,diamond and many other gems and industrial stones in large quantities across African rich mining fields...... Specialties: We are ready to deal with buyers agent and mandates..\nActivity\nActivity\n24,521 followers\n24,521 followers\nFredrick hasn‚Äôt posted yet\nRecent posts Fredrick shares will be displayed here.\nShow all activity\nExperience\nExperience\nCEO\nCEO\nCEO\nchief executive officer \nchief executive officer \nJan 2009 - Present ¬∑ 17 yrs 2 mos\nJan 2009 to Present ¬∑ 17 yrs 2 mos\nLagos/Nigeria\nLagos/Nigeria\nEducation\nEducation\nYaba School Of Technology Yaba Lagos State\nYaba School Of Technology Yaba Lagos State \nYaba School Of Technology Yaba Lagos State \nBachelor of Applied Science (BASc), Mining and Mineral Engineering\nBachelor of Applied Science (BASc), Mining and Mineral Engineering\n1998 - 2002\n1998 - 2002\nSkills\nSkills\nBusiness Strategy\nBusiness Strategy\nFred Uduma profile picture\nEndorsed by Fred Uduma who is highly skilled at this\nEndorsed by Fred Uduma who is highly skilled at this\n26 endorsements\n26 endorsements\nBusiness Development\nBusiness Development\n16 endorsements\n16 endorsements\nShow all 8 skills\nLanguages\nLanguages\nEnglish\nEnglish\nFull professional proficiency\nFull professional proficiency\nInterests\nInterests\nTop Voices\nTop Voices\nCompanies\nCompanies\nGroups\nGroups\nNewsletters\nNewsletters\nSchools\nSchools\nJustin Trudeau\nJustin Trudeau\n¬∑ 3rd\nThird degree connection\nPrime Minister of Canada | Premier ministre du Canada\nPrime Minister of Canada | Premier ministre du Canada\n5,493,975 followers\n5,493,975 followers\nFollow\nEliete Oliveira\nEliete Oliveira\n¬∑ 3rd\nThird degree connection\nRecursos Humanos | Psicologia | Orienta√ß√£o Profissional e de Carreira | Mentoria para entrevistas | Consultoria de Curr√≠culo e Linkedin | Assessment Disc\nRecursos Humanos | Psicologia | Orienta√ß√£o Profissional e de Carreira | Mentoria para entrevistas | Consultoria de Curr√≠culo e Linkedin | Assessment Disc\n762,442 followers\n762,442 followers\nFollow\nShow all Top Voices",
    "searchKeyword": "CEO"
  },
  {
    "profileUrl": "https://www.linkedin.com/in/kunyutsai",
    "name": "Kun Yu Tsai",
    "title": "Full Stack and Mobile Engineer / Lead Engineer at Moonbility / CEO at NEX Foundation",
    "location": "United Kingdom",
    "company": "Moonbility",
    "about": "",
    "experience": "Experience\nExperience\nLead Software Engineer\nLead Software Engineer\nMoonbility\nMoonbility\nMay 2024 - Present ¬∑ 1 yr 10 mos\nMay 2024 to Present ¬∑ 1 yr 10 mos\nGreater London, England, United Kingdom ¬∑ Hybrid\nGreater London, England, United Kingdom ¬∑ Hybrid\nFreelencer logo\nFreelance Software Engineer\nFreelance Software Engineer\nFreelencer ¬∑ Freelance\nFreelencer ¬∑ Freelance\nMay 2019 - Present ¬∑ 6 yrs 10 mos\nMay 2019 to Present ¬∑ 6 yrs 10 mos\nTaipei, Taipei City, Taiwan ¬∑ Hybrid\nTaipei, Taipei City, Taiwan ¬∑ Hybrid\nBackend | Mobile App | Frontend | DevOp\n\n‚óÜ gogofoo - e-commerce app\n - Developed gogofoo backend service in Django. Built gogofoo Android and iOS apps in Flutter. \n\n‚óÜ Elgar - mother post-fertility care service\n - Developed backend service in Django. Built iOS apps in Swift.\n\n‚óÜ Other:\n - DevOps integration.\n - Built API/server with NestJS.\n - Frontend development (Vue), Android (Kotlin/Java)\n - Web crawlers.\nBackend | Mobile App | Frontend | DevOp ‚óÜ gogofoo - e-commerce app „ÄÄ- Developed gogofoo backend service in Django. Built gogofoo Android and iOS apps in Flutter. ‚óÜ Elgar - mother post-fertility care service „ÄÄ- Developed backend service in Django. Built iOS apps in Swift. ‚óÜ Other: „ÄÄ- DevOps integration. „ÄÄ- Built API/server with NestJS. „ÄÄ- Frontend development (Vue), Android (Kotlin/Java) „ÄÄ- Web crawlers.\n‚Ä¶see more\nNEX Foundation\nNEX Foundation\nPart-time ¬∑ 6 yrs 4 mos\nPart-time ¬∑ 6 yrs 4 mos\nHybrid\nHybrid\nChief Executive Officer\nChief Executive Officer\nMar 2023 - Present ¬∑ 3 yrs\nMar 2023 to Present ¬∑ 3 yrs\nTaipei, Taipei City, Taiwan\nTaipei, Taipei City, Taiwan\nSecretary General\nSecretary General\nApr 2021 - Mar 2023 ¬∑ 2 yrs\nApr 2021 to Mar 2023 ¬∑ 2 yrs\nTaiwan\nTaiwan\n‚óÜ Coordinate NEX Foundation Taiwan team.\n‚óÜ Recruiting.\n‚óÜ Coordinate NEX Foundation Taiwan team. ‚óÜ Recruiting.\nEngineering Manager\nEngineering Manager\nNov 2019 - Oct 2022 ¬∑ 3 yrs\nNov 2019 to Oct 2022 ¬∑ 3 yrs\nTaipei‚ÄìKeelung Metropolitan area\nTaipei‚ÄìKeelung Metropolitan area\n‚óÜ Product feature plannin",
    "isCSuite": true,
    "contextForAI": "Kun Yu Tsai\n2nd degree connection\n2nd\nFull Stack and Mobile Engineer / Lead Engineer at Moonbility / CEO at NEX Foundation\nMoonbility\nUnited Kingdom  Contact info\n500+ connections\nRobert Lynch is a mutual connection\nRobert Lynch is a mutual connection\nConnect\nMessage\nMore\nAbout\nAbout\nAbout me.\nComputer Science\n‚óÜ Mobile: Flutter, Android (Kotlin/Java), iOS (Swift)\n‚óÜ Backend: Python Django, a bit Ruby on Rails\n‚óÜ Frontend: JQuery, Vue.js, HTML, CSS\n‚óÜ DevOps: Server Deployment (GCD, Azure, Digital Ocean), Docker, Github Actions (CI/CD)\n‚óÜ AI: a bit Machine Learning\n‚óÜ Others: C, Ncurses, a bit Assembly, \nApart from CS, I also study in and experience with:\n‚óÜ UI UX design | user research | organisation strategy\n‚óÜ psychology | neuroscience | sociology\n‚óÜ medical science | chemistry | law science\nWhat people think about me:\n‚óÜ easy-going | empathetic | enthusiastic | self-awareness \nAn enthusiastic learner aiming to learn everything and to be interdisciplinary. There shall not be boundaries between knowledge fields.\nUpdated at 01/Oct/2022\nAbout me. Computer Science ‚óÜ Mobile: Flutter, Android (Kotlin/Java), iOS (Swift) ‚óÜ Backend: Python Django, a bit Ruby on Rails ‚óÜ Frontend: JQuery, Vue.js, HTML, CSS ‚óÜ DevOps: Server Deployment (GCD, Azure, Digital Ocean), Docker, Github Actions (CI/CD) ‚óÜ AI: a bit Machine Learning ‚óÜ Others: C, Ncurses, a bit Assembly, Apart from CS, I also study in and experience with: ‚óÜ UI UX design | user research | organisation strategy ‚óÜ psychology | neuroscience | sociology ‚óÜ medical science | chemistry | law science What people think about me: ‚óÜ easy-going | empathetic | enthusiastic | self-awareness An enthusiastic learner aiming to learn everything and to be interdisciplinary. There shall not be boundaries between knowledge fields. Updated at 01/Oct/2022\n‚Ä¶see more\nFeatured\nFeatured\nLink\nLink\nMy Github repository to showcase my code.\nMy Github repository to showcase my code.\nGitHub\nGitHub\nAndroid development. Kotlin lover. Enjoy working stuffs on backend, Arduino and iOS as well. - kun-yu-tsai\nAndroid development. Kotlin lover. Enjoy working stuffs on backend, Arduino and iOS as well. - kun-yu-tsai\nLink\nLink\nHinge Health Back application Demo\nHinge Health Back application Demo\nvimeo.com\nvimeo.com\nLink\nLink\nMy Arduino board proejcts\nMy Arduino board proejcts\nYouTube\nYouTube\nActivity\nActivity\n1,477 followers\n1,477 followers\nKun Yu hasn‚Äôt posted yet\nRecent posts Kun Yu shares will be displayed here.\nShow all activity\nExperience\nExperience\nLead Software Engineer\nLead Software Engineer\nMoonbility\nMoonbility\nMay 2024 - Present ¬∑ 1 yr 10 mos\nMay 2024 to Present ¬∑ 1 yr 10 mos\nGreater London, England, United Kingdom ¬∑ Hybrid\nGreater London, England, United Kingdom ¬∑ Hybrid\nFreelencer logo\nFreelance Software Engineer\nFreelance Software Engineer\nFreelencer ¬∑ Freelance\nFreelencer ¬∑ Freelance\nMay 2019 - Present ¬∑ 6 yrs 10 mos\nMay 2019 to Present ¬∑ 6 yrs 10 mos\nTaipei, Taipei City, Taiwan ¬∑ Hybrid\nTaipei, Taipei City, Taiwan ¬∑ Hybrid\nBackend | Mobile App | Frontend | DevOp\n‚óÜ gogofoo - e-commerce app\n - Developed gogofoo backend service in Django. Built gogofoo Android and iOS apps in Flutter. \n‚óÜ Elgar - mother post-fertility care service\n - Developed backend service in Django. Built iOS apps in Swift.\n‚óÜ Other:\n - DevOps integration.\n - Built API/server with NestJS.\n - Frontend development (Vue), Android (Kotlin/Java)\n - Web crawlers.\nBackend | Mobile App | Frontend | DevOp ‚óÜ gogofoo - e-commerce app „ÄÄ- Developed gogofoo backend service in Django. Built gogofoo Android and iOS apps in Flutter. ‚óÜ Elgar - mother post-fertility care service „ÄÄ- Developed backend service in Django. Built iOS apps in Swift. ‚óÜ Other: „ÄÄ- DevOps integration. „ÄÄ- Built API/server with NestJS. „ÄÄ- Frontend development (Vue), Android (Kotlin/Java) „ÄÄ- Web crawlers.\n‚Ä¶see more\nNEX Foundation\nNEX Foundation\nPart-time ¬∑ 6 yrs 4 mos\nPart-time ¬∑ 6 yrs 4 mos\nHybrid\nHybrid\nChief Executive Officer\nChief Executive Officer\nMar 2023 - Present ¬∑ 3 yrs\nMar 2023 to Present ¬∑ 3 yrs\nTaipei, Taipei City, Taiwan\nTaipei, Taipei City, Taiwan\nSecretary General\nSecretary General\nApr 2021 - Mar 2023 ¬∑ 2 yrs\nApr 2021 to Mar 2023 ¬∑ 2 yrs\nTaiwan\nTaiwan\n‚óÜ Coordinate NEX Foundation Taiwan team.\n‚óÜ Recruiting.\n‚óÜ Coordinate NEX Foundation Taiwan team. ‚óÜ Recruiting.\nEngineering Manager\nEngineering Manager\nNov 2019 - Oct 2022 ¬∑ 3 yrs\nNov 2019 to Oct 2022 ¬∑ 3 yrs\nTaipei‚ÄìKeelung Metropolitan area\nTaipei‚ÄìKeelung Metropolitan area\n‚óÜ Product feature planning.\n‚óÜ Engineer insight and implementation.\n‚óÜ Team coordination.\n‚óÜ Product feature planning. ‚óÜ Engineer insight and implementation. ‚óÜ Team coordination.\nAndroid Developer\nAndroid Developer\nHinge Health\nHinge Health\nMay 2016 - Apr 2019 ¬∑ 3 yrs\nMay 2016 to Apr 2019 ¬∑ 3 yrs\nLondon Area, United Kingdom\nLondon Area, United Kingdom\n‚óÜ Led application architectural revamp by introducing MVVM and RxJava.\n‚óÜ Held the discussion with the designer and provided engineer-wise design direction.\n‚óÜ Be the promoter to firstly adopt Kotlin, Corouti",
    "searchKeyword": "CEO"
  },
  {
    "profileUrl": "https://www.linkedin.com/in/anthony-eghiyo-esere-9ba917153",
    "name": "Anthony Eghiyo- Esere",
    "title": "Founder/GCEO POWERDOT Group, CEO Serotny Global",
    "location": "Coventry, England, United Kingdom",
    "company": "Powerdot UK",
    "about": "",
    "experience": "Experience\nExperience\nDirector Of Operations\nDirector Of Operations\nPowerdot UK ¬∑ Full-time\nPowerdot UK ¬∑ Full-time\nDec 2019 - Present ¬∑ 6 yrs 3 mos\nDec 2019 to Present ¬∑ 6 yrs 3 mos\nLondon Area, United Kingdom\nLondon Area, United Kingdom\n20200212_090241.jpg\n20200212_090241.jpg\nGroup Chief Executive Officer\nGroup Chief Executive Officer\nGroup Chief Executive Officer\nPowerdot WA ¬∑ Full-time\nPowerdot WA ¬∑ Full-time\nJan 2019 - Present ¬∑ 7 yrs 2 mos\nJan 2019 to Present ¬∑ 7 yrs 2 mos\nAbuja, Federal Capital Territory, Nigeria\nAbuja, Federal Capital Territory, Nigeria\nSenior Project Director\nSenior Project Director\nSenior Project Director\nSEROTNY\nSEROTNY\nNov 2007 - Present ¬∑ 18 yrs 4 mos\nNov 2007 to Present ¬∑ 18 yrs 4 mos\nManaging Director/CEO\nManaging Director/CEO\nManaging Director/CEO\nSerotny Global Limited\nSerotny Global Limited\nNov 2007 - Present ¬∑ 18 yrs 4 mos\nNov 2007 to Present ¬∑ 18 yrs 4 mos\nAUTOMOTIVE INSULATIONS LIMITED logo\nRobot operator/ Operations\nRobot operator/ Operations\nAUTOMOTIVE INSULATIONS LIMITED\nAUTOMOTIVE INSULATIONS LIMITED\nSep 2017 - 2018 ¬∑ 5 mos\nSep 2017 to 2018 ¬∑ 5 mos\nRugby, Warwickshire, United Kingdom\nRugby, Warwickshire, United Kingdom\nShow all 6 experiences",
    "isCSuite": true,
    "contextForAI": "Anthony Eghiyo- Esere \n2nd degree connection\n2nd\nFounder/GCEO POWERDOT Group, CEO Serotny Global\nPowerdot UK\nCoventry, England, United Kingdom  Contact info\n5,591 followers \n500+ connections\nEWEJE, Oyeniyi - CPHR Candidate is a mutual connection\nEWEJE, Oyeniyi - CPHR Candidate is a mutual connection\nFollow\nMessage\nMore\nAbout\nAbout\nHaving handled and delivered several projects from start to finish stage. Handing over quality, precision and value with experience spanning well over 12 years in the construction industry. Went further to do a research on waterproofing/leakproofing technology and invented MFSS (Multi Functional Solvent Solution) with this technology, structural defects are taken care of completely. Lets talk about Robotics and Mechatronics technology which has now taken another part of me as i continue to improve on programming and manufacturing of autonomous robots via LabView you may view my YouTube channel for ball sorting and pick 'n' place robot which was designed and programmed with the use of proximity sensors, IR sensors, actuators, servo etc. Meanwhile, research is still ongoing to improve on already existing cutting edge ideas.\nHaving handled and delivered several projects from start to finish stage. Handing over quality, precision and value with experience spanning well over 12 years in the construction industry. Went further to do a research on waterproofing/leakproofing technology and invented MFSS (Multi Functional Solvent Solution) with this technology, structural defects are taken care of completely. Lets talk about Robotics and Mechatronics technology which has now taken another part of me as i continue to improve on programming and manufacturing of autonomous robots via LabView you may view my YouTube channel for ball sorting and pick 'n' place robot which was designed and programmed with the use of proximity sensors, IR sensors, actuators, servo etc. Meanwhile, research is still ongoing to improve on already existing cutting edge ideas.\n‚Ä¶see more\nActivity\nActivity\n5,591 followers\n5,591 followers\nFollow\nPosts\nComments\nVideos\nLoaded 9 Posts posts\nAnthony Eghiyo- Esere reposted this\nGeorgina Esere-Kingsley\nGeorgina Esere-Kingsley\n ‚Ä¢ 3rd+\n3rd+\nA writer, entrepreneur, and real estate consultant.\nA writer, entrepreneur, and real estate consultant.\n3w ‚Ä¢ \n3 weeks ago ‚Ä¢ Visible to anyone on or off LinkedIn\nNavigating Change: How Collaboration and Resilience Transformed Our Workplace \n(Continuation from part 1)\nWith a busy day planned ahead, she realized the necessity of prioritizing her health, especially given the strenuous demands of her job. A balanced diet was not just essential for energy, but also for mental clarity and emotional stability. Wrapped in a towel and feeling refreshed, she reflected on her meals for the next day. ‚ÄúI can‚Äôt let convenience compromise my health,‚Äù she resolved.\nThe next morning, Maritime awoke with a sense of purpose. She rushed to the kitchen with a plan in mind. She decided to whip up a nutritious breakfast scrambling eggs packed with protein alongside whole grain toast and fresh fruit. Each bite was a reminder that she could nourish her body, setting a positive tone for her day.\nAs she prepared to head to work, she made a mental note to prep a colorful salad for lunch. Filled with leafy greens, healthy fats, and lean protein, it was a delicious way to fuel herself for the tasks that lay ahead. She recognized that taking a bit of extra time to prepare healthy meals was not a burden but an investment in her well-being.\nMaritime embraced this commitment to herself. She understood that nourishing her body would bolster her mental resilience against stress, allowing her to tackle challenges with renewed vigor. With every healthy choice, she felt a growing empowerment.\nClimbing into bed that night, Maritime was filled with a profound sense of accomplishment. She was learning the significance of self-care, healthy eating, and rest. Each new day was an opportunity-an opportunity not just to survive, but to truly thrive. As she drifted off to sleep, she felt optimistic about the journey ahead, ready to face whatever challenges came her way with vitality and strength.\n‚Ä¶more\nActivate to view larger image,\nSee content credentials\nActivate to view larger image,\n2\n1 repost\nAnthony Eghiyo- Esere\nAnthony Eghiyo- Esere\n   ‚Ä¢ 2nd\nVerified ‚Ä¢ 2nd\nFounder/GCEO POWERDOT Group, CEO Serotny Global\nFounder/GCEO POWERDOT Group, CEO Serotny Global\n7mo ‚Ä¢ \n7 months ago ‚Ä¢ Visible to anyone on or off LinkedIn\nApart from architectural issues, not conducting soil test and following building guidelines and specifications, majority of building collapse cases in Nigeria is as a result of total negligence. ohh yes we completely ignore the signs at early stage and overtime hairline micro cracks graduates to hairline macro cracks which eventually gives full access to water intrusion amongst structural members and overtime corrosion takes place within the reinforcement embedded inside the sub",
    "searchKeyword": "CEO"
  },
  {
    "profileUrl": "https://www.linkedin.com/in/robertdurkin",
    "name": "Rob Durkin",
    "title": "Entrepreneur & Investor",
    "location": "Leeds, England, United Kingdom",
    "company": "Tokenetic Ltd",
    "about": "",
    "experience": "Experience\nExperience\nCo-founder & CTO\nCo-founder & CTO\nTokenetic Ltd ¬∑ Full-time\nTokenetic Ltd ¬∑ Full-time\nSep 2024 - Present ¬∑ 1 yr 6 mos\nSep 2024 to Present ¬∑ 1 yr 6 mos\nBradford, England, United Kingdom ¬∑ On-site\nBradford, England, United Kingdom ¬∑ On-site\nTokenetic delivers scalable, secure, and user-friendly web applications tailored to your specific needs. We combine modern technologies with intuitive design to create solutions that not only look great but also perform seamlessly‚Äîhelping you scale, optimise operations, and enhance user engagement.\nTokenetic delivers scalable, secure, and user-friendly web applications tailored to your specific needs. We combine modern technologies with intuitive design to create solutions that not only look great but also perform seamlessly‚Äîhelping you scale, optimise operations, and enhance user engagement.\n‚Ä¶see more\nCo-Founder & Director\nCo-Founder & Director\nVox Live ¬∑ Full-time\nVox Live ¬∑ Full-time\nFeb 2023 - Present ¬∑ 3 yrs 1 mo\nFeb 2023 to Present ¬∑ 3 yrs 1 mo\nLeeds, England, United Kingdom\nLeeds, England, United Kingdom\nCo-founded this live entertainment agency based in Yorkshire. With hundreds of acts and thousands of 5 star reviews, we've established a reputation as one of the leading providers of entertainment in the UK.\nCo-founded this live entertainment agency based in Yorkshire. With hundreds of acts and thousands of 5 star reviews, we've established a reputation as one of the leading providers of entertainment in the UK.\nChief Technology Officer\nChief Technology Officer\nOld.St Labs ¬∑ Part-time\nOld.St Labs ¬∑ Part-time\nMar 2022 - Jan 2023 ¬∑ 11 mos\nMar 2022 to Jan 2023 ¬∑ 11 mos\nGreater London, England, United Kingdom\nGreater London, England, United Kingdom\nOld.st Labs helps digital innovators take products from napkin to launch. We offer product design, development, strategy and development services. Our team of creatives and developers are based in Philippines which helps keep costs manageable for any project.\nOld",
    "isCSuite": true,
    "contextForAI": "Rob Durkin \n2nd degree connection\n2nd\nEntrepreneur & Investor\nTokenetic Ltd\nUniversity of Cambridge\nLeeds, England, United Kingdom  Contact info\n500+ connections\nRobert Lynch is a mutual connection\nRobert Lynch is a mutual connection\nMessage\nMore\nAbout\nAbout\nI am a successful entrepreneur and investor with extensive experience in the digital media sector. I founded a very successful marketing agency in 2009, which was subsequently acquired by WPP in 2014. I now work as a consultant and advisor helping companies of all sizes to grow. I also act as a board advisor and mentor to several start-ups. I am an active angel investor and have a diverse portfolio of fast-growing businesses in the media and digital media sectors.\nI am a successful entrepreneur and investor with extensive experience in the digital media sector. I founded a very successful marketing agency in 2009, which was subsequently acquired by WPP in 2014. I now work as a consultant and advisor helping companies of all sizes to grow. I also act as a board advisor and mentor to several start-ups. I am an active angel investor and have a diverse portfolio of fast-growing businesses in the media and digital media sectors.\nActivity\nActivity\n1,639 followers\n1,639 followers\nPosts\nComments\nLoaded 5 Posts posts\nRob Durkin\nRob Durkin\n   ‚Ä¢ 2nd\nVerified ‚Ä¢ 2nd\nEntrepreneur & Investor\nEntrepreneur & Investor\n10mo ‚Ä¢ \n10 months ago ‚Ä¢ Visible to anyone on or off LinkedIn\nAre you using offshore software developers at the moment ? We've put together this interesting article on the benefits of on-shore development, hit me up if you're interested in working with our talented team of bright graduate developers entirely based in our offices in Bradford !!\n‚Ä¶more\nVIBE Labs pwrd by Tokenetic\nVIBE Labs pwrd by Tokenetic\n95 followers\n95 followers\nOur approach to software development isn't just about finding the cheapest offshore way of delivering, it's about creating the talent of the future through investing in our people.\n‚Ä¶more\nFrom Offshore Nightmares to Ethical Excellence: How tokenetic is Reinventing Software Development\nVIBE Labs pwrd by Tokenetic\n22\n1 repost\nRob Durkin\nRob Durkin\n   ‚Ä¢ 2nd\nVerified ‚Ä¢ 2nd\nEntrepreneur & Investor\nEntrepreneur & Investor\n11mo ‚Ä¢ Edited ‚Ä¢ \n11 months ago ‚Ä¢ Edited ‚Ä¢ Visible to anyone on or off LinkedIn\nüöÄ Exciting News! üöÄ\nI‚Äôve just launched Tokenetic ‚Äì a 100% UK-based software development company, helping businesses build high-quality web and mobile applications! üá¨üáß\nWe specialize in Node.js and React.js development, delivering scalable, high-performance applications tailored to your needs.\nWhat makes us different?\n ‚úÖ UK-based, office-first team ‚Äì All our developers are top Computer Science grads from local universities, working together in our beautiful Saltaire offices.\n ‚úÖ Expertly trained, in-house talent ‚Äì No outsourcing, no compromises ‚Äì just exceptional UK engineering.\n ‚úÖ Bespoke solutions ‚Äì Whether you need a fast, scalable web platform or a sleek mobile app, we can build it.\n ‚úÖ Web 3.0 capabilities ‚Äì We also have experience in blockchain development for those looking to explore the next evolution of the web.\nIf you or your business need reliable, high-quality software development, let‚Äôs chat! üì© DM me or visit tokenetic.co.uk to learn more.\nhashtag\n#WebDevelopment \nhashtag\n#MobileApps \nhashtag\n#NodeJS \nhashtag\n#ReactJS \nhashtag\n#Blockchain \nhashtag\n#UKTech \nhashtag\n#SoftwareEngineering \nhashtag\n#Saltaire \nhashtag\n#StartupLife\nhttps://lnkd.in/ePPrre3Z\n‚Ä¶more\nTokenetic - Empowering Future Businesses\ntokenetic.co.uk\n47\n7 comments\n1 repost\nShow all posts\nExperience\nExperience\nCo-founder & CTO\nCo-founder & CTO\nTokenetic Ltd ¬∑ Full-time\nTokenetic Ltd ¬∑ Full-time\nSep 2024 - Present ¬∑ 1 yr 6 mos\nSep 2024 to Present ¬∑ 1 yr 6 mos\nBradford, England, United Kingdom ¬∑ On-site\nBradford, England, United Kingdom ¬∑ On-site\nTokenetic delivers scalable, secure, and user-friendly web applications tailored to your specific needs. We combine modern technologies with intuitive design to create solutions that not only look great but also perform seamlessly‚Äîhelping you scale, optimise operations, and enhance user engagement.\nTokenetic delivers scalable, secure, and user-friendly web applications tailored to your specific needs. We combine modern technologies with intuitive design to create solutions that not only look great but also perform seamlessly‚Äîhelping you scale, optimise operations, and enhance user engagement.\n‚Ä¶see more\nCo-Founder & Director\nCo-Founder & Director\nVox Live ¬∑ Full-time\nVox Live ¬∑ Full-time\nFeb 2023 - Present ¬∑ 3 yrs 1 mo\nFeb 2023 to Present ¬∑ 3 yrs 1 mo\nLeeds, England, United Kingdom\nLeeds, England, United Kingdom\nCo-founded this live entertainment agency based in Yorkshire. With hundreds of acts and thousands of 5 star reviews, we've established a reputation as one of the leading providers of entertainment in the UK.\nCo-founded this live entertainment agency based in Yorkshire. With hundreds of acts and thousands of 5 star reviews, w",
    "searchKeyword": "CEO"
  },
  {
    "profileUrl": "https://www.linkedin.com/in/todd-solash",
    "name": "Todd Solash",
    "title": "Deputy CEO and President, Athora Holding Ltd.",
    "location": "London, England, United Kingdom",
    "company": "Athora",
    "about": "",
    "experience": "Experience\nExperience\nDeputy CEO and President, Athora Holding Ltd.\nDeputy CEO and President, Athora Holding Ltd.\nAthora\nAthora\nOct 2023 - Present ¬∑ 2 yrs 5 mos\nOct 2023 to Present ¬∑ 2 yrs 5 mos\nGreater London, England, United Kingdom\nGreater London, England, United Kingdom\nPresident of Individual Retirement and Life Insurance\nPresident of Individual Retirement and Life Insurance\nCorebridge Financial ¬∑ Full-time\nCorebridge Financial ¬∑ Full-time\nFeb 2017 - Oct 2023 ¬∑ 6 yrs 9 mos\nFeb 2017 to Oct 2023 ¬∑ 6 yrs 9 mos\nLos Angeles Metropolitan Area\nLos Angeles Metropolitan Area\nFormerly AIG Life & Retirement\nFormerly AIG Life & Retirement\nSenior Executive Director - Head of Individual Annuity\nSenior Executive Director - Head of Individual Annuity\nAXA US\nAXA US\nAug 2010 - Feb 2017 ¬∑ 6 yrs 7 mos\nAug 2010 to Feb 2017 ¬∑ 6 yrs 7 mos\nPartner\nPartner\nOliver Wyman\nOliver Wyman\nDec 2005 - Jul 2010 ¬∑ 4 yrs 8 mos\nDec 2005 to Jul 2010 ¬∑ 4 yrs 8 mos\nRisk management and product development\nRisk management and product development\nRisk management and product development\nJefferson National Life Insurance\nJefferson National Life Insurance\n2000 - 2005 ¬∑ 5 yrs\n2000 to 2005 ¬∑ 5 yrs\nShow all 6 experiences",
    "isCSuite": true,
    "contextForAI": "Todd Solash \n2nd degree connection\n2nd\nDeputy CEO and President, Athora Holding Ltd.\nAthora\nUniversity of Pennsylvania\nLondon, England, United Kingdom  Contact info\n3,286 followers \n500+ connections\nMaxwell (Max) Kahn is a mutual connection\nMaxwell (Max) Kahn is a mutual connection\nFollow\nMessage\nMore\nAbout\nAbout\nTodd Solash is a veteran of the retirement, annuity and life insurance industries. As Deputy CEO & President of Athora Holding Ltd., Todd helps people in accumulating assets for retirement, turning those assets into an income stream that they cannot outlive, and providing solutions that protect them from life‚Äôs uncertainties. \nTodd joined Athora from Corebridge Financial where he was President of Individual Retirement and Life Insurance. Earlier in his career, he led the Individual Annuity business at AIG and previously consulted with major insurers and banks as a partner at Oliver Wyman Financial Services. Prior to that, he held senior positions at Jefferson National Life.\n/********/\nAthora is a leading European savings and retirement services group. We concentrate on the large and attractive traditional life and pensions market, with an ambition to become a leading provider of guaranteed savings and pensions products in Europe.\nTodd Solash is a veteran of the retirement, annuity and life insurance industries. As Deputy CEO & President of Athora Holding Ltd., Todd helps people in accumulating assets for retirement, turning those assets into an income stream that they cannot outlive, and providing solutions that protect them from life‚Äôs uncertainties. Todd joined Athora from Corebridge Financial where he was President of Individual Retirement and Life Insurance. Earlier in his career, he led the Individual Annuity business at AIG and previously consulted with major insurers and banks as a partner at Oliver Wyman Financial Services. Prior to that, he held senior positions at Jefferson National Life. /********/ Athora is a leading European savings and retirement services group. We concentrate on the large and attractive traditional life and pensions market, with an ambition to become a leading provider of guaranteed savings and pensions products in Europe.\n‚Ä¶see more\nActivity\nActivity\n3,286 followers\n3,286 followers\nFollow\nPosts\nComments\nImages\nLoaded 9 Posts posts\nTodd Solash\nTodd Solash\n   ‚Ä¢ 2nd\nVerified ‚Ä¢ 2nd\nDeputy CEO and President, Athora Holding Ltd.\nDeputy CEO and President, Athora Holding Ltd.\n4mo ‚Ä¢ \n4 months ago ‚Ä¢ Visible to anyone on or off LinkedIn\nSome exciting news from Athora Italia, which is now the Title Partner of the FIGC - Federazione Italiana Giuoco Calcio Women‚Äôs Professional Serie A Division.\nThe¬†Serie A Women Athora¬†partnership reflects our commitment to supporting progress, inclusion, and opportunity - both¬†in football and in everyday life. \nWomen‚Äôs football in Italy is thriving, and we‚Äôre proud to be part of the journey,¬†helping to¬†elevate the league, its incredible athletes, and the communities they inspire.\nCongratulations to everyone involved. I‚Äôm¬†excited to see the amazing things we‚Äôll achieve together.\nYou can read the press release here: https://lnkd.in/eYHbj3JT\nhashtag\n#AthoraItalia \nhashtag\n#UnGiornoTiRingrazierai \nhashtag\n#SerieAWomenAthora\n‚Ä¶more\nActivate to view larger image,\n1/3\nActivate to view larger image,\n199\n4 comments\nTodd Solash\nTodd Solash\n   ‚Ä¢ 2nd\nVerified ‚Ä¢ 2nd\nDeputy CEO and President, Athora Holding Ltd.\nDeputy CEO and President, Athora Holding Ltd.\n5mo ‚Ä¢ \n5 months ago ‚Ä¢ Visible to anyone on or off LinkedIn\nAthora‚Äôs half-year results, released today, reflect the strength of our business model and strategy. We continue to build momentum with: higher operating capital generation, strong investment spreads, reduced expenses, and ongoing financial strength. \nJust as importantly, we continue to deliver attractive products and returns for customers across Belgium, Netherlands, Germany and Italy, while expanding our reach.\nOur planned entry into the UK market in 2026 through the acquisition of Pension Insurance Corporation Group (subject to regulatory approval) marks a huge step forward, creating one of the largest savings and retirement services companies in Europe ‚Äì a milestone in our strategic ambitions.\nI am immensely proud of the dedication of our teams. Every day, their work helps customers achieve long-term financial security and our progress is tremendously exciting. \nFor more details on our financial performance this period, please see our full press release: \nhttps://lnkd.in/eFJhXyYD\n‚Ä¶more\nHY 2025 Press release\nathora.com\n133\n2 comments\n2 reposts\nShow all posts\nExperience\nExperience\nDeputy CEO and President, Athora Holding Ltd.\nDeputy CEO and President, Athora Holding Ltd.\nAthora\nAthora\nOct 2023 - Present ¬∑ 2 yrs 5 mos\nOct 2023 to Present ¬∑ 2 yrs 5 mos\nGreater London, England, United Kingdom\nGreater London, England, United Kingdom\nPresident of Individual Retirement and Life Insurance\nPresident of Individual Retirement and Life Insurance\nCorebridge Fi",
    "searchKeyword": "CEO"
  },
  {
    "profileUrl": "https://www.linkedin.com/in/shaheensayed",
    "name": "Shaheen Sayed",
    "title": "Chief Commercial Officer at Accenture",
    "location": "London, England, United Kingdom",
    "company": "Accenture",
    "about": "",
    "experience": "Experience\nExperience\nAccenture\nAccenture\n14 yrs 7 mos\n14 yrs 7 mos\nMarket Unit Lead United Kingdom Ireland & Africa\nMarket Unit Lead United Kingdom Ireland & Africa\nSep 2023 - Present ¬∑ 2 yrs 6 mos\nSep 2023 to Present ¬∑ 2 yrs 6 mos\nLondon\nLondon\nSenior Managing Director | Technology Lead UK & Ireland\nSenior Managing Director | Technology Lead UK & Ireland\nFull-time\nFull-time\nDec 2020 - Sep 2023 ¬∑ 2 yrs 10 mos\nDec 2020 to Sep 2023 ¬∑ 2 yrs 10 mos\nSenior Managing Director | Health and Public Service Lead UK & Ireland\nSenior Managing Director | Health and Public Service Lead UK & Ireland\n2018 - Dec 2020 ¬∑ 3 yrs\n2018 to Dec 2020 ¬∑ 3 yrs\nLondon Area, United Kingdom\nLondon Area, United Kingdom\nShow all 6 experiences",
    "isCSuite": true,
    "contextForAI": "Shaheen Sayed  \n3rd degree connection\n3rd\nChief Commercial Officer at Accenture\nAccenture\nLondon, England, United Kingdom  Contact info\nAccenture UKIA \n28,120 followers \n500+ connections\nFollow\nMessage\nMore\nHighlights\nHighlights\nShaheen recently posted on LinkedIn\nShaheen recently posted on LinkedIn\nUnderstand what topics Shaheen posts about to inform your outreach.\nUnderstand what topics Shaheen posts about to inform your outreach.\nFree insight from Sales Navigator\nFree insight from Sales Navigator\nUnlock more insights about leads\nImprove outreach with sales insights\nTry Sales Navigator for ¬£0\n1-month free. We‚Äôll remind you 7 days before your trial ends.\nAbout\nAbout\nShaheen Sayed is the Head of Accenture‚Äôs UK, Ireland and Africa business (UKIA) and is a member of Accenture‚Äôs Global Management Committee. \nIn her role, Shaheen has overall responsibility for the growth and success of Accenture‚Äôs business in the regions.¬†She oversees a wide range of functions, from strategy & consulting to technology, operations and Accenture Song, ensuring that Accenture delivers high-value services to its clients.¬† Accenture is a major local employer in all three markets and also has a strong innovation footprint through R&D and investment including its brand-new AI experience studios in London and Dublin and our global innovation centre, The Dock, based in Ireland.\nPrior to this role, Shaheen led the Technology business in the UK and Ireland, specialising in complex technology and business transformations and pioneering new market technologies. During her 20-year career with Accenture, Shaheen has helped drive cutting-edge technology solutions across diverse industries, including banking, capital markets, telecommunications and healthcare. As the former head of Health & Public Service for Accenture in the UK and Ireland, she delivered innovative solutions across health, tax, welfare, justice, defence and policing.\nShaheen is a recognised thought leader on inclusive business cultures and talent in the digital age. She is a guest lecturer for the London School of Economics Global Masters Programme. She also serves as an Honorary Colonel in 3 Military Intelligence, a unit of the British Army and is a fellow of the Royal Society of Arts.\nShaheen Sayed is the Head of Accenture‚Äôs UK, Ireland and Africa business (UKIA) and is a member of Accenture‚Äôs Global Management Committee. In her role, Shaheen has overall responsibility for the growth and success of Accenture‚Äôs business in the regions.¬†She oversees a wide range of functions, from strategy & consulting to technology, operations and Accenture Song, ensuring that Accenture delivers high-value services to its clients.¬† Accenture is a major local employer in all three markets and also has a strong innovation footprint through R&D and investment including its brand-new AI experience studios in London and Dublin and our global innovation centre, The Dock, based in Ireland. ¬† Prior to this role, Shaheen led the Technology business in the UK and Ireland, specialising in complex technology and business transformations and pioneering new market technologies. During her 20-year career with Accenture, Shaheen has helped drive cutting-edge technology solutions across diverse industries, including banking, capital markets, telecommunications and healthcare. As the former head of Health & Public Service for Accenture in the UK and Ireland, she delivered innovative solutions across health, tax, welfare, justice, defence and policing. ¬† Shaheen is a recognised thought leader on inclusive business cultures and talent in the digital age. She is a guest lecturer for the London School of Economics Global Masters Programme. She also serves as an Honorary Colonel in 3 Military Intelligence, a unit of the British Army and is a fellow of the Royal Society of Arts.\n‚Ä¶see more\nFeatured\nFeatured\nPost\nPost\nGreat to see our Accenture 2025 TechVision is live, ‚ÄúAI: A Declaration Of Autonomy‚Äù. This year‚Äôs report explores how AI is reshaping industries, trust, and human-AI collaboration and highlights four main trends: \n1. The Binary Big Bang: When AI expands exponentially, systems are upended; \n2. Your Face, in the Future: Differentiating when every interface looks the same; \n3. When LLMs Get Their Bodies: How foundation models reinvent robotics; and, \n4. The New Learning Loop: How people and AI are defining a virtuous cycle of learning, leading and creating.\nWhat's clear is that the future belongs to leaders who responsibly harness AI‚Äôs potential while building trust across all those users involved and affected. Trust isn‚Äôt optional ‚Äì it‚Äôs the foundation for transformation in this new era.\nhashtag\n#TechVision2025\nhttps://lnkd.in/eYUwYa7y\nTechnology Trends 2025 | Tech Vision\naccenture.com\n177\n3 comments\nActivity\nActivity\n28,120 followers\n28,120 followers\nFollow\nPosts\nComments\nVideos\nImages\nLoaded 9 Posts posts\nShaheen Sayed\nShaheen Sayed\n   ‚Ä¢ 3rd+\nVerified ‚Ä¢ 3rd+\nChief Commercial Officer at Accenture\nChief Com",
    "searchKeyword": "CEO"
  },
  {
    "profileUrl": "https://www.linkedin.com/in/chrisnorman1",
    "name": "Chris Norman MBE",
    "title": "CEO and Founder at GOOD Agency",
    "location": "London, England, United Kingdom",
    "company": "GOOD Agency",
    "about": "",
    "experience": "Experience\nExperience\nGOOD Agency\nGOOD Agency\n30 yrs 11 mos\n30 yrs 11 mos\nClient Partner\nClient Partner\nPart-time\nPart-time\nJan 2026 - Present ¬∑ 2 mos\nJan 2026 to Present ¬∑ 2 mos\nCo-Founder\nCo-Founder\nFull-time\nFull-time\nApr 1995 - Present ¬∑ 30 yrs 11 mos\nApr 1995 to Present ¬∑ 30 yrs 11 mos\nChief Executive Officer\nChief Executive Officer\nFull-time\nFull-time\nMar 2011 - Jan 2026 ¬∑ 14 yrs 11 mos\nMar 2011 to Jan 2026 ¬∑ 14 yrs 11 mos\nLondon Area, United Kingdom\nLondon Area, United Kingdom\nShow all 4 experiences",
    "isCSuite": true,
    "contextForAI": "Chris has a {:badgeType} account\nChris Norman MBE \n3rd degree connection\n3rd\nCEO and Founder at GOOD Agency\nGOOD Agency\nLondon South Bank University\nLondon, England, United Kingdom  Contact info\n500+ connections\nConnect\nMessage\nMore\nAbout\nAbout\nGOOD is a purpose-driven strategy and creative agency. \nWe work with brands and charities to create a shared vision of a better world. We are change-drivers, committed to making our work, work for everyone.\nWork that raises funds, makes profits and shifts brand dials.\nWork that makes real people feel valued, involved, inspired.\nWork that changes the world we live in.\nWork that works harder, lasts longer, delivers more and means more.\nGOOD is a purpose-driven strategy and creative agency. We work with brands and charities to create a shared vision of a better world. We are change-drivers, committed to making our work, work for everyone. Work that raises funds, makes profits and shifts brand dials. Work that makes real people feel valued, involved, inspired. Work that changes the world we live in. Work that works harder, lasts longer, delivers more and means more.\n‚Ä¶see more\nActivity\nActivity\n2,290 followers\n2,290 followers\nPosts\nComments\nLoaded 9 Posts posts\nChris Norman MBE reposted this\nGreenheart\nGreenheart\n3,637 followers\n3,637 followers\n3w ‚Ä¢ \n3 weeks ago ‚Ä¢ Visible to anyone on or off LinkedIn\nThe last thing any leader needs in 2026 is another framework to navigate.\nIf you feel like you‚Äôre drowning in acronyms and reporting standards, you aren‚Äôt alone. Framework fatigue is real, and it‚Äôs often the biggest barrier to actual progress.\nThe truth is, most organisations already have the data and the tools they need. What‚Äôs missing isn‚Äôt more structure: it‚Äôs the capacity to make sense of it all.\nAt Greenheart, we don‚Äôt believe in adding complexity for the sake of it. Our role isn‚Äôt to hand you a new manual; it‚Äôs to help you join the dots between the ones you already have.\nWhen we partner with leadership teams, we focus on integration over accumulation. We look at how your B Corp commitments, your climate transition plans and your strategic goals can stop competing for attention and start working as one single, resilient operating system.\nThat‚Äôs when the magic happens.\nWe love nothing more than giving you the clarity to do less, but better. We aim to give you the confidence to evolve from ‚Äòmanaging‚Äô sustainability reports to actually running a high-performing, resilient and future-proof business.\nWe‚Äôre here to reduce the load, not add to it. Because a strategy that lives in a binder is just a waste of everyone‚Äôs time. Whereas a plan that lives in your day-to-day decision-making? That‚Äôs resilience.\nWhat acronyms or reporting standards would you ban right now??\nhashtag\n#Greenheart\nhashtag\n#TrustedPartner\nhashtag\n#LeadershipInPractice\n*****\nüíö We‚Äôre Greenheart. We partner with organisations to build resilient, future-fit businesses ‚Äì embedding sustainability into strategy, governance and day-to-day decision-making.\nüîî Follow us for grounded thinking on leadership, impact and building businesses that hold up under pressure.\n‚Ä¶more\nActivate to view larger image,\nActivate to view larger image,\n6\n1 repost\nChris Norman MBE reposted this\nCastle Forum\nCastle Forum\n123 followers\n123 followers\n3w ‚Ä¢ Edited ‚Ä¢ \n3 weeks ago ‚Ä¢ Edited ‚Ä¢ Visible to anyone on or off LinkedIn\nCastle Forum X Octopus Energy - The Future of Business - March 25th in London\nBIG ANNOUNCEMENT!¬†üí• üì£ \nWe are excited to invite you all to our first event of 2026 - hosted by Octopus Energy in central London on March 25th (doors at 5:30pm).\nThe topic is a fun one - The Future of Business. \nHow can business be a force for good in a world in crisis? Is corporate sustainability dead and how can companies balance profit-making with positive impact for people and planet? \nBuilding on the foundations of The Castle Debates - which ran for a decade and a half - we are re-launching with an emphasis on the future. Future generations, future business models and future systems. Our intention is to bring people together to affect positive change. \nJoin us for an engaging discussion with amazing speakers. Our events are designed to include the people in the room to spark ideas for impact. We‚Äôre all about genuine human connection and relationship building - with delicious refreshments and good vibes.\nSpeakers will be announced very soon. \nRegister to attend and find out more below. See you there!\nhttps://lnkd.in/eUKMcvwe \nAlexandra Bacon Arthur Williams Kerry G. Micael Johnstone Nathan Castle Padraig Dunne Stephen Sykes\n‚Ä¶more\nCastle Forum X Octopus Energy - The Future of Business\neventbrite.com\n21\n5 comments\n7 reposts\nShow all posts\nExperience\nExperience\nGOOD Agency\nGOOD Agency\n30 yrs 11 mos\n30 yrs 11 mos\nClient Partner\nClient Partner\nPart-time\nPart-time\nJan 2026 - Present ¬∑ 2 mos\nJan 2026 to Present ¬∑ 2 mos\nCo-Founder\nCo-Founder\nFull-time\nFull-time\nApr 1995 - Present ¬∑ 30 yrs 11 mos\nApr 1995 to Present ¬∑ 30 yrs 11 mos\nChief Executive O",
    "searchKeyword": "CEO"
  },
  {
    "profileUrl": "https://www.linkedin.com/in/herbertjames",
    "name": "James Herbert",
    "title": "Founder | Investor | Advisor",
    "location": "London, England, United Kingdom",
    "company": "Yellow Bus Capital",
    "about": "",
    "experience": "Experience\nExperience\nFounding Partner\nFounding Partner\nYellow Bus Capital ¬∑ Full-time\nYellow Bus Capital ¬∑ Full-time\nOct 2024 - Present ¬∑ 1 yr 5 mos\nOct 2024 to Present ¬∑ 1 yr 5 mos\nLondon Area, United Kingdom\nLondon Area, United Kingdom\nYellow Bus Capital is an alternative investor and advisor focused on technology and finance.\n\nWe operate at the intersection of these critical sectors, leveraging innovative strategies to drive long-term value and meaningful impact. Combining founder-led vision, entrepreneurial drive, institutional expertise and a collaborative approach, we identify, invest in, and scale the most compelling opportunities that will shape the future.\nYellow Bus Capital is an alternative investor and advisor focused on technology and finance. We operate at the intersection of these critical sectors, leveraging innovative strategies to drive long-term value and meaningful impact. Combining founder-led vision, entrepreneurial drive, institutional expertise and a collaborative approach, we identify, invest in, and scale the most compelling opportunities that will shape the future.\n‚Ä¶see more\nPrivate Equity, Venture Capital and +4 skills\nBrightsparks.\nBrightsparks.\n22 yrs 9 mos\n22 yrs 9 mos\nFounder\nFounder\nJun 2003 - Present ¬∑ 22 yrs 9 mos\nJun 2003 to Present ¬∑ 22 yrs 9 mos\nLondon Area, United Kingdom\nLondon Area, United Kingdom\nFounded in 2003 from my university bedroom, I started Brightsparks by employing friends and university colleagues to work in events and hospitality. So far, we have directly employed over 50,000 people (predominantly students and graduates), staffed over 20,000 events, run graduate recruitment campaigns placing hundreds of graduates, and developed bespoke technology to facilitate our continued growth.\n\nFounder & Non-Exec Chairman, Feb 2018 ‚Äì present.\nFounder & CEO, Jun 2003 ‚Äì Feb 2018.\nFounded in 2003 from my university bedroom, I started Brightsparks by employing friends and university colleagues to work in events and hospitality.",
    "isCSuite": true,
    "contextForAI": "James Herbert \n3rd degree connection\n3rd\nFounder | Investor | Advisor\nYellow Bus Capital\nDurham University\nLondon, England, United Kingdom  Contact info\n500+ connections\nConnect\nMessage\nMore\nAbout\nAbout\nInstinctively curious, creative, and driven, James is a seasoned and forward-thinking entrepreneur with over 20 years of experience founding and leading impactful businesses.\nJames is the Co-Founder of Yellow Bus Capital, an alternative investor and advisor focused on technology, finance, and sustainability.\nPrior to this, James led J.P. Morgan‚Äôs Tech Disruptors Vertical in the UK, where he worked with tech entrepreneurs to leverage the firm‚Äôs resources and network for growth. James is also the Founder and former CEO of Hastee, a fintech pioneer in the Earned Wage Access (EWA) category. Hastee became recognised as an industry leader, empowering employees with real-time access to their earned wages to improve their liquidity, productivity, and financial wellbeing. James began his entrepreneurial journey with Brightsparks, a business he founded while at university. Brightsparks has since employed over 50,000 people in hospitality, and James continues to serve as Chairman.\nA proud dad, sport-lover (especially golf, kitesurfing, sailing, skiing and rugby) and social animal, James is a competitive team-player who thrives on a challenge and loves working with smart and motivated people. Always learning.\nInstinctively curious, creative, and driven, James is a seasoned and forward-thinking entrepreneur with over 20 years of experience founding and leading impactful businesses. James is the Co-Founder of Yellow Bus Capital, an alternative investor and advisor focused on technology, finance, and sustainability. Prior to this, James led J.P. Morgan‚Äôs Tech Disruptors Vertical in the UK, where he worked with tech entrepreneurs to leverage the firm‚Äôs resources and network for growth. James is also the Founder and former CEO of Hastee, a fintech pioneer in the Earned Wage Access (EWA) category. Hastee became recognised as an industry leader, empowering employees with real-time access to their earned wages to improve their liquidity, productivity, and financial wellbeing. James began his entrepreneurial journey with Brightsparks, a business he founded while at university. Brightsparks has since employed over 50,000 people in hospitality, and James continues to serve as Chairman. A proud dad, sport-lover (especially golf, kitesurfing, sailing, skiing and rugby) and social animal, James is a competitive team-player who thrives on a challenge and loves working with smart and motivated people. Always learning.\n‚Ä¶see more\nTop skills\nTop skills\nEntrepreneurship ‚Ä¢ Strategy ‚Ä¢ Leadership ‚Ä¢ Business Development ‚Ä¢ Alternative Investments\nEntrepreneurship ‚Ä¢ Strategy ‚Ä¢ Leadership ‚Ä¢ Business Development ‚Ä¢ Alternative Investments\nActivity\nActivity\n6,456 followers\n6,456 followers\nLoaded 3 Comments posts\nJames Herbert commented on a post ‚Ä¢ 3w\n3w\nHas been a pleasure to be part of your journey to date, and I‚Äôm very much looking forward to this next stage and beyond. LFG!\nHas been a pleasure to be part of your journey to date, and I‚Äôm very much looking forward to this next stage and beyond. LFG!\nJames Herbert commented on a post ‚Ä¢ 1mo\n1mo\nPrompts please‚Ä¶\nPrompts please‚Ä¶\nJames Herbert commented on a post ‚Ä¢ 1mo\n1mo\nFAMILY OFFICE\nFAMILY OFFICE\nShow all comments\nExperience\nExperience\nFounding Partner\nFounding Partner\nYellow Bus Capital ¬∑ Full-time\nYellow Bus Capital ¬∑ Full-time\nOct 2024 - Present ¬∑ 1 yr 5 mos\nOct 2024 to Present ¬∑ 1 yr 5 mos\nLondon Area, United Kingdom\nLondon Area, United Kingdom\nYellow Bus Capital is an alternative investor and advisor focused on technology and finance.\nWe operate at the intersection of these critical sectors, leveraging innovative strategies to drive long-term value and meaningful impact. Combining founder-led vision, entrepreneurial drive, institutional expertise and a collaborative approach, we identify, invest in, and scale the most compelling opportunities that will shape the future.\nYellow Bus Capital is an alternative investor and advisor focused on technology and finance. We operate at the intersection of these critical sectors, leveraging innovative strategies to drive long-term value and meaningful impact. Combining founder-led vision, entrepreneurial drive, institutional expertise and a collaborative approach, we identify, invest in, and scale the most compelling opportunities that will shape the future.\n‚Ä¶see more\nPrivate Equity, Venture Capital and +4 skills\nBrightsparks.\nBrightsparks.\n22 yrs 9 mos\n22 yrs 9 mos\nFounder\nFounder\nJun 2003 - Present ¬∑ 22 yrs 9 mos\nJun 2003 to Present ¬∑ 22 yrs 9 mos\nLondon Area, United Kingdom\nLondon Area, United Kingdom\nFounded in 2003 from my university bedroom, I started Brightsparks by employing friends and university colleagues to work in events and hospitality. So far, we have directly employed over 50,000 people (predominantly students and graduates), staffed over 20",
    "searchKeyword": "CEO"
  },
  {
    "profileUrl": "https://www.linkedin.com/in/margherita-della-valle",
    "name": "Margherita Della Valle",
    "title": "Group Chief Executive Officer at Vodafone",
    "location": "London, England, United Kingdom",
    "company": "Vodafone",
    "about": "",
    "experience": "Experience\nExperience\nVodafone\nVodafone\n31 yrs 10 mos\n31 yrs 10 mos\nGroup Chief Executive\nGroup Chief Executive\nFull-time\nFull-time\nJan 2023 - Present ¬∑ 3 yrs 2 mos\nJan 2023 to Present ¬∑ 3 yrs 2 mos\nGroup CFO\nGroup CFO\nJul 2018 - Aug 2023 ¬∑ 5 yrs 2 mos\nJul 2018 to Aug 2023 ¬∑ 5 yrs 2 mos\nDeputy Group CFO\nDeputy Group CFO\nJul 2015 - Jul 2018 ¬∑ 3 yrs 1 mo\nJul 2015 to Jul 2018 ¬∑ 3 yrs 1 mo\nShow all 6 experiences",
    "isCSuite": true,
    "contextForAI": "Margherita has a {:badgeType} account\nMargherita Della Valle \n3rd degree connection\n3rd\nGroup Chief Executive Officer at Vodafone\n Top Voice\nVodafone\nUniversit√† Bocconi\nLondon, England, United Kingdom  Contact info\n37,940 followers\nFollow\nConnect\nMore\nActivity\nActivity\n37,940 followers\n37,940 followers\nFollow\nPosts\nComments\nImages\nLoaded 9 Posts posts\nMargherita Della Valle\nMargherita Della Valle\n ‚Ä¢ 3rd+\nInfluencer ‚Ä¢ 3rd+\nGroup Chief Executive Officer at Vodafone\nGroup Chief Executive Officer at Vodafone\n2mo ‚Ä¢ \n2 months ago ‚Ä¢ Visible to anyone on or off LinkedIn\nAs part of the German President‚Äôs state visit to the UK, it was an honour to attend the business roundtable with President Frank-Walter Steinmeier, UK Prime Minister Keir Starmer , and a group of German and UK business leaders across defence, energy, automotive, and financial services. Collaboration across borders is essential for Europe‚Äôs resilience, security, and competitiveness. And, it‚Äôs great to see the growing focus on developing the European technology ecosystem and strengthening strategically critical infrastructure, including telecoms.\n‚Ä¶more\nActivate to view larger image,\nActivate to view larger image,\n2,165\n20 comments\n15 reposts\nMargherita Della Valle\nMargherita Della Valle\n ‚Ä¢ 3rd+\nInfluencer ‚Ä¢ 3rd+\nGroup Chief Executive Officer at Vodafone\nGroup Chief Executive Officer at Vodafone\n3mo ‚Ä¢ Edited ‚Ä¢ \n3 months ago ‚Ä¢ Edited ‚Ä¢ Visible to anyone on or off LinkedIn\nLast week, I joined Emmet Kelly at the Morgan Stanley TMT 2025 Conference to talk through Vodafone‚Äôs H1 FY26 results, and our ambitions beyond. \nThe last two and a half years have seen us undergo a comprehensive transformation at Vodafone, setting the foundations for sustainable growth. We‚Äôve reshaped the Group, reset our capital structure, improved our customer experience, and simplified how we operate. As a result, we are now seeing growth across Europe and Africa, where we hold strong market positions with clear acceleration potential. \nBut, there is much more to do. We will continue to focus on our priorities of Customers, Simplicity, and Growth, with disciplined execution driving operational excellence. \nYou can find more details on our H1 FY26 results here - https://lnkd.in/exnvtJbi\n‚Ä¶more\nActivate to view larger image,\nActivate to view larger image,\n594\n9 comments\n10 reposts\nShow all posts\nExperience\nExperience\nVodafone\nVodafone\n31 yrs 10 mos\n31 yrs 10 mos\nGroup Chief Executive\nGroup Chief Executive\nFull-time\nFull-time\nJan 2023 - Present ¬∑ 3 yrs 2 mos\nJan 2023 to Present ¬∑ 3 yrs 2 mos\nGroup CFO\nGroup CFO\nJul 2018 - Aug 2023 ¬∑ 5 yrs 2 mos\nJul 2018 to Aug 2023 ¬∑ 5 yrs 2 mos\nDeputy Group CFO\nDeputy Group CFO\nJul 2015 - Jul 2018 ¬∑ 3 yrs 1 mo\nJul 2015 to Jul 2018 ¬∑ 3 yrs 1 mo\nShow all 6 experiences\nEducation\nEducation\nUniversit√† Bocconi\nUniversit√† Bocconi\nMaster's degree in Economics, International Economics\nMaster's degree in Economics, International Economics\n1983 - 1988\n1983 - 1988\nSkills\nSkills\nBusiness Planning\nBusiness Planning\nEndorsed by Pietro Guindani and 5 others who are highly skilled at this\nEndorsed by Pietro Guindani and 5 others who are highly skilled at this\nEndorsed by 29 colleagues at Vodafone\nEndorsed by 29 colleagues at Vodafone\n32 endorsements\n32 endorsements\nBusiness Strategy\nBusiness Strategy\nEndorsed by Oliver Kelly and 4 others who are highly skilled at this\nEndorsed by Oliver Kelly and 4 others who are highly skilled at this\nEndorsed by 31 colleagues at Vodafone\nEndorsed by 31 colleagues at Vodafone\n35 endorsements\n35 endorsements\nShow all 21 skills\nLanguages\nLanguages\nEnglish\nEnglish\nFrench\nFrench\nShow all 3 languages\nInterests\nInterests\nCompanies\nCompanies\nSchools\nSchools\nVodafone\nVodafone\n2,514,907 followers\n2,514,907 followers\nFollow\nUniversit√† Bocconi\nUniversit√† Bocconi\n377,383 followers\n377,383 followers\nFollow\nShow all companies",
    "searchKeyword": "CEO"
  },
  {
    "profileUrl": "https://www.linkedin.com/in/duncan-wanblad-freng-b4a46b14",
    "name": "Duncan Wanblad FREng",
    "title": "Chief Executive Officer at Anglo American",
    "location": "London, England, United Kingdom",
    "company": "Anglo American",
    "about": "",
    "experience": "Experience\nExperience\nAnglo American\nAnglo American\n17 yrs 9 mos\n17 yrs 9 mos\nChief Executive Officer\nChief Executive Officer\nFull-time\nFull-time\nApr 2022 - Present ¬∑ 3 yrs 11 mos\nApr 2022 to Present ¬∑ 3 yrs 11 mos\nGroup Director - Strategy and Business Development at Anglo American\nGroup Director - Strategy and Business Development at Anglo American\nFull-time\nFull-time\nJan 2016 - Apr 2022 ¬∑ 6 yrs 4 mos\nJan 2016 to Apr 2022 ¬∑ 6 yrs 4 mos\nGreater London, England, United Kingdom\nGreater London, England, United Kingdom\nCEO Base Metals and Minerals\nCEO Base Metals and Minerals\nAug 2013 - Jan 2019 ¬∑ 5 yrs 6 mos\nAug 2013 to Jan 2019 ¬∑ 5 yrs 6 mos\nLondon Area, United Kingdom\nLondon Area, United Kingdom\nShow all 5 experiences\nExecutive Director: Projects and Engineering\nExecutive Director: Projects and Engineering\nAnglo Platinum\nAnglo Platinum\n2004 - 2008 ¬∑ 4 yrs\n2004 to 2008 ¬∑ 4 yrs\nCity of Johannesburg, Gauteng, South Africa\nCity of Johannesburg, Gauteng, South Africa",
    "isCSuite": true,
    "contextForAI": "Duncan has a {:badgeType} account\nDuncan Wanblad FREng \n3rd degree connection\n3rd\nChief Executive Officer at Anglo American\nAnglo American\nUniversity of the Witwatersrand\nLondon, England, United Kingdom  Contact info\n500+ connections\nConnect\nMessage\nMore\nActivity\nActivity\n4,084 followers\n4,084 followers\nDuncan hasn‚Äôt posted yet\nRecent posts Duncan shares will be displayed here.\nShow all activity\nExperience\nExperience\nAnglo American\nAnglo American\n17 yrs 9 mos\n17 yrs 9 mos\nChief Executive Officer\nChief Executive Officer\nFull-time\nFull-time\nApr 2022 - Present ¬∑ 3 yrs 11 mos\nApr 2022 to Present ¬∑ 3 yrs 11 mos\nGroup Director - Strategy and Business Development at Anglo American\nGroup Director - Strategy and Business Development at Anglo American\nFull-time\nFull-time\nJan 2016 - Apr 2022 ¬∑ 6 yrs 4 mos\nJan 2016 to Apr 2022 ¬∑ 6 yrs 4 mos\nGreater London, England, United Kingdom\nGreater London, England, United Kingdom\nCEO Base Metals and Minerals\nCEO Base Metals and Minerals\nAug 2013 - Jan 2019 ¬∑ 5 yrs 6 mos\nAug 2013 to Jan 2019 ¬∑ 5 yrs 6 mos\nLondon Area, United Kingdom\nLondon Area, United Kingdom\nShow all 5 experiences\nExecutive Director: Projects and Engineering\nExecutive Director: Projects and Engineering\nAnglo Platinum\nAnglo Platinum\n2004 - 2008 ¬∑ 4 yrs\n2004 to 2008 ¬∑ 4 yrs\nCity of Johannesburg, Gauteng, South Africa\nCity of Johannesburg, Gauteng, South Africa\nEducation\nEducation\nUniversity of the Witwatersrand\nUniversity of the Witwatersrand\nGDE Industrial Engineering\nGDE Industrial Engineering\n1996 - 1997\n1996 - 1997\nUniversity of the Witwatersrand\nUniversity of the Witwatersrand\nBSc Mech Eng, Engineering\nBSc Mech Eng, Engineering\n1985 - 1989\n1985 - 1989\nShow all 3 educations\nSkills\nSkills\nMining\nMining\nEndorsed by Paulo Castellari and 7 others who are highly skilled at this\nEndorsed by Paulo Castellari and 7 others who are highly skilled at this\nEndorsed by 12 colleagues at Anglo American\nEndorsed by 12 colleagues at Anglo American\n38 endorsements\n38 endorsements\nCoal\nCoal\nEndorsed by 4 colleagues at Anglo American\nEndorsed by 4 colleagues at Anglo American\n17 endorsements\n17 endorsements\nShow all 34 skills\nInterests\nInterests\nCompanies\nCompanies\nSchools\nSchools\nINSEAD\nINSEAD\n747,616 followers\n747,616 followers\nFollow\nAnglo American\nAnglo American\n1,414,492 followers\n1,414,492 followers\nFollow\nShow all companies",
    "searchKeyword": "CEO"
  },
  {
    "profileUrl": "https://www.linkedin.com/in/steve-jackson-7452a719",
    "name": "Steve Jackson",
    "title": "Dad, Technologist, Private Investor and Innovator",
    "location": "United Kingdom",
    "company": "",
    "about": "",
    "experience": "Experience\nExperience\nDirector\nDirector\nDirector\nHeritage Hen Huts Limited ¬∑ Part-time\nHeritage Hen Huts Limited ¬∑ Part-time\nJul 2024 - Present ¬∑ 1 yr 8 mos\nJul 2024 to Present ¬∑ 1 yr 8 mos\nUnited Kingdom ¬∑ Hybrid\nUnited Kingdom ¬∑ Hybrid\nA forward thinking and innovative company brining new products to market, designed and manufactured in the UK, changing the way poultry is cared for, increasing efficiency and egg production, to challenge the status quo resulting in happy hens‚Ä¶. Buy British‚Ä¶\nA forward thinking and innovative company brining new products to market, designed and manufactured in the UK, changing the way poultry is cared for, increasing efficiency and egg production, to challenge the status quo resulting in happy hens‚Ä¶. Buy British‚Ä¶\n‚Ä¶see more\nBusiness Strategy, Entrepreneurship and +3 skills\nProperty Developer\nProperty Developer\nProperty Developer\nJackdaw Property ¬∑ Part-time\nJackdaw Property ¬∑ Part-time\nDec 1988 - Present ¬∑ 37 yrs 3 mos\nDec 1988 to Present ¬∑ 37 yrs 3 mos\nUnited Kingdom\nUnited Kingdom\nMy passion for creating - \nNew builds developments \nProperty renovations\nFrom hotels to broken down shacks I have played with all types!! \n\nMy passion for creating - New builds developments Property renovations From hotels to broken down shacks I have played with all types!! \n‚Ä¶see more\nDirector level\nINSPIREMENTOR LIMITED logo\nFounder Owner\nFounder Owner\nINSPIREMENTOR LIMITED ¬∑ Part-time\nINSPIREMENTOR LIMITED ¬∑ Part-time\nDec 2013 - Present ¬∑ 12 yrs 3 mos\nDec 2013 to Present ¬∑ 12 yrs 3 mos\nHampshire\nHampshire\nBusiness Strategy, Non Executive, Exit / Acquisition and Investment \n\nFocused on working with innovative disruptive companies who are owner led to help them achieve their full potential.\n\nCurrently looking to invest in forward thinking companies who challenge status quo.\nBusiness Strategy, Non Executive, Exit / Acquisition and Investment Focused on working with innovative disruptive companies who are owner led to help them achieve their full potential.",
    "isCSuite": true,
    "contextForAI": "Steve Jackson\n2nd degree connection\n2nd\nDad, Technologist, Private Investor and Innovator\nUnited Kingdom  Contact info\n500+ connections\nIwona Plumpton is a mutual connection\nIwona Plumpton is a mutual connection\nConnect\nMessage\nMore\nAbout\nAbout\nI am a Dad, husband, Investor, technologist, consultant, proven business leader and property developer with over 40 years of experience, with a passion for strategy, innovation and growth in whatever I put my mind to.\nHaving made enough I have jumped off the ‚Äòbandwagon‚Äô after a very successful technology and property development career and now focus on my family and farm‚Ä¶\nTo all my colleagues who I worked with please remember to get off whilst you are still young enough to enjoy what‚Äôs important to you, rather than trying to keep up with the Jones‚Äôs. \n‚Äî‚Äî‚Äî‚Äî‚Äî‚Äî‚Äî‚Äî-\nI can say in my time I have grown, merged, acquired, sold, undertaken an MBO and played the turnaround specialist in a number of businesses addressing the private, healthcare and public sector environments.\nOver the years I have held positions from Non Exec, Investor, Owner, Shareholder, CEO, Chairman, Managing Director and Sales Director, creating and growing teams both on a local and global scale.\n‚Äî‚Äî‚Äî‚Äî\nMy style is ‚Äôhands on‚Äô growing and empowering teams ensuring I gain the best from them and therefore for the company and its shareholders.\nSome of the highlights\n2024/25 Enjoying Life \n2024. Creation of Heritage Hen Huts Limited \n2023/ 4 Exit Amicus ITS / Aura \n2022 Sold Flaxfield House Holiday Homes ¬£3m\n2019 Tech NED and Company Advisor \n2019 Merger of Amicus ITS with Aura\n2018. Creation of Flaxfield House Holiday Homes\n2016 Completed MBO of Amicus ITS\n2014 Amicus ITS managed services recognised no 1 in field Europe\n2013 Creation of Inspirementor\n2012 Sold Amicus ITS / Harmoni healthcare Group ¬£110M t/o employing 2500 people for ¬£48m\n2010 Created Dorset Shepherd Huts\n2008 Created technology Amicus ITS global partner programme\n2008 Opened Amicus ITS India operation\n2007 Merged two failing technology companies/created Amicus ITS\n2007 Sales Director Deverill technology \n2004/7 Creation Property Development Company and traveled the world \n2000/4 Grew WCI European and USA Technology operations 100% YOY\n2004. WCI International technology director \n2000 Sold 2GL global consulting firm\n1999 helped grow 2GL to ¬£35M t/o\n1998 Acquired software company \n1995/7 Expands locations across the UK\n1988 2GL computer services company\n1985 IBM‚Äôs ‚ÄòYoungest Engineer UK‚Äô\n I am a Dad, husband, Investor, technologist, consultant, proven business leader and property developer with over 40 years of experience, with a passion for strategy, innovation and growth in whatever I put my mind to. Having made enough I have jumped off the ‚Äòbandwagon‚Äô after a very successful technology and property development career and now focus on my family and farm‚Ä¶ To all my colleagues who I worked with please remember to get off whilst you are still young enough to enjoy what‚Äôs important to you, rather than trying to keep up with the Jones‚Äôs. ‚Äî‚Äî‚Äî‚Äî‚Äî‚Äî‚Äî‚Äî- I can say in my time I have grown, merged, acquired, sold, undertaken an MBO and played the turnaround specialist in a number of businesses addressing the private, healthcare and public sector environments. Over the years I have held positions from Non Exec, Investor, Owner, Shareholder, CEO, Chairman, Managing Director and Sales Director, creating and growing teams both on a local and global scale. ‚Äî‚Äî‚Äî‚Äî My style is ‚Äôhands on‚Äô growing and empowering teams ensuring I gain the best from them and therefore for the company and its shareholders. Some of the highlights 2024/25 Enjoying Life 2024. Creation of Heritage Hen Huts Limited 2023/ 4 Exit Amicus ITS / Aura 2022 Sold Flaxfield House Holiday Homes ¬£3m 2019 Tech NED and Company Advisor 2019 Merger of Amicus ITS with Aura 2018. Creation of Flaxfield House Holiday Homes 2016 Completed MBO of Amicus ITS 2014 Amicus ITS managed services recognised no 1 in field Europe 2013 Creation of Inspirementor 2012 Sold Amicus ITS / Harmoni healthcare Group ¬£110M t/o employing 2500 people for ¬£48m 2010 Created Dorset Shepherd Huts 2008 Created technology Amicus ITS global partner programme 2008 Opened Amicus ITS India operation 2007 Merged two failing technology companies/created Amicus ITS 2007 Sales Director Deverill technology 2004/7 Creation Property Development Company and traveled the world 2000/4 Grew WCI European and USA Technology operations 100% YOY 2004. WCI International technology director 2000 Sold 2GL global consulting firm 1999 helped grow 2GL to ¬£35M t/o 1998 Acquired software company 1995/7 Expands locations across the UK 1988 2GL computer services company 1985 IBM‚Äôs ‚ÄòYoungest Engineer UK‚Äô\n‚Ä¶see more\nServices\nServices\nManagement Consulting ‚Ä¢ Business Consulting\nManagement Consulting ‚Ä¢ Business Consulting\nRequest services\nShow all services\nActivity\nActivity\n1,073 followers\n1,073 followers\nLoaded 3 Comments posts\nSteve Jackson commented on a post ‚Ä¢ 4mo\n4mo\nBria",
    "searchKeyword": "CEO"
  },
  {
    "profileUrl": "https://www.linkedin.com/in/ACoAAAPHxWUB59dqev-1XvyVABqJBA__d2hCmOk",
    "name": "Steve Jackson",
    "title": "Dad, Technologist, Private Investor and Innovator",
    "location": "United Kingdom",
    "company": "",
    "about": "",
    "experience": "Experience\nExperience\nDirector\nDirector\nDirector\nHeritage Hen Huts Limited ¬∑ Part-time\nHeritage Hen Huts Limited ¬∑ Part-time\nJul 2024 - Present ¬∑ 1 yr 8 mos\nJul 2024 to Present ¬∑ 1 yr 8 mos\nUnited Kingdom ¬∑ Hybrid\nUnited Kingdom ¬∑ Hybrid\nA forward thinking and innovative company brining new products to market, designed and manufactured in the UK, changing the way poultry is cared for, increasing efficiency and egg production, to challenge the status quo resulting in happy hens‚Ä¶. Buy British‚Ä¶\nA forward thinking and innovative company brining new products to market, designed and manufactured in the UK, changing the way poultry is cared for, increasing efficiency and egg production, to challenge the status quo resulting in happy hens‚Ä¶. Buy British‚Ä¶\n‚Ä¶see more\nBusiness Strategy, Entrepreneurship and +3 skills\nProperty Developer\nProperty Developer\nProperty Developer\nJackdaw Property ¬∑ Part-time\nJackdaw Property ¬∑ Part-time\nDec 1988 - Present ¬∑ 37 yrs 3 mos\nDec 1988 to Present ¬∑ 37 yrs 3 mos\nUnited Kingdom\nUnited Kingdom\nMy passion for creating - \nNew builds developments \nProperty renovations\nFrom hotels to broken down shacks I have played with all types!! \n\nMy passion for creating - New builds developments Property renovations From hotels to broken down shacks I have played with all types!! \n‚Ä¶see more\nDirector level\nINSPIREMENTOR LIMITED logo\nFounder Owner\nFounder Owner\nINSPIREMENTOR LIMITED ¬∑ Part-time\nINSPIREMENTOR LIMITED ¬∑ Part-time\nDec 2013 - Present ¬∑ 12 yrs 3 mos\nDec 2013 to Present ¬∑ 12 yrs 3 mos\nHampshire\nHampshire\nBusiness Strategy, Non Executive, Exit / Acquisition and Investment \n\nFocused on working with innovative disruptive companies who are owner led to help them achieve their full potential.\n\nCurrently looking to invest in forward thinking companies who challenge status quo.\nBusiness Strategy, Non Executive, Exit / Acquisition and Investment Focused on working with innovative disruptive companies who are owner led to help them achieve their full potential.",
    "isCSuite": true,
    "contextForAI": "Steve Jackson\n2nd degree connection\n2nd\nDad, Technologist, Private Investor and Innovator\nUnited Kingdom  Contact info\n500+ connections\nIwona Plumpton is a mutual connection\nIwona Plumpton is a mutual connection\nConnect\nMessage\nMore\nAbout\nAbout\nI am a Dad, husband, Investor, technologist, consultant, proven business leader and property developer with over 40 years of experience, with a passion for strategy, innovation and growth in whatever I put my mind to.\nHaving made enough I have jumped off the ‚Äòbandwagon‚Äô after a very successful technology and property development career and now focus on my family and farm‚Ä¶\nTo all my colleagues who I worked with please remember to get off whilst you are still young enough to enjoy what‚Äôs important to you, rather than trying to keep up with the Jones‚Äôs. \n‚Äî‚Äî‚Äî‚Äî‚Äî‚Äî‚Äî‚Äî-\nI can say in my time I have grown, merged, acquired, sold, undertaken an MBO and played the turnaround specialist in a number of businesses addressing the private, healthcare and public sector environments.\nOver the years I have held positions from Non Exec, Investor, Owner, Shareholder, CEO, Chairman, Managing Director and Sales Director, creating and growing teams both on a local and global scale.\n‚Äî‚Äî‚Äî‚Äî\nMy style is ‚Äôhands on‚Äô growing and empowering teams ensuring I gain the best from them and therefore for the company and its shareholders.\nSome of the highlights\n2024/25 Enjoying Life \n2024. Creation of Heritage Hen Huts Limited \n2023/ 4 Exit Amicus ITS / Aura \n2022 Sold Flaxfield House Holiday Homes ¬£3m\n2019 Tech NED and Company Advisor \n2019 Merger of Amicus ITS with Aura\n2018. Creation of Flaxfield House Holiday Homes\n2016 Completed MBO of Amicus ITS\n2014 Amicus ITS managed services recognised no 1 in field Europe\n2013 Creation of Inspirementor\n2012 Sold Amicus ITS / Harmoni healthcare Group ¬£110M t/o employing 2500 people for ¬£48m\n2010 Created Dorset Shepherd Huts\n2008 Created technology Amicus ITS global partner programme\n2008 Opened Amicus ITS India operation\n2007 Merged two failing technology companies/created Amicus ITS\n2007 Sales Director Deverill technology \n2004/7 Creation Property Development Company and traveled the world \n2000/4 Grew WCI European and USA Technology operations 100% YOY\n2004. WCI International technology director \n2000 Sold 2GL global consulting firm\n1999 helped grow 2GL to ¬£35M t/o\n1998 Acquired software company \n1995/7 Expands locations across the UK\n1988 2GL computer services company\n1985 IBM‚Äôs ‚ÄòYoungest Engineer UK‚Äô\n I am a Dad, husband, Investor, technologist, consultant, proven business leader and property developer with over 40 years of experience, with a passion for strategy, innovation and growth in whatever I put my mind to. Having made enough I have jumped off the ‚Äòbandwagon‚Äô after a very successful technology and property development career and now focus on my family and farm‚Ä¶ To all my colleagues who I worked with please remember to get off whilst you are still young enough to enjoy what‚Äôs important to you, rather than trying to keep up with the Jones‚Äôs. ‚Äî‚Äî‚Äî‚Äî‚Äî‚Äî‚Äî‚Äî- I can say in my time I have grown, merged, acquired, sold, undertaken an MBO and played the turnaround specialist in a number of businesses addressing the private, healthcare and public sector environments. Over the years I have held positions from Non Exec, Investor, Owner, Shareholder, CEO, Chairman, Managing Director and Sales Director, creating and growing teams both on a local and global scale. ‚Äî‚Äî‚Äî‚Äî My style is ‚Äôhands on‚Äô growing and empowering teams ensuring I gain the best from them and therefore for the company and its shareholders. Some of the highlights 2024/25 Enjoying Life 2024. Creation of Heritage Hen Huts Limited 2023/ 4 Exit Amicus ITS / Aura 2022 Sold Flaxfield House Holiday Homes ¬£3m 2019 Tech NED and Company Advisor 2019 Merger of Amicus ITS with Aura 2018. Creation of Flaxfield House Holiday Homes 2016 Completed MBO of Amicus ITS 2014 Amicus ITS managed services recognised no 1 in field Europe 2013 Creation of Inspirementor 2012 Sold Amicus ITS / Harmoni healthcare Group ¬£110M t/o employing 2500 people for ¬£48m 2010 Created Dorset Shepherd Huts 2008 Created technology Amicus ITS global partner programme 2008 Opened Amicus ITS India operation 2007 Merged two failing technology companies/created Amicus ITS 2007 Sales Director Deverill technology 2004/7 Creation Property Development Company and traveled the world 2000/4 Grew WCI European and USA Technology operations 100% YOY 2004. WCI International technology director 2000 Sold 2GL global consulting firm 1999 helped grow 2GL to ¬£35M t/o 1998 Acquired software company 1995/7 Expands locations across the UK 1988 2GL computer services company 1985 IBM‚Äôs ‚ÄòYoungest Engineer UK‚Äô\n‚Ä¶see more\nServices\nServices\nManagement Consulting ‚Ä¢ Business Consulting\nManagement Consulting ‚Ä¢ Business Consulting\nRequest services\nShow all services\nActivity\nActivity\n1,073 followers\n1,073 followers\nLoaded 3 Comments posts\nSteve Jackson commented on a post ‚Ä¢ 4mo\n4mo\nBria",
    "searchKeyword": "CEO"
  },
  {
    "profileUrl": "https://www.linkedin.com/in/donald-oberia-41a582119",
    "name": "Donald Oberia",
    "title": "Senior Building Surveyor @ StartTo End LTD",
    "location": "United Kingdom",
    "company": "StartTo End LTD",
    "about": "",
    "experience": "Experience\nExperience\nSenior Building Surveyor\nSenior Building Surveyor\nSenior Building Surveyor\nStartTo End LTD ¬∑ Full-time\nStartTo End LTD ¬∑ Full-time\nOct 2022 - Present ¬∑ 3 yrs 5 mos\nOct 2022 to Present ¬∑ 3 yrs 5 mos\nUnited Kingdom ¬∑ Hybrid\nUnited Kingdom ¬∑ Hybrid\nAutoCAD, Microsoft Office and +7 skills\nCurrie & Brown\nCurrie & Brown\nFull-time ¬∑ 1 yr 1 mo\nFull-time ¬∑ 1 yr 1 mo\nUnited Kingdom\nUnited Kingdom\nAssistant Building Surveyor\nAssistant Building Surveyor\nMar 2022 - Mar 2023 ¬∑ 1 yr 1 mo\nMar 2022 to Mar 2023 ¬∑ 1 yr 1 mo\nAssistant Building Surveyor\nAssistant Building Surveyor\nMar 2022 - Mar 2023 ¬∑ 1 yr 1 mo\nMar 2022 to Mar 2023 ¬∑ 1 yr 1 mo\nTrainee Building Surveyor\nTrainee Building Surveyor\nTrainee Building Surveyor\nPrembuild Midlands Ltd ¬∑ Part-time\nPrembuild Midlands Ltd ¬∑ Part-time\nNov 2019 - Jan 2023 ¬∑ 3 yrs 3 mos\nNov 2019 to Jan 2023 ¬∑ 3 yrs 3 mos\nBirmingham, England, United Kingdom\nBirmingham, England, United Kingdom\nGraduate Building Surveyor\nGraduate Building Surveyor\ncalfordseaden ¬∑ Full-time\ncalfordseaden ¬∑ Full-time\nAug 2021 - Feb 2022 ¬∑ 7 mos\nAug 2021 to Feb 2022 ¬∑ 7 mos\nChief Executive Officer\nChief Executive Officer\nChief Executive Officer\nLabell√© ldn\nLabell√© ldn\nJan 2020 - Feb 2022 ¬∑ 2 yrs 2 mos\nJan 2020 to Feb 2022 ¬∑ 2 yrs 2 mos\nShow all 9 experiences",
    "isCSuite": true,
    "contextForAI": "Donald Oberia\n2nd degree connection\n2nd\nSenior Building Surveyor @ StartTo End LTD\nStartTo End LTD\nUniversity of Wolverhampton\nUnited Kingdom  Contact info\n390 followers \n323 connections\nIwona Plumpton is a mutual connection\nIwona Plumpton is a mutual connection\nFollow\nMessage\nMore\nAbout\nAbout\nHead Building Surveyor at STEND, I lead a team of professionals in delivering high-quality building surveys, stock condition surveys, project management, and building design services. We work with a diverse range of clients, from social housing providers to commercial developers, to make the built environment safer, more efficient, and sustainable.\nI have a BSc in Building Surveying from the University of Wolverhampton, and I am an Undergraduate Member of the Chartered Institute of Building (RICS). I have over 6 years of experience in the industry, working for reputable firms such as Currie & Brown and Calfordseaden. I have developed core competencies in building surveying, social housing, dilapidations, and Spanish language. I am passionate about precision and client satisfaction, and I am always eager to learn and grow. Let's connect and explore how we can work together to elevate your property assets. You can reach me at donald@starttoend.co.uk.\nHead Building Surveyor at STEND, I lead a team of professionals in delivering high-quality building surveys, stock condition surveys, project management, and building design services. We work with a diverse range of clients, from social housing providers to commercial developers, to make the built environment safer, more efficient, and sustainable. I have a BSc in Building Surveying from the University of Wolverhampton, and I am an Undergraduate Member of the Chartered Institute of Building (RICS). I have over 6 years of experience in the industry, working for reputable firms such as Currie & Brown and Calfordseaden. I have developed core competencies in building surveying, social housing, dilapidations, and Spanish language. I am passionate about precision and client satisfaction, and I am always eager to learn and grow. Let's connect and explore how we can work together to elevate your property assets. You can reach me at donald@starttoend.co.uk.\n‚Ä¶see more\nTop skills\nTop skills\nTeam Leadership ‚Ä¢ AutoCAD ‚Ä¢ Construction ‚Ä¢ Microsoft Office ‚Ä¢ CostX\nTeam Leadership ‚Ä¢ AutoCAD ‚Ä¢ Construction ‚Ä¢ Microsoft Office ‚Ä¢ CostX\nServices\nServices\nAccounting ‚Ä¢ Bookkeeping ‚Ä¢ 3D Design ‚Ä¢ Engineering Design ‚Ä¢ Architecture ‚Ä¢ Landscape Design ‚Ä¢ Property Law ‚Ä¢ Writing\nAccounting ‚Ä¢ Bookkeeping ‚Ä¢ 3D Design ‚Ä¢ Engineering Design ‚Ä¢ Architecture ‚Ä¢ Landscape Design ‚Ä¢ Property Law ‚Ä¢ Writing\nRequest services\nShow all services\nActivity\nActivity\n390 followers\n390 followers\nFollow\nDonald hasn‚Äôt posted yet\nRecent posts Donald shares will be displayed here.\nShow all activity\nExperience\nExperience\nSenior Building Surveyor\nSenior Building Surveyor\nSenior Building Surveyor\nStartTo End LTD ¬∑ Full-time\nStartTo End LTD ¬∑ Full-time\nOct 2022 - Present ¬∑ 3 yrs 5 mos\nOct 2022 to Present ¬∑ 3 yrs 5 mos\nUnited Kingdom ¬∑ Hybrid\nUnited Kingdom ¬∑ Hybrid\nAutoCAD, Microsoft Office and +7 skills\nCurrie & Brown\nCurrie & Brown\nFull-time ¬∑ 1 yr 1 mo\nFull-time ¬∑ 1 yr 1 mo\nUnited Kingdom\nUnited Kingdom\nAssistant Building Surveyor\nAssistant Building Surveyor\nMar 2022 - Mar 2023 ¬∑ 1 yr 1 mo\nMar 2022 to Mar 2023 ¬∑ 1 yr 1 mo\nAssistant Building Surveyor\nAssistant Building Surveyor\nMar 2022 - Mar 2023 ¬∑ 1 yr 1 mo\nMar 2022 to Mar 2023 ¬∑ 1 yr 1 mo\nTrainee Building Surveyor\nTrainee Building Surveyor\nTrainee Building Surveyor\nPrembuild Midlands Ltd ¬∑ Part-time\nPrembuild Midlands Ltd ¬∑ Part-time\nNov 2019 - Jan 2023 ¬∑ 3 yrs 3 mos\nNov 2019 to Jan 2023 ¬∑ 3 yrs 3 mos\nBirmingham, England, United Kingdom\nBirmingham, England, United Kingdom\nGraduate Building Surveyor\nGraduate Building Surveyor\ncalfordseaden ¬∑ Full-time\ncalfordseaden ¬∑ Full-time\nAug 2021 - Feb 2022 ¬∑ 7 mos\nAug 2021 to Feb 2022 ¬∑ 7 mos\nChief Executive Officer\nChief Executive Officer\nChief Executive Officer\nLabell√© ldn\nLabell√© ldn\nJan 2020 - Feb 2022 ¬∑ 2 yrs 2 mos\nJan 2020 to Feb 2022 ¬∑ 2 yrs 2 mos\nShow all 9 experiences\nEducation\nEducation\nUniversity of Wolverhampton\nUniversity of Wolverhampton\nBachelor's degree, Building surveying\nBachelor's degree, Building surveying\n2016 - 2019\n2016 - 2019\nSutton Colfield college\nSutton Colfield college\nSutton Colfield college\n2012 - 2015\n2012 - 2015\nLicenses & certifications\nLicenses & certifications\nGoogle¬†Ads Display Certification\nGoogle¬†Ads Display Certification\nGoogle\nGoogle\nIssued Jul 2022\nIssued Jul 2022\nCredential ID 118830848\nCredential ID 118830848\nShow credential\nBusiness Peer Network\nBusiness Peer Network \nBusiness Peer Network \nIBD\nIBD\nIssued Jun 2021\nIssued Jun 2021\nShow all 6 licenses & certifications\nSkills\nSkills\nBuilding Surveying\nBuilding Surveying\nSenior Building Surveyor at StartTo End LTD\nSenior Building Surveyor at StartTo End LTD\n1 endorsement\n1 endorsement\nSocial Housing\nSocial Housing\nSenior Building Surveyor at StartTo End ",
    "searchKeyword": "CEO"
  },
  {
    "profileUrl": "https://www.linkedin.com/in/ACoAAB1zY9YBC2VLQJtQ5qK_Oj_JKzPo4xD8Q6g",
    "name": "Donald Oberia",
    "title": "Senior Building Surveyor @ StartTo End LTD",
    "location": "United Kingdom",
    "company": "StartTo End LTD",
    "about": "",
    "experience": "Experience\nExperience\nSenior Building Surveyor\nSenior Building Surveyor\nSenior Building Surveyor\nStartTo End LTD ¬∑ Full-time\nStartTo End LTD ¬∑ Full-time\nOct 2022 - Present ¬∑ 3 yrs 5 mos\nOct 2022 to Present ¬∑ 3 yrs 5 mos\nUnited Kingdom ¬∑ Hybrid\nUnited Kingdom ¬∑ Hybrid\nAutoCAD, Microsoft Office and +7 skills\nCurrie & Brown\nCurrie & Brown\nFull-time ¬∑ 1 yr 1 mo\nFull-time ¬∑ 1 yr 1 mo\nUnited Kingdom\nUnited Kingdom\nAssistant Building Surveyor\nAssistant Building Surveyor\nMar 2022 - Mar 2023 ¬∑ 1 yr 1 mo\nMar 2022 to Mar 2023 ¬∑ 1 yr 1 mo\nAssistant Building Surveyor\nAssistant Building Surveyor\nMar 2022 - Mar 2023 ¬∑ 1 yr 1 mo\nMar 2022 to Mar 2023 ¬∑ 1 yr 1 mo\nTrainee Building Surveyor\nTrainee Building Surveyor\nTrainee Building Surveyor\nPrembuild Midlands Ltd ¬∑ Part-time\nPrembuild Midlands Ltd ¬∑ Part-time\nNov 2019 - Jan 2023 ¬∑ 3 yrs 3 mos\nNov 2019 to Jan 2023 ¬∑ 3 yrs 3 mos\nBirmingham, England, United Kingdom\nBirmingham, England, United Kingdom\nGraduate Building Surveyor\nGraduate Building Surveyor\ncalfordseaden ¬∑ Full-time\ncalfordseaden ¬∑ Full-time\nAug 2021 - Feb 2022 ¬∑ 7 mos\nAug 2021 to Feb 2022 ¬∑ 7 mos\nChief Executive Officer\nChief Executive Officer\nChief Executive Officer\nLabell√© ldn\nLabell√© ldn\nJan 2020 - Feb 2022 ¬∑ 2 yrs 2 mos\nJan 2020 to Feb 2022 ¬∑ 2 yrs 2 mos\nShow all 9 experiences",
    "isCSuite": true,
    "contextForAI": "Donald Oberia\n2nd degree connection\n2nd\nSenior Building Surveyor @ StartTo End LTD\nStartTo End LTD\nUniversity of Wolverhampton\nUnited Kingdom  Contact info\n390 followers \n323 connections\nIwona Plumpton is a mutual connection\nIwona Plumpton is a mutual connection\nFollow\nMessage\nMore\nAbout\nAbout\nHead Building Surveyor at STEND, I lead a team of professionals in delivering high-quality building surveys, stock condition surveys, project management, and building design services. We work with a diverse range of clients, from social housing providers to commercial developers, to make the built environment safer, more efficient, and sustainable.\nI have a BSc in Building Surveying from the University of Wolverhampton, and I am an Undergraduate Member of the Chartered Institute of Building (RICS). I have over 6 years of experience in the industry, working for reputable firms such as Currie & Brown and Calfordseaden. I have developed core competencies in building surveying, social housing, dilapidations, and Spanish language. I am passionate about precision and client satisfaction, and I am always eager to learn and grow. Let's connect and explore how we can work together to elevate your property assets. You can reach me at donald@starttoend.co.uk.\nHead Building Surveyor at STEND, I lead a team of professionals in delivering high-quality building surveys, stock condition surveys, project management, and building design services. We work with a diverse range of clients, from social housing providers to commercial developers, to make the built environment safer, more efficient, and sustainable. I have a BSc in Building Surveying from the University of Wolverhampton, and I am an Undergraduate Member of the Chartered Institute of Building (RICS). I have over 6 years of experience in the industry, working for reputable firms such as Currie & Brown and Calfordseaden. I have developed core competencies in building surveying, social housing, dilapidations, and Spanish language. I am passionate about precision and client satisfaction, and I am always eager to learn and grow. Let's connect and explore how we can work together to elevate your property assets. You can reach me at donald@starttoend.co.uk.\n‚Ä¶see more\nTop skills\nTop skills\nTeam Leadership ‚Ä¢ AutoCAD ‚Ä¢ Construction ‚Ä¢ Microsoft Office ‚Ä¢ CostX\nTeam Leadership ‚Ä¢ AutoCAD ‚Ä¢ Construction ‚Ä¢ Microsoft Office ‚Ä¢ CostX\nServices\nServices\nAccounting ‚Ä¢ Bookkeeping ‚Ä¢ 3D Design ‚Ä¢ Engineering Design ‚Ä¢ Architecture ‚Ä¢ Landscape Design ‚Ä¢ Property Law ‚Ä¢ Writing\nAccounting ‚Ä¢ Bookkeeping ‚Ä¢ 3D Design ‚Ä¢ Engineering Design ‚Ä¢ Architecture ‚Ä¢ Landscape Design ‚Ä¢ Property Law ‚Ä¢ Writing\nRequest services\nShow all services\nActivity\nActivity\n390 followers\n390 followers\nFollow\nDonald hasn‚Äôt posted yet\nRecent posts Donald shares will be displayed here.\nShow all activity\nExperience\nExperience\nSenior Building Surveyor\nSenior Building Surveyor\nSenior Building Surveyor\nStartTo End LTD ¬∑ Full-time\nStartTo End LTD ¬∑ Full-time\nOct 2022 - Present ¬∑ 3 yrs 5 mos\nOct 2022 to Present ¬∑ 3 yrs 5 mos\nUnited Kingdom ¬∑ Hybrid\nUnited Kingdom ¬∑ Hybrid\nAutoCAD, Microsoft Office and +7 skills\nCurrie & Brown\nCurrie & Brown\nFull-time ¬∑ 1 yr 1 mo\nFull-time ¬∑ 1 yr 1 mo\nUnited Kingdom\nUnited Kingdom\nAssistant Building Surveyor\nAssistant Building Surveyor\nMar 2022 - Mar 2023 ¬∑ 1 yr 1 mo\nMar 2022 to Mar 2023 ¬∑ 1 yr 1 mo\nAssistant Building Surveyor\nAssistant Building Surveyor\nMar 2022 - Mar 2023 ¬∑ 1 yr 1 mo\nMar 2022 to Mar 2023 ¬∑ 1 yr 1 mo\nTrainee Building Surveyor\nTrainee Building Surveyor\nTrainee Building Surveyor\nPrembuild Midlands Ltd ¬∑ Part-time\nPrembuild Midlands Ltd ¬∑ Part-time\nNov 2019 - Jan 2023 ¬∑ 3 yrs 3 mos\nNov 2019 to Jan 2023 ¬∑ 3 yrs 3 mos\nBirmingham, England, United Kingdom\nBirmingham, England, United Kingdom\nGraduate Building Surveyor\nGraduate Building Surveyor\ncalfordseaden ¬∑ Full-time\ncalfordseaden ¬∑ Full-time\nAug 2021 - Feb 2022 ¬∑ 7 mos\nAug 2021 to Feb 2022 ¬∑ 7 mos\nChief Executive Officer\nChief Executive Officer\nChief Executive Officer\nLabell√© ldn\nLabell√© ldn\nJan 2020 - Feb 2022 ¬∑ 2 yrs 2 mos\nJan 2020 to Feb 2022 ¬∑ 2 yrs 2 mos\nShow all 9 experiences\nEducation\nEducation\nUniversity of Wolverhampton\nUniversity of Wolverhampton\nBachelor's degree, Building surveying\nBachelor's degree, Building surveying\n2016 - 2019\n2016 - 2019\nSutton Colfield college\nSutton Colfield college\nSutton Colfield college\n2012 - 2015\n2012 - 2015\nLicenses & certifications\nLicenses & certifications\nGoogle¬†Ads Display Certification\nGoogle¬†Ads Display Certification\nGoogle\nGoogle\nIssued Jul 2022\nIssued Jul 2022\nCredential ID 118830848\nCredential ID 118830848\nShow credential\nBusiness Peer Network\nBusiness Peer Network \nBusiness Peer Network \nIBD\nIBD\nIssued Jun 2021\nIssued Jun 2021\nShow all 6 licenses & certifications\nSkills\nSkills\nBuilding Surveying\nBuilding Surveying\nSenior Building Surveyor at StartTo End LTD\nSenior Building Surveyor at StartTo End LTD\n1 endorsement\n1 endorsement\nSocial Housing\nSocial Housing\nSenior Building Surveyor at StartTo End ",
    "searchKeyword": "CEO"
  },
  {
    "profileUrl": "https://www.linkedin.com/in/pete-redfern-36970b47",
    "name": "Pete Redfern",
    "title": "Chief Executive Officer",
    "location": "Marlow, England, United Kingdom",
    "company": "Pete Redfern Advisory Ltd",
    "about": "",
    "experience": "Experience\nExperience\nManaging Director\nManaging Director\nManaging Director\nPete Redfern Advisory Ltd ¬∑ Self-employed\nPete Redfern Advisory Ltd ¬∑ Self-employed\nDec 2022 - Present ¬∑ 3 yrs 3 mos\nDec 2022 to Present ¬∑ 3 yrs 3 mos\nOxford, England, United Kingdom\nOxford, England, United Kingdom\nConsultancy on deal support, funding and general advisory in property, housebuilding, construction and building materials sectors.\nConsultancy on deal support, funding and general advisory in property, housebuilding, construction and building materials sectors.\nChairman\nChairman\nYouth Adventure Trust ¬∑ Part-time\nYouth Adventure Trust ¬∑ Part-time\nJun 2016 - Present ¬∑ 9 yrs 9 mos\nJun 2016 to Present ¬∑ 9 yrs 9 mos\nCity Of Bristol, England, United Kingdom ¬∑ Remote\nCity Of Bristol, England, United Kingdom ¬∑ Remote\nChairman of Charity helping young people between 11 and 16 with outdoor and adventure experiences.\nChairman of Charity helping young people between 11 and 16 with outdoor and adventure experiences.\nChief Executive Officer\nChief Executive Officer\nTravis Perkins plc ¬∑ Full-time\nTravis Perkins plc ¬∑ Full-time\nSep 2024 - Mar 2025 ¬∑ 7 mos\nSep 2024 to Mar 2025 ¬∑ 7 mos\nNorthampton, England, United Kingdom\nNorthampton, England, United Kingdom\nChief Executive\nChief Executive\nTaylor Wimpey plc\nTaylor Wimpey plc\nJan 2001 - May 2022 ¬∑ 21 yrs 5 mos\nJan 2001 to May 2022 ¬∑ 21 yrs 5 mos\nHigh Wycombe\nHigh Wycombe\nFinance Director\nFinance Director\nFinance Director\nRugby Cement\nRugby Cement\nOct 1997 - Oct 2000 ¬∑ 3 yrs 1 mo\nOct 1997 to Oct 2000 ¬∑ 3 yrs 1 mo\nShow all 6 experiences",
    "isCSuite": true,
    "contextForAI": "Pete Redfern \n3rd degree connection\n3rd\nChief Executive Officer\nPete Redfern Advisory Ltd\nThe Open University\nMarlow, England, United Kingdom  Contact info\n500+ connections\nConnect\nMessage\nMore\nActivity\nActivity\n1,053 followers\n1,053 followers\nLoaded 1 Comments post\nPete Redfern commented on a post ‚Ä¢ 7mo\n7mo\nCongrats Lakhvir! üéâ\nCongrats Lakhvir! üéâ\nShow all comments\nExperience\nExperience\nManaging Director\nManaging Director\nManaging Director\nPete Redfern Advisory Ltd ¬∑ Self-employed\nPete Redfern Advisory Ltd ¬∑ Self-employed\nDec 2022 - Present ¬∑ 3 yrs 3 mos\nDec 2022 to Present ¬∑ 3 yrs 3 mos\nOxford, England, United Kingdom\nOxford, England, United Kingdom\nConsultancy on deal support, funding and general advisory in property, housebuilding, construction and building materials sectors.\nConsultancy on deal support, funding and general advisory in property, housebuilding, construction and building materials sectors.\nChairman\nChairman\nYouth Adventure Trust ¬∑ Part-time\nYouth Adventure Trust ¬∑ Part-time\nJun 2016 - Present ¬∑ 9 yrs 9 mos\nJun 2016 to Present ¬∑ 9 yrs 9 mos\nCity Of Bristol, England, United Kingdom ¬∑ Remote\nCity Of Bristol, England, United Kingdom ¬∑ Remote\nChairman of Charity helping young people between 11 and 16 with outdoor and adventure experiences.\nChairman of Charity helping young people between 11 and 16 with outdoor and adventure experiences.\nChief Executive Officer\nChief Executive Officer\nTravis Perkins plc ¬∑ Full-time\nTravis Perkins plc ¬∑ Full-time\nSep 2024 - Mar 2025 ¬∑ 7 mos\nSep 2024 to Mar 2025 ¬∑ 7 mos\nNorthampton, England, United Kingdom\nNorthampton, England, United Kingdom\nChief Executive\nChief Executive\nTaylor Wimpey plc\nTaylor Wimpey plc\nJan 2001 - May 2022 ¬∑ 21 yrs 5 mos\nJan 2001 to May 2022 ¬∑ 21 yrs 5 mos\nHigh Wycombe\nHigh Wycombe\nFinance Director\nFinance Director\nFinance Director\nRugby Cement\nRugby Cement\nOct 1997 - Oct 2000 ¬∑ 3 yrs 1 mo\nOct 1997 to Oct 2000 ¬∑ 3 yrs 1 mo\nShow all 6 experiences\nEducation\nEducation\nThe Open University\nThe Open University\nBachelor of Arts - BA, History\nBachelor of Arts - BA, History\nSep 2015 - Aug 2024\nSep 2015 - Aug 2024\nUniversity of Warwick\nUniversity of Warwick\nBachelor of Science, Mathematics\nBachelor of Science, Mathematics\n1989 - 1992\n1989 - 1992\nGrade: First\nGrade: First\nLicenses & certifications\nLicenses & certifications\nChartered Surveyor\nChartered Surveyor\nRICS\nRICS\nIssued Jul 2015\nIssued Jul 2015\nChartered Accountant\nChartered Accountant\nICAEW\nICAEW\nIssued Aug 1995\nIssued Aug 1995\nSkills\nSkills\nSocial Housing\nSocial Housing\nEndorsed by 2 colleagues at Taylor Wimpey plc\nEndorsed by 2 colleagues at Taylor Wimpey plc\n6 endorsements\n6 endorsements\nAffordable Housing\nAffordable Housing\nKeiran James and 2 connections have given endorsements for this skill\nKeiran James and 2 connections have given endorsements for this skill\n4 endorsements\n4 endorsements\nShow all 24 skills\nInterests\nInterests\nCompanies\nCompanies\nNewsletters\nNewsletters\nSchools\nSchools\nThe Open University\nThe Open University\n525,968 followers\n525,968 followers\nFollow\nUniversity of Warwick\nUniversity of Warwick\n300,009 followers\n300,009 followers\nFollow\nShow all companies",
    "searchKeyword": "CEO"
  },
  {
    "profileUrl": "https://www.linkedin.com/in/roger-brown-93b5261",
    "name": "Roger Brown",
    "title": "Chief Executive Officer at Seplat Energy Plc",
    "location": "London, England, United Kingdom",
    "company": "Seplat Petroleum Development Company Plc",
    "about": "",
    "experience": "Experience\nExperience\nSeplat Petroleum Development Company Plc\nSeplat Petroleum Development Company Plc\n12 yrs 8 mos\n12 yrs 8 mos\nChief Executive Officer\nChief Executive Officer\nFull-time\nFull-time\nAug 2020 - Present ¬∑ 5 yrs 7 mos\nAug 2020 to Present ¬∑ 5 yrs 7 mos\nNigeria\nNigeria\nGroup Chief Financial Officer\nGroup Chief Financial Officer\nJul 2013 - Aug 2020 ¬∑ 7 yrs 2 mos\nJul 2013 to Aug 2020 ¬∑ 7 yrs 2 mos\nLondon Area, United Kingdom\nLondon Area, United Kingdom\nChief Executive Officer\nChief Executive Officer\nSeplat Energy Plc ¬∑ Full-time\nSeplat Energy Plc ¬∑ Full-time\nAug 2020 - Present ¬∑ 5 yrs 7 mos\nAug 2020 to Present ¬∑ 5 yrs 7 mos\nManaging Director\nManaging Director\nStandard Bank\nStandard Bank\nDec 2001 - Jul 2013 ¬∑ 11 yrs 8 mos\nDec 2001 to Jul 2013 ¬∑ 11 yrs 8 mos\nLondon Area, United Kingdom\nLondon Area, United Kingdom\nHead of EMEA Oil and Gas\nHead of EMEA Oil and Gas\nFinancial Advisor\nFinancial Advisor\nPwC\nPwC\nSep 1994 - Dec 2001 ¬∑ 7 yrs 4 mos\nSep 1994 to Dec 2001 ¬∑ 7 yrs 4 mos\nLondon Area, United Kingdom\nLondon Area, United Kingdom",
    "isCSuite": true,
    "contextForAI": "Roger Brown \n3rd degree connection\n3rd\nChief Executive Officer at Seplat Energy Plc\nSeplat Petroleum Development Company Plc\nUniversity of Dundee\nLondon, England, United Kingdom  Contact info\n500+ connections\nConnect\nMessage\nMore\nActivity\nActivity\n2,164 followers\n2,164 followers\nRoger hasn‚Äôt posted yet\nRecent posts Roger shares will be displayed here.\nShow all activity\nExperience\nExperience\nSeplat Petroleum Development Company Plc\nSeplat Petroleum Development Company Plc\n12 yrs 8 mos\n12 yrs 8 mos\nChief Executive Officer\nChief Executive Officer\nFull-time\nFull-time\nAug 2020 - Present ¬∑ 5 yrs 7 mos\nAug 2020 to Present ¬∑ 5 yrs 7 mos\nNigeria\nNigeria\nGroup Chief Financial Officer\nGroup Chief Financial Officer\nJul 2013 - Aug 2020 ¬∑ 7 yrs 2 mos\nJul 2013 to Aug 2020 ¬∑ 7 yrs 2 mos\nLondon Area, United Kingdom\nLondon Area, United Kingdom\nChief Executive Officer\nChief Executive Officer\nSeplat Energy Plc ¬∑ Full-time\nSeplat Energy Plc ¬∑ Full-time\nAug 2020 - Present ¬∑ 5 yrs 7 mos\nAug 2020 to Present ¬∑ 5 yrs 7 mos\nManaging Director\nManaging Director\nStandard Bank\nStandard Bank\nDec 2001 - Jul 2013 ¬∑ 11 yrs 8 mos\nDec 2001 to Jul 2013 ¬∑ 11 yrs 8 mos\nLondon Area, United Kingdom\nLondon Area, United Kingdom\nHead of EMEA Oil and Gas\nHead of EMEA Oil and Gas\nFinancial Advisor\nFinancial Advisor\nPwC\nPwC\nSep 1994 - Dec 2001 ¬∑ 7 yrs 4 mos\nSep 1994 to Dec 2001 ¬∑ 7 yrs 4 mos\nLondon Area, United Kingdom\nLondon Area, United Kingdom\nEducation\nEducation\nUniversity of Dundee\nUniversity of Dundee\n1988 - 1992\n1988 - 1992\nInterests\nInterests\nTop Voices\nTop Voices\nCompanies\nCompanies\nGroups\nGroups\nNewsletters\nNewsletters\nSchools\nSchools\nChristine Lagarde\nChristine Lagarde\nPresident of the European Central Bank \nPresident of the European Central Bank \n3,123,766 followers\n3,123,766 followers\nFollow\nRichard Branson\nRichard Branson\nFounder at Virgin Group\nFounder at Virgin Group\n18,646,999 followers\n18,646,999 followers\nFollow\nShow all Top Voices",
    "searchKeyword": "CEO"
  }
]